section,group,id,text
Info,0,Title,ヒーロークラス適性審査試験・Ⅱ
Info,0,Explanation,る能力向上が可能となる。<br><br><yellow>※ヒーロー限定<br>対象クエストをノーマル以上でクリア<br>※ヒーローのレベル上限を55まで解放<c>
Info,0,Target,任意のフリー/アークスか期間限定クエスト
Info,0,Reward,ヒーロー制限解除許可証Ⅱ
Info,1,Title,Prueba de aptitud de clase de heroe II
Info,1,Explanation,<yellow> Sólo héroe.<br>Completa la misión en Normal o superior.<br>Nota: aumenta el límite de nivel de héroe a 55. <c>
Info,1,Target,"Cualquier expedición, misión de Arks o misión de tiempo limitado"
Info,1,Reward,Permiso de expansión de héroe II
