section,group,id,text
Info,0,Title,続・アークス的観光旅行？
Info,0,Explanation,タイムアタックに連れて行ったって？<br>オレはそういうのじゃなくて普通の<br>観光に連れて行ってくれ。頼んだぜ！<br><yellow>※エンガ（ホワイトデー）のみ同行<br>ノーマル以上でクリア<c>
Info,0,Reward,エンガ（ホワイトデー）のパートナーカード<br>※受注時に付与<br>※好感度上昇によるプレゼン
Info,1,Title,Turismo al estilo ARKS (continuación)
Info,1,Explanation,"<yellow> Con solo Enga (Día Blanco) como compañero,<br>completa en Normal o superior. <c>"
Info,1,Reward,Tarjeta de socio de Enga (Día Blanco)<br>Se concede al aceptar el pedido<br>Sin obsequio por mayor afinidad
