section,group,id,text
Skit,0,text00,『マターボードのイベント』について
Skit,0,text01,マターボードやストーリークエストを進めていくと、<br>マターの対象となるキャラクターがアークスシップから<br>いなくなる場合があります。
Skit,0,text02,その場合でも、対象のマターを選択状態にして<br>マターボードに記載されている場所へ向かうことで<br>遭遇できる時系列へと瞬間的に戻り<br>イベントが再生されます。<br>   <br>あせらず、自分のペースでゲームを進
Skit,1,text00,Eventos de la matriz de divergencia
Skit,1,text01,Los que son el<br>foco de ciertos Flux Points pueden no estar en<br>el barco ARKS.
Skit,1,text02,"En ese caso, selecciona el objetivo selecciona estado y dirigete a los lugares indicados en el tablero de Matoi. De esta manera, podras volver a los sucesos previos y ver lo que sucedio.<br><br>No hay prisa, avanza a tu propio ritmo"
