section,group,id,text
Skit,0,text00,『クライアントオーダー』について
Skit,0,text01,ロッティにクライアントオーダーが発生しました。<br><br>ロッティはショップエリア・南外周通路にいます。
Skit,0,text02,ルべルトにクライアントオーダーが発生しました。<br><br>ルべルトはショップエリア・南外周通
Skit,1,text00,Órdenes de clientes
Skit,1,text01,Aviso de emisión de orden del cliente:<br><br> Consulte a Lottie en Outer Ring: South en Shopping Plaza para obtener más información.
Skit,1,text02,Aviso de emisión de orden del cliente:<br><br> Consulte a Rubert en Outer Ring: South en Shopping Plaza para obtener más información.
