section,group,id,text
Required,0,Title,クヴァリス連破訓練・3-Ⅴ
Required,0,Summary,アークス上級訓練教官ロナルディンから、<br>経験を積むために、<br>ドレッドエネミーの討伐を勧められる。<br><br><yellow>※対象リージョン：クヴァリス<br>※ドレッドエネミー：<br>　二つ名“老練の”が付いた個体<c>
Required,1,Title,Entrenamiento implacable de Kvaris 3-V
Required,1,Summary,椀攀渀挀攀⸀㰀戀爀㸀㰀戀爀㸀㰀礀攀氀氀漀眀㸀吀愀爀最攀琀 爀攀最椀漀渀㨀 䬀瘀愀爀椀猀㰀戀爀㸀䐀爀攀愀搀 䔀渀攀洀椀攀猀㨀 匀攀攀欀 漀甀琀 愀 猀瀀攀挀椀洀攀渀 眀栀漀猀攀 渀愀洀攀 椀渀挀氀甀搀攀猀 ∀嘀攀琀攀爀愀渀∀㰀挀㸀
SubObjectives,0,text0101,南クヴァリスでドレッドエネミーを倒す
SubObjectives,0,text0102,西クヴァリスでドレッドエネミーを倒す
SubObjectives,1,text0101,Derrota a los temibles enemigos en Kvaris del Sur.
SubObjectives,1,text0102,Derrota a los temibles enemigos en West Kvaris
