section,group,id,text
Required,0,Title,スティア連破訓練・3-Ⅸ
Required,0,Summary,アークス上級訓練教官ロナルディンから、<br>経験を積むために、<br>メガロティクスの討伐を勧められる。<br><br><yellow>※対象リージョン：スティア<br>※推奨セクション：ノイゼンプラント<c>
Required,1,Title,Entrenamiento implacable de Stia 3-IX
Required,1,Summary,爀 琀漀 最愀椀渀 猀漀洀攀 攀砀瀀攀爀椀攀渀挀攀⸀㰀戀爀㸀㰀戀爀㸀㰀礀攀氀氀漀眀㸀吀愀爀最攀琀 刀攀最椀漀渀㨀 匀琀椀愀㰀戀爀㸀刀攀挀漀洀洀攀渀搀攀搀 匀攀挀琀漀爀㨀 一攀甀猀攀渀 倀氀愀渀琀㰀挀㸀
SubObjectives,0,text0101,ドールズのボスエネミーの<br>メガロティクス（Lv.65以上）を倒す
SubObjectives,1,text0101,Derrota a los enemigos jefes de DOLLS Megalotix<br>(Nv.65 o superior)
