section,group,id,text
Required,0,Title,ハルファ広域連破訓練・2-Ⅴ
Required,0,Summary,アークス上級訓練教官ロナルディンから、<br>経験を積むために、<br>ボスエネミーの討伐を勧められる。<br><br><yellow>※推奨セクション：<br>　リテム・エルノザ（Rank.4以上）<c>
Required,1,Title,Entrenamiento implacable en Halfha 2-V
Required,1,Summary,琀漀 最愀椀渀 猀漀洀攀 攀砀瀀攀爀椀攀渀挀攀⸀㰀戀爀㸀㰀戀爀㸀㰀礀攀氀氀漀眀㸀刀攀挀漀洀洀攀渀搀攀搀 猀攀挀琀漀爀㨀 刀攀琀攀洀 䄀氀渀漀琀栀攀 ⠀刀愀渀欀 㐀 漀爀 栀椀最栀攀爀⤀㰀挀㸀
SubObjectives,0,text0101,フォートス・ランチャー（Lv.60以上）を<br>倒す
SubObjectives,0,text0102,バブルクラッブ（Lv.60以上）を倒す
SubObjectives,1,text0101,Derrota a los lanzadores Fortos (nivel 60 o superior)
SubObjectives,1,text0102,Derrota a Bubble Snappers (Nv. 60 o superior)
