section,group,id,text
Required,0,Title,【シーズン】補給隊の支援活動・4-Ⅳ
Required,0,Summary,シーズンシンボルの付いた<br>ネクス・エアリオを倒す。<br><br><yellow>※エネミー討伐推奨セクション：<br>　西エアリオ<c>
Required,1,Title,[Estacional] Los esfuerzos de la unidad de suministros 4-IV
Required,1,Summary,Derrota a un Nex Aelio marcado con un símbolo de temporada.<br><br><yellow>Sector recomendado para la supresión del enemigo:<br>Oeste Aelio <c>
SubObjectives,0,text0101,シンボル付きネクス・エアリオを倒す
SubObjectives,1,text0101,Derrota a un Nex Aelio marcado con un símbolo.
