section,group,id,text
Required,0,Title,エアリオ連破訓練・3-Ⅷ
Required,0,Summary,アークス上級訓練教官ロナルディンから、<br>経験を積むために、<br>ギガンティクスの討伐を勧められる。<br><br><yellow>※ギガンティクス：<br>　二つ名“絶望の”が付いた個体<c>
Required,1,Title,Aelio Entrenamiento implacable 3-VIII
Required,1,Summary,戀爀㸀猀漀洀攀 攀砀瀀攀爀椀攀渀挀攀⸀㰀戀爀㸀㰀戀爀㸀㰀礀攀氀氀漀眀㸀䜀椀最愀渀琀椀砀㨀 匀攀攀欀 漀甀琀 愀 猀瀀攀挀椀洀攀渀 眀栀漀猀攀 渀愀洀攀㰀戀爀㸀椀渀挀氀甀搀攀猀 ∀䴀愀氀攀瘀漀氀攀渀琀⸀∀㰀挀㸀
SubObjectives,0,text0101,北エアリオでギガンティクスを倒す
SubObjectives,0,text0102,南エアリオでギガンティクスを倒す
SubObjectives,1,text0101,Derrota a un Gigantix en North Aelio
SubObjectives,1,text0102,Derrota a un Gigantix en South Aelio
