section,group,id,text
,0,name_7005,ブルーダー
,0,msq_011220_005_0010,一通り終わったようだな。<br>いろいろと学べたと思う。
,0,msq_011220_005_0020,最後に、訓練教官のリアメイに<br>会いにいってみてくれ。
,0,msq_011220_005_0030,彼女の手ほどきは、定評がある。<br>良い経験になるはずだ。頑張ってくれ
,1,name_7005,topadora
,1,msq_011220_005_0010,Tienes todo hecho. Apuesto a que aprendiste mucho.
,1,msq_011220_005_0020,"Para tu tarea final, quiero que conozcas a la instructora de capacitación Leah May."
,1,msq_011220_005_0030,Sus métodos de entrenamiento son mundialmente famosos. Estoy seguro de que le sacarás mucho partido. Buena suerte.
