section,group,id,text
,0,msq_013141_0010,そういえば、先遣隊のアークスから聞いたのだけれど、<br>この先に、フローティングボードという乗り物があるらしいわ。
,0,msq_013141_0020,専用の端末から呼び出せるようね。<br>誰も管理していないけれど、自由に使っていいようね。
,0,msq_013141_0030,へー、そうなんだ。<br>見つけたら、使ってみよう！
,0,name010,マノ
,1,msq_013141_0010,"Oh, eso me recuerda. El equipo de avance de ARKS estaba diciendo que más adelante hay cosas llamadas tablas flotantes."
,1,msq_013141_0020,"Pueden ser convocados desde terminales dedicadas. Aparentemente, está bien que los usemos."
,1,msq_013141_0030,"Vaya, eso es genial. ¡Definitivamente los probaré!"
,1,name010,Manón
,1,name020,Aina
