section,group,id,text
,0,76670101,はあ……アイナともっと<br>お喋りとかしたいんだけどなあ……。
,0,76670102,でもガロアの目が気になって、<br>あんまり近づけなくて……。
,0,76670201,ガロアはさ、アイナに厳しく接してるけど、<br>本当は娘がかわいくて仕方がないんだよ。
,0,76670202,アイナのことが心配で、<br>実はいつもしっかり見守ってるんだ。
,1,76670101,*Suspiro*... Realmente desearía poder charlar más con Aina.
,1,76670102,Pero ni siquiera puedo acercarme a ella cuando Garoa está a la vista.
,1,76670201,"Él siempre es muy estricto y duro con ella, pero en el fondo se nota que tiene<br>una debilidad por ella."
,1,76670202,"Aunque parece que mantiene distancia, en realidad siempre está cuidando a<br>de ella."
