section,group,id,text
Event1,0,text01,次の相手は……<br>そうだな、クォーツ・ドラゴンだ。
Event1,0,text02,流星のごとく天を舞う強敵。<br>地を這うしかないわれらは<br>足枷をはめられているも同然だ。
Event1,0,11_voice_NPC_5426_207,言うなれば、根本的に不利な戦い。<br>だが、心で負けていれば尚更勝てぬぞ。<br>さて、いかにして
Event1,1,text01,En cuanto a tu próximo oponente... Sí. Será<br>el Dragón de Cuarzo.
Event1,1,text02,Un enemigo poderoso que atraviesa el cielo<br>como un meteorito. Los que nos arrastramos por el suelo<br>somos como prisioneros encadenados.
Event1,1,11_voice_NPC_5426_207,Ese corazón sellaría aún más tu destino <br>. ¿Cómo lo combatirás?
