section,group,id,text
Event1,0,text01,今回は、鳥類ダーカーのニセモノ<br>ランカ・ヴァレースが駆逐対象だ。
Event1,0,11_voice_NPC_5059_102,元々ひらひらと飛び回って<br>攻撃しづらい面倒な相手だったが<br>その辺をそのままコピーしていやがる。
Event1,0,text03,混戦状態で放置しておくのは<br>おススメできないヤツだね。<br>こいつの掃討を頼む。
Event1,1,text01,"Su objetivo de exterminio esta vez es el<br>Lanka Valehs, un Falspawn tipo pájaro de imitación."
Event1,1,11_voice_NPC_5059_102,"El original era un enemigo molesto que volaba alrededor de<br>y era difícil de golpear, y este<br>falso copió ese aspecto al por mayor."
Event1,1,text03,No es algo que recomendaría dejar solo a<br>en una batalla campal. Eliminarlos.
