section,group,id,text
Event1,0,11_voice_NPC_5055_101,わあ、これが蝶の群れの観測データ！<br><%me>さん<br>何てお礼を言ったらいいか……！
Event1,0,text02,これだけのデータがあれば<br>メカニズムの解析も<br>不可能ではないと思います！
Event1,0,text03,それにしても、美しいですね。<br>この光景をこの目で直に見られたのなら<br>どんなにすばらしいか……
Event1,0,text04,いえ、僕は気象予報官として<br>僕にできることをするのみですね。<br>では、どうもありがとうございました
Event1,1,11_voice_NPC_5055_101,栀攀 戀甀琀琀攀爀昀氀椀攀猀✀ 搀愀渀挀攀℀ 㰀戀爀㸀䠀漀眀 挀愀渀 䤀 琀栀愀渀欀 礀漀甀 攀渀漀甀最栀Ⰰ 㰀戀爀㸀㰀─洀攀㸀㼀
Event1,1,text02,¡Esto debería ser suficiente para ayudarme a determinar<br>qué hay detrás de su comportamiento inusual en bandada!
Event1,1,text03,"Incluso solo con esto, parece... maravilloso.<br>Me pregunto cuánto más sería si<br>lo viera con mis propios ojos..."
Event1,1,text04,"¡Pero tengo mis deberes como meteorólogo jefe,<br>y los cumpliré! ¡Gracias!"
