section,group,id,text
Event1,0,text01,同僚の教導官と、これまでに指導した<br>教え子たちの話をしていてね。<br>恥ずかしながら影響されてしまったわ。
Event1,0,11_voice_NPC_5057_100,教導官との兼任になるけれど<br>アークスとしての活動を<br>一部再開しようと思っているの。
Event1,0,text03,それでね。<br>復帰するにあたって、私と<br>組んでくれる人を探しているのだけど。
Event1,0,text04,貴方、その気はないかしら？<br>相応しい力があると判断できたなら<br>私の背中は貴方に預
Event1,1,text01,"Fuimos guiados y, por tonto que parezca este <br>, me afectó profundamente."
Event1,1,11_voice_NPC_5057_100,Estoy pensando en volver a<br>servicio ARKS parcialmente activo mientras<br>mantengo mi trabajo de instructor.
Event1,1,text03,Lo que me lleva al punto: estaba<br>buscando a alguien que formara equipo conmigo<br>para mi gran regreso.
Event1,1,text04,No se me ocurre nadie más adecuado que tú.<br>¿Estás dispuesto a ello? Sé que tienes lo que se necesita<br>para cuidarme la espalda.
