section,group,id,text
Event1,0,text01,龍祭壇には敵さんがわんさかいるから<br>撃っても撃ってもキリがなくて<br>撃ちごたえがありますよお？
Event1,0,text02,もちろん敵さんが一番頑丈な<br>スーパーハードで行きましょう。<br>そのほうが、長く楽しめます。
Event1,0,11_voice_NPC_5026_101,ダーカーも、ダーカーに侵食された<br>龍族さんも、撃って殺して撃って殺して<br>ぜんぶ綺麗にしてあげればいいんです。
Event1,0,text04,ほんと、アークスってすばらしい。<br>リサにとっての理想ですよお。<br>……さ、行きましょうか。
Event1,1,text01,Cualquiera que puedas<br>dispara y dispara y seguirán llegando. <br>¡Es genial!
Event1,1,text02,"más dedos que nunca. ¿No querría<br>que todo terminara demasiado rápido, verdad?"
Event1,1,11_voice_NPC_5026_101,爀 椀渀昀攀猀琀攀搀 䐀爀愀挀漀渀椀愀渀㰀戀爀㸀甀渀琀椀氀 眀攀✀瘀攀 挀氀攀愀渀攀搀 琀栀攀 瀀氀愀挀攀 眀椀琀栀 琀栀攀椀爀 戀氀漀漀搀⸀
Event1,1,text04,"Gracias a Dios por los ARKS. ¿Qué haría yo<br>conmigo mismo si no fuera por trabajos como este?<br>¡Vamos entonces, vámonos!"
