section,group,id,text
Event1,0,11_voice_NPC_5087_104,特訓にもいろいろあると思うけど<br>的に当ててるだけじゃバレットボウは<br>上達しないんじゃないかなー？
Event1,0,text02,強い敵を仕留めることが<br>上達への近道だと思うんだー。
Event1,0,text03,そこでわたしが考えた訓練メニューは<br>ヴォル・ドラゴンを仕留めること！<br>難しそうでしょー？
Event1,0,text04,よっぽど心を落ち着けていかないと<br>当てても仕留められないかもよー？
Event1,1,11_voice_NPC_5087_104,漀眀 琀爀愀椀渀椀渀最Ⰰ 戀甀琀 樀甀猀琀㰀戀爀㸀栀椀琀琀椀渀最 琀愀爀最攀琀猀 椀猀渀✀琀 最漀渀渀愀 挀甀琀 椀琀Ⰰ 椀㼀
Event1,1,text02,¿Pero si tuvieras que enfrentarte a algunos<br>enemigos realmente fuertes? ¡Eso debería ayudarte a mejorar rápidamente!
Event1,1,text03,"¡Es por eso que mi régimen de entrenamiento incluye que<br>derribe un Vol Dragon!<br>Suena difícil, ¿verdad?"
Event1,1,text04,"Realmente tendrás que componer<br>tú mismo, porque no cualquier golpe que le des<br>derribará esa cosa."
