section,group,id,text
Event1,0,text01,データ、見させてもらったぜ！<br>……おたく、マジすげーっていうか<br>目で追えない動きばっかしてるな……
Event1,0,text02,あのヤベー敵の群れがワーッと来た時<br>淡々と避けながら、降りかかる猛攻を<br>涼しい顔で切り返してたんだよな……
Event1,0,text03,……これ、安心感がハンパなさすぎて<br>逆におたくが怖くなってきたぜ。<br>急に敵側に行ったり、しないよな……？
Event1,0,11_voice_NPC_5052_101,なんつー冗談はさておき、これを参考に<br>オレも自分の戦い方を編み出せそうだ。<br>ソイツらを蹴散らせるように頑張る
Event1,1,text01,"¡Eché un vistazo a los datos!<br>¡Es como si te movieras a la velocidad de la luz, amigo!"
Event1,1,text02,"Esas sucias sonuvaguns se acercaron a ti,<br>pero tú simplemente las rodeaste y las encendiste<br>como si no fuera nada."
Event1,1,text03,"Pensé que me sentiría aliviado, pero ese<br>fue terriblemente aterrador. No vas a cambiar de bando, ¿verdad, amigo?"
Event1,1,11_voice_NPC_5052_101,"Bromas aparte, intentaré incorporar<br>algo de eso en mi propio estilo de lucha.<br>¡Vamos a echarlos a la calle!"
