section,group,id,text
Event1,0,11_voice_NPC_5050_104,こちらは、説明のとおり<br>惑星・地球の東京での<br>探索能力試験になります。
Event1,0,text02,試験の結果が良好であれば<br>新たなエリアでの<br>活動が許可されます。
Event1,0,text03,指定された目標を達成するにあたり<br>制約は一切ありません。<br>自己の判断に基づいて行動願います。
Event1,0,text04,貴方の実力であれば<br>問題なく達成できる内容かと思いますが<br>挑戦する際は、ご用心ください。
Event1,1,11_voice_NPC_5050_104,"Como se explicó, esta prueba medirá<br>tu capacidad para realizar expediciones<br>en el Tokio del planeta Tierra."
Event1,1,text02,"Si tiene éxito, se le permitirá operar<br>en nuevos planetas o en nuevas áreas."
Event1,1,text03,No existen restricciones con respecto a cómo<br>logra la meta designada.<br>Actúa según tu propio criterio.
Event1,1,text04,"No creo que alguien de tu calibre<br>tenga ningún problema, pero permanece en guardia."
