section,group,id,text
Event1,0,text01,まあそう気張らなくていい。<br>オレにはなぜか、フッとお前の<br>活躍を見たくなる時が来るんだ。
Event1,0,11_voice_NPC_5020_100,お前ときたら、いつもオレの予想の<br>斜め上を行く動きをしてくれるからな。
Event1,0,text03,今日また海底でお前のクリアを<br>見届けられると思っていていいな？
Event1,1,text01,"No hay necesidad de ponerse nervioso.<br>A veces me apetece verte en<br>acción, ¿sabes?"
Event1,1,11_voice_NPC_5020_100,"Después de todo, siempre superas y redefines mis<br>expectativas."
Event1,1,text03,"Así que dime, no quieres que acompañe a<br>mientras cruzas el lecho marino<br>nuevamente hoy, ¿verdad?"
