section,group,id,text
Event1,0,text01,大変、大変なの！<br>会場周辺にまた敵がいっぱい<br>出てきちゃったんだって！
Event1,0,11_voice_NPC_5099_102,やっと会場の設営が終わって<br>見渡す限りの青い海をみんなに<br>楽しんでもらおうってところなのに！
Event1,0,text03,早く対策を取らないと<br>怪我人もでてしまうかもしれないって<br>うわさで聞いたの……
Event1,0,text04,まばゆいビーチを守るために<br>お願い、貴方の力を貸して欲しいの！<br>暴れている悪い敵を倒してっ！
Event1,1,text01,¡Oh... oh no!<br>¡Un grupo de enemigos<br>han aparecido alrededor del lugar!
Event1,1,11_voice_NPC_5099_102,"Justo cuando finalmente terminamos la construcción, ¡<br> que todos pudieran contemplar el interminable<br>océano azul!"
Event1,1,text03,"Si no hacemos algo al respecto, y<br>rápido, puede haber incluso personas que resulten<br>lesionadas..."
Event1,1,text04,"Así que, por favor, ¡préstame tu fuerza para<br>proteger esta deslumbrante playa! ¡Derriba a<br>esos terribles enemigos arrasadores!"
