section,group,id,text
Event1,0,11_voice_NPC_5053_101,ああ、ありがとう！<br>確かに希少種のデータは<br>受け取ったぞ！
Event1,0,text02,今のところ、通常種と比べても<br>色以外に差異は見受けられないが……<br>調べれば違いがわかるかもしれん！
Event1,0,text03,少しでも違いがあれば<br>それが種の謎を解き明かす<br>鍵になるはずだ。
Event1,0,text04,ああそうだ、これをキミに。<br>少ないが、謝礼を受け取ってほしい。<br>また、よろし
Event1,1,11_voice_NPC_5053_101,"¡Ah, gracias! ¡He recibido sus raros datos de subespecies <br>!"
Event1,1,text02,"del color, pero tal vez más investigaciones<br>confirmen algo."
Event1,1,text03,Incluso la más sutil de las diferencias puede ser la clave<br>que desvela el misterio de la especie.
Event1,1,text04,"Oh, sí, aquí está tu compensación, tal como está.<br>Espero trabajar contigo nuevamente."
