section,group,id,text
Event1,0,text01,やっぱりダーカーってやつは厄介だな。<br>それをマネた幻創種までいて<br>会場近くで多数目撃されてるって話だ。
Event1,0,11_voice_NPC_5479_102,倒してもキリがないんだろうが<br>かといって放置するわけにもいかねえ。
Event1,0,text03,オレ自身も、やれるだけは<br>やってやろうと思ってるんだが<br>あんたも協力してくれないか？
Event1,1,text01,琀愀猀洀猀 椀洀椀琀愀琀椀渀最 琀栀攀洀㰀戀爀㸀渀攀愀爀 琀栀攀 瘀攀渀甀攀Ⰰ 愀渀搀 愀 眀栀漀氀攀 戀甀渀挀栀 漀昀 ✀攀洀 琀漀漀⸀
Event1,1,11_voice_NPC_5479_102,"Dudo que podamos eliminarlos a todos, pero<br>tampoco podemos simplemente ignorarlos."
Event1,1,text03,Me gustaría hacer lo que pueda para reducirlos.<br>¿Podrías darme una mano?
