section,group,id,text
Event1,0,text01,……ふー、なんとかなったか？<br>いや、とんでもねーのが出てきたな。<br>なんだよあの機甲種は……
Event1,0,11_voice_NPC_5003_105,あいつが変な感じの原因なのか？<br>……うーん、なんかそれだけじゃない<br>気もするんだけど、うーん……
Event1,0,text03,だめだ、わかんねー！<br>あんまり長居するのもなんだし<br>一旦帰還しよ
Event1,1,text01,"Vaya, ¿lo hicimos? Hombre, eso fue una locura. <br>¿Qué pasó con esos autómatas?"
Event1,1,11_voice_NPC_5003_105,"¿Era eso lo que me hacía sentir<br>aprensivo? No, tengo la sensación de que<br>ese no es el final."
Event1,1,text03,"¡Uf, no! ¡Simplemente no lo entiendo! De todos modos, creo que preferiría<br>no quedarme aquí mucho tiempo, así que<br>regresemos, amigo."
