section,group,id,text
Event1,0,11_voice_NPC_5062_101,ありがとうございます。<br>これがブーストエネミーになった<br>スパルガンのデータですね。
Event1,0,text02,地下坑道の機甲種もブーストエネミーに<br>なる……予想通りですが砂漠の機甲種と<br>比較すれば、何か違うのかも……
Event1,0,text03,いただいたデータ、もう少し分析<br>してみますね。先輩、どうも<br>ありがとうございました。
Event1,1,11_voice_NPC_5062_101,"Gracias. Estos son los datos de la versión Berserk<br>Enemy del Spargun, ¿verdad?"
Event1,1,text02,䈀甀琀 琀栀攀礀 洀愀礀 搀椀昀昀攀爀 猀漀洀攀栀漀眀㰀戀爀㸀昀爀漀洀 琀栀攀椀爀 䐀攀猀攀爀琀 挀漀甀渀琀攀爀瀀愀爀琀猀⸀⸀⸀
Event1,1,text03,Este dato merece un análisis más detallado.<br>Muchas gracias por tu ayuda.
