section,group,id,text
Event1,0,11_voice_NPC_5053_101,データは確かに受け取った。<br>車体前面のファイヤーパターンなど<br>特徴的な要素がいくつかあるようだね。
Event1,0,text02,こうした個体差が<br>他にもあるのかは<br>まだわからないが……
Event1,0,text03,貴重な希少種のデータであり<br>研究に役立つものには違いない！
Event1,0,text04,もう少し調べてみるとしよう。<br>また、よろし
Event1,1,11_voice_NPC_5053_101,昀攀愀琀甀爀攀猀℀ 吀栀攀 昀椀爀攀㰀戀爀㸀瀀愀琀琀攀爀渀 漀渀 琀栀攀 昀爀漀渀琀 椀猀 攀猀瀀攀挀椀愀氀氀礀 攀礀攀ⴀ挀愀琀挀栀椀渀最⸀
Event1,1,text02,"Queda por ver si cada miembro de esta subespecie<br>tiene su propio patrón o no, pero..."
Event1,1,text03,¡Estos son datos invaluables que sin duda serán<br>invaluables para mi investigación!
Event1,1,text04,"Si me perdonan, tengo datos que revisar.<br>Te veré luego."
