section,group,id,text
Event1,0,11_voice_NPC_5051_104,極上のコシを生み出すには<br>最高の器具と、最高の足が必要！<br>これ、冗談じゃなくね。
Event1,0,text02,踏むことでコシを出す。<br>料理人の中では常識なのよ。
Event1,0,text03,そして私が考えたのは、その段取りを<br>安定化させ、自動にするための手段。
Event1,0,text04,たぶん、いいえ、必ず最高の器具が<br>作り出せるはず……<br>だから、よろしくお願い
Event1,1,11_voice_NPC_5051_104,攀渀琀 愀渀搀 琀栀攀 爀椀最栀琀 氀攀最猀 琀漀㰀戀爀㸀最攀琀 椀琀 搀漀渀攀℀ 䄀渀搀 搀漀渀✀琀 琀栀椀渀欀 䤀✀洀 欀椀搀搀椀渀最⸀
Event1,1,text02,Es un buen trabajo preliminar que realmente ayuda a darle a tu comida<br>la textura que deseas.<br>Cualquier buen chef lo sabe.
Event1,1,text03,"Entonces, lo que quiero intentar hacer es automatizar los<br>pasos para replicar el mismo proceso cada vez."
Event1,1,text04,"Estoy bastante seguro, no, estoy seguro de que esto me ayudará a<br>a hacer el mejor electrodoméstico de cocina hasta el momento.<br>Entonces... ¡Gracias de antemano!"
