section,group,id,text
Event1,0,text01,難しいと思い、敬遠していたことを<br>実際にやってみたら、すぐに出来た。<br>ということはままある。
Event1,0,text02,実力というものは測りにくいからの。<br>自信によって、かなり左右される。
Event1,0,text03,だから、目的や課題といった形で<br>超えるべきハードルを設定してやれば<br>自信と実力のズレも生じにくい。
Event1,0,11_voice_NPC_5011_100,……その様子じゃと<br>ハードルは超えられたようじゃの。<br>うむ、うむ。素晴らしいことじゃ
Event1,1,text01,"Al final, solo para encontrarlo fácil<br>una vez que realmente se ponen a hacerlo."
Event1,1,text02,Esto se debe a que puede resultar complicado medir<br>la propia habilidad. Está muy influenciado por el nivel de confianza <br>.
Event1,1,text03,攀猀 眀椀氀氀 瀀爀攀瘀攀渀琀 愀 最愀瀀 昀爀漀洀㰀戀爀㸀昀漀爀洀椀渀最 戀攀琀眀攀攀渀 挀漀渀昀椀搀攀渀挀攀 愀渀搀 猀欀椀氀氀⸀
Event1,1,11_voice_NPC_5011_100,"Parece que has superado el obstáculo.<br>Mmm, sí. Maravilloso."
