section,group,id,text
Event1,0,11_voice_NPC_5479_100,さてと、あらかた片付けたし<br>ひとまずホワイトデーイベントは<br>無事開催できそうだな。
Event1,0,text02,イベントまでどうしたもんか……<br>せっかくこっちの世界に来たんだし<br>どっか観光がてらクエストに行くか。
Event1,0,text03,……そういえば、あんたに観光案内を<br>頼んだら、いきなりタイムアタックを<br>させられたってオークゥが怒ってたぜ。
Event1,0,text04,オレもパートナーカードを渡すから<br>まずはタイムアタックじゃなく普通の<br>観光に連れてってくれ。頼んだぜ
Event1,1,11_voice_NPC_5479_100,"Things are mostly cleaned up, so it's looking<br>like the White Day event's actually a go."
Event1,1,text02,"t as well make the most of<br>it. Y'know, sightsee, do some quests..."
Event1,1,text03,愀 吀椀洀攀 䄀琀琀愀挀欀㰀戀爀㸀眀栀攀渀 猀栀攀 爀攀愀氀氀礀 眀愀渀琀攀搀 礀漀甀 琀漀 琀愀欀攀㰀戀爀㸀栀攀爀 猀椀最栀琀猀攀攀椀渀最⸀
Event1,1,text04,"I'll give you my Partner Card, so how about<br>you take me on a regular tour, not a Time<br>Attack? See ya on your next quest!"
