section,group,id,text
Event1,0,text01,先輩、こんにちは。<br>いつもありがとうございます。
Event1,0,11_voice_NPC_5062_100,惑星ハルコタンは、今までの惑星と<br>全くちがう文化の惑星ですね。<br>独自の発展を遂げてて、素敵です。
Event1,0,text03,でも、そこにもダーカーや<br>ブーストエネミーは出現する……<br>放ってはおけないです。
Event1,0,text04,ご協力、よろしく
Event1,1,text01,Hola. Gracias por toda tu ayuda.
Event1,1,11_voice_NPC_5062_100,", ¿no es así? Es maravilloso que<br>se hayan desarrollado de maneras tan únicas."
Event1,1,text03,"Sin embargo, Falspawn y Berserk Enemies también han aparecido allí. Simplemente no podemos dejarlos en paz."
Event1,1,text04,"¡Diablos, sí! Tengo muchas ganas de volver a trabajar contigo <br>, ¡enseña!"
