section,group,id,text
Event1,0,text01,あ、オレはハンスってんだけど。<br>おたくは確か……<br><%me>？
Event1,0,text02,なに驚いてんの。おたく有名よ？<br>マジ半端ないアークスだって。<br>でもアークス入った時期は同じだろ？
Event1,0,11_voice_NPC_5052_100,てなわけで、タメ口でいいよな？<br>ま、仲良くやろうぜ！<br>オレ、おたくを手本にすっからさ。
Event1,0,text04,ここでモニターさせてもらってるから<br>原生種を手当たり次第に撃破<br>いっ
Event1,1,text01,"Hola, soy Hans. Eres...<br><%me>, ¿verdad?"
Event1,1,text02,¿Por qué tan sorprendido? Eres famoso.<br>Te has hecho un nombre en ARKS.<br>Pero nos unimos casi al mismo tiempo.
Event1,1,11_voice_NPC_5052_100,"Estamos bien, ¿verdad? Podemos ser amigos, tú y yo.<br>Puedes compartir tus mejores consejos conmigo."
Event1,1,text04,"Voy a monitorearte desde aquí, así que simplemente<br>desperdiciarás un montón de sylvants, ¿de acuerdo? ¡Vuélvete loco!"
