section,group,id,text
Event1,0,text01,少ない情報かき集めて<br>魔物種について<br>調べてみたんだけどよ。
Event1,0,text02,今んとこ、わかったことっつったら<br>大群がすげースピードで<br>突撃してくるってことぐらいなわけよ。
Event1,0,11_voice_NPC_5052_100,アークス随一の頭脳派のオレとしては<br>コイツらと実際に戦う前に<br>データを集めておきてーんだよな。
Event1,0,text04,つーわけで、お次は<br>ミノタオルグスってエネミーの<br>情報提供を頼めねーかな
Event1,1,text01,He estado recopilando la poca información que puedo sobre<br>los sobrenaturales.
Event1,1,text02,"Pero lo mejor que tengo hasta ahora es que cuando<br>te atacan, lo hacen rápido y en manadas enormes."
Event1,1,11_voice_NPC_5052_100,"Como cerebro de toda la operación ARKS,<br>quiero obtener más datos antes de que tengamos<br>enfrentamientos reales con ellos."
Event1,1,text04,¿Crees que podrías darme información sobre este<br>enemigo llamado Minotaurgz?
