section,group,id,text
Event1,0,text01,ご苦労だった。<br>まあ改めて言うべきことも特にないな。<br>今回は安心して見ていられたよ。
Event1,0,text02,だが、そろそろ欲目を出しても<br>いい頃だろう。
Event1,0,11_voice_NPC_5054_100,テクニックが大きく開花することを<br>
Event1,1,text01,"Esa fue una tarea dificil. Bueno, no tengo nada especifico que decir. Estaba tranquilo al verte esta vez."
Event1,1,text02,"De todos modos, parece que es hora de que deje que mi sesgo<br>se muestre un poco. Espero mucho de<br>ti en el futuro."
Event1,1,11_voice_NPC_5054_100,Estoy ansioso por ver florecer tus Técnicas.
