section,group,id,text
Event1,0,text01,エクステンドレベル３以上の<br>武装エクステンドを、三度実行する。
Event1,0,text02,目的を言うだけなら、それだけじゃが<br>その実行に至るまでの準備など<br>やることはたくさんあるはずじゃ。
Event1,0,11_voice_NPC_5011_100,これを成し遂げた時<br>お主はさらなる高みへと
Event1,1,text01,Extiende un arma tres veces para que su<br>Nivel de extensión sea tres o mayor.
Event1,1,text02,"Puede parecer un objetivo simple, pero se requiere<br>mucha preparación para lograr<br>dicha tarea."
Event1,1,11_voice_NPC_5011_100,"Cuando hayas logrado eso, habrás<br>mejorado como artesano."
