section,group,id,text
Event1,0,text01,うわぁ……これが噂の<br>スノウバンサー達の肉かぁ……
Event1,0,11_voice_NPC_5051_104,やっぱり、マルモスのものとは<br>質が違う感じね。<br>日常的に食べてるものが違うのかな？
Event1,0,text03,……あーっと、忘れてた！<br>今回のお礼、渡さないと！<br>本当にありが
Event1,1,text01,"Vaya... ¡Carne de Snow Banser, en carne y hueso!<br>Literalmente."
Event1,1,11_voice_NPC_5051_104,"Mmmm, tiene una consistencia muy diferente a la de<br>Marmoth. ¿Quizás se deba a diferencias en<br>sus dietas?"
Event1,1,text03,"¡Oh, casi me olvido de tu recompensa!<br>¡Aquí, muchas gracias!"
