section,group,id,text
Event1,0,text01,おつかれさまっ！<br>ビーチの敵を一掃してくれたんだね。<br>これで安心だよ。本当にありがとう！
Event1,0,11_voice_NPC_5099_101,輝く太陽に照らされて<br>キラキラする海を思いっきり楽しむ<br>みんなの笑顔が待ちきれないよ！
Event1,0,text03,さ、このあとは貴方も<br>心置きなく、夏を満喫していっ
Event1,1,text01,¡Está bien! Realmente limpiaste a<br>a todos los enemigos en la playa.<br>¡Realmente lo aprecio!
Event1,1,11_voice_NPC_5099_101,"El sol brillante, retozando en nuestros corazones<br>contentos en el océano resplandeciente...<br>¡No puedo esperar a ver las caras sonrientes de todos!"
Event1,1,text03,¡Y tú también! ¡Deja atrás todos tus problemas<br>y disfruta del verano!
