section,group,id,text
Event1,0,text01,いや、本当にさっくりと<br>終わらせてきやがったなー。
Event1,0,text02,何？　エネミーが<br>たくさん出るから簡単だった？<br>……い、言ってくれるじゃねーか。
Event1,0,11_voice_NPC_5052_101,ま、考えようによっちゃ<br>どっちを向いても敵だらけだから<br>攻撃すりゃあたるわな！
Event1,0,text04,よーし、オレもやってやるぜ！<br>今回もサンキューな。<br>またよろしく頼む
Event1,1,text01,"Vaya, terminaste eso en un abrir y cerrar de ojos."
Event1,1,text02,¿Qué es eso? ¿Dices que fue fácil porque los<br>enemigos simplemente se acercaban a ti? ¡La boca de<br>este niño!
Event1,1,11_voice_NPC_5052_101,漀眀 樀甀猀琀 琀栀爀漀眀 漀甀琀 愀渀 愀琀琀愀挀欀㰀戀爀㸀愀渀礀眀栀攀爀攀 愀渀搀 栀椀琀 猀漀洀攀琀栀椀渀最Ⰰ 爀椀最栀琀㼀
Event1,1,text04,"¡Genial, estoy dispuesto a eso! Gracias de nuevo, amigo.<br>Sigue así, ¿eh?"
