section,group,id,text
Event1,0,text01,今回の試験は、惑星・地球の<br>東京というエリアでの自由な探索活動を<br>許可するためのものとなります。
Event1,0,11_voice_NPC_5050_104,本来ならば、地球と我々アークスとの<br>接点を作った貴方に、このような任務を<br>課すのは、おかしな話なのですが……
Event1,0,text03,これもひとえに<br>組織というものの硬直性ゆえと<br>ご容赦いただければと思います。
Event1,0,text04,とはいえ、貴方の実力をもってすれば<br>問題のない任務でしょう。<br>それでは、吉報をお待ちして
Event1,1,text01,The purpose of this trial is to certify you to<br>act freely in the Tokyo area of Planet Earth.
Event1,1,11_voice_NPC_5050_104,椀渀椀琀椀愀氀氀礀 攀猀琀愀戀氀椀猀栀攀搀 㰀戀爀㸀爀攀氀愀琀椀漀渀猀 戀攀琀眀攀攀渀 䔀愀爀琀栀 愀渀搀 䄀刀䬀匀Ⰰ 戀甀琀⸀⸀⸀
Event1,1,text03,Consider it part of the bureaucracy inherent<br>in our organization. Please pay it no mind.
Event1,1,text04,"Nevertheless, considering your level of skill,<br>this assignment shouldn't be an issue for you.<br>I await a favorable report."
