section,group,id,text
Event1,0,text01,今回の特訓も有意義なものだった。<br>共に現地へ向かってくれたこと<br>ありがたく思う。
Event1,0,11_voice_NPC_5151_100,お前の成長もめざましい。<br>私もウカウカしていられないな。
Event1,0,text03,次も互いにとって有益な特訓と<br>なれば良いな。<br>そ
Event1,1,text01,Esta formación fue bastante valiosa. Gracias por<br>acompañarme allí.
Event1,1,11_voice_NPC_5151_100,"Debería haber esperado tanto.<br>No puedo aflojar, no sea que me superes."
Event1,1,text03,"Espero que nuestro próximo ejercicio sea igual de<br>beneficioso. Entonces, hasta la próxima."
