section,group,id,text
Event1,0,text01,センパイ、今回は浮遊大陸にいる<br>龍族のバリドランで頼む。<br>ちょっと獣っぽい感じのやつな。
Event1,0,11_voice_NPC_5091_104,そんなに脅威じゃないって？<br>そうかもしれないけど……<br>何ていうか、相性が悪いんだよ。
Event1,0,text03,こっちの間合いに近づく前に<br>遠距離攻撃をされるし、群れている。<br>効率良く倒す方法が、分からない。
Event1,0,text04,センパイ、いつも頼んで悪いけど<br>ジャストアタックでの仕留め方ってのを<br>おれに見せ
Event1,1,text01,攀 漀昀 琀栀漀猀攀 䈀愀爀椀搀爀愀渀㰀戀爀㸀䐀爀愀挀漀渀椀愀渀猀⸀ 夀漀甀 欀渀漀眀Ⰰ 琀栀攀 爀攀愀氀 戀攀愀猀琀氀礀 昀攀氀氀愀猀⸀
Event1,1,11_voice_NPC_5091_104,"Sure.<br>They probably aren't a big deal for you, but,<br>well, they're not the easiest of foes for me."
Event1,1,text03,攀礀 樀甀猀琀 㰀戀爀㸀猀眀愀爀洀 愀爀漀甀渀搀 洀攀Ⰰ 礀漀甀 欀渀漀眀㼀 䤀 搀漀渀✀琀 㰀戀爀㸀欀渀漀眀  栀漀眀 琀漀 昀攀渀搀 琀栀攀洀 漀昀昀⸀
Event1,1,text04,礀漀甀 挀漀甀氀搀 猀栀漀眀 洀攀 㰀戀爀㸀栀漀眀 琀漀 昀椀渀椀猀栀 琀栀攀洀 漀昀昀 眀椀琀栀 愀 瀀攀爀昀攀挀琀 愀琀琀愀挀欀⸀
