section,group,id,text
Event1,0,text01,戻ったな。<br>随分と上達したようだ。
Event1,0,11_voice_NPC_5151_100,特訓を重ねてこそ、意味がある。<br>それが証明されて何よりだ。
Event1,0,text03,自主的に努力を重ねることはもちろん<br>更なる高みを目指すなら<br>特訓を課そう。
Event1,0,text04,今よりハードな特訓メニューを<br>用意
Event1,1,text01,Has vuelto... coloréame impresionado. Has<br>mejorado significativamente.
Event1,1,11_voice_NPC_5151_100,La formación especial tiene valor; eso está<br>muy claro.
Event1,1,text03,漀甀 眀愀渀琀 琀漀 琀爀甀氀礀 攀砀挀攀氀Ⰰ㰀戀爀㸀琀栀攀渀 猀瀀攀挀椀愀氀 琀爀愀椀渀椀渀最 椀猀 琀栀攀 眀愀礀 琀漀 最漀⸀
Event1,1,text04,Planearé un curso aún más difícil para ti<br>la próxima vez.
