section,group,id,text
Event1,0,11_voice_NPC_5099_104,まさかのビッグニュースだよ！<br>普段は海岸エリアで見かけない<br>ネプト・キャサドーラが出たんだって！
Event1,0,text02,この会場付近でもすでに何度か<br>目撃されているみたいなの！
Event1,0,text03,さすがに<br>青い海じゃなくて火の海は勘弁！<br>こんがり焼けすぎちゃうよーっ！
Event1,0,text04,何度も頼んでごめんねっ<br>貴方だけが頼り
Event1,1,11_voice_NPC_5099_104,¡Tengo algunas noticias para ti! ¡Un Nept<br>Casadohra ha sido avistado en la costa! <br>¡Eso básicamente nunca sucede!
Event1,1,text02,¡Aparentemente también ha sido visto en el resort unas cuantas<br>veces!
Event1,1,text03,"¡Quiero un hermoso mar de agua, no un mar de<br>llamas! ¡Esa cosa quemará todo hasta dejarlo<br>crujiente!"
Event1,1,text04,"Lo siento, te sigo pidiendo que me ayudes, ¡pero eres<br>el único con quien puedo contar!"
