section,group,id,text
Event1,0,11_voice_NPC_5050_101,報告、承りました。<br>それでは達成の報酬として<br>フォトンクリスタルをお渡しします。
Event1,0,text02,本件は、既定時間を過ぎれば<br>再度受注していただくことが可能です。
Event1,0,text03,フォトンクリスタルは非常に有用な<br>ものです。それゆえ、無理をおして<br>挑戦してしまう者も多い。
Event1,0,text04,その身は一つであることを<br>常にお忘れないよう。<br>無理はなさらないようにお願いしま
Event1,1,11_voice_NPC_5050_101,"Ahora que he presentado un informe con respecto a<br>tu trabajo, te daré un cristal de fotones que<br>ganaste."
Event1,1,text02,Puede aceptar este pedido nuevamente después de que haya transcurrido un<br>período de tiempo determinado.
Event1,1,text03,栀攀洀猀攀氀瘀攀猀 琀漀 琀栀攀椀爀 氀椀洀椀琀猀 愀渀搀㰀戀爀㸀戀攀礀漀渀搀 椀渀 漀爀搀攀爀 琀漀 漀戀琀愀椀渀 琀栀攀洀⸀
Event1,1,text04,Nunca olvides que tienes una sola vida.<br>No te esfuerces demasiado.
