section,group,id,text
Event1,0,11_voice_NPC_5053_101,ありがとう！<br>キミからもたらされた情報は<br>必ずや幻創種の解明に役立つだろう。
Event1,0,text02,幻創種は、そもそも生物と<br>大別してよいものかすらも<br>定かではない存在のようなのだ。
Event1,0,text03,研究には、これまで以上の困難が<br>待ち受けているだろう。<br>私も気を引き締めてかかるよ。
Event1,0,text04,少ないが、謝礼を受け取ってほしい。<br>これからも私の研究に<br>力を貸してもら
Event1,1,11_voice_NPC_5053_101,"¡Ah, gracias! La información que me trajiste<br>sin duda será fundamental para analizar<br>los fantasmas."
Event1,1,text02,搀攀爀攀搀 㰀戀爀㸀氀椀瘀椀渀最 戀攀椀渀最猀Ⰰ 琀栀漀甀最栀 琀栀攀礀 瀀漀猀猀攀猀猀 㰀戀爀㸀洀愀渀礀 猀椀洀椀氀愀爀 焀甀愀氀椀琀椀攀猀⸀
Event1,1,text03,"La investigación será más difícil<br>que nunca, pero debo estar a la altura de la tarea."
Event1,1,text04,Por favor acepte esta modesta recompensa.<br>Agradecería contar con tu ayuda nuevamente.
