section,group,id,text
CharaName,0,name01,オーザ
CharaName,1,name01,Oza
Event1,0,11_voice_NPC_5020_100,よし、こんなものだな。<br>良い練習になったと思うぞ。
Event1,0,text02,単騎での実力研鑽ももちろんだが<br>アークスとしては、連携行動も<br>おろそかにするわけにはいかない。
Event1,0,text03,それを忘れなければ大丈夫だ。<br>では、一度帰還するとしよう。
Event1,1,11_voice_NPC_5020_100,Eso debería bastar. Buena práctica.
Event1,1,text02,"Ahora, por supuesto, los agentes de ARKS debemos estar<br>siempre listos para trabajar en solitario, pero eso no significa<br>que podamos dejar pasar el trabajo en equipo."
Event1,1,text03,"Solo tenlo en cuenta y lo harás bien.<br>¡Ahora, de regreso al barco!"
