section,group,id,text
Event1,0,text01,うん、ちゃんと揃ってるわね！<br>状態もいいし、問題ないわ。
Event1,0,11_voice_NPC_5056_101,無事に帰ってきたみたいだし<br>頑張ってくれたみたいね！
Event1,0,text03,ちゃんと報酬はあるからね。<br>ほら！
Event1,0,text04,ま、ともかくお疲れ様！<br>それじゃ、また
Event1,1,text01,"¡Sí, los tienes todos! Y están todos en buenas<br>condiciones, así que no hay problemas."
Event1,1,11_voice_NPC_5056_101,"Parece que regresaste sano y salvo, <br>, ¡así que debes haber trabajado duro ahí fuera!"
Event1,1,text03,"No te preocupes, no olvidé tu recompensa. ¡Aquí!"
Event1,1,text04,"De todos modos, ¡excelente trabajo! ¡Hasta luego!"
