section,group,id,text
Event1,0,11_voice_NPC_5052_107,おいおい本当に大丈夫なのか！？<br>あんなの絶対、倒せないって！
Event1,0,text02,いやもちろん<br>倒してみてほしいけどさ……
Event1,0,text03,おたくはマジで考え方が前向きだな。<br>みんながおたくを信頼する理由が<br>さすがにオレにもわかってきたぜ。
Event1,0,text04,とはいってもオレには<br>ここで応援することしかできねえけど<br>頑張ってくれよな！
Event1,1,11_voice_NPC_5052_107,"Amigo, ¿estás seguro de que sabes lo que estás haciendo<br>aquí? No quiero ser deprimente, ¡pero de ninguna manera<br>esa cosa se va a caer!"
Event1,1,text02,"Pero, ah, supongo que me encantaría verte<br>intentarlo de todos modos."
Event1,1,text03,Pero no es difícil saber por qué<br>todos tienen tanta fe en ti.
Event1,1,text04,"ines como siempre. ¡Pero ve a buscar <br>! ¡Dale todo lo que tienes, amigo!"
