section,group,id,text
Event1,0,text01,ヒュー……流石だぜ。<br>やってくれたか、ありがとな。
Event1,0,11_voice_NPC_5427_203,いくら相手が原生種とは言え……<br>ノルマが尋常じゃないからな。<br>手伝ってくれて大助かりだ。
Event1,0,text03,まだ依頼は残ってるんだ。<br>よかったら、また手伝ってくれ。<br>その分の礼
Event1,1,text01,¡Qué bueno! Realmente me ayudaste <br>.
Event1,1,11_voice_NPC_5427_203,"Incluso para los estándares de Sylvant, esta cuota de<br>no es razonable. Realmente aprecio que<br>hayas mejorado mis números."
Event1,1,text03,Todavía tengo más trabajos en un segundo plano si<br>quieres seguir contribuyendo. Haré que valga la pena<br>si lo haces.
