section,group,id,text
Event1,0,text01,さて、参りましょう。<br>散策するうちに、したいことを<br>思い出せると良いのですが……
Event1,0,text02,へえ、この森、なかなかいい処だねえ。<br>なんか弱そうなザコがいる程度だし<br>気にしないで、歩きながら考えようよ。
Event1,0,text03,それはいいのだが……この服で動くと<br>胸元の鈴が鳴るのが、些か気になる……<br>まあ、行くとしようか。
Event1,1,text01,"Ahora, sigamos nuestro camino.<br>Ojalá pueda recordar qué es<br>que quiero hacer a medida que avanzamos."
Event1,1,text02,"Vaya, este bosque es un bonito lugar. Todos estos tipos<br>parecen débiles, así que ignorémoslos y reflexionemos un poco."
Event1,1,text03,"Bueno, pero... cuando me muevo con esta ropa, el sonido de la campana en el pecho es un poco inquietante... Bueno, vamos a ver."
