section,group,id,text
,0,pr_058050_0010,敵性存在の消滅を確認。<br>お疲れさまでした！
,0,pr_058050_0020,それにしても、この領域……<br>エフィメラの濃度によって<br>出現する敵も強くなるみたいです。
,0,pr_058050_0030,領域の濃度は、アークスの技術で<br>干渉が可能ということがわかりました。<br>少しずつ濃度を上げて調査しましょう。
,0,pr_058050_0040,今はまだ低濃度領域での調査ですが<br>現状でも敵の強さは桁違いです。<br>無理はしないでくださいね！
,1,pr_058050_0010,¡Presencia enemiga eliminada! ¡Trabajo bueno!
,1,pr_058050_0020,Aún así... Parece que los enemigos en esta área son más fuertes debido a la gran concentración de Ephemera.
,1,pr_058050_0030,n<br>esta área. Intentemos aumentar la concentración mientras investigas.
,1,pr_058050_0040,洀椀攀猀 栀攀爀攀 愀爀攀 漀渀 愀 搀椀昀昀攀爀攀渀琀 氀攀瘀攀氀⸀ 䐀漀渀✀琀 搀漀 愀渀礀琀栀椀渀最 爀椀猀欀礀Ⰰ 漀欀愀礀㼀
