section,group,id,text
MainText,0,name010,メッセージパック
MainText,0,text010,こちら調査隊、記録を残す！<br>クソッタレ、通信はまだ繋がらないのか……!?
MainText,0,text020,襲撃を受けた。多数のスターレス……待ち伏せだった可能性が高い。<br>応戦の最中に散開、隊は分断された。
MainText,0,text030,もし、これを見た者がいるなら、気をつけろ。<br>これは、偶然じゃない……！
MainText,1,name010,módulo de datos
MainText,1,text010,¡Equipo de investigación registrándose!<br>¡Maldita sea! ¿¡Las comunicaciones todavía están caídas!?
MainText,1,text020,Hemos sido atacados por numerosos Starless. Probablemente fue una emboscada.<br>Nos separaron durante los combates.
MainText,1,text030,"Si alguien ve esto, ¡tenga cuidado! ¡Este no fue un incidente casual!"
