section,group,id,text
CharaName,0,name01,？？？
CharaName,0,name02,？？？
CharaName,1,name01,???
CharaName,1,name02,???
CharaName,0,ra_025020_0001,A.P.238/7/10
CharaName,0,ra_025020_0010,<%me><br>……待っていた。
CharaName,0,ra_025020_0020,ははっ、どうかな？<br>今の話し方、シオンみたいだったろう？
CharaName,0,ra_025020_0030,ま、ぼくは彼女のコピーだから<br>似てて当然なんだけどね。
CharaName,0,ra_025020_0040,でも、かたっくるしいのはなしだ。<br>気楽に話しかけて欲しいかな。<br>ぼくも、君を気軽に頼るから。
CharaName,0,ra_025020_0050,ああっとそれより、本題だね。<br>君を呼び出した理由。<br>直接話したいこと。
CharaName,0,ra_025020_0060,彼女……<br>マトイのことについてさ。
CharaName,0,ra_025020_0070,単刀直入に言うと<br>彼女が何者なのか、わからない。<br>どこにも、データが存在しないんだ。
CharaName,0,ra_025020_0080,あれだけの力を持っているのに<br>その存在すら記録されていない。<br>……これはおかしい。
CharaName,0,ra_025020_0090,アークスのデータベースにも<br>シオンの記録の中にも、どこにも……<br>まるで、故意に消されたように、ね。
CharaName,0,ra_025020_0100,ルーサーが抹消していたのなら<br>まだ納得がいったんだけど……<br>あいつも、彼女のことは知らなかった。
CharaName,0,ra_025020_0110,となると、そんなことができるのは<br>もう１人しかいない……
CharaName,0,ra_025020_0120,そう、シオンが消したんだ。<br>彼女の記録を、全て。
CharaName,0,ra_025020_0130,消されていたのはそれだけじゃない。<br>今からちょうど十年前の記録が<br>すべて、完全に抹消されている。
CharaName,0,ra_025020_0135,記録だけじゃない。<br>アークス全員の記憶も、消されてる。<br>誰も、まともに覚えていないんだ。
CharaName,0,ra_025020_0140,サルベージも追跡調査も不可能。<br>不自然なほどに、完全にね。
CharaName,0,ra_025020_0150,十年前……皆が忘れたその時間に<br>きっと、何かがあるはず。<br>でも、消された記録は辿れない……
CharaName,0,ra_025020_0160,だったら、見に行けばいい。<br>何があったのかを、直接ね。
CharaName,0,ra_025020_0170,<%me>なら<br>それができる。
CharaName,0,ra_025020_0180,……これはなにも好奇心だけで<br>言っているわけじゃないんだ。
CharaName,0,ra_025020_0190,シオンはいなくなり<br>ルーサーは滅んだ。<br>これから、アークスは生まれ変わる。
CharaName,0,ra_025020_0200,つまり、ルーサーの持っていた管制も<br>シオンの司っていた演算も<br>全て、ぼくがやらなければならない。
CharaName,0,ra_025020_0210,これからはじまる新たなアークスの<br>管理と保全のために、ぼくは<br>可能な限り、知らなければならない。
CharaName,0,ra_025020_0220,それがどんなに都合の悪いこと<br>だったとしても。
CharaName,0,ra_025020_0230,とはいえ、好奇心があるのも事実。<br>ぼく自身、ぼくが生まれる前の歴史を<br>見てみたいって思ってるしね。
CharaName,0,ra_025020_0240,だから、どうするかの判断は<br>君に任せるよ。<br>知らない方がいいことも、きっとある。
CharaName,0,ra_025020_0250,それでも、協力してくれるなら<br>いつでも話しかけて欲しい。<br>ぼくはここで、君を待ってるからさ。
CharaName,0,ra_025030_0010,ありがとう。君ならきっと<br>協力してくれると思ってたよ。
CharaName,0,ra_025030_0020,さて、そうと決まったら<br>さっさと動き出さないとね。
CharaName,0,ra_025030_0030,完全に抹消された記録の日時。<br>その空白の日時を見に行けば<br>きっと何かがわかるはずだ。
CharaName,0,ra_025030_0040,今までやってきた時間遡航の<br>応用みたいな感じだよ。
CharaName,0,ra_025030_0050,でも、君ならきっとできる。<br>これまで何度も、跳んできた<br>君になら。
CharaName,0,ra_025030_0060,……もしかしたらシオンは、ここまで<br>見越していたのかもしれないね。<br>……だから、君を選んだのか。
CharaName,0,ra_025030_0070,バックアップはぼくに任せて<br>君は現地へ向かって。
CharaName,0,ra_025030_0080,何があったのか<br>しっかり見届けよう。
CharaName,0,al_020040_0010,シオンの願いはアークスをルーサーから<br>解放して、皆を未来へと繋ぐこと……<br>そういうこと、だったんだよね。
CharaName,0,al_020040_0020,この答えに至るまで、何度も失敗して<br>その度に演算を繰り返して……<br>ようやく、辿り着いた結果なんだね。
CharaName,0,al_020040_0030,……シオンが消えたのは悲しいけど<br>それがシオンの出した答えだから<br>受け入れてあげないと、かな。
CharaName,0,al_020040_0040,こうしてアークスはルーサーの支配から<br>脱却することができたんだね。<br>……ただ、まだ謎が残ってるよ。
CharaName,0,al_020040_0050,二代目ちゃんの、記録。<br>ルーサーからその存在を秘匿するため<br>オラクル全体の記録と記憶を消去した。
CharaName,0,al_020040_0060,それが、１０年前……ああいや<br>今からで考えると１３年前ぐらいかな？
CharaName,0,al_020040_0070,アカシックレコードにアクセスできる<br>シオンだからこその荒技だよね。<br>世界の記憶から消しちゃうなんて。
CharaName,0,al_020040_0080,でも、相当無茶したんだと思うよ。<br>シオンはあくまで観測者で<br>そういうことをする存在じゃないし。
CharaName,0,al_020040_0090,自分の本分ではないことまでして<br>二代目ちゃんを隠したがったのは何故。<br>シオンは、何を考えていたのかな。
CharaName,0,al_020040_0100,答えは、過去にありそうだね……
CharaName,1,ra_025020_0001,A.P.238/7/10
CharaName,1,ra_025020_0010,<br>... I have long awaited your arrival.
CharaName,1,ra_025020_0020,"Heh, what do you think of my Xion impression?<br>Totally captured the vibe, right?"
CharaName,1,ra_025020_0030,"I mean, I'm teeechnically a copy of her, so it<br>wouldn't be that weird if I had ended up<br>exactly like her."
CharaName,1,ra_025020_0040,"act for the both of<br>us. I'd rather talk like, y'know, a real person."
CharaName,1,ra_025020_0050,"Anywho, let's get right to why I called you<br> here. There's something I wanted to tell you<br> directly."
CharaName,1,ra_025020_0060,"It's about...<br>Well, it's about Matoi."
CharaName,1,ra_025020_0070,"If I'm being quite honest with you, I'm not<br>sure who or what she really is. We have no<br>data on her."
CharaName,1,ra_025020_0080,"Surely you know as well as I do that someone<br>with her insanely high level of skill sticks<br>out like a sore thumb, right?"
CharaName,1,ra_025020_0090,椀漀渀✀猀 爀攀挀漀爀搀猀⸀ 㰀戀爀㸀䤀琀✀猀 氀椀欀攀 猀漀洀攀漀渀攀 搀攀氀椀戀攀爀愀琀攀氀礀 攀搀椀琀攀搀 栀攀爀 漀甀琀⸀
CharaName,1,ra_025020_0100,"Now, if it had been Luther, that much I could<br>understand. But even HE didn't seem to know<br>about her."
CharaName,1,ra_025020_0110,"And if it wasn't him, I can think of only one<br>other possible suspect..."
CharaName,1,ra_025020_0120,It had to have been Xion. They must have<br>erased all record of Matoi.
CharaName,1,ra_025020_0130,"And it's not just Matoi that got wiped. Xion<br>seems to have deleted all records beyond<br>about, oh, ten or so years ago."
CharaName,1,ra_025020_0135,"Not just physical records, either. Nobody in<br>ARKS seems to have any clear memories from<br>then anymore, either."
CharaName,1,ra_025020_0140,either. It's vanished<br>straight out of existence. Bloop. Gone.
CharaName,1,ra_025020_0150,Something important had to have happened ten<br>years ago. But we can't revisit memories that<br>no longer exist...
CharaName,1,ra_025020_0160,What we NEED to do is go back directly<br>and see it all for ourselves.
CharaName,1,ra_025020_0170,You are more than capable of that.
CharaName,1,ra_025020_0180,"And this isn't just to sate my own curiosity,<br>either."
CharaName,1,ra_025020_0190,"Xion is no longer with us, and Luther has<br>fallen. ARKS is taking its first steps forward <br>into a brand-new era."
CharaName,1,ra_025020_0200,䰀甀琀栀攀爀 栀攀氀搀 愀渀搀㰀戀爀㸀琀栀攀 挀愀氀挀甀氀愀琀椀漀渀猀 琀栀愀琀 堀椀漀渀 爀愀渀 愀氀氀 戀礀 洀礀猀攀氀昀⸀
CharaName,1,ra_025020_0210,"wborn ARKS, I need to know<br>as much as possible about what happened."
CharaName,1,ra_025020_0220,That includes even things I might not WANT<br>to know the truth about.
CharaName,1,ra_025020_0230,"That said, I won't pretend I'm not curious<br>about it all. I'd quite like to see what<br>happened before I ever even existed."
CharaName,1,ra_025020_0240,ely stuff we'd probably<br>be happier staying blissfully ignorant of.
CharaName,1,ra_025020_0250,"But if you're willing to help me out anyway,<br> feel free to speak to me anytime. I'll be right<br>here waiting."
CharaName,1,ra_025030_0010,Thank you. I knew you wouldn't disappoint me.
CharaName,1,ra_025030_0020,"Right, then! Idle hands never accomplished<br>anything, so let's get to work!"
CharaName,1,ra_025030_0030,"If we just head back to the time that has been<br>wiped clean from history itself, we should<br>learn a thing or two."
CharaName,1,ra_025030_0040,This will be a lot like the sort of time travel<br>you've done already.
CharaName,1,ra_025030_0050,be just another drop in the<br>bucket of your wild life experiences.
CharaName,1,ra_025030_0060,"Xion might have even known I'd try to do this.<br>Maybe that's why they chose you in the first<br>place, y'know?"
CharaName,1,ra_025030_0070,I'll be on backup duty.<br>You just head to the target location.
CharaName,1,ra_025030_0080,Let's find out what truly happened.
CharaName,1,al_020040_0010,I think what Xion really wanted was to free<br>ARKS from Luther's clutches and give them<br>a future...
CharaName,1,al_020040_0020,最 愀渀搀 爀攀挀愀氀挀甀氀愀琀椀渀最Ⰰ 甀渀琀椀氀㰀戀爀㸀眀攀 昀椀渀愀氀氀礀 愀爀爀椀瘀攀搀 眀栀攀爀攀 眀攀 愀爀攀 琀漀搀愀礀⸀
CharaName,1,al_020040_0030,"accounted for, then I<br>suppose it's something we just have to accept."
CharaName,1,al_020040_0040,"Thanks to them, ARKS finally broke away from<br>Luther. But...this still leaves plenty of<br>questions unanswered."
CharaName,1,al_020040_0050,Xion erased all record of Oracle itself to<br>hide our little predecessor from Luther.
CharaName,1,al_020040_0060,"That was ten-- No, I suppose it would<br>have been thirteen years ago now."
CharaName,1,al_020040_0070,Only Xion--someone with direct access to the<br>Akashic Records themselves--could have pulled<br>something like that off.
CharaName,1,al_020040_0080,-not one who should<br>directly meddle with the universe's affairs.
CharaName,1,al_020040_0090,琀 昀漀爀 漀甀爀 氀椀琀琀氀攀 昀爀椀攀渀搀㰀戀爀㸀琀栀攀爀攀㼀 圀栀愀琀 眀愀猀 最漀椀渀最 琀栀爀漀甀最栀 堀椀漀渀✀猀 洀椀渀搀㼀
CharaName,1,al_020040_0100,"If we want answers, we're just gonna have to<br>look to the past to find out."
