section,group,id,text
,0,ssc_504070_0010,やあ、キミか。
,0,ssc_504070_0020,なにか相談？
,0,ssc_504070_0030,なにかあったの？
,0,ssc_504070_0040,いや、ヴァエル襲来時の戦いについて、<br>ふりかえっていたんだ。
,0,ssc_504070_0050,スターレスの軍勢は、<br>ヴァエルの出現と同時にハルファ全域に現れた。
,0,ssc_504070_0060,今までに、見たこともない数だった……。
,0,ssc_504070_0070,それこそ、地平線を埋め尽くすんじゃないか<br>っていうくらいにね。
,0,ssc_504070_0080,でも、こちらも入念な準備をしていた。
,0,ssc_504070_0090,各リージョンのアークスを集めて、<br>合同訓練を繰り返していたのだ。
,0,ssc_504070_0100,それが、あの戦いで実を結んだ。
,0,ssc_504070_0110,みんな、最前線で、<br>臨機応変な動きを見せてくれた。
,0,ssc_504070_0120,僕や、ほかのリージョンリーダーが、<br>細かな指示を出さずともね。
,0,ssc_504070_0130,前線で、とくに目覚ましい活躍を見せたのが、<br>アイナとマノンだ。
,0,ssc_504070_0140,そうだね。<br>ふたりは、本当によくやってくれた。
,0,ssc_504070_0150,アイナは、自身が育てた訓練生を率いて、<br>各地を転戦していた。
,0,ssc_504070_0160,マノンも、戦力の手薄なところを見つけて、<br>戦線の瓦解を防いでいた。
,0,ssc_504070_0170,おかげで、<br>私もセントラルシティの防衛に専念できた。
,0,ssc_504070_0180,ふたりには、<br>本当に感謝している。
,0,ssc_504070_0190,ふたりとも強くなった。
,0,ssc_504070_0200,これから、もっと強くなると思う。
,0,ssc_504070_0210,うん。<br>本当にね。
,0,ssc_504070_0220,だとしたら、<br>キミも、うかうかしていられないな。
,0,ssc_504070_0230,キミたち三人は、これからのアークスを<br>背負って立つ存在になるだろう。
,0,ssc_504070_0240,でも、何度も言うけど、<br>キミたちの力だけに頼っていてはいけない。
,0,ssc_504070_0250,アークスひとりひとりが強くならなければ、<br>いつか立ち行かなくなる。
,0,ssc_504070_0260,戦いが続く限りはね……。
,0,ssc_504070_0270,今は、そのための体制づくりを進めている。
,0,ssc_504070_0280,各リージョン間の連携は、<br>先の戦いで成功例をつくることができた。
,0,ssc_504070_0290,これからは、<br>より一体的な運用を目指していきたいね。
,0,ssc_504070_0300,まずは、それぞれの戦術を学び、<br>相互に活かせるようにしていくところから。
,0,ssc_504070_0310,それから、ルシエランの協力も得て、<br>新たな装備の開発も進めている。
,0,ssc_504070_0320,もちろん、新たなアークスの育成もね。
,0,ssc_504070_0330,アイナには、第２期の訓練生の面倒を、<br>見てもらうことにした。
,0,ssc_504070_0340,いずれは、ひとりひとりのアークスが、<br>キミに比肩する力を得る日が来るかもしれない。
,0,ssc_504070_0350,そうあってほしい。
,0,ssc_504070_0360,自分ひとりじゃ荷が重いから。
,0,ssc_504070_0370,うん。<br>期待していてくれ。
,0,ssc_504070_0380,その重荷を、少しでも軽くするのが、<br>僕たちの使命だね。
,0,ssc_504070_0390,アイナ君やマノン君がそうであるように、<br>みんなキミの背中を見て、一歩ずつ成長している。
,0,ssc_504070_0400,キミには、<br>これからも僕たちの希望であってほしい。
,0,ssc_504070_0410,よろしく頼むよ、ガー
,1,ssc_504070_0010,Hola.
,1,ssc_504070_0020,¿Trabajando en algo?
,1,ssc_504070_0030,¿Todo bien?
,1,ssc_504070_0040,"Oh, estábamos repasando lo que pasó cuando Vael lanzó su asalto."
,1,ssc_504070_0050,Los Starless aparecieron con fuerza al mismo tiempo que Vael emergía del espacio-tiempo.
,1,ssc_504070_0060,Nunca habíamos visto tantos de ellos.
,1,ssc_504070_0070,Era como si estuvieran cubriendo todo el planeta.
,1,ssc_504070_0080,Afortunadamente no nos pillaron desprevenidos.
,1,ssc_504070_0090,Habíamos estado haciendo ejercicios de entrenamiento conjuntos con ARKS de todo Halpha.
,1,ssc_504070_0100,Y todo ese duro trabajo dio sus frutos.
,1,ssc_504070_0110,Todos demostraron un ingenio increíble cuando lo necesitábamos.
,1,ssc_504070_0120,"Nosotros, los comandantes, ni siquiera necesitábamos dar órdenes detalladas."
,1,ssc_504070_0130,Las dos que realmente se destacaron en medio de todo esto fueron Aina y Manon.
,1,ssc_504070_0140,Sí.<br>Fueron realmente un espectáculo digno de contemplar.
,1,ssc_504070_0150,"Aina se movía por todos lados, llevando a sus alumnos a la batalla."
,1,ssc_504070_0160,Manon identificó puntos débiles en nuestra línea de batalla y evitó que fuera invadida.
,1,ssc_504070_0170,No necesitaba preocuparme por nada más que defender Central City.
,1,ssc_504070_0180,Realmente les debemos a esos dos.
,1,ssc_504070_0190,Ambos han crecido mucho.
,1,ssc_504070_0200,Y sólo se harán más fuertes.
,1,ssc_504070_0210,"¿Yo se, verdad?"
,1,ssc_504070_0220,Entonces parece que será mejor que no te relajes.
,1,ssc_504070_0230,Sospecho que ustedes tres asumirán toda la organización ARKS.
,1,ssc_504070_0240,"Pero, como dije, no podemos confiar simplemente en ustedes tres para todo."
,1,ssc_504070_0250,ARKS no funcionará a menos que cada defensor sea capaz de hacer lo que hace...
,1,ssc_504070_0260,Mientras estemos en guerra.
,1,ssc_504070_0270,Actualmente estamos elaborando un marco para ello.
,1,ssc_504070_0280,"Según nuestros resultados recientes, sabemos que las diferentes regiones pueden coordinarse muy bien."
,1,ssc_504070_0290,Todo lo que tenemos que hacer es seguir aprovechando esa coordinación.
,1,ssc_504070_0300,Necesitamos aprender las tácticas de cada uno y descubrir la mejor manera de utilizarlas.
,1,ssc_504070_0310,También tenemos a los Lecielan trabajando arduamente en el desarrollo de nuevos equipos.
,1,ssc_504070_0320,"Y, por supuesto, estamos entrenando a nuevos defensores de ARKS."
,1,ssc_504070_0330,Le hemos pedido a Aina que se encargue de nuestra segunda generación entrante de reclutas.
,1,ssc_504070_0340,¿Quién sabe? Quizás algún día tengamos un ejército de defensores tan fuertes como tú.
,1,ssc_504070_0350,Eso espero.
,1,ssc_504070_0360,Eso me quitaría un verdadero peso de encima.
,1,ssc_504070_0370,Entonces sólo mira.
,1,ssc_504070_0380,"Bueno, nuestro trabajo es ayudarle a llevar esa carga."
,1,ssc_504070_0390,No son sólo Aina y Manon. Todos te consideran su inspiración para seguir creciendo.
,1,ssc_504070_0400,Me gustaría que sigas siendo tú quien nos da esperanza.
,1,ssc_504070_0410,"Contamos contigo, Guardián."
