section,group,id,text
,0,name_7400,デュアドラ
,0,ssq_014277_0010,ほう……。<br>なかなかやるな。上出来だ。
,0,ssq_014277_0020,訓練によって、クラススキルが重要だっていうことも、<br>身をもって知っただろう。
,0,ssq_014277_0030,これからも経験を積んで、上達してほしい。<br>戦闘技術を突き詰めて、いつかバウンサーの道を究めてくれ。
,1,name_7400,Deirdre
,1,ssq_014277_0010,"Eh, no está nada mal. Muy bien hecho."
,1,ssq_014277_0020,No hay nada como entrenar para comprender realmente la importancia de las habilidades de clase.
,1,ssq_014277_0030,No puedo esperar a ver hasta dónde puedes llegar. Refinar las habilidades de batalla es la clave para dominar Bouncer <br>.
