section,group,id,text
,0,name_7234,ペッピーラッピー
,0,ssq_019080_003_0001,こんなにたくさん……、こんなにいろんな……！<br>まさにラッピーのパラダイスじゃないか!?
,0,ssq_019080_003_0002,キミのラッピーへの“愛”。しっかりと伝わってきたよ。<br>……キミになら全てを任せられそうだ。
,0,ssq_019080_003_0003,私のもとに戻って来てくれないか？<br>待っているよ
,1,name_7234,lleno de vida rappy
,1,ssq_019080_003_0001,¡Tantas... y tantas clases...! ¿Es este el paraíso del rap?
,1,ssq_019080_003_0002,Has demostrado adecuadamente tu amor por los Rappies. Creo que puedo confiar en ti.
,1,ssq_019080_003_0003,¿Volverías aquí? Voy a estar esperando.
