section,group,id,text
TutorialText,0,Title,ラッピーの集会場
TutorialText,0,text0001,各リージョンの探索セクションでは、<br>ドレッドエネミーを倒した時、まれに<br>たくさんのラッピーが出現することがあります。<br><br>ラッピーの鳴き声が響きわたるのが出現の合図です。<br>ガイドを頼りにラッピーの出現場所を見つけましょう。
TutorialText,0,text0002,ラッピーのほかにも、<yellow>“エンペ・ラッピー”<c>などの<br>特別なエネミーが出現します。
TutorialText,0,text0003,䈰訰縰夰Ȱ㰰戀爀㸀㰀戀爀㸀쌰퐰ﰰ渰䶜䱘Ｐ䶗輰弰謰渰䰰侮﹑湳࠰杖夰Ȱ㰰戀爀㸀가ꐰ줰鈰㰰誘欰쌰퐰ﰰ渰侮﹑㑳䁘鉢謰撉儰縰地蜰䘰Ȱ0吀瑵牯慩呬硥t
TutorialText,1,Title,Lugar rapero
TutorialText,1,text0001,". <br><br> Podrás escuchar el chirrido de los rappies, así que busca su punto de aparición utilizando la guía."
TutorialText,1,text0002,"También aparecerán enemigos especiales como<yellow>Emperappy <c>, además de Rappies."
TutorialText,1,text0003,"ctor.<br><br> Podrás escuchar el chirrido de los rappies, así que busca su punto de aparición utilizando la guía."
