section,group,id,text
TutorialText,0,Title,グリムモノリス浄化トライアル
TutorialText,0,text0001,エネミーに汚染された<yellow>“グリムモノリス”<c>を<br>浄化するトライアルです。<br><br>周囲のエネミーを倒すことでグリムモノリスは浄化され、<br>一定数のグリムモノリスを浄化するとクリアになります。
TutorialText,0,text0002,浄化されたグリムモノリスは、<br>効果範囲内のプレイヤーに威力上昇とダメージ軽減効果を<br>一定時間付与します。
TutorialText,1,Title,Prueba de purga de monolito sombrío
TutorialText,1,text0001,"La prueba purga una cierta cantidad de Grim Monoliths, lo que puedes hacer derrotando a los enemigos cercanos."
TutorialText,1,text0002,Los monolitos sombríos purgados otorgarán un aumento temporal de potencia y ventajas de reducción de daño a los jugadores dentro de su alcance efectivo.
