section,group,id,text
TutorialText,0,Title,戦闘力の上げ方・３
TutorialText,0,text0001,戦闘力を上げるには、<br><yellow>・装備品の潜在能力を解放する<c><br>などの方法もあります。
TutorialText,0,text0002,ﵗ鮀㺉ᵥ鈠砰皐匰栰朰䰰䢈縰夰Ȱ㰰戀爀㸀㰀戀爀㸀尀⡯ﵗ鮀湒㺉步漰İ㰰戀爀㸀㰀礀攀氀氀漀眀㸀ᰀ焠橷椰渰기똰뀰‰偽ᵧ㰠挀㸀栀丰ⴀ묰뼰䰰씰腟枉夰Ȱ0㰀礀攀氀氀漀眀㸀☀�鮕ㅒ㄀　　渀吰႐㱢挀㸀欀씰腟檉䰰했襶潛୎湎栰䨰訰朰夰Ȱ㰰戀爀㸀ﬀꐰ꼰뤰‰㰀礀攀氀氀漀眀㸀䰀瘀⸀㄀㔀㰀挀㸀㰀戀爀㸀ﬀꐰ꼰뤰栰따혰꼰뤰䈰輰嬰昰İ㰰礀攀氀氀漀眀㸀꼀뤰뤰괰鈰㄰㈀଀㱐挀㸀툀靿㱟戀爀㸀ﬀ씰馈ⵐ湎㰰礀攀氀氀漀眀㸀ꈰ옰ꌰ԰ᄦ滿昰桫鉖⬰㌀　㰀挀㸀縀朰㜰ᙟ㱓戀爀㸀
TutorialText,0,text0003,c>追加
TutorialText,1,Title,Aumentando tu poder de batalla III
TutorialText,1,text0001,También puedes aumentar tu poder de batalla<yellow>desbloqueando el potencial de tu equipo. <c>
TutorialText,1,text0002,ted en cada región.<br><br><yellow>Los materiales de recolección como Minerales<c>y N-Meseta son necesarios para desbloquear el Potencial.
TutorialText,1,text0003,+20<c><br>: agrega un<yellow>en total de 11 aumentos<c>a las armas y armaduras actualmente equipadas.
