section,group,id,text
CharaName,0,un_020030_0010,これはこれはどうもどうもどうも。<br>元気にやってますかあ？　リサですよ。
CharaName,0,un_020030_0020,ここはすっごくヘンでおもしろいので<br>思わずテンションが上がってますねえ。
CharaName,0,un_020030_0030,感じません？　あなたは感じません？<br>ここ、とおってもヘンな感じですよお？
CharaName,0,un_020030_0040,襲ってくる敵さんもなんというか<br>撃っていて感触がおかしいんですねえ。<br>なんといえばいいんでしょうかねえ。
CharaName,0,un_020030_0050,練習のために用意された的を<br>撃っているようで、でもその的に<br>意志がある。なんともたまらないです！
CharaName,0,un_020030_0060,動いて悶えて苦しんで倒れてくれる的が<br>そこらじゅうにいーっぱいというのは<br>リサにとっての理想郷ですねえ！
CharaName,0,un_020030_0070,ではではそれでは、リサは<br>またもう一度行ってきちゃいます。<br>ごきげんよう、ごきげんよう。
