section,group,id,text
,0,un_058020_0010,あらあらあらあら？<br>珍しいお姿があるなあと思ったら<br>シエラさんじゃないですかあ。
,0,un_058020_0020,管理者のあなたが艦橋の外に居て<br>大丈夫なんですかあ？
,0,un_058020_0030,そうです、それが正しい反応です！<br>私の立ち位置をしっかり理解して<br>くれているんですね、リサさん！
,0,un_058020_0040,……何に感激しているのか<br>リサにはちっともさっぱり<br>これっぽっちも理解できませんが。
,0,un_058020_0050,<%me>さんや<br>マトイさんは、私が外に出るという<br>貴重さに気付いてくれないんです！
,0,un_058020_0060,あなたはアークスシップの管理者で<br>どこにでもいる、という感覚ですし<br>それも当然のことでは？
,0,un_058020_0070,それよりも、リサの質問に対する<br>返答を聞いていないのですが？
,0,un_058020_0080,あ、ええっとですね、今はシャオが<br>艦橋に来ているので、自由行動の<br>許可が下りているんですよ。
,0,un_058020_0090,シャオが来ている、ということは<br>何か大事が起きている、って<br>ことですよねえ？
,0,un_058020_0100,あっ、い、いえ。<br>決してそういうわけでは。
,0,un_058020_0110,体温の微上昇と、不自然な視線。<br>嘘は明らかですねえ、シエラさん。
,0,un_058020_0120,それでそれでそれでそれで<br>今度の敵さんは何ですかあ？<br>どこにいるんですかあ？
,0,un_058020_0130,シャオが出てきて、演算を肩代わり<br>するほどでしたら、それはそれは<br>強大な相手なのでしょう？
,0,un_058020_0140,い、いやー、そんなことはー……
,0,un_058020_0150,ふふふふふ。<br>とっても素直でわかりやすい。
,0,un_058020_0160,今度の敵はダーカーですかあ？<br>それとも地球の時のような新種？<br>はたまた全く別の、ですかあ？
,0,un_058020_0163,それはそれはもしかして<br>あなたの内から香る、強そうな気配とも<br>関係があったりするんですかあ？
,0,un_058020_0166,そういえばこの前<br>緊急のメディカルチェックとか<br>受けたりしてましたもん、ねえ？
,0,un_058020_0170,手、手を握りしめたまま<br>かまをかけるのやめてください！
,0,un_058020_0180,<%me>さん。<br>助けてくださいよう！
,0,un_058020_0190,そのぐらいにしてあげて
,0,un_058020_0200,自分でなんとかしよう
,0,un_058020_0210,ふむ。<br>まあ、あなたがそういうのなら<br>このぐらいにしてあげましょう。
,0,un_058020_0220,そんなに嫌がらなくても<br>十分情報は手に入りましたので<br>もう離してあげます。
,0,un_058020_0230,隠し事をするな、とは言いませんが<br>楽しそうな話は<br>隠して欲しくないですねえ。
,0,un_058020_0233,特に、あなたの内から感じる力……<br>それ、とっても楽しそうですねえ。<br>今までになかった感じです。
,0,un_058020_0236,そういう、楽しそうなのは<br>もっともっと教えてほしいですよお。
,0,un_058020_0240,いえ、あまり楽しそうな話でも<br>ないんですけども……
,0,un_058020_0250,ま、今すぐにどうこう、といった<br>話ではなさそうなので、いいです。
,0,un_058020_0260,でも、楽しくなりそうでしたら<br>リサを呼んでくださいねえ。<br>絶対ですよお。ふふふふふ。
,0,un_058020_0270,……アークスシップの中なのに<br>少し命の危険を感じましたよ。
,0,un_058020_0280,映像記録で見るのと<br>直に触れ合うのでは<br>やはり、迫力が違うんです
,1,un_058020_0010,"Wow, wow, wow, wow!<br>Now HERE'S something you don't see every day.<br>Is that really you, Xiera?"
,1,un_058020_0020,Are Overseers allowed to just step away from the Bridge<br>like this?
,1,un_058020_0030,"Nice, Risa! That's exactly how you're supposed to react!<br>You've got a firm grasp on the importance of my position!"
,1,un_058020_0040,"Well, I have absolutely, positively, definitively not even<br>a ghost of a clue why you're so impressed, but anyway!"
,1,un_058020_0050,A certain duo here didn't appreciate the magnitude of<br>me being outside the Bridge!
,1,un_058020_0060,"Well, you ARE the Overseer and all. Maybe it just didn't<br>faze them because it feels like you're everywhere."
,1,un_058020_0070,"But, more importantly... I asked you a question, and I<br>don't believe I got an answer."
,1,un_058020_0080,"Ah, right! Xiao's up on the Bridge right now, so I got<br>permission to move about freely."
,1,un_058020_0090,"If Xiao is on the Bridge, it means something huge<br>is happening, right?"
,1,un_058020_0100,"Oh, n-no! Nothing at all like that!"
,1,un_058020_0110,"Let's see. Slight rise in body temperature,<br>plus nervous glances? You're obviously lying, Xiera."
,1,un_058020_0120,"So, so, so, SO! Who are the new baddies? Where are they?<br>Where, where, where?"
,1,un_058020_0130,Must be something pretty big and bad if Xiao's coming<br>along and helping out with operations personally!
,1,un_058020_0140,"Well, I wouldn't say that..."
,1,un_058020_0150,"HeeheeHEE! Oh, Xiera. Your poker face is TERRIBLE."
,1,un_058020_0160,"So, so, so. Is it the Falspawn? Or a new type of baddy,<br>like on Earth? Or something else entirely?"
,1,un_058020_0163,"Ooh, ooOOoh... Or maybe it's related to that powerful<br>aura inside of YOU that I'm smelling?"
,1,un_058020_0166,"Come to think of it... You just had an emergency<br>medical checkup the other day, didn't you?"
,1,un_058020_0170,P-Please at least let go of my hand if you're going to<br>interrogate me!
,1,un_058020_0180,P-Please! Throw me a lifeline!
,1,un_058020_0190,"I think she's had enough, Risa."
,1,un_058020_0200,"Figure something out yourself, Xiera."
,1,un_058020_0210,Hmph... If you insist. I'll shut my trap.
,1,un_058020_0220,"Ah, ah. No need to be so callous.<br>I have enough information now,<br>so she can be off on her merry little way."
,1,un_058020_0230,"I don't wanna force you to give away any secrets,<br>but if it's fun? Don't keep it from me. That's just cruel."
,1,un_058020_0233,吀䠀䄀吀 猀攀攀洀猀 氀椀欀攀 愀 戀愀爀爀攀氀 漀昀 昀甀渀⸀㰀戀爀㸀匀漀洀攀琀栀椀渀最 䤀✀瘀攀 渀攀瘀攀爀 昀攀氀琀 戀攀昀漀爀攀⸀
,1,un_058020_0236,You simply MUST let me in on all the fun!
,1,un_058020_0240,"Well, it's not as ""fun"" as you're making it out to be..."
,1,un_058020_0250,"Well, sounds like you can't spill all the beans yet.<br>That's fine!"
,1,un_058020_0260,"Buuut... If it starts getting juicy, I want in on it.<br>So don't forget. HeeheeHEEhee!"
,1,un_058020_0270,I've never quite felt like my life was in danger<br>while on board the ARKS Ship before.
,1,un_058020_0280,Risa certainly gives off a more... chaotic energy<br>in person than just seeing her in the records.
