section,group,id,text
Info,0,Title,イベントミッション
Info,0,Goal,緊急クエストを１０回クリア
Info,0,Explanation,任意の緊急クエストをノーマル以上で１０回クリアしよう！<br><yellow>※緊急クエストは、突発的または予告イベントで発生し<br>　一定時間のみ受注可。発生時刻はプレイヤーズサイトの<br>　「ブースト＆予告イベント情報」で確認可<br>※トリガークエストは対象外となります。<c>
Info,1,Goal,Clear 10 Urgent Quests
Info,1,Explanation,"Clear 10 Urgent Quests on Normal or above!<br><yellow>Urgent Quests can appear at random or as part of scheduled<br>events, and can only be undertaken for a limited time.<br>You can check Quest availability times on the Player's Site<br>under the ""Boosts & Scheduled Events"" section.<br>Note: Trigger Quests do not count toward the total.<c>"
