section,group,id,text
Info,0,Title,努力への敬意・錬成巧者
Info,0,Explanation,おお、お主の話はよく耳にするぞ。<br>今、どれほどの技術を手にしておるのか<br>わしに見せてくれんかのう？<br>お主の努力に敬意を表して、贈り物を<br>したいと思っておるんじゃよ。<br><yellow><br>※潜在能力『錬成巧者 Lv.3』を<br>　解放済みの武器を提示<br>※該当武器はエクスキューブ交換ショップで<br>入手可能<c>
Info,0,Errand,錬成巧者のお守り
Info,0,text,条件を満たした武器の提示
Info,1,Title,Putting in the Work - Augmentalist
Info,1,Explanation,"Oho, I hear about you quite often. Won't you show me<br>just how far you've polished your skills? I'll give you a<br>present as a token of my appreciation for your<br>cooperation.<br><br><yellow>Deliver a weapon with the Augmentalist Lv. 3<br>potential unlocked.<br>A suitable weapon can be obtained from the EX-Cube<br>Exchange Shop.<c>"
Info,1,Errand,Augmentalist's Talisman
Info,1,text,Deliver a weapon that meets the conditions.
