section,group,id,text
Info,0,Title,長銃データ収集依頼
Info,0,Explanation,<yellow>このオーダーは、配信停止に<br>なりました。<br>オーダー達成済の場合は<br>報告することができます。<br>オーダー未達成の場合は<br>報告する事ができないため<br>オーダーの破棄をお願い致します。<c>
Info,0,text,ヤスミノコフ７０００Ｖ<br>※1アカウントにつき1回、報告時に付与
Info,0,text_received,ヤスミノコフ７０００Ｖ<br>※報酬アイテムは既
Info,1,Title,Assault Rifle Data Collection
Info,1,Explanation,"<yellow>This Order is no longer available. <br>If you have completed it, you may turn it in. <br>If it is incomplete, you must abandon <br>it instead.<c>"
Info,1,text,Yasminokov 7000V<br>Issued upon completion. Limit once per account.
Info,1,text_received,Yasminokov 7000V x1<br>Note: Reward item already issued.
