section,group,id,text
Info,0,Title,特定封鎖区域討滅任務
Info,0,Explanation,現在、特定の区域で集中的にエネミーが<br>出現する現象が確認されており<br>隔離領域を展開して対応している。<br>実力を持つアークスは、装備を整え<br>この封鎖が破られる前に<br>エネミーたちを掃討せよ。<br><yellow>※ボーナスクエストをプレイするための<br>ボーナスキーは、任意のおすすめクエストを<br>Ａランク以上でクリアした際に<br>一定確率で入手可能。<c>
Info,0,Errand,任意のボーナスクエストのクリ
Info,1,Title,Special Blockade Area Annihilation
Info,1,Explanation,<yellow>Bonus Keys unlock Bonus Quests.<br>They drop at a fixed rate<br>when you clear Recommended Quests<br>with at least an A Rank.<c>
Info,1,Errand,Clear a Bonus Quest
