section,group,id,text
Info,0,Title,ファントムクラス適性審査試験・Ⅱ
Info,0,Explanation,これは、個々のアークスにおける<br>ファントムクラスの適性を審査し<br>能力制限を解除するための試験である。<br>定められた目標を達成することで<br>さらなる能力向上が可能となる。<br><br><yellow>※ファントム限定<br>任意のフリー/アークスか期間限定クエスト<br>をノーマル以上でクリア<br>※ファントムのレベル上限を55まで解放<c>
Info,0,Reward,ファントム制限解除許可証Ⅱ
Info,0,Target,任意のフリー/アークスか期間限定クエ
Info,1,Title,Phantom Class Aptitude Test II
Info,1,Explanation,"This is a trial to determine your aptitude for the<br>ARKS Phantom Class and remove the level cap.<br>By completing the assigned objectives, you can<br>increase your abilities even further.<br><br><yellow>Phantoms only.<br>Clear any Expedition, ARKS, or Limited-Time<br>Quest on Normal or above.<br>Note: Raises Phantom Level cap to 55.<c>"
Info,1,Reward,Phantom Level Cap Unlock Permit II
Info,1,Target,"Any Expedition, ARKS, or Limited Time Quest"
