section,group,id,text
Skit,0,skit01,侵食されたモノリスのせいで<br>転送装置の座標設定がおかしいね。<br>……【巨躯】復活の余波か？
Skit,0,skit02,だったら、モノリス付近のダーカーを<br>殲滅すれば、なんとかなるかも……！
Skit,1,skit01,"Due to the corrupted Monolith, the Teleporter's<br>coordinates got messed up. Is this the<br>aftermath of [Elder's] revival?"
Skit,1,skit02,"If that's the case, we should be able to do<br>something if we eradicate the Falspawn around<br>the Monolith."
Skit_ci,0,skit01,/ci5 1 侵食されたモノリスのせいで<br>転送装置の座標設定がおかしいね。<br>……【巨躯】復活の余波か？
Skit_ci,0,skit02,/ci1 2 だったら、モノリス付近のダーカーを<br>殲滅すれば、なんとかなるかも……！
Skit_ci,1,skit01,"/ci5 1 Due to the corrupted Monolith, the <br>Teleporter's coordinates got messed up. <br>Is this the aftermath of [Elder's] revival?"
Skit_ci,1,skit02,"/ci1 2 If that's the case, we should be able to do<br>something if we eradicate the Falspawn around<br>the Monolith."
