section,group,id,text
TutorialText,0,Title,キャンディーボックスって何？
TutorialText,0,text01,「キャンディーボックス」は、<br>いろいろな効果をもつ「キャンディー」を<br>セットして、<yellow>ペットを強くするものです。<c><br><br>ペットは、それぞれ個別の<br>キャンディーボックスを<br>持っています。<br><br>エネミーを倒していろいろなキャンディーを<br>手に入れ、ペットをカスタマイズしましょう！
TutorialText,0,text02,「キャンディー」はペットを強化するための<br>アイテム類の総称です。キャンディーは種類に<br>応じてセットの上限数が決まっています。<br>■上限数1個<br>・ラムネ　・クレープ<br><br>■上限数2個<br>・パフェ　・ロール　・パンケーキ<br><br>■上限数3個　　■上限数4個<br>・クッキー　　　　　・アメ<br><br>■上限数5個　　■上限数20個<br>・サンド　　　　　　　・グミ
TutorialText,0,text03,一度セットしたキャンディーは<br>そのままではアイテムパックに戻せません。<br><br>「キャンディーリムーバー」で<br>取り外すことや<br>「キャンディーイレイサー」で<br>削除することができます。<br><br>取り外したキャンディーは<br>アイテムパックに戻りますが<br><yellow>削除したキャンディーは消滅します。<c><br>ご注意くださ
TutorialText,1,Title,What's a Sweets Box?
TutorialText,1,text01,"By setting Sweets of various effects into the Sweets Box,<br><yellow>your pet will grow stronger.<c><br><br>Each pet has its own unique Sweets Box.<br>Defeat enemies to get a variety of Sweets and customize your pet!"
TutorialText,1,text02,"Sweets are a type of item that can be used to strengthen your pets.<br>Depending on the type of Sweet, there is a limit as to how many you can set.<br><br>Limit Total 1: Soda, Crepe<br>Limit Total 2: Parfait, Roll, Pancake<br>Limit Total 4: Cookie, Candy<br>Limit Total 20: Ice Cream Sandwich, Gummy"
TutorialText,1,text03,"Once a Sweet has been set, you cannot simply return it to your inventory.<br><br>You can either extract them with a Sugar Tongs or dissolve them with a<br>Sweets Dissolver.<br><br>Extracted Sweets will be returned to your Inventory,<br>but <yellow>dissolved Sweets<c> will be lost forever.<br>Please keep this in mind."
