section,group,id,text
TutorialText,0,Title,『ネッキーからの挑戦状』について
TutorialText,0,text0001,ボクはネッキー！<br>アークスのみんなに挑戦するため<br>新しい採掘基地防衛戦を用意したよ！<br><br>ルールは簡単！<br>３つの拠点が壊れたらクエスト失敗だ！<br>頑張って守り切ってね！<br><br>今回はダーカー以外のエネミーも<br>出て来るので注意してね！
TutorialText,0,text0002,また、特別ルールとして<br><yellow>侵食されたソケットは<br>浄化ができなくなっているよ！<c><br><br>ソルザ・ブラーダを見つけたら<br>素早く倒すのが攻略のカギだよ！
TutorialText,0,text0003,さらにさらに！<br><yellow>最後の力を使って拠点を破壊しようとする<br>エネミー<c>も新しく用意したよ！<br><br>ウェーブが終わる前に倒さないと<br>大惨事になるから、出てきたエネミーは<br>全部倒してね！<br><br>クエストの説明はこれでおしまい！<br>みんなの成功を祈ってい
TutorialText,1,Title,A Challenge from Necky
TutorialText,1,text0001,"Hi, I'm Necky! I've put together a new Mining Base defense battle to challenge<br>everybody in ARKS! The rules are simple: if all three strongholds are destroyed,<br>you fail the quest! Do your best to defend them! And remember, you'll be<br>dealing with more than just Falspawn!"
TutorialText,1,text0002,"There's also a special rule:<br><yellow>You can't purify corrupted sockets!<c><br><br>If you see a Solza Brahda, you'd better take it out lickety-split!"
TutorialText,1,text0003,"But wait, there's more!<br><yellow>I'm pitting you against some new enemies that will use every last ounce<br>of their strength to try and destroy strongholds!<c> They'll do a lot of damage if<br>you don't take them out before the end of the wave, so make sure to destroy<br>EVERY enemy that shows up! That's it for the quest overview! I'll keep my fingers<br>crossed for all of you!"
