section,group,id,text
Event1,0,11_voice_NPC_5057_101,お見事、素晴らしい結果ね。<br>今回の特訓も問題なくクリア、と。
Event1,0,text02,実力が伸びている感じが薄いかも<br>しれないけれど、他者から見れば<br>その変化は明らかよ。
Event1,0,text03,一つ一つの動きの精度が段違い。<br>それは、長い研鑽でしか得られない<br>時間と努力の為せる技だから。
Event1,0,text04,今の貴方に相応しい次の特訓<br>しっかり考えないといけないわね。<br>それじ
Event1,1,11_voice_NPC_5057_101,Splendid. Most impressive indeed. You've<br>cleared this round of boot camp without issue.
Event1,1,text02,"From where you're standing, you may not feel<br>like you're making much progress, but to an<br>outside observer, your improvement is palpable."
Event1,1,text03,Each of your motions has grown drastically <br>more precise. Such technique can only be <br>honed through time and tireless effort.
Event1,1,text04,I'll have to come up with a more fitting <br>boot camp session for you next time. <br>See you around.
