section,group,id,text
Event1,0,11_voice_NPC_5018_104,同じルートだと、慣れによって<br>成績が変化してきちゃうから<br>新しいルートを作ったらしいよ？
Event1,0,text02,とはいえ、指針なしだとなかなか<br>二の足を踏んじゃう人も多くてね。
Event1,0,text03,そこで白羽の矢が立ったのがきみ。<br>推薦者は私。うんうん、きみなら<br>大丈夫、間違いないね。
Event1,0,text04,ということで、ちゃちゃっと<br>済ませてきちゃってもらえないかな？<br>ベリーハードでも、い
Event1,1,11_voice_NPC_5018_104,"Another new route here, pardner. <br>Can't have you gettin' too comfy."
Event1,1,text02,Most cowpokes'd shiver in the saddle if they <br>got left on a trail with no signposts.
Event1,1,text03,But that's why I chose you. I know you can<br>handle a tussle or two.
Event1,1,text04,"That's how it is, so saddle up and hit the<br>trail. Think you can handle Very Hard?"
