section,group,id,text
Event1,0,11_voice_NPC_5052_107,やっぱ、あの火柱は本当にやべーな！<br>モニター越しでも、こっちにまで<br>熱が伝わってきそうだったぜ。
Event1,0,text02,隙の多いフォトンアーツは<br>タコ殴りにされるから危ねーな。<br>手数で攻めるしかねーのかな？
Event1,0,text03,あとは、羽を叩き壊して<br>動きを封じるとか<br>色々やりようはあるみてーだな。
Event1,0,text04,勉強になったわ！<br>うし！　ちょっくら行ってみるわ。<br>……の前に、装備を整
Event1,1,11_voice_NPC_5052_107,I knew it! That pillar of fire is nuts! I could<br>practically feel the heat through the monitor.
Event1,1,text02,"Photon Arts that leave ya open are just gonna<br>get ya pounded, huh. Guess ya just gotta wail<br>on it, pal."
Event1,1,text03,"Plus, ya can just break its wings to slow it<br>down. There're a buncha different ways to ride<br>this pony."
Event1,1,text04,"I learned a ton! A'ight, I'll be right back.<br>Whoopsie, hold up... I gotta get my equipment<br>straight first!"
