section,group,id,text
Event1,0,text01,大変、大変なのー！<br>ようやく準備を進めようと思ったら<br>今度は、強力な敵が出てきちゃったの！
Event1,0,11_voice_NPC_5061_108,会場の飾りつけが始まったときに<br>どこからともなく、急に現れて<br>暴れだしたんだって。
Event1,0,11_voice_NPC_5061_102,このままじゃ、準備どころか<br>イベントの開催も危ぶまれちゃう！
Event1,0,text04,イベントを開催するためにも<br>暴れている敵たちを<br>追い払ってき
Event1,1,text01,I've got a biiiiig problem!<br>Powerful enemies appeared just as<br>preparations were getting underway!
Event1,1,11_voice_NPC_5061_108,"I was about to decorate the venue, but then<br>they came out of nowhere and started<br>wrecking havoc."
Event1,1,11_voice_NPC_5061_102,"Forget about preparations, at this rate<br>the event itself is in jeopardy!"
Event1,1,text04,I'd like you to take out the rampaging enemies<br>so that we can hold our event!
