section,group,id,text
Event1,0,11_voice_NPC_5050_104,……はい、以上が規定文言です。<br>読みましたか、理解できましたか？<br>簡単に言えば、こういうことです。
Event1,0,text02,『指定された条件を達成できたら<br>　アムドゥスキア・浮遊大陸エリアでの<br>　自由行動を認める』
Event1,0,text03,それ以外の条件はありません。<br>それ以上のフォローもないです。<br>だから、貴方の実力次第。
Event1,0,text04,受ける受けないは貴方の自由です。<br>私はただここで、愚直に実力の<br>判断を行うのみで
Event1,1,11_voice_NPC_5050_104,"I'm starting to doubt that you're actually<br>reading these. Well, you know the score at this<br>point anyway, I suppose."
Event1,1,text02,"Once you fulfill the requirements, you will be<br>permitted to explore the Amduskia Floating<br>Continent as you see fit."
Event1,1,text03,"Simple, isn't it? Nothing more will be expected<br>of you, but no more assistance will be given,<br>either. It's all in your hands."
Event1,1,text04,The choice is yours whether to pursue this<br>permit or not. Just know that I will be judging<br>your abilities if you do.
