section,group,id,text
Event1,0,text01,ハンターは攻守ともに高い能力を持った<br>パーティーの要ともいえる存在だ。
Event1,0,11_voice_NPC_5020_104,だからこそ、責任も重い。<br>敵を圧倒できる力がある一方で、ひとつ<br>間違えれば味方の総崩れにもつながる。
Event1,0,text03,そうならないためにも、戦場の状況は<br>常に把握しておかねばならない。<br>なに、オレもまだまだ精進中だ。
Event1,0,text04,共に浮遊大陸へと向かい<br>他者との連携行動を練習
Event1,1,text01,Hunters are the key to making sure your Party <br>is strong on both attack and defense.
Event1,1,11_voice_NPC_5020_104,"That's a lot of responsibility. We may be strong<br>enough to roll over the enemy, but if we step<br>out of line, the team could fall apart."
Event1,1,text03,"That means we need to always stay mindful of <br>the overall shape of the battle. It's something <br>I'm trying to work on too, of course."
Event1,1,text04,So why not come sharpen that sense with me <br>on the Floating Continent?
