section,group,id,text
Event1,0,text01,わ、わたし、ロッティです。<br>アークスです。なりたてです。<br>とっても緊張してます。はうう。
Event1,0,text02,え、えっと……先輩、ですよね？<br>先輩はブーストエネミーと<br>戦ったこと、ありますか？
Event1,0,11_voice_NPC_5062_105,あの、アークスになったからには<br>そういうのと戦わなきゃいけないん<br>ですけど、どういうのかわからなくて。
Event1,0,text04,お、お願いします。<br>ブーストエネミーについて<br>教えてもら
Event1,1,text01,"Um, hello, I'm Lottie. ARKS. New recruit.<br>I'm super tense. Urgh."
Event1,1,text02,"So, um, you're my senior, right?<br>Have you ever fought a Berserk Enemy?"
Event1,1,11_voice_NPC_5062_105,"Now that I'm in ARKS, I'm supposed to fight<br>them, but when it comes to combat, I'm way <br>out of my depth."
Event1,1,text04,"So, um, could you please teach me what I need<br>to know?"
