section,group,id,text
Event1,0,text01,ありがとうございます。<br>これがブーストエネミーになった<br>イエーデのデータですね。
Event1,0,text02,イエーデはブーストエネミー化した<br>個体もまとめて集団で来るんですね。<br>なるほど、な情報です。
Event1,0,11_voice_NPC_5062_100,どうもありがとうございました。<br>先輩が集めてくれたデータ<br>大事に
Event1,1,text01,"Thank you. This is the data on the Berserk<br>Enemy version of the Yedi, right?"
Event1,1,text02,The Yedi forms groups that are inclusive of<br>Berserk Enemy variants? Fascinating.
Event1,1,11_voice_NPC_5062_100,"You've compiled some excellent intel here.<br>I'll make the most of it, I promise."
