section,group,id,text
Event1,0,11_voice_NPC_5018_101,いやいやお見事、文句なしだね。<br>やはりきみぐらいの実力があれば<br>この位の依頼はこなしちゃうねえ。
Event1,0,text02,改めて、きみの実力をきちんと<br>確認することができて、よかったよ。<br>うんうん。
Event1,0,text03,これからも、その力を私たち<br>アークスの平和と安全のために<br>ふるって欲しいね。
Event1,0,text04,なにより、私が楽をしたいから
Event1,1,11_voice_NPC_5018_101,"Hoo-whee, pardner, that was a marvel. <br>Guess this challenge don't faze an old <br>pro like you."
Event1,1,text02,Nice to check in an' make sure you still got <br>the hardest hide in these parts.
Event1,1,text03,I hope you'll keep usin' that strength of yours<br>to keep ARKS flyin' high.
Event1,1,text04,"Life's to be enjoyed, after all."
