section,group,id,text
Event1,0,text01,もはや私以上にデュアルブレードを<br>扱っていらっしゃいますわね。
Event1,0,11_voice_NPC_5150_100,特別、私が未熟なこともありますが<br>貴方様の上達速度は凄すぎますわ。
Event1,0,text03,さて、今回の訓練メニューですけども<br>ずばり、海王種２０体の討伐、ですわ
Event1,1,text01,You're... already wielding Soaring Blades<br>better than I am.
Event1,1,11_voice_NPC_5150_100,"Maybe I'm not as good as I thought I was...?<br>But you're an absolute maniac at this. Too<br>good, almost."
Event1,1,text03,"Aaanyways, this new course I thought up has<br>you taking out twenty Oceanids."
