section,group,id,text
Event1,0,11_voice_NPC_5053_101,私は今、感激のあまり震えている……<br>わかるかね？　他では得がたい<br>貴重なデータを入手できたのだよ。
Event1,0,text02,キミの能力の高さには<br>ただただ恐れ入るばかりだ。
Event1,0,text03,この縁を大切にしていきたいと<br>思っている。どうかこれからも<br>私たちに力を貸してほしい。
Event1,0,text04,高額の謝礼を工面できないことが<br>実に心苦しいのだが<br>本当
Event1,1,11_voice_NPC_5053_101,Do you know how valuable this?<br>It's beyond words!
Event1,1,text02,Another piece of impressive work. Thank you.
Event1,1,text03,I hope our relationship remains strong.<br>Your aid is invaluable.
Event1,1,text04,"I know the rewards are few, but my <br>appreciation is honest and true!"
