section,group,id,text
Event1,0,text01,いやー、さすがはおたくだぜ！<br>安定した戦いっぷりで<br>冷静に見てられたわ。
Event1,0,11_voice_NPC_5052_104,っつっても、エネミーがデカすぎて<br>半分以上モニターから<br>はみ出てたんだよな……
Event1,0,text03,おかげで、ところどころ<br>何が起こってたのか<br>わかんなかったのが勿体ねーな。
Event1,0,text04,ま、まぁ……相手の手札は<br>だいたいわかったし、何とかなんだろ。<br>遭遇したらボコってや
Event1,1,text01,"Whew! You're a pal, pal!<br>You were cool as ice out there,<br>and you had the fight on lock!"
Event1,1,11_voice_NPC_5052_104,"Course, the enemy was so damn huge,<br>I couldn't see half of it through<br>the monitor..."
Event1,1,text03,"That made it pretty hard to tell<br>what was goin' on sometimes,<br>let me tell you."
Event1,1,text04,"But I got a rough idea of what the<br>enemy does. Next time I see one,<br>POW, right in the metal kisser!"
