section,group,id,text
Event1,0,11_voice_NPC_5056_105,どうも名前で呼んでると<br>調子が狂うなあ。そんなことない？
Event1,0,text02,大丈夫ならいいんだけど<br>調子が狂ってクエストに失敗したら<br>私が責任感じちゃうじゃない。
Event1,0,text03,私が認めた一人前のアークスらしく<br>カッコいいとこ見せてよね
Event1,1,11_voice_NPC_5056_105,"Man, calling you by your name just throws me<br>off. You disagree?"
Event1,1,text02,"If you're fine with it, then whatever, but don't<br>blame me if you fail a Quest because you <br>forgot what it's like to have a real name."
Event1,1,text03,"Now, get out there and remind me why I<br>recognized you as a full-fledged ARKS operative<br>in the first place!"
