section,group,id,text
Event1,0,text01,……ああ、おつかれさん。<br>しっかり片付けたみたいだね。
Event1,0,11_voice_NPC_5059_104,ウジャウジャと群れてたけど<br>きれいさっぱり消え失せたね。
Event1,0,text03,基地もきれいになってよかっただろ。<br>ま、つかの間の平和ってやつだね。
Event1,0,text04,直ぐに掃除が必要になるとは思うけど<br>その時は宜しく頼んだよ
Event1,1,text01,"Ah, thank you. It looks like you cleaned them<br>up well."
Event1,1,11_voice_NPC_5059_104,Those swarms and swarms have now <br>been wiped completely away.
Event1,1,text03,And I suppose it's good that the base is purer<br>now. Though it's a fleeting peace at best.
Event1,1,text04,I'm sure more cleansing will be needed before<br>long. I hope you'll be up to the task.
