section,group,id,text
Event1,0,text01,壊世区域のエネミー……<br>熟練のアークスにとっても<br>相変わらずヤツらは厄介な存在だな。
Event1,0,text02,そこで、前回のザンディオンに続く<br>新たなテクニックの創造を進めているが<br>依然として、データ不足気味なんだ。
Event1,0,text03,だから貴様に協力を頼みたい。<br>今回は、リリーパの壊世区域に出現する<br>エネミーの情報を集めてきて欲しい。
Event1,0,text04,他ならぬ、この私がお願いしてるのだ。<br>引き受けてくれる……よな
Event1,1,text01,"Enemies from the Corrupted Regions...<br>They're bad news, even for ARKS veterans."
Event1,1,text02,"It's why I'm still making new Techniques<br>following Zandion from last time.<br>Unfortunately, I'm still short on data."
Event1,1,text03,"So it's up to you again, bonehead. This time,<br>you need to go to the Corrupted Region on<br>Lillipa and get info on the enemies there."
Event1,1,text04,"The almighty Klariskrays is asking for your<br>help. You're not gonna turn me down, are you?"
