section,group,id,text
Event1,0,text01,どうもありがとう！<br>新しい食材を見つけたときって<br>本当にわくわくするわね！
Event1,0,11_voice_NPC_5051_104,アークスの胃袋を預かる私としては<br>スタミナを第一に考えて肉料理を提供<br>することが一番だと思っていたけど……
Event1,0,text03,やっぱり料理人は<br>いろいろ試してみないとね！
Event1,0,text04,<%me>さん<br>楽しみに待ってるから<br>よろし
Event1,1,text01,Thank you so much! Don't new ingredients like<br>this just get you giddy?
Event1,1,11_voice_NPC_5051_104,"With all these hungry ARKS operatives to worry<br>over, I always figured a nice meaty dish for<br>stamina would be the best bet, but..."
Event1,1,text03,"A good cook shouldn't limit themselves, should<br>they!"
Event1,1,text04,"I'll be looking forward to when you get back,<br><%me>!"
