section,group,id,text
CharaName,0,name01,ハンス
CharaName,1,name01,Hans
Event1,0,11_voice_NPC_5052_101,うんうん、基本を押さえときゃ<br>どうってことなさそうだな。
Event1,0,text02,おっしゃ、後はオレに任せて<br>おたくは帰ってゆっくり休んでな！
Event1,0,text03,おっと、でも戻ったら一度オレの所に<br>来るの、忘れないでくれよな。<br>それじゃ後でな！
Event1,1,11_voice_NPC_5052_101,"That's right, pal. Master the basics and the<br>rest oughta be no trouble."
Event1,1,text02,"All right, now you come on back here and kick<br>back while I take care of the rest!"
Event1,1,text03,Don't forget to swing by once you get here.<br>See ya in a bit!
