section,group,id,text
Event1,0,11_voice_NPC_5053_101,私は今、感激のあまり震えている……<br>わかるかね？　他では得がたい<br>貴重なデータを入手できたのだよ。
Event1,0,text02,キミの能力の高さには<br>ただただ恐れ入るばかりだ。
Event1,0,text03,報酬額が低くて申し訳ないが、せめて<br>私たちはこれをもとに有益な研究成果を<br>提供することでキミの厚意に報いたい。
Event1,0,text04,心から感謝するよ。<br>どうもありがと
Event1,1,11_voice_NPC_5053_101,Do... do you realize what valuable data you've<br>brought us? I can hardly process it...
Event1,1,text02,Another piece of impressive work. Thank you.
Event1,1,text03,"The compensation may be scant, but I hope the<br>research your help enables will be rewarding<br>in and of itself."
Event1,1,text04,"Thank you. Truly, I mean it."
