section,group,id,text
Event1,0,11_voice_NPC_5056_102,せっかく新しい惑星に行けるように<br>なったんだから、ガンガン攻めないと！
Event1,0,text02,それとも、もう目をつむってても<br>Ｓランククリアする自信でも<br>あるのかなぁ？
Event1,0,text03,ちょっと私に認められたくらいで調子に<br>乗ってると、すぐにまたへっぽこぴーに<br>降格させちゃうからね
Event1,1,11_voice_NPC_5056_102,We've got access to a whole new planet. Let's<br>get stomping!
Event1,1,text02,"Just a second, though. You're not starting to<br>think you can hit those S Ranks with without a<br>care in the world, are you?"
Event1,1,text03,"If you let it go to your head just because I<br>gave you a little recognition, get ready to be<br>dropped right back down to clown town!"
