section,group,id,text
Event1,0,text01,……白ノ領域って、独特の雰囲気。<br>文化や歴史をとても感じられるわ。<br>今までの惑星と、違う。
Event1,0,11_voice_NPC_5019_100,今までと違うってことは<br>予想できないことも、たくさんある。<br>だから、成長も……できる。
Event1,0,text03,……貴方となら、私も成長できるし<br>連携も上手くいく。
Event1,0,text04,……きっと楽しめる。<br>そんな気がしてる。<br>さあ、行ってみましょう
Event1,1,text01,Daybreak Province is... peculiar. It oozes<br>culture and history. Like nowhere on <br>the planets we've seen before.
Event1,1,11_voice_NPC_5019_100,"That means we should expect the unexpected.<br>And that, in turn, suggests we'll find<br>opportunities to grow."
Event1,1,text03,Working with you should bring plenty such<br>opportunities. And we'd make a good team.
Event1,1,text04,I have a feeling this will be... fun. Let's go.
