section,group,id,text
Event1,0,text01,料理人とはいえ、料理のことだけを<br>考えていてはまだまだ一流とは<br>言えないのよね。
Event1,0,11_voice_NPC_5051_104,味だけでなく、目でもお客さんを<br>楽しませてこその一流。<br>それに必要なのが、美しい器。
Event1,0,text03,ディランダールの水晶片……<br>あの美しさ、私の料理にふさわしい。
Event1,0,text04,と、いうことで。<br>お願いお願い！　あの水晶を<br>集めて
Event1,1,text01,"In order to be a top-tier chef, you have to<br>stretch your mind and think beyond flavors now<br>and then."
Event1,1,11_voice_NPC_5051_104,"A real chef gives people a feast for the eyes as<br>well as the mouth. And to do that, you need<br>some gorgeous serving vessels."
Event1,1,text03,And you know what would be just perfect to <br>serve my cooking in? That's right. Dirandahl <br>crystal shards.
Event1,1,text04,So... that's my request! Go round up some of<br>those crystal shards for me! Pretty please!
