section,group,id,text
Event1,0,11_voice_NPC_5051_104,普通すりこぎは木で作るんだけど<br>あのすり鉢の堅さに耐えるには<br>同じくダーカーの素材でないと。
Event1,0,text02,色々お願いしちゃってごめんなさいね。<br>その分、私も頑張って料理を作るから！
Event1,0,text03,あなたを信じて待ってるわ。<br>今回もよろしくお願いし
Event1,1,11_voice_NPC_5051_104,"Now I know normally people use wood <br>for pestles, but if I'm using a mortar made <br>from Falspawn parts, I need a pestle to <br>match, right?"
Event1,1,text02,"I'm sorry, I know I ask a lot of you.<br>But trust me, I put in the effort in the kitchen<br>to make it all worthwhile!"
Event1,1,text03,I'm sure you'll be able to pull it off.<br>Good luck!
