section,group,id,text
Event1,0,11_voice_NPC_5052_107,龍族の本拠とはいえ<br>たいしたことなかったみたいだな。<br>いや、おたくだったからか？
Event1,0,text02,まー、おかげでどんなエリアかは<br>確認できたし、じゅーぶんだぜ。
Event1,0,text03,いざというとき、身を隠す場所も<br>だいたい目星がついたからな……
Event1,0,text04,な、なんでもねーよ！　気にすんな！<br>おたくの提供してくれた情報は<br>無駄にはし
Event1,1,11_voice_NPC_5052_107,"Y'know, for bein' inside the Draconians' home<br>base, that didn't look like much trouble.<br>Or maybe that's just 'cause it's you, pal."
Event1,1,text02,"But now we know just what we're up against <br>with this place, so I call that a success!"
Event1,1,text03,Specially since I spotted me some good hiding<br>spots for when the need arises.
Event1,1,text04,I-Ignore that! Forget you heard anything!<br>I just said I'm gonna make good use of the <br>info you brought!
