section,group,id,text
Event1,0,text01,いいですね、問題なし。<br>これにて今回の特訓はクリア。
Event1,0,text02,順調に階段を昇っているようね。<br>順調すぎて怖すぎるぐらいよ。
Event1,0,11_voice_NPC_5057_101,私は貴方の行く先を見てみたい。<br>一体どこまでの使い手になるのか。
Event1,0,text04,……脱線したわね。<br>次の特訓も準備しておくわ。<br>それ
Event1,1,text01,Very nice. No problems whatsoever. <br>That's another round of boot camp <br>successfully cleared.
Event1,1,text02,"You're rising through the ranks smoothly.<br>Frighteningly so, if I'm being honest."
Event1,1,11_voice_NPC_5057_101,I'd like to see how far you can go.<br>What heights will you reach in your <br>pursuit of martial mastery?
Event1,1,text04,But I digress. I'll line up another boot camp<br>for you shortly. See you then.
