section,group,id,text
CharaName,0,name01,ゼノ
CharaName,1,name01,Zeno
Event1,0,text01,そういやお前さんと初めて会ったのって<br>ナベリウスでのダーカー大量発生ん時<br>だったよな。
Event1,0,11_voice_NPC_5001_104,あの時と同じようにナベリウスで<br>何かが起きてやがるのか……？
Event1,0,text03,まあ、考えても始まらねえ。<br>行くとしようぜ<br><%me>。
Event1,1,text01,"Now that I think about it, we first met during<br>that Falspawn outbreak on Naverius, huh?"
Event1,1,11_voice_NPC_5001_104,Is something happening now just like<br>there was back then?
Event1,1,text03,"Well, no use philosophizing over it.<br>Let's get a move on, <%me>."
