section,group,id,text
Event1,0,text01,浮上施設は新しく発見されたエリアだが<br>お前であれば問題ないだろう。
Event1,0,11_voice_NPC_5020_100,最近お前の活躍を聞かない日は無い。<br>今回の探索も、オレの予想以上の<br>成果をあげてくれると期待している。
Event1,0,text03,いつも通り、気負うことなく<br>探
Event1,1,text01,"The Floating Facility may be a recent discovery,<br>but I doubt that'll faze you."
Event1,1,11_voice_NPC_5020_100,Not a day goes by lately when I don't hear <br>about your work. I'm hoping to see <br>exceptional things from you on this mission.
Event1,1,text03,"Now, like always, let's take it easy and enjoy<br>the exploration."
