section,group,id,text
Event1,0,11_voice_NPC_5055_100,<%me>さん<br>ありがとうございました！
Event1,0,text02,まさに百聞は一見に如かず、ですね！<br>惑星ウォパルのことが<br>よく理解できました。
Event1,0,text03,大雨はもちろんですが<br>他にもいろいろなデータが取れたので<br>また何かお願いするかもしれません。
Event1,0,text04,そのときは、どうかぜひ<br>相談に乗ってくださいね
Event1,1,11_voice_NPC_5055_100,"Thank you so much, <br><%me>!"
Event1,1,text02,"There's no substitute for the real deal, is<br>there? I understand Wopal so much better now."
Event1,1,text03,"We got valuable data on lots of things, <br>not just on the Heavy Rain. I might very <br>well ask you for another favor soon."
Event1,1,text04,I really hope you'll be willing to help me out<br>when the time comes!
