section,group,id,text
Event1,0,text01,先輩、こんにちは。<br>いつもありがとうございます。
Event1,0,11_voice_NPC_5062_100,惑星ハルコタンは、今までの惑星と<br>全くちがう文化の惑星ですね。<br>独自の発展を遂げてて、素敵です。
Event1,0,text03,でも、そこにもダーカーや<br>ブーストエネミーは出現する……<br>放ってはおけないです。
Event1,0,text04,ご協力、よろしく
Event1,1,text01,Hello. Thanks for all your help.
Event1,1,11_voice_NPC_5062_100,"The culture on Harukotan is quite different from<br>that of other planets, isn't it? It's wonderful<br>that they've developed in such unique ways."
Event1,1,text03,"However, Falspawn and Berserk Enemies have<br>appeared there as well. We simply cannot leave<br>them be."
Event1,1,text04,"Heck yeah! I'm looking forward to working with<br>you again, teach!"
