section,group,id,text
Event1,0,11_voice_NPC_5055_101,ありがとうございます！<br>おかげで、たくさんのデータを<br>得ることができました。
Event1,0,text02,光の粒が空を舞う光景……<br>初めて見るモノでした。
Event1,0,text03,まだまだ世界には<br>不思議な現象があふれていますね！
Event1,0,text04,また、何かあったら<br>協力を頼んでもいいですか？<br>よろしくお願
Event1,1,11_voice_NPC_5055_101,Thank you very much! You've given me such a<br>tremendous amount of data to pore over!
Event1,1,text02,The way those light particles drift through the<br>air... I've never seen anything like it.
Event1,1,text03,This world is full of strange and <br>wonderful phenomena.
Event1,1,text04,Would you mind helping me again if <br>anything similarly curious comes up? <br>Thank you so much.
