section,group,id,text
Event1,0,text01,リング強化、成功ですねー！<br>その調子で、どんどん強く<br>していっちゃいましょー！
Event1,0,text02,リングはさまざまな効果があるので<br>色々と試してみると<br>いいかもですよー。
Event1,0,text03,キャンプシップの<br>ギャザリング端末も便利だから<br>活用してみてくださいねー。
Event1,0,text04,ではでは、ギャザラーライフ<br>楽しんでくださーい！<br>ば
Event1,1,text01,You've successfully performed <br>Ring Enhancement! Keep it up and<br>make your rings as strong as they can be!
Event1,1,text02,"Rings have lots of different effects, so<br>I recommend trying on as many as you can!"
Event1,1,text03,And don't be shy about using the handy-dandy<br>Gathering Terminal on the Gateway Ship!
Event1,1,text04,Now you're ready to take on the life of a<br>gatherer! I hope you love it! Bye-bye!
