section,group,id,text
Event1,0,text01,いっつもごめんね。<br>気軽に特訓へ誘える相手なんて<br>わたしのまわりには他にいないのよ。
Event1,0,11_voice_NPC_5087_104,それにほら、修行だ特訓だってのは<br>どうしても地味に見えがちじゃん？<br>敬遠されちゃうのよねー。
Event1,0,text03,でもま、あなたが来てくれたからよし！<br>それじゃ二人そろって、無敵の<br>ブレイバー目指してがんばろー
Event1,1,text01,"Sorry for always pestering you like this, but<br>you're the only person I feel comfortable<br>asking along."
Event1,1,11_voice_NPC_5087_104,"Most people try and shy away from this sort of<br>practice and training, you know?"
Event1,1,text03,But not you! You always show up!<br>So let's take this chance to forge each other<br>into the best Bravers we can be!
