section,group,id,text
Event1,0,text01,あ、ありがとうございました。<br>これだけ情報が集まれば<br>しっかりとしたものが書けそうです。
Event1,0,11_voice_NPC_5062_105,お、応援してくれるんですか？<br>あっ、えっと……その……
Event1,0,text03,す、すみません……<br>先輩に応援してもらえるなんて<br>なんだかうれしくって……
Event1,0,text04,えっと、あの、ほんとに<br>ありがとうございました！<br>わたし頑張りますね
Event1,1,text01,"Um, thank you. This will be ample information<br>for me to write a thorough report with."
Event1,1,11_voice_NPC_5062_105,"Oh, you say you're rooting for me?<br>Oh, gosh, um..."
Event1,1,text03,S-Sorry. I'm just flattered that you're<br>personally invested in the work I'm doing.
Event1,1,text04,"Look, um... thank you for your support!<br>I'll keep doing my best to make a difference <br>around here."
