section,group,id,text
Event1,0,11_voice_NPC_5051_107,うわ、これ本当に食べられるの！？
Event1,0,text02,……って、私がそんなこと言ってちゃ<br>いけないわよね。
Event1,0,text03,このプリップリのビオル・メデューナ<br>私の手で最高のお料理にしてみせるわ！
Event1,0,text04,なんだか腕が鳴るわね。<br>どうもありがとう！
Event1,1,11_voice_NPC_5051_107,"Yikes, is this even edible!?"
Event1,1,text02,"I mean, I guess it's my job to make sure it is,<br>but still."
Event1,1,text03,"I'll get this tender Biol Meduna fixed up into<br>something great though, you just wait and see!"
Event1,1,text04,"I'm always down for a good challenge, after<br>all. Thanks so much for your help!"
