section,group,id,text
Event1,0,text01,アタシが請けた依頼のほとんどは<br>粗末で情けない小さい相手なんだけど<br>中には面倒な相手もいるの……
Event1,0,11_voice_NPC_5428_102,指定された中にあった<br>強力な龍族の火照りを<br>冷ましてあげなくちゃならないのよ。
Event1,0,text03,アタシひとりじゃ大変なの……<br>あなたにリードをお願いしても<br>いいかしら？
Event1,0,11_voice_NPC_5428_202,最後のお願い、聞いてくれたら……<br>アタシの大切なモノ……<br>あなたにあげて
Event1,1,text01,"Most of the jobs I took were small ones <br>against minor foes, but there were some <br>sizable surprises mixed in there, too."
Event1,1,11_voice_NPC_5428_102,"This one, for instance. I'm being asked to cool<br>the flames of some powerful Draconians."
Event1,1,text03,I'm not entirely sure my body could take the<br>heat. Perhaps you could take the lead there?
Event1,1,11_voice_NPC_5428_202,"Do this last favor for me, and I'll give you<br>something extra special of mine."
