section,group,id,text
Event1,0,11_voice_NPC_5051_101,ありがとーう！<br>今か今かと待ってたのよ。
Event1,0,text02,タグ・セヴァニアンのお肉を出すと<br>予告したら、それお目当てに<br>行列が出来てるぐらいだから！
Event1,0,text03,こうなると、他のレシピを開拓して<br>人気メニューが偏らないよう<br>私も頑張らなきゃね！
Event1,0,text04,また必ず何かお願いすることになると<br>思うから、そのときはよろし
Event1,1,11_voice_NPC_5051_101,Thanks so much! I could hardly keep myself<br>settled while I waited.
Event1,1,text02,"I mean, you should just see the line that<br>formed up one I said I'd be fixing up some<br>Tag Sevanian!"
Event1,1,text03,I better fix up some other new recipes so I can<br>keep my main menu balanced!
Event1,1,text04,I'll definitely be seeking your help out again.<br>I hope you don't mind!
