section,group,id,text
Event1,0,text01,悪かったわね、手伝わせちゃって。<br>おかげで、メッセージの内容の方を<br>じっくり考えられたわ。
Event1,0,text02,……材料、たしかに受けとったわ。<br>これでチョコの材料も集まったし<br>すぐに取りかかれそうね。
Event1,0,text03,え、チョコにショウガを<br>使うのかって？　使うわよ。<br>何も問題ないと思うわ。
Event1,0,11_voice_NPC_5543_101,あたしなりに、相手の健康を気遣った<br>自信のレシピよ。おいしく作るから<br>楽しみにしてな
Event1,1,text01,"Sorry to make you run my errands like that.<br>Getting some time to think really helped me<br>fine tune my message, though."
Event1,1,text02,"These should be all the ingredients I need <br>too, so I guess it's time to start working on<br>that chocolate."
Event1,1,text03,"What do you mean, am I really going to use<br>ginger in it? Of course I am. Why wouldn't I?"
Event1,1,11_voice_NPC_5543_101,I'm going to use my own special recipe <br>to make a healthier sort of chocolate <br>for everyone.
