section,group,id,text
Event1,0,11_voice_NPC_5052_101,また、おたくのレジェンドを<br>目撃しちまったな……<br>マジ、リスペクトだわ。
Event1,0,text02,エネミーに囲まれようが<br>一斉に攻撃されようが<br>がんがんブッ倒していく。
Event1,0,text03,モニター越しに見てて<br>思わず手に力がこもっちまったぜ。
Event1,0,text04,っと、感心してねーで<br>オレも実践して来ねーとな。<br>ひとまず礼を言
Event1,1,11_voice_NPC_5052_101,"Once again, I've witnessed a legend in the<br>makin'. Ya got my full-on respect. For real."
Event1,1,text02,"The baddies may try to surround ya and <br>gang up on ya all at once, but you just <br>wipe the floor with 'em."
Event1,1,text03,I was surgin' with energy just watchin' ya<br>through the monitor.
Event1,1,text04,"Whoops, I gotta quit gushin' and get movin'!<br>Anyways, thanks again, pal!"
