section,group,id,text
Event1,0,text01,怒涛の勢いで海王種が<br>押し寄せてきたときに<br>天国はすぐそこだって思ったね。
Event1,0,11_voice_NPC_5052_104,何とか帰っては来たけどよ。<br>修行って言うには<br>ハード過ぎだと思うぜ……
Event1,0,text03,ってわけでさ、いつも通り海王種を<br>バッタバッタとなぎ倒す<br>おたくを参考にしたいんだわ。
Event1,0,text04,頼んだオレが言うのもなんだけど<br>本当に気をつけろよ
Event1,1,text01,I thought I was gonna see the pearly gates <br>when all those Oceanids came surgin' up.
Event1,1,11_voice_NPC_5052_104,"I mean, I managed to survive anyway, but still.<br>This training's on super extra hard mode, let<br>me tell ya, pal."
Event1,1,text03,So give those Oceanids a good thumpin' like<br>always so I can watch.
Event1,1,text04,"Sure, I'm the one asking you to go rushin' into<br>danger, but seriously--be careful out there!"
