section,group,id,text
Event1,0,11_voice_NPC_5052_104,やっぱ気になるだろ？<br>おたくとは付き合い長いから<br>そういうのピンと来るんだ。
Event1,0,text02,ま、オレがちゃちゃっと倒しても<br>よかったんだけどさ。<br>それじゃ、おたくもつまんねーだろ？
Event1,0,text03,花を持たせてやりてーというか<br>見せ場、作らせてやりてーし。<br>オレはいつもどおりモニターで見てる。
Event1,0,text04,あ、そうそう！<br>１体だけじゃなくて、５、６０体くらい<br>ウジャウジャいるからヨロシクな
Event1,1,11_voice_NPC_5052_104,"That request caught your eye, ya? I know you<br>well enough to tell that much, pal."
Event1,1,text02,"I mean, I could've gone out there and cleaned<br>up shop myself, of course. But I wouldn't <br>wanna steal all the fun, right?"
Event1,1,text03,I figure I gotta leave something for you to do.<br>Some place to let you strut your stuff and all.<br>Me? I'll keep an eye from my monitor here.
Event1,1,text04,"Ah, yeah, before you go! Remember, we're not<br>talking just one, but a real swarm of like<br>fifty or sixty or so! Good luck!"
