section,group,id,text
Event1,0,11_voice_NPC_5052_104,こういう図々しいこと頼めるのも<br>マブパートナーの証だよな？
Event1,0,text02,だが変な気遣いはしねーでくれよな。<br>オレはオレでいずれキッチリ<br>攻略してやるつもりだからよ。
Event1,0,text03,１体シメてくれりゃいいから<br>オレにも獲物を残しといてく
Event1,1,11_voice_NPC_5052_104,"Only a true partner would make a request this<br>shameless, right pal?"
Event1,1,text02,"Don't sweat it, though. I fully plan to mount <br>my own strategic attack. Eventually."
Event1,1,text03,"You only need to take down one, so leave <br>some for me! Ya know, for later."
