section,group,id,text
Event1,0,text01,聞いてくれよ！　オレもついに<br>「壊世区域」の調査に<br>行かなきゃなんなくなっちまったぜ！
Event1,0,11_voice_NPC_5052_105,映像とかデータとか見てると<br>まさにアルティメットなエネミーが<br>ウヨウヨしてるんだよなぁ……
Event1,0,text03,おたくは、あんなとんでもねー<br>バケモノたちと<br>普通にやりあってるわけ？
Event1,0,text04,つーわけで、ちょーっと<br>おたくの戦い方ってヤツを<br>モニターさせてくん
Event1,1,text01,"Yo, just listen to this! I've finally been<br>ordered to go investigate the Corrupted Region!"
Event1,1,11_voice_NPC_5052_105,"I've been lookin' at images 'n data 'n all that<br>good stuff, and there're some seriously fierce<br>enemies swarmin' around there."
Event1,1,text03,"You stare down monsters like that all the time,<br>dontcha?"
Event1,1,text04,"Sooo basically, you'll let me monitor the way<br>ya fight, yeah!?"
