section,group,id,text
Event1,0,11_voice_NPC_5059_100,相手はデカいが、やり方さえ<br>間違わなければ殺せる。<br>大きさにビビるんじゃないよ。
Event1,0,text02,全身が岩みたいだからって<br>生き物だから柔らかい急所が必ずある。
Event1,0,text03,ま、今さらあんたに解説するような<br>話じゃないね。早く殺
Event1,1,11_voice_NPC_5059_100,"The enemies may be large, but you can <br>kill them as long as you know how. <br>Don't be cowed by their size."
Event1,1,text02,Even these boulder things must stay <br>alive somehow. They must have a soft <br>spot somewhere.
Event1,1,text03,"Well, I'm sure you don't need a long <br>explanation at this point. <br>Kill them and be quick."
