section,group,id,text
Event1,0,text01,今は、アークスシップの中は<br>平和そのものなんだけど<br>地球でピンチが続いてるみたい！
Event1,0,text02,太平洋っていう海で<br>この前の大陸とは<br>別の何かが出現したみたいなの！
Event1,0,11_voice_NPC_5097_104,巨大な船っていう話なんだけど<br>前にも同じような事があったような？
Event1,0,text04,そっちのほうも、何かが起こる前に<br>調査をお願い
Event1,1,text01,"The ARKS Ship is as peaceful as can be,<br>but there's always a crisis or two on Earth!"
Event1,1,text02,"Something's shown up over a body of <br>water called the Pacific Ocean, and it's <br>different from the last continent!"
Event1,1,11_voice_NPC_5097_104,"They say it's some sort of giant boat, but<br>something about all this feels so familiar..."
Event1,1,text04,Mind looking into things before <br>they go south?
