section,group,id,text
Event1,0,text01,おつかれさまーっ！<br>うんうん、チョコも無事そうだね！<br>これにて耐久試験、完了っと！
Event1,0,text02,熱だけじゃなくて、衝撃なんかにも<br>しっかり耐えて、それでいておいしい<br>チョコレートも、完成間近！
Event1,0,text03,あとは、飾り付けとか<br>隠し味とか、アレンジ部分かな……
Event1,0,11_voice_NPC_5121_101,ま、それを考えるのがわたしの仕事！<br>それじゃ、本当にありが
Event1,1,text01,"Hey, welcome back! Looks like the chocolate<br>is safe and sound! That's the end of the<br>durability test!"
Event1,1,text02,"We've seen that the chocolate stands up not<br>only to heat, but to impact as well! I'm getting<br>closer to making the perfect chocolate!"
Event1,1,text03,"All that's left is the decoration, secret<br>ingredients, as well as my own special<br>touch..."
Event1,1,11_voice_NPC_5121_101,But that's my job to come up with those<br>things! Thank you so much for your efforts!
