section,group,id,text
Event1,0,11_voice_NPC_5055_101,<%me>さん<br>ありがとうございました！
Event1,0,text02,惑星ウォパル……<br>本当に新しい世界を垣間見た思いです。
Event1,0,text03,なにより<%me>さん<br>こんな風景の中に身を置ける<br>あなたが羨ましいですよ。
Event1,0,text04,でも僕も、おかげですべてを<br>共有できるんですから感謝し
Event1,1,11_voice_NPC_5055_101,"Thank you very much, <br><%me>!"
Event1,1,text02,"Seeing Wopal really is like catching a glimpse<br>of a whole new world, don't you think?"
Event1,1,text03,"I envy you for being able to actually stand<br>there amid that landscape, <br><%me>."
Event1,1,text04,But I'm grateful that you can share that<br>experience at least vicariously with me anyway!
