section,group,id,text
Event1,0,11_voice_NPC_5056_101,<%me>！<br>すっごく見ごたえあったよ！<br>退屈してたのがウソみたいだよー。
Event1,0,text02,本当はアンタをまた、へっぽこぴーって<br>呼ぶ瞬間を楽しみにしてたんだけど<br>こういう計算違いは嬉しいなー。
Event1,0,text03,これからもアンタから<br>目が離せなくなっちゃったじゃない。<br>ずーっとウォッチしてる
Event1,1,11_voice_NPC_5056_101,"That was some spectacle, <br><%me>!<br>I take back what I said about getting bored."
Event1,1,text02,"I'll be honest, I was getting excited to <br>call you a clown again, but this was a <br>welcome surprise."
Event1,1,text03,"At this point, I don't think I can take my eyes<br>off you. My peepers will be wide open!"
