section,group,id,text
Event1,0,11_voice_NPC_5021_100,うむ、どうだった？<br>なかなかの陳列内容だっただろう。
Event1,0,text02,陳列内容もさることながら<br>いつでもどこでも呼び出せる<br>というのが人気の秘密だろうな。
Event1,0,text03,せっかくのショップなのだから<br>上手い具合に利用してみせてこその<br>アークスというものだろう！
Event1,0,text04,いいか、私もＡＣショップには
Event1,1,11_voice_NPC_5021_100,"So! What did ya think? It's got a pretty nice<br>lineup, don't it?"
Event1,1,text02,"The lineup's one thing, but the real secret to<br>its popularity is that you can look at it<br>anytime, anywhere."
Event1,1,text03,"It's a pretty great shop, so you can't<br>call yourself an ARKS op if you don't<br>put it to good use!"
Event1,1,text04,Now did I ever tell ya the story about the time<br>I bought somethin' from the AC Shop<br>for my first main squeeze...
