section,group,id,text
Event1,0,text01,新惑星、発見されましたねえ。<br>もちろん、殺ることは変わりません。<br>殺して殺して殺すだけですよお。
Event1,0,11_voice_NPC_5026_100,ああ、でも見たことない敵さんは<br>どんな感じなんでしょうねえ。<br>殺しがいがあるといいですねえ。
Event1,0,text03,撃って撃って撃って撃ちまくって<br>殺しつくしちゃいましょう。<br>楽しいですよお。
Event1,0,text04,さあさあ、さあさあさあ。<br>白ノ領域へ向かいましょう。<br>楽しい楽し
Event1,1,text01,"So we've got a whole new planet to explore! <br>Oh, and butcher our way through. That's our<br>three-step plan: kill, kill, and kill!"
Event1,1,11_voice_NPC_5026_100,"What kinda new baddies do you think we'll <br>meet? Ooh, I hope they're really fun to kill!"
Event1,1,text03,"It's so much fun! Just bang, bang, bang, bang...<br>Until the sun shines right through 'em!"
Event1,1,text04,"Hey, hey, c'mon, let's go! We gotta get <br>to the Daybreak Province and do some <br>serious exploring!"
