section,group,id,text
Event1,0,11_voice_NPC_5052_104,オレは石橋を叩いて渡るタイプだから<br>あんな危ねえの相手にしてまで<br>経験を積もうなんて思わないよ。
Event1,0,text02,強い敵ほど腕が鳴るとか？<br>そういうのオレには理解できないな……
Event1,0,text03,もちろん、おたくが頑張るのをオレが<br>止める権利はないし、応援してるよ。
Event1,0,text04,ほいじゃ、ファイ
Event1,1,11_voice_NPC_5052_104,"I'm a ""measure like ten times, cut once"" kinda<br>guy, ya know, pal? I'm not so thirsty for<br>experience I'd go take on a doozy like this."
Event1,1,text02,"What? You got a death wish or somethin'? <br>I'll never understand you wackos who go <br>hunt down the biggest, meanest enemies <br>on purpose."
Event1,1,text03,"But hey, who am I to hold you back, pal?<br>You just go have yourself a great time."
Event1,1,text04,"Go get 'em, pal! Go nuts out there!"
