section,group,id,text
Event1,0,text01,いつも、僕のわがままに<br>付き合ってくださって<br>ありがとうございます！
Event1,0,text02,新惑星ということもあり<br>今まで観測されたことがない現象が<br>確認されています。
Event1,0,11_voice_NPC_5055_104,花舞と呼ばれる現象なのですが<br>一体どんなものなのか……<br>気になってしかたありません。
Event1,0,text04,いつも危険な依頼ばかりで<br>申し訳ないのですが……<br>どうかよろしくお願いし
Event1,1,text01,Thank you so much for always accepting my<br>capricious requests!
Event1,1,text02,"Now that there's a new planet, I am currently<br>verifying all the phenomenon I've never<br>observed before."
Event1,1,11_voice_NPC_5055_104,"For example, there is one known as a Blossom<br>Shower... But what in heaven's name could it<br>be? I must find out."
Event1,1,text04,"I sincerely apologize that all my requests are<br>such dangerous ventures, but I hope you will<br>aid me nonetheless!"
