section,group,id,text
Event1,0,11_voice_NPC_5020_104,ハンターの役割は、パーティー内の<br>壁となること。それはわかっているな？
Event1,0,text02,だからこそ、ハンターは<br>他のメンバーの……他者の動きを<br>しっかり認識していなければならない。
Event1,0,text03,視野を広く保つために必要なのは<br>やはりなによりも経験だろうな。<br>かくいうオレもまだまだだ。
Event1,0,text04,共に凍土へと向かい<br>他者との連携行動を
Event1,1,11_voice_NPC_5020_104,"In Party settings, the Hunter can serve as a<br>kind of bulwark for the defensively<br>disadvantaged, let's say."
Event1,1,text02,So a Hunter has to stay aware of their<br>teammates and their surroundings.
Event1,1,text03,"The key to keeping your perspective broad is,<br>of course, experience. I'm constantly<br>learning, myself."
Event1,1,text04,So let's go practice staying sharp together<br>on the Tundra!
