section,group,id,text
Event1,0,text01,あ！　お帰りなさい！<br>今回も、エネミー討伐のデータ<br>しっかり記録させてもらいました！
Event1,0,11_voice_NPC_5437_101,これで、あなたの評価試験は<br>ひとまず終わりです！<br>無事に終わって本当に良かったです！
Event1,0,text03,色々なクラスの良いところを<br>併せ持つヒーローですが<br>まだまだ導入が始まったばかり！
Event1,0,text04,多くのアークスに認知してもらうために<br>今後とも、力を貸してもらえれば<br>本当にっ！　本当に
Event1,1,text01,Ah! Welcome back! I got all your enemy<br>suppression data recorded and saved!
Event1,1,11_voice_NPC_5437_101,That takes care of your evaluation for the time<br>being! I'm glad everything went okay!
Event1,1,text03,"The Hero class is meant to combine the best of<br>other classes, but it's still barely getting<br>off the ground!"
Event1,1,text04,"I would really, REALLY appreciate it if you'd<br>keep helping me out so that more ARKS <br>operatives will take it seriously!"
