section,group,id,text
Event1,0,text01,センパイ！<br>見させてもらったよ。
Event1,0,text02,エネミーの動き自体は<br>そんなに速くないから<br>攻撃のチャンスは結構あるんだな。
Event1,0,text03,落ち着いて戦えば<br>おれにもやれる気がしてきたよ。
Event1,0,11_voice_NPC_5091_100,勉強になった。<br>また、困ったときは<br>お願いしても
Event1,1,text01,"Hey, Boss, you put on a great clinic out there!"
Event1,1,text02,I guess its moves are slow enough they <br>leave a lot of openings to attack.
Event1,1,text03,"I think I can get it now, if I just keep a cool<br>head out there."
Event1,1,11_voice_NPC_5091_100,That was a big help. Do you mind if I <br>come back for more help later?
