section,group,id,text
CharaName,0,name01,フーリエ
CharaName,1,name01,Fourie
Event1,0,11_voice_NPC_5008_104,うーん、持ち帰れそうな物は<br>これといって見当たりませんでしたね……
Event1,0,text02,でもステキな風景が見られました！<br>私、これをあの子たちへの<br>お土産にしようと思います！
Event1,0,text03,早く見せてあげたいなぁ。<br>戻りましょう<br><%me>さん。
Event1,1,11_voice_NPC_5008_104,"Hmmm, I didn't see anything we could <br>take back with us."
Event1,1,text02,But we DID to experience this lovely view!<br>I think I'll use that as my souvenir to them!
Event1,1,text03,"Oh, I can't wait to show them. All right, let's<br>head back, <%me>."
