section,group,id,text
Event1,0,text01,お疲れ様でした。<br>なんだか、まだ足元が<br>ふわふわしている気がいたします。
Event1,0,text02,隔離用の罠やら、空中からの攻撃やら<br>貴方様にほとんど対処して貰いましたが<br>少し成長できた気がしますわ！
Event1,0,11_voice_NPC_5150_100,今回もありがとうございました。<br>またお誘いさせて頂きますので<br>宜しくお願いいたし
Event1,1,text01,"Good job out there.<br>Hey, I think my legs are still shaking."
Event1,1,text02,"Between those isolating traps and the attacks<br>from the sky, I think you ended up handling<br>most of it, but I still feel like I improved!"
Event1,1,11_voice_NPC_5150_100,"Again, thank you so much. I'll invite you again<br>sometime, so I hope you'll humor me and tag<br>along."
