section,group,id,text
Event1,0,11_voice_NPC_5053_101,完璧だよ。私たちの要求にここまで<br>完全に応えてくれる協力者は<br>キミをおいて他にいない。
Event1,0,text02,私はキミと出会えたことに<br>心から感謝しているよ。
Event1,0,text03,この縁を大切にしていきたいと<br>思っている。どうかこれからも<br>私たちに力を貸してほしい。
Event1,0,text04,高額の謝礼を工面できないことが<br>実に心苦しいのだが<br>本当にありが
Event1,1,11_voice_NPC_5053_101,Perfection. I can't recall ever having had an<br>assistant as exacting as you are.
Event1,1,text02,I'm grateful that chance brought the two of us<br>under the same roof.
Event1,1,text03,"Your cooperation is invaluable, and I hope we<br>can continue to count on it."
Event1,1,text04,"I wish we could scrounge together a better<br>reward, but you have my heartfelt thanks!"
