section,group,id,text
Event1,0,text01,同僚の教導官と、これまでに指導した<br>教え子たちの話をしていてね。<br>恥ずかしながら影響されてしまったわ。
Event1,0,11_voice_NPC_5057_100,教導官との兼任になるけれど<br>アークスとしての活動を<br>一部再開しようと思っているの。
Event1,0,text03,それでね。<br>復帰するにあたって、私と<br>組んでくれる人を探しているのだけど。
Event1,0,text04,貴方、その気はないかしら？<br>相応しい力があると判断できたなら<br>私の背中は貴方に預
Event1,1,text01,"I was talking with an instructor colleague about<br>the students we've guided, and as silly as this<br>might sound, it affected me deeply."
Event1,1,11_voice_NPC_5057_100,I'm thinking of returning to <br>partially-active ARKS duty while <br>keeping up my instructor work.
Event1,1,text03,Which brings me to the point: I was <br>looking for someone to team up with <br>me for my big comeback.
Event1,1,text04,I can think of nobody more suitable than you.<br>Are you up for it? I know you've got what it<br>takes to watch my back.
