section,group,id,text
Event1,0,text01,押忍！<br>先生、今回もよろしくお願いします！
Event1,0,text02,今回は、ディランダールについて<br>ご指導いただけますでしょうか！
Event1,0,11_voice_NPC_5063_100,ディランダールの騎手を狙い<br>撃退するその様子をモニターさせて<br>いただければと思います！
Event1,0,text04,それではよろしくお願いい
Event1,1,text01,Heck yeah! You ready for another sesh?
Event1,1,text02,Would you mind giving me some tips for <br>fighting a Dirandahl?
Event1,1,11_voice_NPC_5063_100,I was hoping to watch you as you knock the<br>block off of a Dirandahl's rider!
Event1,1,text04,I can't wait to see this! Thanks!
