section,group,id,text
Event1,0,11_voice_NPC_5052_107,おいおい本当に大丈夫なのか！？<br>あんなの絶対、倒せないって！
Event1,0,text02,いやもちろん<br>倒してみてほしいけどさ……
Event1,0,text03,おたくはマジで考え方が前向きだな。<br>みんながおたくを信頼する理由が<br>さすがにオレにもわかってきたぜ。
Event1,0,text04,とはいってもオレには<br>ここで応援することしかできねえけど<br>頑張ってくれよな！
Event1,1,11_voice_NPC_5052_107,"Uh, pal, you sure you know what you're doin'<br>here? Not to be a downer here, but no way is<br>that thing goin' down!"
Event1,1,text02,"But, ah, I guess I'd be pretty into seein' you<br>try anyway."
Event1,1,text03,"You really are... let's call it ""proactive.""<br>Maybe to a fault. But it ain't hard to tell why<br>everyone has so much faith in ya."
Event1,1,text04,"Guess I'll just be hootin' and hollerin' for ya<br>from the sidelines like always. But you go get<br>'em! Give it all ya got, pal!"
