section,group,id,text
Event1,0,11_voice_NPC_5018_101,やー、見事だねー。<br>こんなに早く戻ってくるとは<br>思わなかったよ。
Event1,0,text02,仲間との連携が重要なクエストだから<br>どうなるかなーと思ったけど<br>無用な心配だったようだね。
Event1,0,text03,みんな、きみのスコアを見て<br>目の色変えてキャンプシップに<br>向かっていったよ。
Event1,0,text04,がんばるアークスが増えたし<br>これでまた<br>私は少し楽をできそうだね
Event1,1,11_voice_NPC_5018_101,"Woo-wee, that was fancy.<br>I never thought you'd get back that quick."
Event1,1,text02,"Was wonderin' how it'd go since you gotta <br>work with your pardners, but it looks like it <br>turned out right as rain."
Event1,1,text03,"Everyone's eyes lit right on up, and they all<br>rushed to the Gateway Ship as soon as they <br>saw yer score."
Event1,1,text04,"I can take a load off now, seein' all those <br>ARKS operatives givin' it their all."
