section,group,id,text
Event1,0,11_voice_NPC_5087_100,お互いに磨き合って高め合うって<br>とってもいいことだと思わない？
Event1,0,text02,特にスーパーハードともなると<br>そういう姿勢が大事だと思うんだー。
Event1,0,text03,しーっかり呼吸を合わせて<br>Ｓランククリアしちゃおう！<br
Event1,1,11_voice_NPC_5087_100,Don't you think you and me trying to one up<br>each other is a great way for us to hone our<br>skills?
Event1,1,text02,"It's definitely something that helps out when<br>we're talking Super Hard quests, that's for<br>sure."
Event1,1,text03,"So! Speaking of that, why don't you and I sync<br>up and score us another S Rank together? I<br>won't take no for an answer!"
