section,group,id,text
Event1,0,text01,相棒、おかえり。<br>それで、アウロラは何だって……？<br>……ああ、悪かったって話か。
Event1,0,11_voice_NPC_5544_100,え、仲良くなったのが誤算だって？<br>ははは……でも、おれからすれば<br>それは嬉しい誤算、だったかな。
Event1,0,text03,アウロラにはお礼を言わないとね。<br>こうして楽しい時間を過ごせるのも<br>彼女のおかげなんだから…
Event1,1,text01,"Welcome back, mate. What was<br>up with Aurora? Oh, she just wanted<br>to apologize?"
Event1,1,11_voice_NPC_5544_100,"So she never expected me to make friends<br>with myself? Heh, well, I'm still glad I did."
Event1,1,text03,"I should probably go thank her. If it weren't<br>for her, I wouldn't have been able to do any<br>of this in the first place, after all!"
