section,group,id,text
Event1,0,text01,単に優秀なパルチザン使いなら<br>これまで掃いて捨てるほどいた。
Event1,0,11_voice_NPC_5054_100,だが頂点を極めたと言える者は<br>残念ながら私に心当たりはない。
Event1,0,text03,ドラゴン・エクスを仕留めることで<br>私の記憶に鮮烈な衝撃を残してくれ
Event1,1,text01,Nothing special about just being a skilled<br>Partisan wielder. I've seen enough to last a<br>lifetime.
Event1,1,11_voice_NPC_5054_100,But not a single one comes to mind who really<br>hit the peak of what a Partisan user can do.
Event1,1,text03,Want to really sear yourself into my memory?<br>Then get going on this Dragon X hunt.
