section,group,id,text
Event1,0,text01,右へ左へ、上へ後ろへ……<br>何と素早い動きをするのか。<br>目が回るかと思いました。
Event1,0,text02,今回も貴方の戦い方を<br>参考にさせて頂きました。<br>一人ではどうなっていたことやら……
Event1,0,text03,体力も消耗しましたし<br>早めの帰還といたしましょ
Event1,1,text01,From right to left... Above and then behind...<br>Those were some quick moves.<br>I thought my head was going to start spinning.
Event1,1,text02,"Once again, I learned a whole lot from your<br>fighting style. Who knows what would have<br>happened if I'd gone in by myself..."
Event1,1,text03,"I've gone and used up a lot of my stamina,<br>so we should hurry back."
