section,group,id,text
Event1,0,text01,ふーん、なかなかいい感じの<br>場所じゃない？<br>でも、空気が張りつめてる感じだね。
Event1,0,text02,さすが黒の民の本拠地ってとこかな？<br>ま、適度な緊張感はいいものだよね！
Event1,0,text03,それじゃ、エネミーの不意打ちに<br>気をつけな
Event1,1,text01,"Hmmm, this place is pretty nice...<br>but the atmosphere feels kinda tense."
Event1,1,text02,"I guess we should've expected as much from <br>he Nightfaller base. Well, a little bit of<br>tension never hurt anyone!"
Event1,1,text03,"Okay, let's get moving before the enemy<br>notices us! Carefully, though."
