section,group,id,text
pr_058050,0,pr_058050_0010,敵性存在の消滅を確認。<br>お疲れさまでした！
pr_058050,0,pr_058050_0020,それにしても、この領域……<br>エフィメラの濃度によって<br>出現する敵も強くなるみたいです。
pr_058050,0,pr_058050_0030,領域の濃度は、アークスの技術で<br>干渉が可能ということがわかりました。<br>少しずつ濃度を上げて調査しましょう。
pr_058050,0,pr_058050_0040,今はまだ低濃度領域での調査ですが<br>現状でも敵の強さは桁違いです。<br>無理はしないでくださいね！
pr_058050,1,pr_058050_0010,Enemy presence eliminated! Good work!
pr_058050,1,pr_058050_0020,"Still, though... It seems the enemies in this area are stronger due to the thick concentration of Ephemera."
pr_058050,1,pr_058050_0030,We now know that ARKS technology can interfere with the concentration in<br>this area. Let's try raising the concentration as you investigate.
pr_058050,1,pr_058050_0040,"Until now, you've investigated low concentration areas, but the enemies here are on a different level. Don't do anything risky, okay?"
