section,group,id,text
Basic,0,Title,歴史を騙し、現在を喰らう
Basic,0,Explanation,十年前の『彼女』と【若人】の戦いの裏で<br>密やかにうごめいていた邪悪があった。<br>歴史を騙し、現在をも食おうとする邪悪が。<br>真実を探る、或いは伝えるため<br>数多の人が惑星リリーパに集ってきていた。<br>――――――――――――――――――――<br>失敗条件/戦闘不能後、リタイアを選択
Basic,0,StoryExplanation,十年前の『彼女』と【若人】の戦いの裏で、密やかに<br>うごめいていた邪悪があった。歴史を騙し、現在をも<br>食おうとする邪悪が。真実を探る、或いは伝えるため<br>数多の人が惑星リリーパに集ってきていた。
Basic,1,Title,"Rewrite History, Devour the Present"
Basic,1,Explanation,"A profound evil simmered beneath the battle<br>that had occurred between ""Her"" and Apprentice<br>the Vernal ten years ago, an evil which sought to<br>devour the present by rewriting the past itself.<br>A substantial group of searchers had started<br>to gather on Lillipa to seek out, or disseminate,<br>the truth.<br>----------------------------------------------------<br>You will fail this quest if you become incapacitated<br>or retire."
Basic,1,StoryExplanation,"A profound evil awaken during the battle between ""Her"" and<br>Apprentice the Vernal ten years ago, an evil that will destroy<br>the present by rewriting the past itself. A group of searchers<br>started gathering on Lillipa to seek, or disseminate, the truth."
QuestTarget,0,SimpleExplanation,【若人】を探せ！
QuestTarget,1,SimpleExplanation,Seek out Apprentice the Vernal!
