section,group,id,text
Basic,0,Title,ダーカー強襲
Basic,0,Explanation,アークスシップ第百二十八番艦<br>『テミス』へのダーカーの強襲。<br>事前予測なしの突発事象に<br>慌てふためくアークス達。<br>安寧の時を引き裂くような出撃命令は<br>そのすぐあとに通達された。<br>――――――――――――――――――――<br>失敗条件/戦闘不能後、リタイアを選択
Basic,0,StoryExplanation,アークスシップ第百二十八番艦『テミス』への<br>ダーカーの強襲。事前予測なしの突発事象に慌て<br>ふためくアークス達。安寧の時を引き裂くような<br>出撃命令は、そのすぐあとに通達された。
Basic,1,Title,Falspawn Full Assault
Basic,1,Explanation,"Falspawn were bearing down in a full assault on<br>ARKS Ship 128, the Themis. Flustered by the sudden<br>turn of events, the ARKS membership aboard<br>received their deployment orders.<br>They would have time to enjoy some<br>peace and quiet later.<br>-------------------------------------------<br>You will fail this quest if you become incapacitated<br>or retire."
Basic,1,StoryExplanation,"Falspawn were bearing down in a full assault on ARKS Ship 128,<br>the Themis. Flustered by the sudden turn of events, the ARKS<br>membership aboard received their deployment orders.<br>They would have time to enjoy some peace and quiet later."
QuestTarget,0,SimpleExplanation,侵入したダーカーを殲滅せよ！
QuestTarget,1,SimpleExplanation,Exterminate the invading Falspawn!
