section,group,id,text
Title,0,name01,『パルチザン』について
Title,1,name01,Partisans
mess,0,text01,武器「パルチザン」について、説明します。<br><br>パルチザンは、高速かつ豪快に敵を薙ぎ払う打撃武器です。<br><br>豪快な舞から大技へ繋ぎ、スキのない攻撃を得意とします。<br><%WeaponActionText>で任意でギアをためる乱舞が行えます。
mess,0,text02,パルチザンのギアシステムについて、説明します。<br><br>スキル「パルチザンギア」を習得している場合には<br>武器パレットの上部にギアゲージが追加されます。<br><br>パルチザンのギアゲージは、乱舞アクションにより蓄積されます。<br>乱舞アクションは、攻撃のあとに華麗に舞うアクションです。<br><%WeaponActionText>を長押しして乱舞を行い<br>ギアゲージを任意で蓄積することも可能です。
mess,0,text03,ギアゲージはゲージ単位で最大３つまで蓄積され、<br>フォトンアーツを使用するとゲージを１つ分消費します。<br>時間経過によるギアゲージの減少はありません。<br><br>ギアゲージを消費して放つフォトンアーツは、<br>攻撃範囲が拡大され強力になります。<br>舞うほどに強くなるのがパルチザンのギアシステム
mess,1,text01,"Partisans are melee weapons that cut down foes with style and speed.<br><br>They specialize in sweeping, powerful strikes that keep their wielder<br>out of harm's way.<br><br>You can perform a flourish which builds up the Focus Gauge with the <%WeaponActionText>."
mess,1,text02,"If you have learned the Partisan Focus skill, the Focus Gauge will be displayed<br>in the upper portion of the Weapon Palette.<br><br>The gauge is filled up by performing a partisan's flourish action. A flourish<br>is a stylish twirl performed after unleashing an attack. You can hold down the<br><%WeaponActionText> to continuously perform flourishes and build up the<br>Focus Gauge."
mess,1,text03,"The gauge can stock a maximum of three charges. Using a Photon Art will<br>deplete the gauge by one charge in exchange for increasing the intensity and<br>range of the Photon Art.<br><br>The gauge does not deplete over time.<br>Remember: “The more you style, the bigger your smile (and damage and range).”"
