section,group,id,text
Title,0,name01,『カタナギア』について
Title,1,name01,Katana Gear
mess,0,text01,カタナのギアシステムについて、説明します。<br><br>スキル「カタナギア」を習得している場合には<br>メインパレットの上部にギアゲージが追加されます。<br><br>カタナの攻撃をヒットさせると、ギアゲージが蓄積されていきます。
mess,0,text02,ギアゲージが高まると<br>カタナによる攻撃力が上昇し<br>ジャストカウンター攻撃の範囲も広がります。<br><br>ギアゲージを３段階目まで溜めた状態で<br>ジャストカウンターを行うと、ギアが開放され<br>一定時間攻撃力とクリティカルヒット率に<br>ボーナスを得ることができ
mess,1,text01,"Once you've acquired the skill ""Katana Gear,"" a gear gauge will appear above<br>your weapon palette.<br><br>This gauge will fill as you land hits with your katana."
mess,1,text02,"Once the gauge is full, your katana will gain a boost to attack and an<br>increased range to pull off Perfect Counters.<br><br>Charge the gauge up to its third stage and pull off a Perfect Counter and<br>your gear will be unleashed, granting you increased Attack and a boost to<br>your critical hit rate."
