section,group,id,text
Info,0,Title,英雄と幻視の巫女
Info,0,Explanation,に依頼するといいって<br>教えてもらってさ。<br>手を貸してもらえると助かる！<br><br><yellow>※イーサン、カレンのみ同行<br>ノーマル以上でクリア<c>
Info,0,Reward,イーサン、カレンのPC　※受注時に付与<br>※好感度上昇によるプレゼントはあり
Info,1,Title,El héroe y la hechicera visionaria
Info,1,Explanation,"Sorry for the sudden request!<br>We happened to be get lost here, so we're looking<br>for a way home. We were going to check out each<br>location, but the locals said we should just ask you. We'd be very grateful if you helped us out!<br><br><yellow>With Ethan and Karen as your only<br>partners, clear on Normal or above.<c>"
Info,1,Reward,Tarjeta de socio de Ethan y Karen<br>Emitida tras la aceptación de Quest.<br>Nota: No recibirás un regalo por aumentar la afinidad.
