section,group,id,text
NpcMessageC,0,DragonFellowsB2,/face2 ま、また勝手に動く足場ですー！<br>まるでアトラクション！
NpcMessageC,0,DragonFellowsB3,あれ？　さっきまでのマップと<br>今のマップ、ちょーっと違うような……
NpcMessageC,0,DeliveryA1,/face2 ふふふっ、その辺にはですねぇ<br>なんと！　珍しい化石が<br>あるらしいですよ！
NpcMessageC,0,DeliveryA2,/face2 知っていますか？　知っていますか？<br>そのへんに、稀少な昆虫の化石が<br>あるらしいですよー！
NpcMessageC,0,DeliveryA3,/face2 ここでひとつ耳寄り情報です！<br>珍しい昆虫の化石、そのあたりに<br>あるらしいですよ！
NpcMessageC,0,DeliveryB1,/face4 あっちにもこっちにも固形データ……<br>もー、何が何だかわからないー！
NpcMessageC,0,DeliveryB2,変な、卵みたいな形の石<br>その辺にあったりしませんか？
NpcMessageC,0,DeliveryB3,なにかヘンな感じの物質反応……<br>ダーカーみたいだけど<br>違う気もします。
NpcMessageC,0,DeliveryC1,/face2 うわー、すごい綺麗なパラメータ！<br>そのあたり、貴重な資源が<br>たーっくさん、ですね！
NpcMessageC,0,DeliveryC2,/face2 あっちからもこっちからも<br>すごい貴重な資源のデータが<br>ちらほら見えますよー！
NpcMessageC,0,DeliveryC3,/face2 噂以上の反応ですよー！<br>貴重な資源が眠ってる感じがします！
NpcMessageC,0,Mining1,周囲からフォトン反応ですー！<br>これ、地表から？
NpcMessageC,0,Mining2,近くにフォトンの反応ー！<br>ん、これ、地表かも？
NpcMessageC,0,Mining3,/face2 フォトン反応がびんびんびーん！<br>地表からみたいですよー！
NpcMessageC,0,Door_Ruin1,こ、この設備まだ動いてます！<br>気をつけてくださいねっ！
NpcMessageC,0,Door_Ruin2,設備が稼働してるっぽい？<br>ちゅ、注意してくださいー！
NpcMessageC,0,Door_Ruin3,この反応……設備、動いてる？<br>な、何か起きるかもですよー！
NpcMessageC,0,Capture1,捕縛対象の反応をキャッチ！<br>もしかしたら出てくるかもですー！
NpcMessageC,0,Capture2,捕獲対象の反応をかくにーん！<br>これはもしかしたら！
NpcMessageC,0,Capture3,周辺に気を配っててくださいー！<br>捕獲対象の反応がありましたー！
NpcMessageC,0,DestroyAPC1,正体不明の熱源反応……？<br>き、気をつけてください－！
NpcMessageC,0,DestroyAPC2,正体不明の反応確認！<br>な、なにか来るかも来ないかもー！
NpcMessageC,0,DestroyAPC3,正体不明の熱源反応がありますー！<br>これ、ホント何なんでしょう？
NpcMessageC,0,SmallmanMsg1,そういえば、あのウワサ知ってます？<br>最近、リリーパ族がときどき現れては<br>話しかけてくるそうですよー。
NpcMessageC,0,SmallmanMsg2,/face6 リリーパ族とのコミュニケーションって<br>どういう感じなんでしょうね。<br>できてる人もいるそうですけど。
NpcMessageC,0,SmallmanMsg3,/face2 リリーパ族って<br>とってもかわいいですよね！<br>もっと仲良くなれたらいいのになー！
NpcMessageC,0,FortAttack1,近くにゲートの反応があります！<br>ダーカーの影響受けちゃってる<br>龍族さんの反応もたーっくさん……。
NpcMessageC,0,FortAttack2,む！ゲートの反応ですよー！<br>でもすぐそばに、ダーカー侵食の<br>反応もありますねー……。
NpcMessageC,0,FortAttack3,次のエリアへのゲートが近いです！<br>敵さんが待ち構えてると思うので<br>しっかり準備してってくださいねー。
NpcMessageC,0,ShellFlower1,/face2 そのへん！　海岸エリアにごろごろっと<br>いっぱい転がってる花みたいなの！<br>それ、砲仙花っていうんですよー。
NpcMessageC,0,ShellFlower2,海岸でよく見かける砲仙花には<br>要注意ですよー！　毒をはき出したり<br>火を吹いたりしますからー！
NpcMessageC,0,ShellFlower3,砲仙花は、不思議な植物ですよねー。<br>毒を吐いたり火を吐いたり、どういう<br>進化をしてきたのか、さっぱりです。
NpcMessageC,0,SmallmanHomeDefense1,うーん、最近リリーパ族の集落が<br>襲われているって報告が<br>多いみたいですね。気になりますー。
NpcMessageC,0,SmallmanHomeDefense2,このあたりには水もありますし<br>他の場所に比べたら、リリーパ族も<br>暮らしやすいみたいですねー。
NpcMessageC,0,SmallmanHomeDefense3,リリーパ族の集落って襲われやすいから<br>いつでも移動できるよう、いろんな所に<br>作ってるみたいですよー。
NpcMessageC,0,SmallmanJunkSpot1,リリーパ族って、けっこう器用でして<br>拾ったジャンクを組み合わせて<br>道具を作ったりしてるみたいです。
NpcMessageC,0,SmallmanJunkSpot2,このあたり、ジャンクが多いですねー。<br>リリーパ族にとっては、きっと<br>宝の山！　ですよー！
NpcMessageC,0,SmallmanJunkSpot3,このあたりにはたーくさんの<br>リリーパ族が住んでるらしいですよー！<br>ときどき出会えたりするかも！
NpcMessageC,0,Umincyu_kiki1patu1,/face1 このあたりに、原生住民の<br>みなさんも来てるみたいですね。<br>なんだか、それっぽい反応が……
NpcMessageC,0,Umincyu_kiki1patu2,/face1 うーん、このあたりには<br>原生住民のみなさんにとっての<br>天敵がいるって聞いたようなー……
NpcMessageC,0,Umincyu_kiki1patu3,/face1 あれ、こんなところに<br>原生住民の反応……ってこれ<br>なんだか危ない感じかも！
NpcMessageC,0,Slimevanish1,/face1 このあたりでは、時々ヘンテコなのが<br>集まって、ぴちゃっと落ちてくることが<br>あるみたいですよー。
NpcMessageC,0,Slimevanish2,/face1 噂に聞くヘンテコなのって<br>どのぐらいぬめっとしてるんでしょう。<br>ちょっと気になりますねー。
NpcMessageC,0,Slimevanish3,/face1 な、なんだかヘンな反応があります！<br>これ、どこからだろ……天井？
NpcMessageC,0,AliceAlly1,おやおやっ、近くに<br>他のアークスさんがいるみたいですよ！<br>……これ、アークスの反応ですよねぇ？
NpcMessageC,0,OrakioAlly1,おやおやっ、近くに<br>他のアークスさんがいるみたいですよ！<br>……これ、アークスの反応ですよねぇ？
NpcMessageC,0,SessionOrakioAlly1,近辺にアークスの反応が二つあります。<br>パーティを組んでいるようですが<br>少し、反応がヘンな気も……
NpcMessageC,0,SessionOrakioAlly2,……いえ、気のせいみたいです。<br>そのまま進行し、可能であれば<br>協力してあげてください。
NpcMessageC,0,castleterror1,バリエーションテスト１
NpcMessageC,0,castleterror2,バリエーションテスト２
NpcMessageC,0,castleterror3,バリエーションテスト３
NpcMessageC,0,whitegiant1,おやおやっ、白の民の人たちが<br>出撃準備を整えてますね。<br>何かあるんでしょうか？
NpcMessageC,0,whitegiant2,むむむっ、これは敵さんの反応？<br>なんだか白の民さんも警戒してます。<br>皆さん、注意注意ですよー！
NpcMessageC,0,whitegiant3,あれっ、白の民さんが移動中？<br>もしかして、敵さんなのかも……？<br>みなさーん、注意してくださーい！
NpcMessageC,0,nyau1,んー……なんだかヘンテコな反応……<br>ダーカーではないんですけどー<br>とにかく、ヘンな反応があります！
NpcMessageC,0,nyau2,あっ、何だか反応が出てます！<br>でもこれ何の反応だかわかりません！<br>とりあえず、ふわっと注意注意です！
NpcMessageC,0,nyau3,周囲に反応があるんですが……<br>なんだかとってもヘンな反応です。<br>念のため、気をつけてくださいー！
NpcMessageC,0,Destroy_pirateship1,バリエーションテスト１
NpcMessageC,0,Destroy_pirateship2,バリエーションテスト２
NpcMessageC,0,Destroy_pirateship3,バリエーションテスト３
NpcMessageC,0,BossAnnihilationMOarfish1,テスト１
NpcMessageC,0,BossAnnihilationMOarfish2,テスト２
NpcMessageC,0,BossAnnihilationMOarfish3,テスト３
NpcMessageC,0,NagisaAlly1,むむむっ、近くになにやら<br>誰かがいそうな反応ですよ！<br>……でもこれ、アークスじゃないかも？
NpcMessageC,0,AsaiAlly1,むむむっ、アークスの反応ですよ！<br>近くで戦闘しているのかも？
NpcMessageC,0,AsaiAlly2,どうやら、この周辺で<br>アークスが戦ってるみたいですよー！<br>注意してくださーい。
NpcMessageC,0,AsaiAlly3,あれれ？　この反応……アークスです。<br>もしかして戦ってるかも！
NpcMessageC,0,collabo1Ally1,むむむっ、アークスの反応ですよ！<br>近くで戦闘しているのかも？
NpcMessageC,0,collabo1Ally2,どうやら、この周辺で<br>アークスが戦ってるみたいですよー！<br>注意してくださーい。
NpcMessageC,0,collabo1Ally3,あれれ？　この反応……アークスです。<br>もしかして戦ってるかも！
NpcMessageC,0,Sessioncollabo1Ally1,おやおやっ、近くにアークスの反応が<br>二つあるみたいですよー！<br>でも、ちょっとヘンな反応ですねぇ。
NpcMessageC,0,IceHell1,わわっ、みなさん大丈夫ですか！？<br>気温がどんどん下がっていますー！<br>注意してくださーい！
NpcMessageC,0,IceHell2,あれ？　あれれれれ？<br>すごく気温が下がっていってる？<br>なんとなーく気を付けてくださーい！
NpcMessageC,0,IceHell3,んんー、黒の民さんの動きや反応が<br>なんだか怪しい感じですよ……<br>急な気温低下と関係があるかもです！
NpcMessageC,0,SessionasaiAlly1,おやおやっ、近くにアークスの反応が<br>二つあるみたいですよー！<br>でも、ちょっとヘンな反応ですねぇ。
NpcMessageC,0,SessionnewafinAlly1,おやおやっ、近くにアークスの反応が<br>二つあるみたいですよー！<br>でも、ちょっとヘンな反応ですねぇ。
NpcMessageC,0,annihilation_rappyemp,あれ？　大きな反応がありますよ？<br>確か大きな影の目撃情報もありますし<br>ちょーっと、気になりますよー。
NpcMessageC,1,DestroyEnemy1,M-Multiple active signals!<br>Please be careful!
NpcMessageC,1,DestroyEnemy2,W-Whoa!? So many signals!<br>Watch out!
NpcMessageC,1,DestroyEnemy3,Th-This signal...<br>Something's coming... I think!
NpcMessageC,1,EscapeEnemy1,/face2 The target's signal is stronger than <br>ever! Pretty sure it's coming!
NpcMessageC,1,EscapeEnemy2,"/face2 Oooh, this is good!<br>I'm picking up a target signal!"
NpcMessageC,1,EscapeEnemy3,"/face2 Great signal!<br>Come on over, Mr. Target!"
NpcMessageC,1,DestroyBoss1,"Whoa, we have a signal from a huge heat <br>source! B-Be careful, please!"
NpcMessageC,1,DestroyBoss2,What's this reading?<br>It's really... hot!
NpcMessageC,1,DestroyBoss3,This heat source is off the charts!<br>Be careful out there!
NpcMessageC,1,DefenceAllyAPC1,Huh? This signal...<br>Is someone next to you?
NpcMessageC,1,DefenceAllyAPC2,Is this another ARKS op?<br>They might be nearby.
NpcMessageC,1,DefenceAllyAPC3,Is another ARKS op nearby?<br>I'm getting their signal.
NpcMessageC,1,Smallman1,Hmm... What's this tiny signal?
NpcMessageC,1,Smallman2,"Oh! ...Huh?<br>That's weird, I thought I just saw a small signal."
NpcMessageC,1,Smallman3,Hmm... A small signal has been<br>flickering in and out.
NpcMessageC,1,DarkerIncident1,Oh no... I'm getting Falspawn readings!
NpcMessageC,1,DarkerIncident2,Think something big and dark is headed your way!
NpcMessageC,1,DarkerIncident3,"Is this Falspawn?<br>It could be, but then again..."
NpcMessageC,1,Door_Cave1,"Hmm, the enemies are acting oddly."
NpcMessageC,1,Door_Cave2,They're up to something...<br>Be careful!
NpcMessageC,1,Door_Cave3,I'm feeling a teensy bit uneasy.<br>Watch out!
NpcMessageC,1,Door_Urban1,"Oops, the system broke...<br>Watch out for malfunctions!"
NpcMessageC,1,Door_Urban2,"Oh no, I can't control it!?<br>Watch out for your surroundings!"
NpcMessageC,1,Door_Urban3,Huh? What the hey?<br>I... I think it's malfunctioning!
NpcMessageC,1,DragonFellows1,"Whoa, that's scary!<br>Watch out!"
NpcMessageC,1,DragonFellows2,Looks like the ground around there<br>is moving on its own.
NpcMessageC,1,DragonFellows3,Huh? Wasn't that platform <br>over there a second ago?
NpcMessageC,1,DragonFellowsB1,"Hmm... I'm getting a scary reading here, too!"
NpcMessageC,1,DragonFellowsB2,"/face2 Th-The platform is moving on its <br>own again! What is this, a theme park?"
NpcMessageC,1,DragonFellowsB3,Huh? I swear the map just changed...
NpcMessageC,1,DeliveryA1,"/face2 Hehe, guess what! Around those parts...<br>there's a rare fossil!"
NpcMessageC,1,DeliveryA2,/face2 Did you know?<br>Apparently there are rare insect fossils<br>around there!
NpcMessageC,1,DeliveryA3,/face2 Here's a cool tip!<br>I hear you can find rare insect fossils there!
NpcMessageC,1,DeliveryB1,/face4 What on earth is going on!?<br>I'm getting fixed readings everywhere...
NpcMessageC,1,DeliveryB2,"Doesn't happen to be a weird, <br>egg-shaped rock around there, does there?"
NpcMessageC,1,DeliveryB3,"I'm getting a strange material reading...<br>It seems to be Falspawn, but different somehow..."
NpcMessageC,1,DeliveryC1,"/face2 Whoa, what clear parameters!<br>There are LOTS of valuable resources around!"
NpcMessageC,1,DeliveryC2,/face2 I'm getting readings from valuable resources<br>scattered all over the place!
NpcMessageC,1,DeliveryC3,/face2 There are tons of hidden <br>valuable resources there.<br>Much more than the rumors say!
NpcMessageC,1,Mining1,I'm detecting photon readings nearby.<br>Are these coming from the ground?
NpcMessageC,1,Mining2,I'm detecting photon readings close by.<br>Are these.. from the ground?
NpcMessageC,1,Mining3,/face2 Photon readings are off the charts!<br>They seem to be coming from the ground.
NpcMessageC,1,Door_Ruin1,Th-This device is still active!<br>Watch out!
NpcMessageC,1,Door_Ruin2,"Guess these devices are still operational, huh?<br>L-look out!"
NpcMessageC,1,Door_Ruin3,"These readings...<br>The devices are active?<br>Look out, they might move!"
NpcMessageC,1,Capture1,I'm getting readings of a target creature!<br>It might appear!
NpcMessageC,1,Capture2,I'm getting readings of a target creature!<br>Could it be?
NpcMessageC,1,Capture3,Keep an eye on your surroundings!<br>I'm getting readings of a target creature!
NpcMessageC,1,DestroyAPC1,An unknown heat source?<br>W-Watch out!
NpcMessageC,1,DestroyAPC2,Unknown heat source detected!<br>Something may or may not appear!
NpcMessageC,1,DestroyAPC3,There's an unknown heat source?<br>What IS this?
NpcMessageC,1,SmallmanMsg1,Have you heard this rumor? They say that <br>Lillipans sometimes appear and talk to us.
NpcMessageC,1,SmallmanMsg2,/face6 I wonder how the Lillipans <br>communicate with us? Apparently <br>some have succeeded.
NpcMessageC,1,SmallmanMsg3,/face2 The Lillipans are so cute!<br>I wish we could get closer with them!
NpcMessageC,1,FortAttack1,"Gate detected nearby!<br>I'm getting readings of many Draconians<br>under Falspawn influence, too."
NpcMessageC,1,FortAttack2,"Oh, I'm detecting a gate!<br>But there's signs of Falspawn corruption<br>right in front of it..."
NpcMessageC,1,FortAttack3,"The gate to the next area is close by!<br>Enemies are probably waiting for you <br>to approach, so be ready!"
NpcMessageC,1,ShellFlower1,/face2 The flower-like things scattered around<br>the coast are called Blitzblossoms.
NpcMessageC,1,ShellFlower2,Be careful of the Blitzblossoms<br>that you see on the coast!<br>They spit poison and fire!
NpcMessageC,1,ShellFlower3,Blitzblossoms are strange plants.<br>They spit poison and fire.<br>I can't fathom why they've evolved this way.
NpcMessageC,1,SmallmanHomeDefense1,There have been many reports of<br>attacks on Lillipan settlements.<br>I wonder what's up?
NpcMessageC,1,SmallmanHomeDefense2,"There's water around here,<br>and it's a relatively nice place for<br>the Lillipans to live."
NpcMessageC,1,SmallmanHomeDefense3,"Lillipan settlements are attacked often,<br>so they build several, allowing them to <br>evacuate at a moment's notice."
NpcMessageC,1,SmallmanJunkSpot1,Lillipans are pretty handy.<br>They build tools out of the junk materials<br>that they gather.
NpcMessageC,1,SmallmanJunkSpot2,There's a lot of junk around here.<br>It's a treasure trove for Lillipans.
NpcMessageC,1,SmallmanJunkSpot3,There's lots of Lillipans living around here!<br>You might encounter some now and again!
NpcMessageC,1,Umincyu_kiki1patu1,/face1 I'm detecting signals of natives nearby...
NpcMessageC,1,Umincyu_kiki1patu2,/face1 Hmm... I've heard that natural enemies of<br>natives have been found around here.
NpcMessageC,1,Umincyu_kiki1patu3,"/face1 Huh, I'm getting readings<br>of a native creature. That's unusual...<br>Wait, this might be dangerous!"
NpcMessageC,1,Slimevanish1,"/face1 Around here, weird blobs form<br>and splash to the ground!"
NpcMessageC,1,Slimevanish2,/face1 I wonder how slimy the weird blobs<br>I heard about are?<br>Can't help but wonder.
NpcMessageC,1,Slimevanish3,/face1 I-I'm getting a weird signal!<br>It's from... above?
NpcMessageC,1,AliceAlly1,"Oh? There are two other ARKS ops nearby!<br>...They are ARKS ops, right?"
NpcMessageC,1,OrakioAlly1,"Oh? There are two other ARKS ops nearby!<br>...They are ARKS ops, right?"
NpcMessageC,1,SessionOrakioAlly1,There are two ARKS ops nearby.<br>Looks like they're in the same party...<br>But their signals are a bit strange.
NpcMessageC,1,SessionOrakioAlly2,"...Never mind, it was just my imagination.<br>Please proceed, and help them if you can."
NpcMessageC,1,castleterror1,Variation Test 1
NpcMessageC,1,castleterror2,Variation Test 2
NpcMessageC,1,castleterror3,Variation Test 3
NpcMessageC,1,whitegiant1,Oh? The Daybreakers are preparing to strike.<br>I wonder what's up?
NpcMessageC,1,whitegiant2,"Uhh, I'm getting an enemy reading.<br>The Daybreakers are on the alert, too.<br>Watch out, everyone!"
NpcMessageC,1,whitegiant3,"Huh? The Daybreakers are on the move!<br>There might be enemies.<br>Be careful, everyone!"
NpcMessageC,1,nyau1,"Hmm, I'm getting a strange reading...<br>It's not Falspawn, but... it's weird!"
NpcMessageC,1,nyau2,"Oh, I'm getting a reading!<br>But I don't know what it is!<br>Just keep an eye out!"
NpcMessageC,1,nyau3,"I'm getting a reading, but it's very strange.<br>Be alert, just in case!"
NpcMessageC,1,Destroy_pirateship1,Variation Test 1
NpcMessageC,1,Destroy_pirateship2,Variation Test 2
NpcMessageC,1,Destroy_pirateship3,Variation Test 3
NpcMessageC,1,BossAnnihilationMOarfish1,Test 1
NpcMessageC,1,BossAnnihilationMOarfish2,Test 2
NpcMessageC,1,BossAnnihilationMOarfish3,Test 3
NpcMessageC,1,NagisaAlly1,I'm detecting someone nearby!<br>But... it might not be an ARKS op?
NpcMessageC,1,AsaiAlly1,Oh? ARKS ops detected!<br>They might be fighting nearby.
NpcMessageC,1,AsaiAlly2,Looks like there are ARKS ops fighting nearby!<br>Please stay on the alert!
NpcMessageC,1,AsaiAlly3,Huh? This signal... they're ARKS ops.<br>They might be fighting!
NpcMessageC,1,collabo1Ally1,Oh? ARKS ops detected!<br>They might be fighting nearby.
NpcMessageC,1,collabo1Ally2,Looks like there are ARKS ops fighting nearby!<br>Please stay on the alert!
NpcMessageC,1,collabo1Ally3,Huh? This signal... they're ARKS ops.<br>They might be fighting!
NpcMessageC,1,Sessioncollabo1Ally1,Oh? There are two ARKS ops nearby!<br>But their signals are a bit strange.
NpcMessageC,1,IceHell1,"Oh, no, is everyone okay?<br>It's getting very cold!<br>Be careful!"
NpcMessageC,1,IceHell2,Huh? It's getting super cold!<br>Watch out!
NpcMessageC,1,IceHell3,"Hmm, the Nightfallers are acting strangely. <br>It might have something to do <br>with the sudden cold."
NpcMessageC,1,SessionasaiAlly1,Oh? There are two ARKS ops nearby!<br>But their signals are a bit strange.
NpcMessageC,1,SessionnewafinAlly1,Oh? There are two ARKS ops nearby!<br>But their signals are a bit strange.
NpcMessageC,1,annihilation_rappyemp,"Hmm, there's a large signal. There've <br>been sightings of a large shadow, too.<br>It's a little concerning."
NpcMessageD,0,DestroyEnemy1,動体熱源、多数感知。<br>警戒を。
NpcMessageD,0,DestroyEnemy2,多数の反応を感知。<br>注意を。
NpcMessageD,0,DestroyEnemy3,周囲状況に警戒。<br>多数の反応が感知されました。
NpcMessageD,0,DestroyBoss1,強力な反応を感知。<br>周囲を警戒してください。
NpcMessageD,0,DestroyBoss2,異常な反応を感知。<br>注意が必要です。
NpcMessageD,0,DestroyBoss3,周囲への警戒を強めてください。<br>強力な反応が感知されています。
NpcMessageD,0,DefenceAllyAPC1,交戦中のアークスの反応を感知。<br>近くに居るようです。
NpcMessageD,0,DefenceAllyAPC2,アークスの反応を感知。<br>周辺で交戦中の模様です。
NpcMessageD,0,DefenceAllyAPC3,周辺状況のデータから見るに<br>付近に交戦中のアークスが<br>存在するようです。
NpcMessageD,0,DarkerIncident1,ダーカーの出現予兆を感知。<br>気をつけてください。
NpcMessageD,0,DarkerIncident2,パラメータの異常値を感知。<br>ダーカーの出現に警戒を。
NpcMessageD,0,DarkerIncident3,各種計測値に異常あり……<br>ダーカーが来るかもしれません。
NpcMessageD,0,Capture1,要捕獲対象の反応を感知。
NpcMessageD,0,Capture2,要捕獲対象の反応が<br>見られました。<br>周囲を確認してみてください。
NpcMessageD,0,Capture3,要捕獲対象の反応を<br>瞬間的ながらも、感知しました。<br>周囲に潜んでいるかもしれません。
NpcMessageD,0,castleterror1,異常なエネルギー反応を感知。<br>街に点在する灯籠周辺からです。<br>各員、警戒を。
NpcMessageD,0,castleterror2,街の灯籠周辺より異常値を検出。<br>各員、周辺状況の変化に注意を。<br>警戒を強めてください。
NpcMessageD,0,castleterror3,パラメータの異常値を感知。<br>街の灯籠周辺より確認。<br>各員、注意を。
NpcMessageD,0,whitegiant1,敵性反応出現の兆候を感知。<br>白の民の戦士も出撃体勢です。<br>各員、警戒を。
NpcMessageD,0,whitegiant2,敵性反応の出現兆候を感知しました。<br>白の民の戦士も警戒態勢のようです。<br>各員、周辺状況の変化に注意を。
NpcMessageD,0,whitegiant3,白の民が臨戦態勢をとっています。<br>現在の敵性反応は微弱ですが、あるいは<br>間もなく出現するかもしれません。
NpcMessageD,0,nyau1,不可解な反応が出ています。<br>あまり強い反応ではありませんが<br>各員、周辺状況に注意してください。
NpcMessageD,0,nyau2,判断のつかない微弱反応を感知。<br>各員、留意はしておいてください。
NpcMessageD,0,nyau3,不思議な反応が感知されています。<br>敵性でも友軍でもない、反応です。<br>一応、注意を。
NpcMessageD,0,Destroy_pirateship1,海中に、高エネルギー反応、感知。<br>付近のアークスは留意を。
NpcMessageD,0,Destroy_pirateship2,海中に、高エネルギー反応、感知。<br>付近のアークスは留意を。
NpcMessageD,0,Destroy_pirateship3,海中に、高エネルギー反応、感知。<br>付近のアークスは留意を。
NpcMessageD,0,BossAnnihilationMOarfish1,強力な反応を感知。<br>敵性反応の可能性、大。<br>各員、警戒を。
NpcMessageD,0,BossAnnihilationMOarfish2,強力な反応を感知。<br>敵性反応の可能性、大。<br>各員、警戒を。
NpcMessageD,0,BossAnnihilationMOarfish3,強力な反応を感知。<br>敵性反応の可能性、大。<br>各員、警戒を。
NpcMessageD,0,NagisaAlly1,人型存在の反応を感知……<br>ですが、アークスの反応とは<br>異なります。留意を。
NpcMessageD,0,AsaiAlly1,付近にアークスの反応を感知。<br>戦闘中のようです。留意を。
NpcMessageD,0,AsaiAlly2,交戦中のアークスの反応を検知。<br>周辺エリアに居ます。<br>ご認識を。
NpcMessageD,0,AsaiAlly3,アークスの反応を感知。<br>周辺エリアで戦闘中のようです。<br>留意を。
NpcMessageD,0,collabo1Ally1,付近にアークスの反応を感知。<br>戦闘中のようです。留意を。
NpcMessageD,0,collabo1Ally2,交戦中のアークスの反応を検知。<br>周辺エリアに居ます。<br>ご認識を。
NpcMessageD,0,collabo1Ally3,アークスの反応を感知。<br>周辺エリアで戦闘中のようです。<br>留意を。
NpcMessageD,0,Sessioncollabo1Ally1,付近にアークスの反応を二つ感知。<br>協力体制を組んでいるようです。<br>反応が普段とは異なります。留意を。
NpcMessageD,0,SessionasaiAlly1,付近にアークスの反応を二つ感知。<br>協力体制を組んでいるようです。<br>反応が普段とは異なります。留意を。
NpcMessageD,0,SessionnewafinAlly1,付近にアークスの反応を二つ感知。<br>協力体制を組んでいるようです。<br>反応が普段とは異なります。留意を。
