section,group,id,text
Required,0,Title,【シーズン】交戦データの収集・Ⅰ
Required,0,Summary,を送信するように頼まれる。<br><br><yellow>※シーズンエネミー：<br>　シンボル付きでないラッピーなども含む<c>
Required,1,Title,[Estacional] Recoge datos de batalla I
Required,1,Summary,Xiemi asks you to send her battle data on enemies marked with seasonal symbols to assist with equipment development.<br><br><yellow>Seasonal Enemies: Rappies without symbols are also eligible.<c>
SubObjectives,0,text0101,シンボル付きエネミーを倒す
SubObjectives,1,text0101,Derrota a los enemigos marcados con un símbolo.
