section,group,id,text
emilia,0,Emilia_01_20,……ふむ、成る程。<br>異世界からの来訪者への技術協力、か。
emilia,0,Emilia_01_30,そんな魅力的なお誘いを<br>私が断ると思うかい？<br>喜んで協力させてもらうよ。
emilia,0,Emilia_01_40,未知の技術や思考に触れる機会なんて<br>そうそうあるものじゃないからね。
emilia,1,Emilia_01_10,"Ah, eres tu. Si, ¿cual es el problema?"
emilia,1,Emilia_01_20,¿Eres tu?
emilia,1,Emilia_01_30,Hmm... ¿Llevaria a los visitantes de otros mundos ayuda tecnica? 
emilia,1,Emilia_01_40,No es comun poder ver tecnologia y pensamientos desconocidos como estos. 
st11,0,st01_010,先日の襲撃を経て、エーテルの構成と<br>その分解、及びリミッターの解放権限を<br>見直す方向で話がまとまった。
st11,0,st01_020,決定が迅速で、とても良いことだな。<br>もろもろの反省が生きている<br>とも言える。
st11,1,st01_010,"Despues del ataque, nos reunimos para revisar la constitucion del ehter y como romperla, asi como las autorizaciones para liberar los limitadores."
st11,1,st01_020,Es bueno que se haya tomado una decision rapida. Es un signo de que estamos aprendiendo de nuestros errores.
sq00,0,11_voice_NPC_5009_104,私は今回留守番だ。<br>私程度の能力では邪魔になる。
sq00,0,sq00_020,その分、分析などに全力を尽くす。<br>他ならない、キミのためだからね。
sq00,1,11_voice_NPC_5009_104,"Como solo estaria en el camino de aquellos<br>que luchan, me quedare sentado<br>esta una vez."
sq00,1,sq00_020,"Hare lo imposible con todas las<br>analisis que pueda proporcionar. Por ti,<br>es lo menos que puedo hacer."
sq01,0,sq01_010,キミの無事を祝いたいのはやまやまだが<br>分析しなければならないデータが<br>山積みで、てんてこ舞いさ。
sq01,0,11_voice_NPC_5009_105,かの【深遠なる闇】との戦いで<br>色々と想定外のデータが出ている。<br>これは時間がかかりそうだぞ。
sq01,1,sq01_010,"Fervientemente espero que puedas salir indemne<br>de esto. La buena suerte, querido Guardian.<br>Estamos contigo."
sq01,1,11_voice_NPC_5009_105,Bien hecho. Este es el primer paso <br>hacia el futuro <br>que hemos conquistado juntos.
sq13,0,11_voice_NPC_5009_100,【深遠なる闇】のデータ分析が<br>落ち着いてきたと思ったら<br>今度は終の女神の分析だ。
sq13,0,sq13_020,まったく、私は働き者だよ。<br>もっとも、ここで手を抜くわけには<br>いかないけどね。
sq13,1,11_voice_NPC_5009_100,"Y sin embargo, nunca espere que la misteriosa<br>Amduskia fuera resuelta de esta forma."
sq13,1,sq13_020,"Como investigador, parte de mi quisiera haber descubierto la verdad por mis propias manos. <br>En ese sentido, es un poco desafortunado."
ep6_sq00,0,ep6_sq00_01,【深遠なる闇】のデータ分析が<br>落ち着いてきたと思ったら<br>今度は終の女神の分析だ。
ep6_sq00,0,11_voice_NPC_5009_104,まったく、私は働き者だよ。<br>もっとも、ここで手を抜くわけには<br>いかないけどね。
ep6_sq00,1,ep6_sq00_01,"Y sin embargo, nunca espere que la misteriosa<br>Amduskia fuera resuelta de esta forma."
ep6_sq00,1,11_voice_NPC_5009_104,"Como investigador, parte de mi quisiera haber descubierto la verdad por mis propias manos. <br>En ese sentido, es un poco desafortunado."
ep6_sq01,0,ep6_sq01_01,ライト君は動揺しすぎだが<br>たしかにアークスは危機的状況だ。
ep6_sq01,0,ep6_sq01_02,事実は事実。しかし希望が潰えた時でも<br>次の一手につながる可能性を探る。<br>それが研究者だ。
ep6_sq01,0,11_voice_NPC_5009_104,……キミも大変だろうが<br>よろしく頼んだぞ。守護輝士君。
ep6_sq01,1,ep6_sq01_01,Tenemos que acabar con ellos mientras<br>tengamos la ventaja.
ep6_sq01,1,ep6_sq01_02,Supongo que deberia hacerlo. Debe analizar el enemigo y apoyarlo con todo su ser.<br>Eso es lo que debe hacer.
ep6_sq01,1,11_voice_NPC_5009_104,"Se que lo sabes, pero... necesitamos a alguien como tйo."
ep6_sq02,0,11_voice_NPC_5009_100,ご苦労だったな。<br>キミだけではなく<br>全員で掴んだ未来への糸口だ。
ep6_sq02,0,ep6_sq02_02,しかし、アムドゥスキアの謎が<br>こんな形で明かされるとは……
ep6_sq02,0,ep6_sq02_03,研究者としては自らの手で<br>真実を見つけたかった気もするな。<br>その点だけは残念だ。
ep6_sq02,1,11_voice_NPC_5009_100,"Iba a pensarlo por un momento, pero gracias al esfuerzo de todos <br>logramos llegar hacia el futuro <br>que queremos."
ep6_sq02,1,ep6_sq02_02,No esperaba que la misteriosa<br>Amduskia fuera resuelta de esta forma.
ep6_sq02,1,ep6_sq02_03,"Como investigador, parte de mi quisiera haber descubierto la verdad por mis propias manos. <br>En ese sentido, es un poco desafortunado."
ep6_sq05,0,ep6_sq05_1,敵の勢いが弱まった今が<br>おそらく正念場なのだろう。
ep6_sq05,0,ep6_sq05_2,なら私がするべきは<br>敵のデータをさらに分析して<br>全身全霊でサポートすることだな。
ep6_sq05,0,ep6_sq05_3,キミには<br>大変な思いをさせてばかりだが……<br>よろしく頼む。
ep6_sq05,1,ep6_sq05_1,Tenemos que acabar con ellos mientras<br>tengamos la ventaja.
ep6_sq05,1,ep6_sq05_2,Supongo que deberia hacerlo. Debe analizar el enemigo y apoyarlo con todo su ser.<br>Eso es lo que debe hacer.
ep6_sq05,1,ep6_sq05_3,"Lo sabes que siempre te estresas demasiado, pero... necesitamos a alguien como tйo."
ep6_sq06_02,0,11_voice_NPC_5009_101,一時はどうなるかと思ったが<br>なんとかなってよかったよ。<br>皆で全力を尽くした成果だな。
ep6_sq06_02,0,text02,しかし、キミはとんでもないね。<br>あれほどの大役をこなしても<br>普段と変わらない様子とはね。
ep6_sq06_02,0,11_voice_NPC_5009_100,さて、実はのんびりしてられないんだ。<br>先の戦いで色々と研究が滞っていてね。<br>さっそく取りかからないと。
ep6_sq06_02,1,11_voice_NPC_5009_101,"Iba a pensar que podriamos tener problemas, pero gracias al trabajo de todos <br>logramos llegar hacia el futuro ||TAG_1||que queremos."
ep6_sq06_02,1,text02,"Es increible, incluso despues de todo eso, sigues igual que siempre. <br>Nunca crees que estes pasando por demasiado, ¿verdad?"
ep6_sq06_02,1,11_voice_NPC_5009_100,Ahora es hora de regresar al trabajo.<br>Tengo un monton de investigacion pendiente y me tengo que mover.
