section,group,id,text
AcceptCondition,0,a1,特定のクライアントオーダーのクリア
AcceptCondition,0,a2,特定のクライアントオーダーのクリア
AcceptCondition,0,a3,スーパーハード受注許可証の所持
Basic,0,Title,特別演習：グリーンヒルスプリント
Basic,0,Explanation,さを証明せよ。<br>――――――――――――――――――――――――――――――――――――――<br><yellow>※エネミーとのレベル差７以上で、エネミー撃破時の獲得クエストポイント減少<c>
Basic,1,Title,Entrenamiento especial: Green Hill Sprint
Basic,1,Explanation,when the level disparity between you and the enemies is 7 or greater.<c>
QuestTarget,0,SimpleExplanation,より多くクエストPtを獲得してゴールする
QuestTarget,1,SimpleExplanation,Gana puntos de misión y alcanza la meta.
