section,group,id,text
TutorialText,0,Title,シーズナルリージョンマグ
TutorialText,0,text0001,シーズナルイベント期間中は、<br>リージョンマグが<yellow>シーズナルリージョンマグ<c>に変わります。<br><br>このシーズナルリージョンマグに、<br>イベント期間中のみ入手可能なギャザリング素材を投入すると、<br>まんぷく度を大きく上昇させることができます。
TutorialText,0,text0002,シーズナルイベント期間中は、<br>リージョンマグが<yellow>“シーズナルリージョンマグ”<c>に変わります。<br><br>シーズナルイベント期間中のリージョンマグブースト[全体]には、<br>シーズンエネミーの出現確率上昇の効果が追加されます。
TutorialText,1,Title,Revistas regionales de temporada
TutorialText,1,text0001,al gathering materials to these Seasonal Region<br>Mags fills them up a great deal and makes them very happy.
TutorialText,1,text0002,"Evento estacional, se agrega un efecto de aumento de la tasa de aparición de enemigos estacionales a los aumentos de Mag de región [Todos]."
