section,group,id,text
TutorialText,0,Title,星崩の猛攻
TutorialText,0,text0001,“星崩の猛攻”は、強力なエネミーを<br>撃破することが目的となる高難度のソロクエストです。<br><br>各ランクをクリアすると次のランクが解放されます。
TutorialText,0,text0002,クエストのランクに応じて、<br><yellow>“エネミー能力強化”や“プレイヤー能力の弱体化”<c>が<br>発生することがあります。<br><br>エネミー能力強化とプレイヤー能力の弱体化の内容は<br>クエスト受注前に確認できるほか、<br>クエスト受注後はメインメニューでも確認できます。
TutorialText,1,Title,Golpe de caída del planeta
TutorialText,1,text0001,s to defeat powerful enemies.<br><br>Clearing a rank will unlock the next rank.
TutorialText,1,text0002,"y Mejoras de habilidades y desventajas de habilidades del jugador antes de aceptar la misión, así como desde el menú principal después de aceptarla."
