section,group,id,text
Info,0,Title,ジャストアタック特訓・Ⅵ
Info,0,Explanation,センパイは海岸エリアには行き慣れて<br>いるんだろ？<br>あそこに出現するダーカーに<br>リューダソーサラーってのがいるよな？<br>攻撃が遠近共に充実した厄介なやつでさ<br>うまいようにジャストアタックが出来ない。<br>いつものようにお手本を見せてくれないか？<br><br><yellow>※ジャストアタックで撃破する<c>
Info,0,Errand,イオのパートナーカード<br>※初回報告時に付与
Info,1,Title,Campo de entrenamiento de ataque perfecto VI
Info,1,Explanation,<yellow> Derrota al enemigo especificado con un ataque perfecto. <c>
Info,1,Errand,Tarjeta de socio de Io<br>Nota: Se emite al completar la primera misión.
