section,group,id,text
TutorialText,0,Title,『艦内潜入：敵大型戦艦』について
TutorialText,0,text0001,クリア条件について説明します。<br><br>このクエストは<br><yellow>最深部にいる討伐目標を撃破する<c>か<br><yellow>累計戦闘不能回数が一定以上になる<c>と<br><c 00ffff>クエスト終了となります。<c><br><br>クエスト終了時には<br>それまでの報酬が手に入りますので<br>最後まで諦めないでください。
TutorialText,0,text0002,このクエストには以下の特徴があります。<br><br>・レーザーセンサーによる妨害<br>　『レーザーセンサー』に触れてしまうと<br>　閃機種の防衛兵器が起動します。<br>　<yellow>ステップでは回避できないので<c><br>　注意してください。<br><br>・HP回復の
TutorialText,1,Title,Infiltración de barcos: gran acorazado enemigo
TutorialText,1,text0001,"Los requisitos de la misión son los siguientes.<br><br><c 00ffff>La misión termina<c> cuando <yellow>derrotas al objetivo de supresión en el área final<c> o <yellow>quedas incapacitado un cierto número de veces.<c><br><br>Conservas todas las recompensas que adquieras hasta el momento en que termina la misión, así que sigue luchando tanto como puedas."
TutorialText,1,text0002,Esta misión tiene las siguientes características.<br><br>- Obstáculos del sensor láser<br>Tocar los sensores láser activará las armas defensivas luminmech. Cuidado: <yellow>Estos no se pueden evitar eludiendo.<c><br><br>- Recuperación de HP limitada
