section,group,id,text
CharaName,0,name01,サポートパートナー
CharaName,1,name01,¿?
Skit_ci,0,skit01,/ci1 2 ここにも行動阻害用の突出針……<br>とはいえ、飛行するダーカーが多いから<br>あまり効果はなさそうだね。
Skit_ci,1,skit01,"/ci1 2 Estos picos sobresalen aquí para bloquear<br>avance, pero no son muy efectivos<br>debido a la cantidad de Falspawn voladores."
Skit,0,skit01,ここにも行動阻害用の突出針……<br>とはいえ、飛行するダーカーが多いから<br>あまり効果はなさそうだね。
Skit,1,skit01,"Estos picos sobresalen aquí para bloquear<br>avance, pero no son muy efectivos<br>debido a la cantidad de Falspawn voladores."
