section,group,id,text
TutorialText,0,Title,『トレイン・ギドラン討伐』について
TutorialText,0,text01,『トレイン・ギドラン討伐』について<br>説明します。<br><br>このクエストは、エネミーを次々と<br>撃破しながら前進し、最深部に出現する<br>ボスを倒すことでクリアになります。
TutorialText,0,text02,出現したエネミーをすべて倒すと<br>幻創障壁が解除されて<br>先に進めるようになります。<br><br>同時に、付近のダッシュパネルも<br>使用可能になりますので活用しつつ<br>最深部のボスを目指してください。
TutorialText,1,Title,Supresión del Tren Gidran
TutorialText,1,text01,"En esta misión, tu objetivo es eliminar enemigos en el camino.<br>hasta el área final y luego derrota al jefe que aparece allí."
TutorialText,1,text02,"Destruye a todos los enemigos que parecen disipar la barrera fantasma.<br>permitiéndole seguir adelante. También tienes acceso a los paneles de tablero.<br>en el camino, así que úsalos para llegar al jefe en el área final."
