section,group,id,text
TutorialText,0,Title,『解式フォトンアーツ』について
TutorialText,0,text0001,><c ff4f3f><br>※通常クラスかつ<br>   メインクラスの武器で使用できます。<br><br>※ジャストアタックやクラススキル<br>   エネミーシールドなどの<br>   威力上昇、減少効果は適用されません。<c>
TutorialText,0,text0002,発動に必要なストック数を超えると<br>アイコンが点灯し、使用可能<c>になります。<br><c ff4f3f><br>※消費ストック数は<br>   解式ＰＡごとに異なります。<c>
TutorialText,0,text0003,ストック数上限は<br>習得初期の時点では「３」ですが<br>特定のクライアントオーダーを<br>達成することで増やすことが可能です。<br><br>上手に活用して戦闘を有利に進めましょう。
TutorialText,1,Title,Artes fotonicas de acumulacion
TutorialText,1,text0001,"s Habilidades, campos de amortiguación de fotones <br>, etc. no se aplican. <c>"
TutorialText,1,text0002,aries dependiendo del Photon Art. <c>
TutorialText,1,text0003,ers.<br><br> ¡Utilízalos ampliamente para llevar tu potencial de combate al siguiente nivel!
