section,group,id,text
Required,0,Title,スティア連破訓練・3-Ⅰ
Required,0,Summary,アークス上級訓練教官ロナルディンから、<br>経験を積むために、<br>レアエネミーの討伐を勧められる。<br><br><yellow>※対象リージョン：スティア<br>※推奨セクション：デクストベース<c>
Required,1,Title,Stia Entrenamiento Implacable 3-I
Required,1,Summary,"La instructora de entrenamiento avanzado de ARKS, Ronaldine, te ha asignado la tarea de suprimir enemigos raros para ganar algo de experiencia.<br><br><yellow>Región de destino: Stia<br>Sector recomendado: Dext Base<c>"
SubObjectives,0,text0101,金色のアルターズ（Lv.65以上）を倒す
SubObjectives,1,text0101,Derrota unidades Golden ALTERS (Nv. 65 o superior)
