section,group,id,text
Required,0,Title,エアリオ連破訓練・1-Ⅰ
Required,0,Summary,アークス上級訓練教官ロナルディンから、<br>経験を積むために、<br>フォーマーズの討伐を勧められる。<br><br><yellow>※対象リージョン：エアリオ<br>※推奨セクション：<br>　マグナス山（Rank.5以上）<c>
Required,1,Title,Aelio Entrenamiento implacable 1-I
Required,1,Summary,"La instructora de entrenamiento avanzado de ARKS, Ronaldine, te ha asignado la tarea de suprimir a los FORMERS para ganar algo de experiencia.<br><br><yellow>Región de destino: Aelio<br><br>Sector recomendado: Monte Magnus (rango 5 o superior)<c>"
SubObjectives,0,text0101,フォーマーズ（Lv.70以上）を倒す
SubObjectives,1,text0101,Derrota unidades FORMERS (Nv. 70 o superior)
