section,group,id,text
Required,0,Title,【シーズン】期間限定クエストのクリア
Required,0,Summary,期間限定クエストを、<br>1度も戦闘不能にならずに、<br>エネミーを30体以上倒してクリアする。<br><br><yellow>※クエストカウンターで受注可能<c>
Required,1,Title,[Seasonal] Completa la misión por tiempo limitado
Required,1,Summary,Completa la misión de tiempo limitado derrotando a 30 o más<br>enemigos sin quedar incapacitado.<br><br>*Disponible en el mostrador de misiones
SubObjectives,0,text0101,指定の条件でクエストをクリアする
SubObjectives,1,text0101,Completa la misión bajo las condiciones dadas.
