section,group,id,text
Required,0,Title,【お月見】シーズンエネミーの討伐・Ⅱ
Required,0,Summary,シーズンシンボルの付いた<br>ドレッドエネミーを倒す。<br><br><yellow>※ドレッドエネミー：<br>　二つ名“老練の”が付いた個体<c>
Required,1,Title,[Observación de la luna] Supresión enemiga estacional II
Required,1,Summary,"Defeat a Dread Enemy marked with a Seasonal Symbol.<br><br><yellow>Dread Enemies: Seek out a specimen whose name<br>includes ""Veteran""<c>"
SubObjectives,0,Objective0101,シンボル付きドレッドエネミーを倒す
SubObjectives,1,Objective0101,Derrota al terrible enemigo marcado con un símbolo.
