section,group,id,text
Required,0,Title,南クヴァリスでテイムズ肉の調達
Required,0,Summary,南クヴァリスで、<br>ギャザリングによりテイムズ肉を入手する。<br><br><yellow>※対象ギャザリング素材：<br>　マッタ・クヴァル肉、ガッツ・クヴァル肉、<br>　サッパ・クヴァル肉など<c>
Required,1,Title,Buscando carne TAMES en Kvaris del Sur
Required,1,Summary,"Reúne carne TAMES en Kvaris del Sur.<br><br><yellow>Objetivo: Carne rica de Kvaris, Carne robusta de Kvaris, Carne ligera de Kvaris, etc. <c>"
SubObjectives,0,text0101,南クヴァリスでテイムズ肉を入手する
SubObjectives,1,text0101,Consigue carne TAMES en Kvaris del Sur.
