section,group,id,text
Required,0,Title,エアリオ連破訓練・3-Ⅰ
Required,0,Summary,アークス上級訓練教官ロナルディンから、<br>経験を積むために、<br>任意のエネミーの討伐を勧められる。
Required,1,Title,Aelio Entrenamiento Implacable 3-I
Required,1,Summary,"La instructora de entrenamiento avanzado de ARKS, Ronaldine, tiene<br>te ha asignado la tarea de suprimir enemigos de cualquier tipo<br>in order to gain some experience."
SubObjectives,0,text0101,マグナス山（Rank.3以上）でエネミーを倒す
SubObjectives,0,text0102,研究所跡（Rank.3以上）でエネミーを倒す
SubObjectives,1,text0101,Derrota enemigos en el Monte Magnus (rango 3 o superior)
SubObjectives,1,text0102,Derrota enemigos en las ruinas del laboratorio (rango 3 o superior)
