section,group,id,text
TutorialText,0,Title,このクエストについて
TutorialText,0,text0001,ブーストエネミーが<br>出現しやすい状態となります。<br><br>制限時間までに<br>よりたくさんのエネミーを撃退できるよう<br>仲間と協力して頑張りましょう！
TutorialText,0,text0002,このクエストでは<br><red>クエストをクリアするまで<br>エネミーからドロップするアイテムを<br>獲得できません。<c><br><br>クエストクリア後、転送先のエリアにて<br>獲得することができます
TutorialText,1,Title,Acerca de esta misión
TutorialText,1,text0001,"Esta misión se completa cuando los jugadores exceden el límite de tiempo.<br>Además, puedes acumular puntos de misión para hacer raras.<br>Los enemigos y los enemigos Berserk aparecen con más frecuencia.<br><br>Trabaja con tus compañeros para matar tantos enemigos como sea posible.<br>como puedas dentro del límite de tiempo!"
TutorialText,1,text0002,"En esta misión, <red> no puedes adquirir objetos caídos.<br>de los enemigos hasta que completes la misión.<c><br><br>Los elementos caerán en el área posterior al teletransporte cuando completes la misión."
