section,group,id,text
TutorialText,0,Title,このクエストについて
TutorialText,0,text0001,このクエストでは<br><red>クエストをクリアするまで<br>エネミーからドロップするアイテムを<br>獲得できません。<c><br><br>クエストクリア時、エリア最深部にて<br>獲得できます。
TutorialText,0,text0002,。<c>
TutorialText,0,text0003,クエスト中、戦闘に役立つ<br><c 00ffff>アークス兵器<c>が多く配置されています。<br><br>このクエストに配置されている<br>一部アークス兵器は<br><yellow>威力が大幅に強化<c>されています。<br><br>強化されている兵器は以下の2種です。<br><br>・銃座<br>・フォトン粒子砲
TutorialText,1,Title,Acerca de esta misión
TutorialText,1,text0001,"En esta misión, <red> no puedes adquirir objetos caídos.<br>de los enemigos hasta que cumplas las condiciones claras.<c><br><br>Los elementos caerán en el área final una vez que completes la misión."
TutorialText,1,text0002,"Además, <c 00ffff>recibirás un efecto de bonificación de atuendo PSE<c><br>al equipar ciertas capas y atuendos.<br><br>Tu EXP obtenida y la tasa de obtención de objetos raros aumentarán mientras tengas un atuendo.<br>el bono está en vigor. Consulte el sitio del jugador para obtener información detallada.<br>en trajes aplicables.<br><br><c 00ffff>Nota: Perderás un efecto activo si cambias a un<br>traje no calificado en medio de la misión. También tenga en cuenta que<br>Los efectos de PSE activados estarán activos solo para esta misión.<c>"
TutorialText,1,text0003,"En esta misión, habrá muchas <c 00ffff>ARMAS Armas<c> útiles<br>colocado en el campo. Algunas de estas armas ARKS tienen <yellow>muy<br>potencia de fuego mejorada.<c><br><br>Las armas mejoradas vienen en los dos tipos siguientes:<br><br>torretas<br>Cañones de partículas de fotones"
