section,group,id,text
msn_011220_004,0,name_7005,Bruder
msn_011220_004,0,msn_011220_004_0010,サブクラスについて、知ることができたようだな。
msn_011220_004,0,msn_011220_004_0020,これで、戦いの幅が広がるはずだ。<br>いろいろと試してみてくれ。
msn_011220_004,0,msn_011220_004_0030,ほかにも、何人かに連絡をしておいた。<br>ガイドマーカーが示す者たちを、訪ねるとよいだ
msn_011220_004,1,name_7005,Bruder
msn_011220_004,1,msn_011220_004_0010,Veo que has aprendido sobre las subclases.
msn_011220_004,1,msn_011220_004_0020,"Con suerte, ampliarán tus horizontes de lucha. ¡Asegúrate de probar una variedad de ellos!"
msn_011220_004,1,msn_011220_004_0030,Me puse en contacto con más personas y las etiqueté con marcadores para ti. <br>Probablemente puedan enseñarte un par de cosas.
