section,group,id,text
npc_777101,0,77710101,物資は、ただ集めるだけでなく、その管理が大切です。<br>あらゆる事態に、備えておく必要があります。
npc_777101,0,77710102,とはいえ、無駄を出してもいけない……。<br>やってみると、これがなかなか難しい。
npc_777101,0,77710103,ですが、ああでもないこうでもないと、<br>考えるのは楽しいものです。
npc_777101,0,77710104,このような雑務を嫌う者もいますが、<br>私には合っているようですね。
npc_777101,1,77710101,"Recolectar suministros es importante, pero gestionarlos también lo es.<br>Tenemos que estar preparados para cada eventualidad."
npc_777101,1,77710102,"Dicho esto, tampoco podemos dejar que nada se desperdicie...<br>Es mucho más difícil de lo que parece."
npc_777101,1,77710103,Aunque es divertido pensar en ello.
npc_777101,1,77710104,"Algunas personas odian este trabajo servil, pero a mí me sienta muy bien."
