section,group,id,text
Event1,0,text01,ありがとう！<br>貴方ならなんとかしてくれるって<br>思ってたよー。
Event1,0,11_voice_NPC_5121_100,みんなもホッとしたみたいだし<br>ちょっとは落ち着くんじゃないかな！
Event1,0,text03,まだまだ問題はあるけど<br>緊急事態はなんとかなったし<br>ひとまず安心だよー。
Event1,0,text04,これも全部、貴方のおかげだね！<br>ムチャなお願いだったけど<br>聞いてくれ
Event1,1,text01,¡Muchas gracias! ¡Sabía que podías hacerlo!
Event1,1,11_voice_NPC_5121_100,Todo el mundo parece bastante aliviado. ¡Quizás<br>el ambiente por aquí se vuelva un poco<br>menos tenso ahora!
Event1,1,text03,"Hay más problemas que abordar, pero al menos<br>la emergencia está resuelta. Por fin podemos<br>descansar tranquilos un rato."
Event1,1,text04,¡Realmente nos ayudaste! ¡Muchas gracias<br>por encargarte de esto por mí!
