section,group,id,text
Event1,0,11_voice_NPC_5002_105,あ、<%me><br>ちょっといいかな？<br>よければ、あたしの依頼に付き合って？
Event1,0,text02,ゼノはしばらく一人になりたいみたい。<br>そういうのは尊重したいから、さ。
Event1,0,text03,でもほら、あたしってこんなんだし<br>一人だと不安だからさ。<br>きみが一緒だと安心かな、って。
Event1,0,text04,暇なときで構わないから<br>よろし
Event1,1,11_voice_NPC_5002_105,"Oh, ¿tienes un minuto?<br><%me>? Si lo haces,<br>¿podrías ayudarme con una solicitud?"
Event1,1,text02,"Zeno quiere estar solo por un tiempo, supongo...<br>Y quiero respetar eso."
Event1,1,text03,"Pero bueno. Ya sabes como soy. soy un poco<br>nervioso al hacerlo solo, entonces me sentiría mucho<br>mejor si estuviera contigo."
Event1,1,text04,"Siempre que estés libre es trabajo, así que déjame<br>saber. ¡Realmente lo apreciaría!"
