section,group,id,text
Event1,0,11_voice_NPC_5026_100,お疲れ様でしたあ。<br>楽しかったですねえ？<br>素晴らしい探索が出来ましたねえ？
Event1,0,text02,でも、さっきまで気分よかったのに<br>もうなんだかモヤモヤした気分に<br>なってきてるんですよお。
Event1,0,text03,あなたのほうが、いっぱいやってた<br>気がするから、物足りなく感じるのかも<br>しれないですねえ。
Event1,0,text04,というわけで次は負けませんから<br>また一緒に探索しましょうね
Event1,1,11_voice_NPC_5026_100,"¡Gran trabajo! Eso fue divertido, ¿no? Nada<br>supera una buena expedición como esa."
Event1,1,text02,¿Alguna vez has sentido que toda esa alegría simplemente<br>se desvanece en el momento en que quitas el dedo<br>del gatillo?
Event1,1,text03,Creo que podrías haber conseguido más que yo. Ese<br>debe ser el motivo por el que me siento tan vacío en este momento.
Event1,1,text04,"Sin embargo, me aseguraré de que eso no vuelva a suceder<br>la próxima vez, ¡así que salgamos por<br>otro, en algún momento!"
