section,group,id,text
Event1,0,text01,龍祭壇って、龍族が招いてくれた<br>場所なんでしょ？　だったらさ<br>だっさい姿は見せられないじゃん。
Event1,0,11_voice_NPC_5056_102,だから、このくらいの課題は<br>ちょちょいっとクリアしてみせないと<br>お話にならないと思わない？
Event1,0,text03,それじゃ、頑張ってきなさいよ！<br><%m
Event1,1,text01,"El altar del dragon fue llamado por los <br>Draconianos, ¿verdad? Entonces mejor pon <br> en tu cara de juego si vas a verlo."
Event1,1,11_voice_NPC_5056_102,"De hecho, ¿no estaría de acuerdo en que la única manera<br>de hacer justicia a esta tarea es despejarla<br>en un abrir y cerrar de ojos?"
Event1,1,text03,"De todos modos, ¡buena suerte,<br><%me>!"
