section,group,id,text
Event1,0,text01,先生！　ありがとうございます！<br>あの巨体をものともせずに戦う姿！<br>自分、感服しました！
Event1,0,11_voice_NPC_5063_101,しかも、縦横無尽に飛び回る<br>エネミーの尻尾を破壊して倒すとは！
Event1,0,text03,すぐには、先生のような戦い方は<br>できないと思いますが<br>修練を重ねようと思います！
Event1,0,text04,これからも、先生の<br>お役に立てるように励んでいきます！<br>ご指導ありがとうござ
Event1,1,text01,¡Enseñar! ¡Eso fue increíble! ¡Cortaste ese<br>gigante a su tamaño como si no fuera nada!
Event1,1,11_voice_NPC_5063_101,"Difícilmente puedo golpear a un enemigo volador en un buen día,<br>¡pero destruiste esa cola con facilidad!"
Event1,1,text03,"Mientras tanto, intentare ser util. ¡Gracias por tu orientacion, Maestro!"
Event1,1,text04,"Mientras tanto, intentaré ser<br>útil. ¡Gracias por tu orientación, Maestro!"
