section,group,id,text
Event1,0,text01,調達してくれるの！？<br>嬉しいわ！
Event1,0,11_voice_NPC_5051_100,セグレズンを見たとき<br>私の料理人の勘が囁いたのよ。<br>あの太ももはきっと美味しいって。
Event1,0,text03,地に足をつけず、それでいて<br>いい具合についているあの筋肉<br>きっと柔らかな歯ごたえよ。
Event1,0,text04,そう、フワフワ浮いてて<br>お腹が光ってるやつね。<br>じゃあ、
Event1,1,text01,"¿Saldrás a buscarme algo? <br>¡Oh, gracias!"
Event1,1,11_voice_NPC_5051_100,"Al ver un Segrezun, mis habilidades como chef me dicen que... Aquel muslo debe ser delicioso."
Event1,1,text03,"Esas piernas suyas nunca tocan el suelo,<br>así que te garantizo que son bonitas y suaves.<br>Simplemente un delicioso trozo de carne para masticar."
Event1,1,text04,"Sí, estoy hablando de esos pequeños<br>flotantes con barrigas brillantes.<br>¡Gracias de antemano por conseguirme algunos!"
