section,group,id,text
Event1,0,11_voice_NPC_5055_104,これが黒い粒子……<br>何でしょう、これ……<br>禍々しいとでもいうんでしょうか。
Event1,0,text02,気象の変化と<br>直接関係があるかはわかりませんが<br>とにかく解析に回してみます。
Event1,0,text03,これで依頼内容は完了です。<br>どうもありがとうござい
Event1,1,11_voice_NPC_5055_104,Entonces ESTAS son partículas negras. Fascinante.<br>¿Qué SON? ¿Se supone que debo<br>sentirme... amenazada?
Event1,1,text02,"La relacion entre el cambio climatico y esto aun no esta claro, pero analizare este tema de cualquier forma."
Event1,1,text03,Eso marca su pedido como completo.<br>¡Muchas gracias!
