section,group,id,text
Event1,0,11_voice_NPC_5018_104,同じルートだと、慣れによって<br>成績が変化してきちゃうから<br>新しいルートを作ったらしいよ？
Event1,0,text02,とはいえ、指針なしだとなかなか<br>二の足を踏んじゃう人も多くてね。
Event1,0,text03,そこで白羽の矢が立ったのがきみ。<br>推薦者は私。うんうん、きみなら<br>大丈夫、間違いないね。
Event1,0,text04,ということで、ちゃちゃっと<br>済ませてきちゃってもらえないかな？<br>ベリーハードでも、い
Event1,1,11_voice_NPC_5018_104,Hoy estamos cambiando un poco las cosas.<br>Tengo un Time Attack para ti que se concentra||TAG_1||solo en el Altar del Dragon.
Event1,1,text02,La mayoría de los vaqueros temblarían en la silla si<br>se quedaran en un sendero sin señales.
Event1,1,text03,Pero por eso te elegí. Sé que puedes<br>manejar una pelea o dos.
Event1,1,text04,"Así es, así que prepárate y emprende el sendero <br>. ¿Crees que puedes soportar Muy Difícil?"
