section,group,id,text
Event1,0,text01,お疲れさま。<br>この個体は、分析結果によると<br>幸いなことに影響はなかったみたいね。
Event1,0,11_voice_NPC_5378_105,でも、こうして探していけば<br>そのうち、影響を受けた個体が<br>見つかるかもしれない。
Event1,0,text03,データは、多いほどいいそうよ。<br>大変だとは思うけれど<br>また手を貸してくれると
Event1,1,text01,"Bienvenido de nuevo. Buenas noticias: según el análisis de <br>, la Orgbran estaba libre de influencia."
Event1,1,11_voice_NPC_5378_105,"Sin embargo, podríamos encontrar más organismos individuales<br>afectados si seguimos investigando."
Event1,1,text03,"Cuantos más datos obtengamos, mejor.<br>agradecería cualquier ayuda que nos puedas brindar."
