section,group,id,text
Event1,0,text01,待ってたぜ！<br>ロックゴーレムのデータ<br>確認させてもらってたぜ。
Event1,0,text02,名前のとおり<br>岩でできた大型エネミーっぽいな。
Event1,0,11_voice_NPC_5052_101,腕を破壊しても、しばらくしたら<br>再生するってのが面倒くせーけど<br>そこまで厄介な相手じゃなさそうだな。
Event1,0,text04,よっしゃ、結構情報が揃ってきたぜ！<br>また、お願いすると思うけど<br>よろしく
Event1,1,text01,¡Oye! Obtuve tus datos de combate de Rock Golem aqui.
Event1,1,text02,Y mira eso: un montón grande es genial.
Event1,1,11_voice_NPC_5052_101,"La forma en que regenera los brazos después de destruirlos<br>se volverá molesta muy rápido, pero<br>lo que sea. Podría ser peor."
Event1,1,text04,"¡Me está yendo bastante bien en todo el frente de inteligencia<br>ahora! Sin embargo, nunca está demasiado preparado, <br>, ¡así que sigue así!"
