section,group,id,text
Event1,0,text01,砂漠は、さすがに乾燥していますわね！<br>暑いですけれども、火山洞窟とは<br>また違う暑さですわ……
Event1,0,11_voice_NPC_5150_104,足場も悪いんですのね。<br>確かに、訓練のしがいがありますわ！
Event1,0,text03,さあ行きましょう！<br>私の気合は十分ですわ！
Event1,1,text01,"¡El desierto está terriblemente seco! También hace calor,<br>pero de forma diferente a las Cuevas Volcánicas."
Event1,1,11_voice_NPC_5150_104,El equilibrio aquí también es malo.<br>¡Supongo que eso lo hace bueno para entrenar!
Event1,1,text03,"Pues bien, ¡vámonos!<br>¡Estoy entusiasmado y preparándome para comenzar!"
