section,group,id,text
Event1,0,11_voice_amu_013,お帰りなさいませ。<br>達成、おめでとうございます。
Event1,0,text02,多くのコインを落とす様子を<br>ご覧いただけたようで何よりです。
Event1,0,text03,それでは、こちらを……<br>ささやかなものではございますが<br>助けになれば幸いです。
Event1,0,text04,それではまた。<br>お待ちして
Event1,1,11_voice_amu_013,Bienvenido de nuevo. Y felicitaciones.
Event1,1,text02,"Te dije que el Rey Mesetan dejó caer muchas<br>monedas, pero ¿no es mejor que lo hayas<br>experimentado por ti mismo?"
Event1,1,text03,Acepte esta modesta muestra de mi<br>agradecimiento. Espero que sea útil.
Event1,1,text04,Espero verte de nuevo.
