section,group,id,text
Event1,0,text01,おたくなら、とっくに火山洞窟へ<br>行ってるよな？
Event1,0,text02,あそこ、マジつらくね？<br>龍族の連中、オレを見かけた途端<br>一斉に襲ってきやがるしさ！
Event1,0,11_voice_NPC_5052_106,そんなの逃げるしかねーじゃん？<br>え？　全部、倒せばいいって？<br>無理だって！
Event1,0,text04,じゃあまず、おたくの手本を<br>見せてくれよな！<br>そんなわけで、ヨロ
Event1,1,text01,Voy a arriesgarme y<br>diré que probablemente ya has estado en las<br>cuevas volcánicas.
Event1,1,text02,"Es brutal ahí dentro, ¿no? ¡Esos draconianos<br>se apresuraron hacia mí en el momento en que me vieron!"
Event1,1,11_voice_NPC_5052_106,"Si correr no es la respuesta, ¿cuál es?<br>¿Qué es eso? ¿Solo sacarlos a todos? ¡Diablos, no,<br>eso no va a pasar!"
Event1,1,text04,"Bueno, si es tan fácil, ¿qué tal si me muestras a<br>cómo hacerlo, eh? ¡Estoy esperando!"
