section,group,id,text
Event1,0,text01,こんにちは。<br><%me>さん<br>もう、東京エリアには行かれましたか？
Event1,0,text02,地球の大気を構成する要素は<br>ごく標準的なもののようなんですが<br>一つ気になる現象があるんです。
Event1,0,11_voice_NPC_5055_104,空にきらきらと虹色の光が<br>舞うという話なのですが……<br>どんなものなのか想像がつきません。
Event1,0,text04,難しいとは思いますが<br>この現象について<br>データ収集をお願いできま
Event1,1,text01,"Hay una brillante luz de arco iris en el cielo, y no puedo ni empezar a imaginar que podria ser."
Event1,1,text02,"La composición atmosférica de la Tierra es bastante<br>estándar, salvo por un punto de curiosidad."
Event1,1,11_voice_NPC_5055_104,"Hay una brillante luz de arco iris en el cielo,<br>y no puedo ni empezar a imaginar qué podría ser."
Event1,1,text04,La forma en que esas particulas de luz flotan en el aire... nunca habia visto nada parecido.
