section,group,id,text
Event1,0,11_voice_NPC_5053_104,ずいぶん時間がかかったね。<br>キミならもっと簡単にこなしてくれると<br>思っていたから、少々驚いている。
Event1,0,text02,なるほど、ラッピーとディグナッツでは<br>要する時間も桁違いということか。<br>これは失礼……
Event1,0,text03,もちろん、少ない報酬で要望に応えて<br>もらったことは大いに感謝している。<br>気を悪くしたなら許してほしい。
Event1,0,text04,これからも変わらぬ協力を<br>期待
Event1,1,11_voice_NPC_5053_104,"Lo confieso, me sorprende que te haya tomado tanto tiempo<br>para lograr lo que pensé que te resultaría una tarea<br>sencilla."
Event1,1,text02,"Ya veo, entonces Deegnacht toma órdenes de<br>magnitud más de tiempo para manejarlas que Rappies. <br>Perdón por mi mala educación."
Event1,1,text03,"Realmente aprecio que haya atendido mi solicitud<br>a pesar de la escasa recompensa.<br>Por favor, perdóname si te ofendí."
Event1,1,text04,Espero su ayuda continua.
