section,group,id,text
Event1,0,text01,魔物種って種族のエネミーが<br>いるらしいってことだけは<br>わかったんだけどよ。
Event1,0,11_voice_NPC_5052_100,そうなると、次に気になるのは<br>どんなタイプのエネミーが<br>いるのかって事なわけよ。
Event1,0,text03,手始めに、おたくと<br>このオメガウルフってヤツとの<br>戦闘データを見させてくれねーかな？
Event1,0,text04,色々と事情があるっぽいけど<br>おたくならうまくやってくれんだろ？<br>なぁ？　頼む
Event1,1,text01,"Bien, ahora que se que estos sobrenaturales existen y todo..."
Event1,1,11_voice_NPC_5052_100,A continuacion quiero saber que tipos hay.
Event1,1,text03,¿Qué tal si empezamos mostrándome algunos<br>datos de combate del Lobo Omega?
Event1,1,text04,"Sé que tienes otras cosas en marcha, pero<br>¿cuál es un proyecto más para el montón?<br>¡Vamos, sé un amigo!"
