section,group,id,text
Event1,0,11_voice_NPC_5011_100,うむ、よい経験が積めたようじゃの。<br>報告を見ずともわかるほどじゃ。
Event1,0,text02,何事も、触れてみなければわからぬ。<br>経験を積むとはそういうことじゃ。<br>そしてそれは、決して無駄にはならん。
Event1,0,text03,それでは、また次の訓練を<br>用意して、待
Event1,1,11_voice_NPC_5011_100,"Mmm, sí.<br>Parece que has adquirido mucha experiencia.<br>Puedo ver eso sin mirar el informe."
Event1,1,text02,"significa ganar experiencia,<br>y ese esfuerzo nunca es una pérdida de tiempo."
Event1,1,text03,"Bueno, entonces... estaré esperando aquí con tu<br>próximo ejercicio de entrenamiento."
