section,group,id,text
Event1,0,11_voice_NPC_5059_101,相手がどんなダーカーだろうと<br>今のあんたなら、問題なく<br>塵芥に帰する事ができるでしょ。
Event1,0,text02,新種だろうが関係ない。<br>所詮はアタシたちが殲滅させる対象に<br>過ぎないし、殲滅されるだけの存在。
Event1,0,text03,さあ、いつもみたいに掃除してきてよ。<br>宇宙に巣食う、寄生虫どもをさ
Event1,1,11_voice_NPC_5059_101,"En este punto, estoy seguro de que podrias eliminar cualquier variedad de falspawns --sin importar su tamaйo--, con la basura a donde pertenece."
Event1,1,text02,"Ya sea una especie nueva o una molestia conocida,<br>existen sólo como objetivos que debemos erradicar."
Event1,1,text03,"Ahora, una vez más: adelante y elimine los<br>parásitos que se alimentan de nuestro universo."
