section,group,id,text
Event1,0,text01,おつかれさん。<br>徹底的に殺ってきたみたいだね。
Event1,0,11_voice_NPC_5059_100,これで少しは静かになっただろ。<br>ま、すぐに増えるんだろうけど。
Event1,0,text03,ダーカーを根絶しないかぎり<br>静かになんてならないしね。
Event1,0,text04,とりあえず報酬を渡しとくよ。<br>機会があったらまたよ
Event1,1,text01,Trabajo bueno.<br>Parece que los limpiaste muy bien.
Event1,1,11_voice_NPC_5059_100,Probablemente las cosas se calmarán un poco ahora...<br>Aunque estoy seguro de que aparecerán más en poco tiempo.
Event1,1,text03,No tendremos paz ni tranquilidad hasta que todos los<br>Falspawn sean completamente erradicados.
Event1,1,text04,"De todos modos, aquí tienes tu recompensa.<br>Vuelve cuando tengas la oportunidad."
