section,group,id,text
Event1,0,11_voice_NPC_5050_101,任務達成の報告を承りました。<br>結果も申し分ありませんので<br>殲滅作戦での遊撃行動を許可します。
Event1,0,text02,殲滅作戦を展開している<br>隔離領域の維持には<br>時間的な制約があります。
Event1,0,text03,ライドロイドを乗りこなすことで<br>素早くエネミーの出現場所に急行し<br>殲滅する必要があります。
Event1,0,text04,他のアークスと協力して<br>活躍されることを期待し
Event1,1,11_voice_NPC_5050_101,"He recibido un informe sobre su<br>misión exitosa. no veo nada<br>incorrecto en sus resultados, por lo que su permiso de incursión<br>debería llegar rápidamente."
Event1,1,text02,Sólo podemos aislar el área de ataque por un corto tiempo.<br>período de tiempo.
Event1,1,text03,Necesitas tomar el Ridroid para llegar al<br>enemigo rápidamente y eliminarlo.
Event1,1,text04,Espero verlo cooperar con<br>otros agentes de ARKS.
