section,group,id,text
Event1,0,text01,……遊園地でいいこと思いついたの！<br>夢いっぱいのショーをイベントでやったら<br>きっと盛り上がると思うんだ！
Event1,0,text02,聞いた話なんだけど<br>気持ちが引き込まれるようなショーには<br>大きな動きをつけるといいんだって！
Event1,0,11_voice_NPC_5097_104,どんなのがいいのかな？<br>お芝居みたいなポーズとか<br>腕を振り回す動作とか……？
Event1,0,text04,参考になりそうなものがほしいから<br>手伝ってくれないかなっ！　お
Event1,1,text01,Estaba caminando por la diversión<br>parque cuando se me ocurrió una idea! Apuesto a que la gente<br>Me encantaría un espectáculo emocionante que capture<br>¡Su imaginación!
Event1,1,text02,"Y por lo que he oído, la mejor manera de<br>¡Tocar la fibra sensible del público es movimiento!"
Event1,1,11_voice_NPC_5097_104,¿Pero qué CLASES de movimiento? ¿Poses dramáticas?<br>¿Artistas moviendo los brazos?
Event1,1,text04,"Si estás dispuesto a ayudar, realmente me vendría bien.<br>algún material de referencia. ¿Bonita por favor?"
