section,group,id,text
Event1,0,text01,ベガス・イリュージアという<br>エネミーは<br>それ自体がかなり規格外な存在だ。
Event1,0,text02,通常の個体は、彩色に乏しい印象なのだが<br>かなり鮮やかな色合いの<br>個体が確認されたのだという。
Event1,0,11_voice_NPC_5053_104,幻創種の通常種と希少種の差異を<br>教えてくれる貴重な存在かもしれん。
Event1,0,text04,このエネミーの<br>さらなる情報提供を<br>お願いできないだ
Event1,1,text01,"El Vegas Illusia es un enemigo que desafía<br>explicación, comprensión,<br>y todo buen gusto."
Event1,1,text02,"Si bien los típicos son bastante monótonos, se han reportado algunas<br>variantes de colores brillantes."
Event1,1,11_voice_NPC_5053_104,Quizás estos coloridos colosos podrían ayudar a<br>a ilustrar la diferencia entre los fantasmas normales de<br>y las subespecies raras.
Event1,1,text04,"Por casualidad, ¿podrias conseguirme mas datos sobre estos extraйos fantasmas?"
