section,group,id,text
Event1,0,11_voice_NPC_5057_101,問題なさそうね。<br>それでは今回の特訓はクリア。<br>完了としましょう。
Event1,0,text02,初心を忘れずに<br>研鑽を重ね続けていれば<br>貴方の実力は確実に増していくわ。
Event1,0,text03,さらなる先へ至りたいのであれば<br>さらなる努力と特訓が必要よ。<br>それじゃあね。
Event1,1,11_voice_NPC_5057_101,Parece que eso no te causó ningún problema.<br>Eso concluye este campo de entrenamiento. Veamos<br>esta serie hasta el final.
Event1,1,text02,"Si analizas tus humildes orígenes <br>, seguramente te volverás cada vez más fuerte."
Event1,1,text03,Necesitaré entrenar más duro y<br>asistir a más campos de entrenamiento. Hasta entonces.
