section,group,id,text
Event1,0,11_voice_NPC_5050_104,……はい、以上が規定文言です。<br>読みましたか、理解できましたか？<br>簡単に言えば、こういうことです。
Event1,0,text02,『指定したクエストを<br>　クリアしてくれば<br>　新しいエリアへの探索許可をあげる』
Event1,0,text03,それ以外の条件はありません。<br>それ以上のフォローもないです。<br>だから、貴方の実力次第。
Event1,0,text04,受ける受けないは貴方の自由です。<br>私はただここで、愚直に実力の<br>判断を行うの
Event1,1,11_voice_NPC_5050_104,Gran trabajo. Vi cada minuto de tu examen y no vi nada que me preocupara.
Event1,1,text02,"Mucha suerte ahi fuera. Recuerda, estare mirando, asi que muestrame de que estas hecho."
Event1,1,text03,"No hay condiciones adicionales. No hay seguimiento adicional. Por eso, depende de tus habilidades."
Event1,1,text04,Es tu decision si quieres recibirlo o no. Solo estoy aqui para evaluar tus habilidades de manera directa.
