section,group,id,text
Event1,0,11_voice_NPC_5052_104,おたくのバトルセンスに頼りっぱなしで<br>わりーんだけどよ……
Event1,0,text02,今回は海岸にいるオルグブランって<br>海王種な。
Event1,0,text03,すんげー強いって訳じゃねーんだけどよ<br>あいつ、オールレンジで仕掛けてくる<br>もんだから、やりづれーっつうか。
Event1,0,text04,おたくなら難なくやれる相手だろうから<br>オレの参考になるような攻略法、<br>いっちょ頼むわ
Event1,1,11_voice_NPC_5052_104,"Escucha, lamento depender siempre de ti para<br>cosas como esta."
Event1,1,text02,"Pero está esta Oceanid en la costa.<br>Se llama Orgbran, ¿ves?"
Event1,1,text03,"No quiero que te den una paliza<br>solo por mi, asi que ten cuidado<br>ahi fuera, ¿entiendes?"
Event1,1,text04,¿Estás allí y<br>me muestra cómo lidiar con<br>con ellos? ¡Gracias amigo!
