section,group,id,text
Event1,0,11_voice_NPC_5051_104,……本当にいいの？<br>頼んでおいて言うのも何だけど<br>かなり無理なお願いだし……
Event1,0,text02,でも、これまでいつも<br>あなたはやってくれたものね！
Event1,0,text03,今回も信じてるわ。<br>苦しいときは、プリップリの<br>おいしいお肉を思い出して
Event1,1,11_voice_NPC_5051_104,"¿Estás seguro de esto? Quiero decir, lo sé<br>Fui yo quien preguntó en primer lugar, pero..."
Event1,1,text02,"Bueno, nunca has tenido ningún problema antes.<br>aunque, ¿verdad?"
Event1,1,text03,"Estoy seguro de que tú también puedes manejar esto. Y si tu<br>te encuentras pasando por un momento difícil, sólo piensa en<br>¡esa carne rica y jugosa que te está esperando!"
