section,group,id,text
Event1,0,text01,準備も大詰めにさしかかってるのに<br>大事件が発生したの！
Event1,0,11_voice_NPC_5099_104,噂によると鎧を着たエネミーらしくて<br>しかもとんでもなく強いんだって！
Event1,0,text03,みんな、すごく苦戦しているみたい。<br>イベントのためにも、<br>そいつをやっつけてきて
Event1,1,text01,Estábamos terminando nuestra configuración cuando<br>¡sucedió algo GRANDE!
Event1,1,11_voice_NPC_5099_104,¡La gente me dice que un<br>enemigo con armadura realmente fuerte acaba de aparecer<br>de la nada!
Event1,1,text03,A todos les está costando luchar contra ello...<br>¿Podrías intervenir y sacarlo para que todos podamos<br>disfrutar de nuestro evento en paz?
