section,group,id,text
Event1,0,text01,先生、自分……驚愕しています！<br>ギグル・グンネガムの大きさにではなく<br>先生の動きの鋭さに、です！
Event1,0,11_voice_NPC_5063_101,あっという間に部位破壊をして<br>倒してしまうなんて、流石です！
Event1,0,text03,ダウンを奪ってから、頭を狙う！<br>戦い方をしかと学びました！
Event1,0,text04,先生にご教授いただいた戦い方！<br>自分、絶対にモノにしてみせます！<br>ご指導ありがとうござい
Event1,1,text01,"¡Guau, enseйa! Estoy... ¡atonito! No, no<br>por lo grande que era Gigur Gunnegam,<br>¡sino por lo precisos que eran tus movimientos!"
Event1,1,11_voice_NPC_5063_101,Aplastaste esa pierna en un instante y<br>LA ANIQUILASTE en ese mismo momento. <br>¡Pero eso es normal para ti!
Event1,1,text03,¡Primero lo derribas y luego atacas la cabeza!<br>¡Ahora sé exactamente cómo combatirlo!
Event1,1,text04,"Gracias por mostrarme tus caminos, ¡enseña!<br>¡Definitivamente le daré un buen uso!"
