section,group,id,text
Event1,0,text01,知ってるエネミーだと思ったら<br>知らない攻撃が飛んでくるとか<br>マジで勘弁してほしいよな……
Event1,0,11_voice_NPC_5052_103,見た目が近いんだったら<br>同じ攻撃でいいと思わね？<br>個性を大事にする必要はねえよ！
Event1,0,text03,でも、おたくならそれでも<br>うまくやれるってオレは思うワケよ！<br>ってことで、攻略法を頼むぜ！
Event1,0,text04,大丈夫！　おたくの動きはしっかり<br>モニターさせてもらって<br>どんな動きでも見逃
Event1,1,text01,No he realizado algún ataque. Yo<br>no lo sé... ¿Un chico no puede tomar un descanso?
Event1,1,11_voice_NPC_5052_103,"Si un enemigo se parece a otro enemigo, ambos<br>deberían usar los mismos ataques, ¿verdad?<br>¡La individualidad está sobrevalorada!"
Event1,1,text03,"Sin embargo, tengo la sensación de que puedes lidiar con cualquier<br>bolas curvas que puedan lanzarte en tu camino.<br>¡Muéstrame tus estrategias!"
Event1,1,text04,"¡No te preocupes, mantendré mis ojos en el monitor<br>y me aseguraré de no perderme nada!"
