section,group,id,text
Event1,0,11_voice_NPC_5062_101,先輩、ありがとうございます。<br>新しいタイプの侵食核が<br>あんな風になってるなんて……
Event1,0,text02,噂で聞くだけじゃなくて<br>きちんと確認できて、よかったです。<br>注意を促すこともできますし。
Event1,0,text03,先輩が協力してくれたからこそ、です。<br>本当にありがとうござ
Event1,1,11_voice_NPC_5062_101,Gracias por su ayuda. El efecto de estos<br>nuevos núcleos corruptos ciertamente fue un shock.
Event1,1,text02,Pero me alegro de tener confirmación y no sólo<br>rumores. Podemos advertir a la gente que esté en guardia.
Event1,1,text03,Y no tendríamos nada de eso sin ti.<br>Su ayuda ha sido muy apreciada.
