section,group,id,text
Event1,0,11_voice_NPC_5052_101,おつかれさん！<br>やっぱりおたくの動きは冴えてんな。
Event1,0,text02,おたくの戦い方をみて、大分参考に<br>なったぜ。　あいつ、意外と攻撃が<br>直線的で単調なのな。
Event1,0,text03,パターンさえつかんじまえば<br>こっちのもんだわ。<br>これでぜってー負けねーわ！
Event1,0,text04,いいお手本だったぜ。<br>サンキュな！
Event1,1,11_voice_NPC_5052_101,¡Dulces movimientos! Nunca pierdes el ritmo.
Event1,1,text02,Noto lo sencillas y<br>repetitivas que son esas cosas.
Event1,1,text03,"Una vez que encuentras el patrón, no son tan malos,<br>¿eh? ¡Eso facilita las cosas!"
Event1,1,text04,"¡Gracias por mostrarme los entresijos!<br>¡Te volveré a llamar alguna vez, amigo!"
