section,group,id,text
Event1,0,text01,採掘基地でさんざん苦しめられた<br>あのダーカーを真似た幻創種もいるな。
Event1,0,text02,元のエネミーと同じように<br>わらわらわきだして<br>個体ごとの生命力も高い。
Event1,0,11_voice_NPC_5059_100,各種武器の使用に自爆……<br>さらには光の刃の遠距離攻撃まで。<br>うっとうしさは本物以上だね。
Event1,0,text04,あんたも多彩な攻撃で<br>あの趣味の悪いニセモノどもを<br>一網打尽
Event1,1,text01,Hay una imitación fantasmal del Falspawn.<br>que nos atormentaba en la base minera.
Event1,1,text02,La imitación es tan repugnante y odiosa.<br>Duradero como el original.
Event1,1,11_voice_NPC_5059_100,"Y, sin embargo, la forma en que utilizan diferentes armas,<br>Autodestrucción y ataque desde lejos con luz.<br>Las cuchillas los hacen aún más viles."
Event1,1,text04,Usa todo lo que esté a tu disposición para tomar esos<br>imitaciones repugnantes.
