section,group,id,text
Event1,0,text01,よし、こんなものだな。<br>見慣れたお前の活躍とはいえ<br>今回も大したものだったぞ。
Event1,0,11_voice_NPC_5020_101,この興奮があるから、お前と一緒の<br>探索はやめられないというものだ。
Event1,0,text03,汗で体が冷える前に<br>そろそろ帰還するとしよう。
Event1,1,text01,"Eso deberia bastar. Puede que pienses que me habria acostumbrado a verte en accion por ahora, pero nunca me decepcionas"
Event1,1,11_voice_NPC_5020_101,"Eso es lo que me tiene enganchado, de verdad."
Event1,1,text03,Regresemos antes de que el sudor<br>de un buen día de trabajo nos dé escalofríos.
