section,group,id,text
Event1,0,text01,無理なお願いを聞いてもらって<br>ありがとうございます！
Event1,0,11_voice_NPC_5055_104,アークスの人って、学術研究には<br>理解がないだろうと思ってました。<br>でも……
Event1,0,text03,<%me>さんに<br>会って、考えが変わりました！<br>今回もよろしくお
Event1,1,text01,Muchas gracias por aceptar ayudar. Sé<br>que esto no será exactamente conveniente.
Event1,1,11_voice_NPC_5055_104,No pensé que los agentes de ARKS realmente entenderían<br>por qué es importante la investigación científica.
Event1,1,text03,"¡Pero eso fue antes de conocerte,<br><%me>!<br>¡Me alegro mucho de contar con tu ayuda!"
