section,group,id,text
Event1,0,11_voice_NPC_5018_100,やー、頑張ってるかい？<br>タイムアタックで、１つのエリアを<br>走破して満足しちゃってないかな？
Event1,0,text02,集中力を高めて<br>複数のエリアを一気に走破するのも<br>スキルアップには良いと思うよー。
Event1,0,text03,というわけで、少し本気を出して<br>好きなタイムアタックを３回クリア。<br>挑戦してみるのはどうかな？
Event1,0,text04,訓練の仕方は、人それぞれだと思うから<br>挑戦するかどうかは<br>きみ自身に任せるけ
Event1,1,11_voice_NPC_5018_100,"¡Hola! ¿Cómo te va, socio?<br>No estás satisfecho con sólo apresurarte<br>un área en un Time Attack, ¿verdad?"
Event1,1,text02,"Concentrándote y corriendo a través de un<br>Las áreas de Buncha serían una buena manera de perfeccionarlas.<br>habilidades, creo."
Event1,1,text03,"Dicho esto, ¿por qué no completas ninguna?<br>¿Tirar ATK tres veces solo para calentar? Estás<br>Lo intentaré con este tipo, ¿no?"
Event1,1,text04,Sé que todo el mundo aborda el entrenamiento de forma diferente.<br>Así que depende de ti si quieres ir o no.<br>por ello.
