section,group,id,text
Event1,0,text01,お見事ね。結果も文句なしよ。<br>今回の特訓も問題なくクリア、ね。
Event1,0,11_voice_NPC_5057_101,これほどまでに教え甲斐のあった<br>アークスは貴方が初めてかもしれない。<br>礼を言わせてもらうわ。
Event1,0,text03,一つ一つの動きの精度が段違い。<br>それは、長い研鑽でしか得られない<br>時間と努力の為せる技だから。
Event1,0,text04,貴方にはさらに新しい世界を<br>見せてあげたい……<br>また会え
Event1,1,text01,"Maravilloso. De hecho, resultados muy satisfactorios.<br>Parece que una vez más<br>completó el campo de entrenamiento sin problemas."
Event1,1,11_voice_NPC_5057_101,Quizás seas el primer estudiante que he tenido que es<br>tan rápido en asimilación. Te felicito.
Event1,1,text03,dly el fruto de todo<br>el tiempo y esfuerzo que pones en entrenar.
Event1,1,text04,Quédate conmigo y te revelaré un<br>mundo incalculable de dominio marcial.<br>Espero verte de nuevo.
