section,group,id,text
Event1,0,text01,いつもありがとうございます！<br><%me>さん。
Event1,0,text02,白ノ領域で確認されている、空中に<br>文字のようなものが浮かび上がるという<br>不思議な現象があるんですが……
Event1,0,11_voice_NPC_5055_104,これと似たような現象が<br>黒ノ領域でも目撃されてまして<br>その調査をお願いしたいんです。
Event1,0,text04,詳しい情報がほとんどなくて<br>大変だとは思いますが<br>引き受けてはもらえない
Event1,1,text01,"¡Gracias como siempre,<br><%me>!"
Event1,1,text02,Hay un extraño fenómeno que se ha observado<br>en la provincia de Daybreak donde las letras<br>parecen flotar en el aire.
Event1,1,11_voice_NPC_5055_104,Recientemente<br>fue testigo de un fenómeno similar en Nightfall Province y me gustaría que<br>lo investigue.
Event1,1,text04,"Con tanta escasez de información, estoy seguro de que<br>será difícil, pero ¿aceptarás ayudarme<br>a pesar de eso?"
