section,group,id,text
Event1,0,11_voice_NPC_5018_100,やー、頑張ってるかい？<br>タイムアタックで、１つのエリアを<br>走破して満足しちゃってないかな？
Event1,0,text02,集中力を高めて<br>複数のエリアを一気に走破するのも<br>スキルアップには良いと思うよー。
Event1,0,text03,というわけで、まずは肩慣らしがてら<br>好きなタイムアタックを１回クリア。<br>挑戦してみるのはどうかな？
Event1,0,text04,訓練の仕方は、人それぞれだと思うから<br>挑戦するかどうかは<br>きみ自身に任せるけどね
Event1,1,11_voice_NPC_5018_100,"¡Hola! ¿Como te va, socio? No estas satisfecho con correr solo por un area en un Time Attack, ¿verdad?"
Event1,1,text02,Creo que concentrarse y correr a traves de areas seria una buena manera de perfeccionar esas habilidades.
Event1,1,text03,"Eso siendo dicho, ¿por que no completas algun Time ATK tres veces para calentar? Vas a intentarlo con este amigo, , ¿no?"
Event1,1,text04,"Se que todo el mundo aborda el entrenamiento de manera diferente, asi que depende de ti si quieres o no hacerlo ."
