section,group,id,text
Event1,0,11_voice_NPC_5018_101,おーおーおーおー、見事見事。<br>それほど苦もなくやってのけるとは<br>お兄さん驚きだよ。
Event1,0,text02,間違いなくきみの実力は本物だね。<br>喜ばしいことだよ、うんうん。
Event1,0,text03,きみの力があれば、アークスはもちろん<br>世界は安泰だって気がしてくるね。
Event1,0,text04,私も頑張っていかないとねー。
Event1,1,11_voice_NPC_5018_101,"¡Bien, bien, bien! ¡Mira! Coloréame<br>impresionado. No parecía tan difícil en absoluto."
Event1,1,text02,"Definitivamente eres el verdadero negocio, ¿no?<br>Esa es una gran noticia, seguro que lo es."
Event1,1,text03,Contigo en ARKS y en todos estos<br>mundos que visitamos deberíamos encontrar la paz.
Event1,1,text04,Supongo que será mejor que yo también haga mi parte.
