section,group,id,text
Event1,0,text01,大型ダーカーの幻創種版。<br>大きさに比例して<br>うっとうしさも倍増だね。
Event1,0,11_voice_NPC_5059_100,そのなかで、デコル・マリューズは<br>動きのトリッキーさのわりに<br>たいした相手じゃない。
Event1,0,text03,こいつをあんたの力で<br>ひねりつぶしてや
Event1,1,text01,Hay una versión fantasma de un Falspawn particularmente<br>grande que es tan irritante<br>como el original.
Event1,1,11_voice_NPC_5059_100,"Dicho esto, a pesar de todos sus movimientos complicados, el<br>Dekor Maryuz no es una gran amenaza."
Event1,1,text03,Ve a destruir algunos por mí.
