section,group,id,text
Event1,0,text01,おーおーおーおー、見事見事。<br>これまでにないタイムに<br>お兄さん驚きだよ。
Event1,0,11_voice_NPC_5018_101,やっぱり、きみの実力は本物だねー。<br>アークスにとってうれしいことだよ。<br>うんうん。
Event1,0,text03,これからも、その力で<br>アークスのため、世界のために<br>がんばってほしいなあ。
Event1,0,text04,私もうかうかして
Event1,1,text01,"¡Bien, bien, bien! ¡Mira! Este tipo nunca<br>ha visto a nadie moverse tan rápido como un relámpago como tú<br>hace un momento, compañero."
Event1,1,11_voice_NPC_5018_101,"Parece que eres el verdadero negocio después de todo.<br>Justo el tipo de ARKS que debería estar feliz de tener a<br>cerca, déjame decirte."
Event1,1,text03,"Espero que uses esa habilidad tuya<br>para ayudar a ARKS, salvar el mundo, todo eso,<br>¿sabes?"
Event1,1,text04,Sera mejor asegurarse de seguir asi tambien.
