section,group,id,text
Event1,0,text01,お疲れ様。<br>なかなかいい動きをしていたぞ。
Event1,0,11_voice_NPC_5020_100,やはり、同じハンター同士<br>前に出て戦うのは<br>気兼ねしなくていい。
Event1,0,text03,まあ、フォースなどの<br>後衛を守りながらの<br>立回りも重要ではあるがな。
Event1,0,text04,次の探索も楽しみだな。<br>また、よろしく頼む
Event1,1,text01,Trabajo bueno. Esa fue una buena pelea.
Event1,1,11_voice_NPC_5020_100,"Qué emoción trabajar con otro Cazador,<br>no necesita dudar para lanzarse a la refriega."
Event1,1,text03,"Bueno, supongo que debes asegurarte de<br>defender tu retaguardia, tus Fuerzas,<br>y lo que sea."
Event1,1,text04,Espero con ansias nuestra próxima misión.<br>Hasta pronto.
