section,group,id,text
Event1,0,text01,センパイ、今回は浮遊大陸にいる<br>龍族のバリドランで頼む。<br>ちょっと獣っぽい感じのやつな。
Event1,0,11_voice_NPC_5091_104,そんなに脅威じゃないって？<br>そうかもしれないけど……<br>何ていうか、相性が悪いんだよ。
Event1,0,text03,こっちの間合いに近づく前に<br>遠距離攻撃をされるし、群れている。<br>効率良く倒す方法が、分からない。
Event1,0,text04,センパイ、いつも頼んで悪いけど<br>ジャストアタックでの仕留め方ってのを<br>おれに見せ
Event1,1,text01,"Hola jefe, el próximo paso nos vamos al Flotante.<br>Continente para hacer frente a algunos de esos baridranos<br>Draconianos. Ya sabes, los verdaderos tipos bestiales."
Event1,1,11_voice_NPC_5091_104,"Seguro.<br>Probablemente no sean gran cosa para ti, pero,<br>Bueno, no son los enemigos más fáciles para mí."
Event1,1,text03,"Siempre me golpean con un ataque a distancia.<br>antes de que me coloque en posición, entonces simplemente<br>pululan a mi alrededor, ¿sabes? No<br>saber cómo defenderse de ellos."
Event1,1,text04,"Sé que probablemente estás harto de que te pregunte<br>ahora, pero esperaba que pudieras mostrarme<br>cómo rematarlos con un ataque perfecto."
