section,group,id,text
Event1,0,text01,いつもいつもごめんなさいね。<br>こういう事はあなたにしか頼めなくて。
Event1,0,11_voice_NPC_5051_104,新作メニューのために<br>丁度いい器と、一緒に使うための<br>ピックを探していたんだけど……
Event1,0,text03,浮上施設のネプト・キャサドーラと<br>レオマドゥラードがそれぞれ<br>丁度良さそうなの！
Event1,0,text04,無茶なお願いだとはわかってるけど<br>どうかよろし
Event1,1,text01,"Lamento muchísimo seguir haciéndote esto, pero<br>eres el único a quien puedo pedirle que haga esto."
Event1,1,11_voice_NPC_5051_104,"le, fantástico palillo de dientes...<br>para usar en mi próxima creación culinaria."
Event1,1,text03,¡Y estoy bastante seguro de que las cosas de Nept Casadohra<br>y Leomaduraad en la Instalación Flotante<br>funcionarían espléndidamente!
Event1,1,text04,"Sé que es pedir mucho, pero... no me dejes a<br>colgado, ¿vale?"
