section,group,id,text
Event1,0,11_voice_NPC_5050_104,こちらは、貴方の能力を<br>さらに高めるための<br>適性評価試験になります。
Event1,0,text02,指定された「称号」を取得し<br>私に達成を報告してください。
Event1,0,text03,称号取得のための条件は<br>＋１０の★１２以上のユニットを<br>リア、アーム、レッグに装備すること。
Event1,0,text04,難しい課題ですが<br>今の貴方には乗り越えられるでしょう。<br>報告をお待ち
Event1,1,11_voice_NPC_5050_104,Esta es una prueba de evaluación para aumentar su límite de nivel <br>.
Event1,1,text02,Este titulo se obtiene al alcanzar el nivel 75 con<br>dos clases cualesquiera.
Event1,1,text03,"Para obtener este título, debes tener +10 12★<br>unidades equipadas en tu espalda, brazos y piernas."
Event1,1,text04,"No es una tarea fácil, pero estoy seguro de que estás<br>más que preparado para ello. Estaré esperando a<br>la buena palabra."
