section,group,id,text
Event1,0,text01,<%me>さん！<br>何か使えそうなものが<br>あったかしら？
Event1,0,text02,あら……これは？<br>何かのエンジンのようだけど……
Event1,0,11_voice_NPC_5051_104,このファンのようなもので<br>空気を取り込んで、圧縮して反対側から<br>高熱を噴射する……のかしら？
Event1,0,text04,新しい調理器具に<br>使えるかもしれないわね。<br>さっそく挑戦
Event1,1,text01,Me encantaria que pudieras conseguir de algunos de ellos para mi. ¿Estarias dispuesto a hacerlo?
Event1,1,text02,¿Qué es esto?<br>Parece una especie de motor...
Event1,1,11_voice_NPC_5051_104,"Parece que aspira aire con esta parte<br>que parece un ventilador, lo comprime y luego<br>libera un chorro de calor."
Event1,1,text04,"Sí, probablemente pueda usar este<br>como nuevo utensilio de cocina.<br>¡Lo intentaré ahora mismo!"
