section,group,id,text
CharaName,0,name01,ゼノ
CharaName,1,name01,Zenón
Event1,0,11_voice_NPC_5001_100,さーて、はじめるとするか。<br>もうお前さんも慣れてきてるだろうし<br>余計な前置きとかはいらないよな？
Event1,0,text02,ヘタにエコーを付き合わせるわけにも<br>いかないから、お前さんがいてくれて<br>助かったぜ、ホント。
Event1,0,text03,んじゃ、さくさくっと進んでいこうぜ。
Event1,1,11_voice_NPC_5001_100,"Bien, comencemos. Estoy seguro de que ya estás acostumbrado<br>a esto y no necesitas que te explique<br>nada, ¿verdad?"
Event1,1,text02,"No podía simplemente pedirle a Echo que viniera conmigo, así que<br>realmente me estás salvando el pellejo al unirte a mí,<br>ya sabes."
Event1,1,text03,"De todos modos, pongámonos en marcha."
