section,group,id,text
Event1,0,11_voice_NPC_5054_101,よろしい、特訓は合格だ。<br>……どうした、拍子抜けか？<br>もっと難易度が高いと思ったか？
Event1,0,text02,この難易度を標準と思えるように<br>なったのならば、それはまさしく<br>君自身の成長だ。
Event1,0,text03,日々のたゆまぬ研鑽を忘れていない<br>からこその思いともいえる。<br>これからも、頑張りたまえ！
Event1,1,11_voice_NPC_5054_101,Eso bastará. Pasaste. ¿Qué ocurre? <br>¿Esperabas un desafío mayor?
Event1,1,text02,Tómalo como una señal de tu progreso. Deberías<br>considerarlo como una bendición que seas tan capaz.
Event1,1,text03,"Se necesitan largos días de entrenamiento dedicado para llegar a<br>donde estás. ¡Sigue así, operativo!"
