section,group,id,text
Event1,0,11_voice_NPC_5532_103,真犯人が身近に潜んでいたなんて……<br>というか、プレゼントなら本物の私に<br>くださいよ！　何なんですか！
Event1,0,11_voice_NPC_5457_100,う、うん……びっくりしたけど<br>これで謎が解けたね。せっかくの<br>ハロウィン、最後まで楽しもう！
Event1,0,text03,そうそう、そうでした。<br>ハロウィンイベント会場周辺の<br>エネミー撃退任務が出てましたね。
Event1,0,11_voice_NPC_5532_101,よーし、事件も解決したことですし！<br>ハロウィンの魔女・マジカル★シエラが<br>悪い子たちを、コテンパンにします☆
Event1,1,11_voice_NPC_5532_103,"nuestras narices... En serio<br>¿¡solo un ""regalo"" para mi verdadero yo!?"
Event1,1,11_voice_NPC_5457_100,"O-Oye, mira el lado bueno. Al menos<br>ahora lo sabemos. Así que disfrutemos el resto<br>de Halloween, ¿de acuerdo?"
Event1,1,text03,Prepárate para eliminar<br>enemigos cerca del lugar del evento de Halloween.
Event1,1,11_voice_NPC_5532_101,¡Es hora de que Spooky★Xiera<br>les muestre a algunos malos traviesos qué es qué!
