section,group,id,text
Event1,0,text01,先生、勉強になりました。<br>先生の動きをしっかり自分で<br>再現できるようイメージを固めます。
Event1,0,11_voice_NPC_5063_101,敵のコアばかり見ていないで<br>全体の動きを追うことを<br>忘れないようにします！
Event1,0,text03,それだけで先生に追いつけるとは<br>思ってないですけど、何かこう<br>ひらめくモノが見えました！
Event1,0,text04,先生、ご指導のほど<br>ありがとうございました！<br>またよろしくお願いいた
Event1,1,text01,"¡Aprendí mucho, Enseña! ¡He grabado tus<br>movimientos en mi cerebro para poder replicarlos!"
Event1,1,11_voice_NPC_5063_101,"Me aseguraré y recordaré seguir los movimientos del<br>enemigo en su conjunto, ¡no solo centrarme en<br>en el núcleo!"
Event1,1,text03,"de repente mientras<br>te mira, ¡así que seguiré con eso!"
Event1,1,text04,¡Muchas gracias por tomarte el tiempo de enseñarme a <br>! ¡Siempre aprendo un montón!
