section,group,id,text
Event1,0,11_voice_NPC_5050_101,報告、承りました。<br>それでは達成の報酬として<br>フォトンクリスタルをお渡しします。
Event1,0,text02,本件は、既定時間を過ぎれば<br>再度受注していただくことが可能です。
Event1,0,text03,フォトンクリスタルは非常に有用な<br>ものです。それゆえ、無理をおして<br>挑戦してしまう者も多い。
Event1,0,text04,その身は一つであることを<br>常にお忘れないよう。<br>無理はなさらないようにお
Event1,1,11_voice_NPC_5050_101,"Ahora que he presentado un informe sobre tu trabajo, te daré<br>un cristal de fotones que ganaste."
Event1,1,text02,Puede aceptar este pedido nuevamente después de que haya transcurrido un<br>período de tiempo determinado.
Event1,1,text03,Los cristales de fotones son extremadamente útiles. Por eso<br>muchos se esfuerzan más allá de sus<br>medios para obtenerlos.
Event1,1,text04,"Si quieres proceder con la obtencion de este permiso es tu eleccion. Si lo haces, sera un simple juicio de tus habilidades."
