section,group,id,text
Event1,0,text01,……ああ、おつかれさん。<br>しっかり片付けたみたいだね。
Event1,0,11_voice_NPC_5059_104,ウジャウジャと群れてたけど<br>きれいさっぱり消え失せたね。
Event1,0,text03,基地もきれいになってよかっただろ。<br>ま、つかの間の平和ってやつだね。
Event1,0,text04,直ぐに掃除が必要になるとは思うけど<br>その時は宜しく頼んだよ
Event1,1,text01,"Ah, gracias. Parece que los limpiaste<br>bien."
Event1,1,11_voice_NPC_5059_104,Esos enjambres y enjambres ahora<br>han sido eliminados por completo.
Event1,1,text03,"Y supongo que es bueno que la base sea<br>más pura ahora. Aunque, en el mejor de los casos, es una paz fugaz."
Event1,1,text04,Estoy seguro de que será necesaria más limpieza antes de <br>. Espero que estés a la altura de la tarea.
