section,group,id,text
Event1,0,11_voice_NPC_5053_101,私は今、感激のあまり震えている……<br>わかるかね？　他では得がたい<br>貴重なデータを入手できたのだよ。
Event1,0,text02,キミの能力の高さには<br>ただただ恐れ入るばかりだ。
Event1,0,text03,この縁を大切にしていきたいと<br>思っている。どうかこれからも<br>私たちに力を貸してほしい。
Event1,0,text04,高額の謝礼を工面できないことが<br>実に心苦しいのだが<br>本当にありが
Event1,1,11_voice_NPC_5053_101,¡Este es un hallazgo asombroso! ¡Increíble!<br>En ningún otro lugar podríamos encontrar datos<br>como este.
Event1,1,text02,Otro trabajo impresionante. Gracias.
Event1,1,text03,Espero su continua cooperacion.
Event1,1,text04,"Lamento que no podamos ofrecerle una mejor recompensa <br>. Pero creanme, ¡estoy realmente feliz con tu trabajo!."
