section,group,id,text
Event1,0,text01,新たな希少種の報告が寄せられた。<br>かなりの強敵のようで<br>そもそも通常種のデータすら少ない。
Event1,0,11_voice_NPC_5053_105,希少種に関する内容に至っては<br>通常と異なる形状をしている<br>という程度の不確かなものだ。
Event1,0,text03,今回も、調査に協力しては<br>もらえないだろうか？<br>よろ
Event1,1,text01,"ble, y tampoco tengo muchos<br>datos sobre las especies comunes."
Event1,1,11_voice_NPC_5053_105,"cómo de lo común,<br>lo cual... ciertamente, no es mucho para continuar."
Event1,1,text03,"¿Puedo molestarte para que me eches una mano otra vez? <br>Cuento contigo, de verdad."
