section,group,id,text
Event1,0,text01,アンタ、こんなところでふらふらして<br>ヒマでもしてるの？　まあいいや。
Event1,0,text02,ヒマしていても、いなくても<br>他のへっぽこぴーの手伝いに<br>行ってきなさいよ！
Event1,0,11_voice_NPC_5056_102,へっぽこぴー卒業者は、すべからく<br>他のへっぽこぴーの援助をするべし。<br>それが決まりなんだからね！
Event1,0,text04,ほら、惑星リリーパの地下坑道とか<br>救助任務が多いって話だし<br>さくさくっと助けに行
Event1,1,text01,¿Te quedas sin aliento porque<br>inflo demasiados animales con globos?
Event1,1,text02,No me importa lo aburrido que estes: ¡ve a ayudar a<br>a otros payasos!
Event1,1,11_voice_NPC_5056_102,"Como payaso reformado, es justo<br>que brindes apoyo a los tontos que están debajo de <br>. ¡Ésas son las reglas!"
Event1,1,text04,"Hay muchas misiones de rescate en las Minas<br>de Lillipa, ¡así que comienza a rescatar!"
