section,group,id,text
Event1,0,11_voice_NPC_5057_101,お見事、素晴らしい結果ね。<br>今回の特訓も問題なくクリア、と。
Event1,0,text02,実力が伸びている感じが薄いかも<br>しれないけれど、他者から見れば<br>その変化は明らかよ。
Event1,0,text03,一つ一つの動きの精度が段違い。<br>それは、長い研鑽でしか得られない<br>時間と努力の為せる技だから。
Event1,0,text04,今の貴方に相応しい次の特訓<br>しっかり考えないといけないわね。<br>それじ
Event1,1,11_voice_NPC_5057_101,"Espléndido. De hecho, lo más impresionante. Has<br>superado esta ronda del campo de entrenamiento sin problemas."
Event1,1,text02,"progreso, pero para un observador externo <br>, su mejora es palpable."
Event1,1,text03,deja que estes en el aire.
Event1,1,text04,La próxima vez tendré que proponerte una sesión de campamento de entrenamiento<br>más adecuada. <br>Nos vemos por ahí.
