section,group,id,text
Event1,0,11_voice_NPC_5065_102,はーい、実力試しの定期試験<br>はじめますよー！<br>……そこ、ドン引きすんな。
Event1,0,text02,今回は前とはひと味違うわよー？<br>勝手もわかったし、ちょっとは<br>難しくしてみたんだからね。
Event1,0,text03,まー、あなたぐらいのアークスに<br>なれば、このぐらいだって<br>楽勝な感じでしょ？
Event1,0,text04,そういうことで、よろしくねー
Event1,1,11_voice_NPC_5065_102,"¡Está bien! ¡Es hora de tu<br>prueba de fuerza programada regularmente! ...Oye, deja de retroceder."
Event1,1,text02,Bandeja de bienvenida del juego
Event1,1,text03,"Pero tengo la sensación de que seguirá siendo una especie de<br>brisa para alguien de tu nivel de ARKS<br>operativo, ¿eh?"
Event1,1,text04,"Bueno, ¡ahí lo tienes! ¡Buena suerte!"
