section,group,id,text
Event1,0,11_voice_NPC_5062_106,ウィンディラという飛行する龍族。<br>火山洞窟では見かけませんでした。
Event1,0,text02,同じアムドゥスキアでも、生息してる<br>エネミーは全然ちがうんですね。
Event1,0,text03,今回は、そのウィンディラが<br>ブーストエネミーになったときの<br>様子を知りたいんです。
Event1,0,text04,わたし一人で収集したデータでは<br>不足していて……先輩、すみません。<br>ご協力をお願
Event1,1,11_voice_NPC_5062_106,Hay un draconiano volador llamado Wyndila.<br>No he observado su presencia en las<br>Cuevas Volcánicas.
Event1,1,text02,"En particular, se diferencia por completo de los otros<br>enemigos que habitan en Amduskia."
Event1,1,text03,Por eso me gustaría descubrir qué sucede<br>cuando Wyndila se convierte en un enemigo Berserk.
Event1,1,text04,"La informacion que he recopilado hasta ahora no es suficiente… ¡Seйor, disculpe!"
