section,group,id,text
Event1,0,11_voice_NPC_5020_104,どうした？　ファイターとして<br>さらなる高みを目指すのか？
Event1,0,text02,ならばオレにその力をみせてくれ。<br>そのために、相互評価のシステムが<br>存在するのだからな。
Event1,0,text03,試練は単純明快。<br>ファイターで<br>指定のエネミーを撃破する、だ。
Event1,0,text04,恐れず気負わず、お前の全力を<br>この試練にぶつけてこい。<br>吉報を待
Event1,1,11_voice_NPC_5020_104,¿Que qué? Estás dispuesto a convertirte en el<br>¿El luchador más feroz que puedes ser?
Event1,1,text02,"Bueno, veamos si tienes las agallas para retroceder.<br>eso arriba! De eso se trata este sistema de evaluación.<br>¡Porque en primer lugar!"
Event1,1,text03,Esta prueba es simple y llanamente. Todo lo que tienes que hacer<br>es derrotar a los enemigos adecuados como luchador.
Event1,1,text04,Manténgase concentrado. No dejes que nada te desanime<br>tu juego. Sólo da un paso adelante y derríbalos.<br>Entonces ven a hablar conmigo cuando hayas terminado.
