section,group,id,text
Event1,0,11_voice_NPC_5056_104,うーん、名前で呼ぶの<br>やっぱり慣れないわねぇ。<br>なーんか気持ち悪くない？
Event1,0,text02,ま、いいか。<br>それよりも依頼よ依頼。<br>アンタの活躍、見せてちょうだい！
Event1,0,text03,へっぽこぴーに逆戻りしないように<br>頑張って
Event1,1,11_voice_NPC_5056_104,"Sé lo que dije antes, pero TODAVÍA no estoy<br>acostumbrado a llamarte por tu nombre.<br>Se siente raro, ¿no? ¿No? ¿Sólo yo?"
Event1,1,text02,"Lo que sea, supongo. De todos modos, le haré un pedido <br>. ¡Déjame verte en tu mejor momento!"
Event1,1,text03,¡Intenta que no te atrapen y vuelvas a ser payaso!
