section,group,id,text
Event1,0,text01,おかえりなさい！<br>地球の平和が守られたってホント！？<br>貴方が頑張ってくれたおかげだね！
Event1,0,text02,いろいろ大変だったみたいだけど<br>これでひとまず安心できるね！
Event1,0,11_voice_NPC_5097_100,様子も落ち着いてきたことだし<br>夏のイベントの準備、再開しようかな！
Event1,0,text04,本当にありがとう！<br>また何かあったら、相談させてね
Event1,1,text01,¡Bienvenido de nuevo! ¿¡Es cierto que la paz<br>en la Tierra ha sido restaurada!? ¿En realidad? <br>¡Eso fuiste todo tú!
Event1,1,text02,"Parece que fueron tiempos difíciles, pero al menos<br>¡ahora la gente puede descansar tranquila por un tiempo!"
Event1,1,11_voice_NPC_5097_100,"Y ahora que las cosas están arregladas, ¡para mí volvemos a la configuración del evento de verano <br>!"
Event1,1,text04,¡Muchas gracias! ¡Quizás quieras quedarte en<br>en caso de que surja algo!
