section,group,id,text
Event1,0,11_voice_NPC_5151_100,戻ったようだな。<br>結果は全く問題ない。<br>本部への報告は、私からしておこう。
Event1,0,text02,バウンサーを極めるには<br>まだまだ道のりは長く険しい。<br>だがいつかは到達できるはずだ。
Event1,0,text03,これからも互いを高めあい<br>精進しあっていこう。<br>それ
Event1,1,11_voice_NPC_5151_100,"Has regresado ileso, por supuesto.<br>Informaré de esto a la sede."
Event1,1,text02,"El camino para dominar Bouncer Class es<br>difícil, pero creo plenamente que llegará allí<br>a su debido tiempo."
Event1,1,text03,"Que ambos sigamos dedicándonos a<br>mejorar. Siga adelante, ahora."
