section,group,id,text
Event1,0,text01,これ、これを探してたの！<br>本当にありがとう！
Event1,0,11_voice_NPC_5051_100,これで食材の下処理もできるし<br>貝殻を見ていると新しいメニューの<br>構想も浮かんできそうよ！
Event1,0,text03,本当に助かったわ！<br>またお願いすることもあると思うけど<br>その時はよろ
Event1,1,text01,¡Eso es exactamente lo que estaba buscando!<br>¡Muchas gracias!
Event1,1,11_voice_NPC_5051_100,¡Platos deliciosos mientras<br>contemplo esas conchas gloriosamente llamativas!
Event1,1,text03,"Muchas gracias por ayudar. Estoy seguro de que habra ocasiones en las que te necesitare de nuevo, asi que espero que vuelvas y me ayudes cada ahora y entonces."
