section,group,id,text
Event1,0,11_voice_NPC_5527_204,素晴らしい戦いでした。<br>やはり、私が仕えるべき相手は<br>あなたのほかにありません。
Event1,0,11_voice_NPC_5518_101,連れて行ってくれてありがとうなの。<br>あなたと一緒なら<br>どこにでも行ける気がするの……
Event1,0,text03,……これ、あげる。<br>ニレンカムイ-NT……<br>三人からのお礼……
Event1,0,11_voice_NPC_5519_206,あなたが使うなら……<br>このニレンカムイも幸せなはず。<br>いっぱい戦わせてあげて……ね。
Event1,1,11_voice_NPC_5527_204,Esa fue una pelea muy buena.<br>Realmente eres un líder digno de mi servicio.
Event1,1,11_voice_NPC_5518_101,"Gracias por acompañarme. De alguna manera,<br>Siento que puedo ir a cualquier parte contigo."
Event1,1,text03,Esto es para ti... El Twin Kamuy NT...<br>Una muestra de todo nuestro agradecimiento.
Event1,1,11_voice_NPC_5519_206,"Si me usas, puedo ser verdaderamente feliz.<br>Así que pelea mucho conmigo... ¿vale?"
