section,group,id,text
Event1,0,text01,……って、相棒！<br>「三人で任務に行こう」って<br>この三人なのかよ！
Event1,0,text02,まあまあ、せっかく相棒が<br>おれたちが仲良くなるキッカケを<br>くれたわけだし……行こうぜ！
Event1,0,text03,くっ、相棒を相棒って呼ばれると<br>なんだか複雑な気分になるけど……<br>わかったよ、行
Event1,1,text01,"¡Espera, amigo! Cuando dijiste<br>que estaríamos en un equipo de tres hombres, no pensé que<br>dos de nosotros estaríamos, bueno, ¡yo!"
Event1,1,text02,"Vamos, nuestro compañero nos ha dado una<br>oportunidad de crear vínculos. No podemos simplemente dejar que se desperdicie<br>ahora, ¿verdad?"
Event1,1,text03,"Oye, mi pareja no es tu pareja, ¿entendido?<br>Aunque está bien. Vamos."
