section,group,id,text
ra_012010,0,ra_012010_0010,事象は大いなる変化を見せた。<br>それこそは、貴方が成し遂げた<br>ひとつの成就の形だ。
ra_012010,0,ra_012010_0020,……たとえ、それが<br>望まぬ形であったとしても。
ra_012010,0,ra_012010_0030,……わたしとわたしたちは謝罪する。<br>識りながらも変えることのできない<br>この身であることを。
ra_012010,0,ra_012010_0040,かの事実は根幹を揺るがすもの。<br>跳梁する者たちは拡散を望まず<br>内に秘めようと暗躍するだろう。
ra_012010,0,ra_012010_0050,ゆえに、貴方の役儀こそが重大。<br>すべてを見、すべてを識った<br>貴方こそが、鍵となる。
ra_012010,0,ra_012010_0055,貴方が抱く経験で、世界は成る。<br>それは修正ではなく、累積に基づき<br>数多の知己と敵を産むだろう。
ra_012010,0,ra_012010_0060,それでも、貴方は己の意志が<br>向くままに進んでほしい。<br>誰も見いだせなかった、道へと。
ra_012010,0,ra_012010_0070,わたしとわたしたちは<br>その先を見、識るために<br>ここにいる。
ra_012010,0,ra_012010_0080,A.P.238/4/2
ra_012010,0,al_010090_0010,……今から四十年以上前<br>わたしと、ギーくんと、リーちゃんは<br>ダークファルス【巨躯】と戦った。
ra_012010,0,al_010090_0020,結果だけ見れば、アークスの勝ちだよ。<br>相当ボロボロにされちゃったけども<br>……アークスは、勝ったんだ。
ra_012010,0,al_010090_0030,【巨躯】の力はとんでもなかったよ。<br>あいつの力でナベリウスの地形が変わり<br>凍土が生まれちゃったぐらいだからね。
ra_012010,0,al_010090_0040,消滅させるのは、不可能だった。<br>だから、【巨躯】を封印したんだ。<br>ナベリウスの大地に縛り付けるように。
ra_012010,0,al_010090_0050,その時に使ったのが<br>創世器「白錫クラリッサ」……<br>あなたが直してくれた、あの武器だよ。
ra_012010,0,al_010090_0060,こうして、クラリッサを鍵として<br>【巨躯】は封印された。<br>けど、皆には「撃破した」と伝えた。
ra_012010,0,al_010090_0070,そこに、いろいろな思惑はあったけど<br>三英雄と祭りあげられた、わたしたちも<br>それでいいと、思ってた。
ra_012010,0,al_010090_0080,これからも続くダーカーとの戦いで<br>その虚勢の事実が、希望になるなら<br>……優しい嘘も、必要だって。
ra_012010,0,al_010090_0090,いつか、わたしたちが繋いだ未来の先に<br>ダークファルスを完全に消滅させる手が<br>見つかるって信じてたしね。
ra_012010,0,al_010090_0100,でも、数十年程度で封印が<br>解除されちゃうなんて<br>思ってもみなかった、かな。
ra_012010,0,al_010090_0110,しかも、その封印解除は<br>シオンの導きによって成就したと<br>言っても過言じゃないわけ。
ra_012010,0,al_010090_0120,【巨躯】を復活させる危険を冒してまで<br>叶えたかったシオンの目的……願いって<br>一体、何なんだろう……
ra_012010,0,al_010090_0130,次の記録も、見てみないと。
ra_012010,0,text01,<br>マターボード『偶像のコンフリクト』を入手しました。<br>
ra_012010,1,ra_012010_0010,Los acontecimientos han cambiado drásticamente. Esta es una<br>realización de lo que has logrado.
ra_012010,1,ra_012010_0020,Incluso si adopta una forma no deseada.
ra_012010,1,ra_012010_0030,"Yo y nosotros rogamos perdón. Por no poder<br>cambiar nada, a pesar de percibir la verdad."
ra_012010,1,ra_012010_0040,"Y tal verdad sacude lo más profundo.<br>Aquellos que dominan no desean la difusión,<br>sino que silenciosamente trabajan para ocultar."
ra_012010,1,ra_012010_0050,"Por eso tu deber es grave.<br>Tú, que todo lo ves y todo lo sabes,<br>eres la clave."
ra_012010,1,ra_012010_0055,"El universo se hará realidad a través de<br>tus experiencias. Esto no es una revisión, pero<br>basado en esa acumulación, tendrá<br>muchos amigos y enemigos."
ra_012010,1,ra_012010_0060,"Aun así, debes seguir adelante, siguiendo<br>tu propia voluntad por un camino que nadie más<br>podría seguir."
ra_012010,1,ra_012010_0070,Yo y nosotros estamos aquí para ver y percibir lo que<br>nos espera en ese camino.
ra_012010,1,ra_012010_0080,A.P.238/4/2
ra_012010,1,al_010090_0010,"Hace más de cuarenta años, Reggie, Mary,<br>y yo luchamos contra Dark Falz [Elder]."
ra_012010,1,al_010090_0020,"Teniendo en cuenta el resultado, se podría decir que<br>ARKS ganó. Nos dieron una buena paliza, pero...<br>ARKS ganó."
ra_012010,1,al_010090_0030,"El poder de [Elder] era escandaloso. Después de todo,<br>él era lo suficientemente fuerte como para cambiar la<br>geografía de Naverius y crear una tundra."
ra_012010,1,al_010090_0040,Era imposible destruirlo.<br>Así que lo sellamos.<br>Lo atamos a la tierra de Naverius.
ra_012010,1,al_010090_0050,"Usé mi Brazo Cosmogénico, Clarissa the<br>White para hacerlo. Esa misma arma que tú<br>reparaste."
ra_012010,1,al_010090_0060,"Sellamos a [Elder], usando a Clarissa<br>como llave. Pero les dijimos a todos que<br>lo derrotamos."
ra_012010,1,al_010090_0070,"Teníamos muchas razones para lo que hicimos,<br>y fuimos aclamados como el Trío de Héroes y<br>pensamos que estaba bien aceptar el título honorífico."
ra_012010,1,al_010090_0080,"Pensamos que si un farol podía dar algo de<br>esperanza a la lucha en curso contra<br>Falspawn, entonces era una mentira piadosa útil."
ra_012010,1,al_010090_0090,"Creíamos que algún día en el futuro nosotros<br>forjaríamos, alguien encontraría una manera de<br>derrotar completamente a un Dark Falz."
ra_012010,1,al_010090_0100,Pero nunca pensamos que el sello<br>sería liberado apenas unas décadas después.
ra_012010,1,al_010090_0110,Y no sería exagerado decir que<br>fue la guía de Xion lo que provocó que se deshiciera el sello<br>.
ra_012010,1,al_010090_0120,Cualquier cosa que Xion quisiera lograr debe haber sido lo suficientemente importante como para arriesgarse a revivir a BR⟧[Elder]. ¿Qué estaba tratando de hacer?
ra_012010,1,al_010090_0130,Tendremos que ver la próxima grabación.
ra_012010,1,text01,"Obtuvo la Matriz de Divergencia ""Conflicto Monumental""."
