section,group,id,text
Required,0,Title,隊長の強化プログラム・Ⅰ
Required,0,Summary,クヴァリス先遣隊長のクリストバルから、<br>南クヴァリスに出現する<br>ドレッドエネミーの討伐を頼まれる。<br><br><yellow>※ドレッドエネミー：<br>　二つ名“老練の”が付いた個体<c>
Required,1,Title,El programa de entrenamiento del comandante I
Required,1,Summary,"s en el sur de Kvaris.<br><br><yellow>Enemigos aterradores: busca un espécimen cuyo nombre incluya ""Veterano"" <c>"
SubObjectives,0,text0101,南クヴァリスでドレッドエネミーを倒す
SubObjectives,0,text0102,クリストバルと話す
SubObjectives,1,text0101,Derrota a un temible enemigo en Kvaris del Sur
SubObjectives,1,text0102,hablar con cristóbal
