section,group,id,text
ssc_502110,0,ssc_502110_0010,なにか見てるの？
ssc_502110,0,ssc_502110_0020,なにか考えごと？
ssc_502110,0,ssc_502110_0030,……いえ、<br>少し考えごとをしていたの。
ssc_502110,0,ssc_502110_0040,……ゼフェットのことを。
ssc_502110,0,ssc_502110_0050,……ええ、少しね。
ssc_502110,0,ssc_502110_0060,ゼフェットのことを、<br>思い出していたの。
ssc_502110,0,ssc_502110_0070,ゼフェットは、<br>多くのデータを遺していった……。
ssc_502110,0,ssc_502110_0080,ファリアの“記憶”のなかにね。
ssc_502110,0,ssc_502110_0090,それらを分析すれば、<br>多くの謎が解き明かされるはず。
ssc_502110,0,ssc_502110_0100,このハルファの成り立ちや、<br>ドールズの構造……。
ssc_502110,0,ssc_502110_0110,もちろん、スターレスのことも。
ssc_502110,0,ssc_502110_0120,……そうした情報は、<br>確かに重要よね。
ssc_502110,0,ssc_502110_0130,……でも。
ssc_502110,0,ssc_502110_0140,私は、それよりも……。
ssc_502110,0,ssc_502110_0150,ゼフェット自身のことを、<br>もっと知りたかった。
ssc_502110,0,ssc_502110_0160,リサージェントアークスの<br>総督としての長い年月……。
ssc_502110,0,ssc_502110_0170,どういう気持ちで、<br>活動していたのか……。
ssc_502110,0,ssc_502110_0180,少しだけでも、<br>その気持ちに触れたかった。
ssc_502110,0,ssc_502110_0190,そうすることで、自分がしてきたことの意味を、<br>理解できるかもしれない……。
ssc_502110,0,ssc_502110_0200,……いえ、そうじゃないわ。
ssc_502110,0,ssc_502110_0210,そういう難しいことではなくて……。
ssc_502110,0,ssc_502110_0220,……もっと話したかった。
ssc_502110,0,ssc_502110_0230,以前、ゼフェットは自分のことを、<br>私たちの“父親”だと言っていた。
ssc_502110,0,ssc_502110_0240,もちろん、血のつながりなんてない。
ssc_502110,0,ssc_502110_0250,単に、“コマ”としての私たちを、<br>束ねる存在として、そう言っていたのだと思う。
ssc_502110,0,ssc_502110_0260,……それでも、<br>今は、話がしたい……。
ssc_502110,0,ssc_502110_0270,なんてことない、<br>日常の会話を……。
ssc_502110,0,ssc_502110_0280,そう思っている自分がいるの。
ssc_502110,0,ssc_502110_0290,この気持ちは、なんなのかしら？
ssc_502110,0,ssc_502110_0300,“家族”への想い。
ssc_502110,0,ssc_502110_0310,ゼフェットへの思慕。
ssc_502110,0,ssc_502110_0320,………。
ssc_502110,0,ssc_502110_0330,……そうね。<br>そうかもしれない。
ssc_502110,0,ssc_502110_0340,そう……かも、しれないわね。
ssc_502110,0,ssc_502110_0350,……でも、<br>もう会うことはできない。
ssc_502110,0,ssc_502110_0360,……この感情に、<br>とらわれていても、先へは進めない……。
ssc_502110,0,ssc_502110_0370,……そうよね。<br>とにかく今は、前に進むことだけを考えるわ。
ssc_502110,0,ssc_502110_0380,私は、ハルファのみんなのために、<br>これまで以上に力を注いでいく。
ssc_502110,0,ssc_502110_0390,ありがとう。<br>話を聞いてくれて。
ssc_502110,0,ssc_502110_0400,おかげで、気持ちの整理がついたわ。
ssc_502110,0,ssc_502110_0410,これからも一緒に、頑張りましょう。
ssc_502110,1,ssc_502110_0010,¿Ves algo?
ssc_502110,1,ssc_502110_0020,¿Estás pensando en algo?
ssc_502110,1,ssc_502110_0030,No.<br>Sólo tengo algo en mente.
ssc_502110,1,ssc_502110_0040,"Zephetto, específicamente."
ssc_502110,1,ssc_502110_0050,Mm... Bueno... más o menos.
ssc_502110,1,ssc_502110_0060,Estaba pensando en Zephetto.
ssc_502110,1,ssc_502110_0070,Dejó una gran cantidad de datos detrás...
ssc_502110,1,ssc_502110_0080,"En forma de ""recuerdos"" de Pharia."
ssc_502110,1,ssc_502110_0090,Analizarlo todo debería arrojar luz sobre muchos misterios.
ssc_502110,1,ssc_502110_0100,Sobre el origen de Halpha... Cómo se hacen las MUÑECAS...
ssc_502110,1,ssc_502110_0110,"Y también sobre los Starless, por supuesto."
ssc_502110,1,ssc_502110_0120,Esa información es innegablemente importante.
ssc_502110,1,ssc_502110_0130,Sin embargo...
ssc_502110,1,ssc_502110_0140,"De alguna manera, yo..."
ssc_502110,1,ssc_502110_0150,Esperaba aprender más sobre el propio Zephetto.
ssc_502110,1,ssc_502110_0160,Fue el general de Resurgent ARKS durante tanto tiempo...
ssc_502110,1,ssc_502110_0170,¿Qué estuvo sintiendo todo ese tiempo?
ssc_502110,1,ssc_502110_0180,Ojalá hubiera podido tener una pequeña idea de eso.
ssc_502110,1,ssc_502110_0190,Quizás entonces podría haber entendido por qué tenía que hacer las cosas que hice...
ssc_502110,1,ssc_502110_0200,No. No es eso.
ssc_502110,1,ssc_502110_0210,No... no es tan profundo...
ssc_502110,1,ssc_502110_0220,Sólo quería hablar más.
ssc_502110,1,ssc_502110_0230,"Recuerdo que se refería a sí mismo como nuestro ""padre"" cuando hablaba de nuestra relación."
ssc_502110,1,ssc_502110_0240,"Quiero decir, no estábamos relacionados por sangre."
ssc_502110,1,ssc_502110_0250,Creo que simplemente usó esa palabra para colocarse por encima de sus peones reunidos.
ssc_502110,1,ssc_502110_0260,Aún así... desearía que pudiéramos hablar...
ssc_502110,1,ssc_502110_0270,No sobre nada.<br>Así... cómo fue nuestro día...
ssc_502110,1,ssc_502110_0280,Una parte de mí realmente quiere eso.
ssc_502110,1,ssc_502110_0290,¿Pero por qué? ¿De dónde viene?
ssc_502110,1,ssc_502110_0300,Porque sois familia.
ssc_502110,1,ssc_502110_0310,Porque te preocupabas por él.
ssc_502110,1,ssc_502110_0320,...
ssc_502110,1,ssc_502110_0330,Sí.<br>Puede que tengas razón.
ssc_502110,1,ssc_502110_0340,Tú... puede que tengas razón.
ssc_502110,1,ssc_502110_0350,Ahora nunca lo volveré a ver.
ssc_502110,1,ssc_502110_0360,Pero no puedo dejar que estos sentimientos me impidan seguir adelante.
ssc_502110,1,ssc_502110_0370,Sí. Necesito concentrarme en dejar todo esto atrás y seguir adelante.
ssc_502110,1,ssc_502110_0380,Trabajaré más duro que nunca para la gente de Halpha. Tengo que hacerlo.
ssc_502110,1,ssc_502110_0390,Gracias por estar siempre ahí para escucharme.
ssc_502110,1,ssc_502110_0400,Mi cabeza está bien ahora.
ssc_502110,1,ssc_502110_0410,Espero que sigas presionándome para que sea lo mejor que pueda.
