section,group,id,text
TutorialText,0,Title,ハイランクセクションの追加
TutorialText,0,text0001,“ハイランクセクション”に<br>新たなランクが追加されました。<br><br>出現するエネミーのレベルが高い分、より良い報酬を<br>狙うことができますが、参加には高い戦闘力が必要です。
TutorialText,0,text0002,ネミーとメガロティクスのみになります。<br><br>PSEバーストアンコールも<br>“PSEバーストf”に変化する場合があります。
TutorialText,0,text0003,“アイナ＆マノン”が登場するトライアルは、<br>クリアすると、PSEレベルに関係なく<br>かならず、PSEバーストが発生します。
TutorialText,1,Title,Nuevos sectores de alto rango
TutorialText,1,text0001,quired to enter, but you can find stronger enemies and better rewards in such sectors.
TutorialText,1,text0002,"Esto sucede, solo aparecerán enemigos raros y Megalotix.<br><br> Un PSE Burst Encore también puede convertirse en un PSE F Burst."
TutorialText,1,text0003,"Las pruebas en las que aparecen Aina y Manon activarán automáticamente una ráfaga de PSE al finalizar la prueba, independientemente del nivel de PSE."
