section,group,id,text
Title,0,name01,『アークスビンゴカード』について
Title,1,name01,¿?
mess,0,text01,アークスビンゴカードについて説明します。<br><br>アークスビンゴカードでは、<br>各目標を達成していくことで<br>ビンゴ数に応じた報酬が貰えます。<br><br>「アークスビンゴカード」を選択し<br>「詳細を確認する」から目標を確認出来ます。<br><br>※期間限定のため、<br>　対象にならない時期もあります
mess,0,text02,アークスビンゴカードは、設定しておかないと<br>目標達成の判定がされません。<br><br>内容を確認したら「このビンゴカードを進める」を<br>押し忘れないようにしましょう。
mess,0,text03,設定した後は自動的に<br>目標達成の判定が行われます。<br>コンプリート目指して頑張りましょう。
mess,1,text01,"En la tarjeta de bingo ARKS, completar objetivos te permitirá ganar recompensas<br>proporcional a su número de bingos.<br><br>Seleccione [ARKS Bingo Card] y luego [View Details] para consultar una lista de objetivos.<br><br>Los cartones de bingo ARKS solo están disponibles en determinados momentos."
mess,1,text02,"Si no configura su tarjeta de bingo ARKS primero, progresará en el cumplimiento de los objetivos.<br>en él no será reconocido.<br><br>Asegúrese de recordar seleccionar [Use this Bingo Card] después de verificar su contenido."
mess,1,text03,"Después de configurar un cartón de bingo para su uso, avance en el cumplimiento de los objetivos.<br>se grabará automáticamente. ¡Rellena esos cuadrados y gana grandes premios!"
