section,group,id,text
TutorialText,0,Title,『オーバーリミット』について
TutorialText,0,text01,新世武器の強化値上限は、<br>「＋３０」までです。<br><br>強化値が「＋３０」に達し、<br>潜在能力「Lv.3」を解放すると<br>上限となります。
TutorialText,0,text02,ただし、以下の場合は強化値上限を<br>最大で「＋３５」まで拡張できます。<br><br>・<yellow>同名の武器<c>を合成した場合<br>・「強化値上限＋１」などの<br>  補助アイテムを使用した場合<br><br>※同名の武器が強化値上限拡張済の場合、<br>　通常より多く強化値上限を拡張できます。<br>　（最大＋３５まで）
TutorialText,1,Title,Anulación de límite
TutorialText,1,text01,"Las armas se pueden elevar a un nivel de mejora máximo de [+30].<br><br>Un arma de este nivel, con un potencial de nivel 3 desbloqueado, estará en su punto máximo."
TutorialText,1,text02,"Sin embargo, en los siguientes casos, es posible superar este límite y aumentar<br>el nivel de mejora a [+35].<br><br>- Fusionando el arma con <yellow>otra arma con el mismo nombre<c><br>- Mediante el uso de un elemento de soporte como [Enhancement Cap +1]<br><br>Si el arma del mismo nombre que se utiliza en la fusión ya ha alcanzado el<br>Límite del nivel de mejora, entonces aumentará el nivel de mejora más allá del límite<br>más que un arma estándar (Hasta +35)."
