section,group,id,text
Title,0,name01,『採掘基地防衛戦：混沌』について
Title,1,name01,¿?
mess,0,text01,今回の防衛戦は、『クロームドラゴン』の<br>空間移動に巻き込まれた他惑星のエネミーから<br>３つの拠点を守り抜くクエストです。<br><br>全ての拠点を破壊されるとクエストが<br>失敗となりますので、ご注意ください。
mess,0,text02,また、ソルザ・ブラーダの攻撃により<br>防衛ソケットが侵食されると、ソケットの<br>機能が制限されてしまいます。<br><br>他惑星のエネミー出現による影響か<br><yellow>侵食されたソケットの浄化が<br>行えないこと<c>が判明しました。<br><br>侵食が進むほど不利になるため<br>速やかに対処してください。
mess,1,text01,"En esta misión, debes defender tres sitios de los enemigos arrancados de otros mundos.<br>a través de las manipulaciones espaciales del [Chrome Dragon].<br><br>Si los tres sitios son destruidos, la misión terminará en un fracaso."
mess,1,text02,"También es posible que los ataques de Solza Brahda corrompan los Zócalos de Defensa,<br>limitando su efectividad.<br><br>Se ha confirmado que <yellow>no podrás purificar archivos corruptos<br>Zócalos de defensa con extraterrestres cercanos<c>.<br><br>A medida que la corrupción se extienda, usted estará en una desventaja aún mayor, así que tenga cuidado.<br>Estamos seguros de abordar la corrupción lo más rápido posible."
