section,group,id,text
Info,0,Title,イベントミッション
Info,0,Goal,パーティーメイカーを設置
Info,0,Explanation,任意のクエストで「パーティーメイカー」を設置しよう！<br><yellow><br>※クエスト内で「クイックメニュー」から設置可<br>※クイックメニューにない場合は「パターンを変更」で<br>　「04.マルチプレイ重視」などに
Info,1,Title,Event Mission
Info,1,Goal,Drop the Party Beacon
Info,1,Explanation,"Use the Party Beacon in a Quest of your choice!<br><yellow><br>You can set up the Party Beacon during a Quest<br>by selecting it from the Quick Menu.<br>If it is not displayed on the Quick Menu,<br>you can select a different Quick Menu configuration<br>by selecting ""04 - Multiplayer"" from the Layout Swap menu.<c>"
