section,group,id,text
Info,0,Title,イベントミッション
Info,0,Goal,エクストリームクエストを３回クリア
Info,0,Explanation,任意のエクストリームクエストを<br>Aランク以上で３回クリアしよう！<br><yellow>※クエスト開始には「エクストリームパス」が必要<br>（アカウントにつき、22時間ごとに1回<br>ログイン時に受け取るか装備管理官プリンから入手可）
Info,1,Goal,Clear 3 Extreme Quests
Info,1,Explanation,Clear 3 Extreme Quests with an A Rank or better!<br><yellow>Note: An Extreme Pass is required to begin an Extreme<br>Quest. (One pass can be obtained every 22 hours per<br>account. Passes can be obtained from bonuses when<br>logging in or from Equipment Officer Prin.)<c>
