section,group,id,text
Event1,0,name01,イナンナ
Event1,0,11_voice_navi07_003,そこまで。ＶＲエネルギーが切れたため<br><c bb0000>チャレンジを終了<c>します。<br>まずまずの結果ですね
Event1,0,text02,まもなくキャンプシップへの帰還を<br>開始します。ミッションの遂行<br>お疲れ様でした。
Event1,0,linewindow,チャレンジ終了。キャンプシップに転送
Event1,1,name01,Inanna
Event1,1,11_voice_navi07_003,"Let me stop you right there. Now that you've<br>run out of VR Energy, I will be <c bb0000>ending this<c><br><c bb0000>challenge<c>. Good effort."
Event1,1,text02,You will be transported back to the Gateway<br>Ship shortly. Good work out there.
Event1,1,linewindow,That's a wrap. You will now be transported back to the Gateway Ship.
