section,group,id,text
Event1,0,name01,シエラ
Event1,0,11_voice_navi09_405,領域展開の、限界時間です。<br>これにて任務終了、ですね。<br>お疲れさまでした！
Event1,0,text02,なかなかの成果でしたね！<br>次はもっともっとできますよ！
Event1,0,text03,これにて、本作戦は終了となります。<br>テレポーターで帰還して
Event1,1,name01,Xiera
Event1,1,11_voice_navi09_405,You have reached the time limit for field<br>deployment. Your mission is now complete.<br>Nice work out there!
Event1,1,text02,Not bad. Not bad at all.<br>I'm sure you can do even better next time!
Event1,1,text03,That concludes this operation.<br>Take the Teleporter back.
