section,group,id,text
Info,0,Title,難易度制限解放試練・Ⅱ
Info,0,Explanation,これは、尋常ならざる強敵と相対する許可を<br>申請するための試練である。<br><br>改めて実力を誇示する必要はない。<br>必要な条件は「新たな難度で危険を顧みず<br>さらなる強敵と戦う覚悟を決める」のみ。<br><br>己が実力に自信を抱き<br>危険の先に待つ至宝を望む者は<br>覚悟を決めて挑戦するといい。
Info,0,Target,コフィーの説明を聞く
Info,0,Errand,ベリーハード受注許可
Info,1,Title,Difficulty Level Trial II
Info,1,Explanation,"This is a trial that will grant you a permit to face <br>unusually strong enemies.<br><br>Here, actions will trump words. You need only <br>demonstrate your resolve to fight more fearsome <br>foes on a new difficulty without hesitation or fear.<br><br>If you are confident in your abilities and wish to <br>serve ARKS in an even higher capacity, then steel <br>yourself and take up this challenge."
Info,1,Target,Listen to Cofy's Explanation
Info,1,Errand,Very Hard Difficulty Permit
