section,group,id,text
Info,0,Title,ＦＵＮスクラッチの利用方法！
Info,0,Explanation,昨今は、控えめなアークスが多くて困る！<br>ＦＵＮを貯めたらＦＵＮスクラッチで使う！<br>これは基本的かつ重要なことだ！<br><br>ＦＵＮスクラッチは使用に条件があるぶん<br>相応の結果が期待できる<br>すばらしいものなのだぞ！<br><br>いいか、私はＦＵＮスクラッチで……
Info,0,Errand,ＦＵＮスクラッチ
Info,1,Title,A Primer on FUN Scratch Tickets!
Info,1,Explanation,"Too many ARKS scamps these days don't know <br>the meaning of FUN, I tell ya! Ya gotta spend it on <br>FUN Scratch Tickets--that's just common sense! <br>Sure, there are certain conditions you need to <br>meet in order to use 'em, but that just makes <br>their rewards even better! Now listen, <br>I once used a FUN Scratch Ticket and..."
Info,1,Errand,Draw a FUN Scratch Ticket.
