section,group,id,text
Info,0,Title,必見！アイテム管理法！
Info,0,Explanation,昨今は、だらしないアークスが多い！<br>アイテムの整理をきちんとしなければ<br>やがて自分の首を絞めるというのに<br>物を持てるだけ持つなど、言語道断！<br><br>個人個人に割り当てられた倉庫<br>その価値、利用法、心して聞くといい！<br><br>いいか、私の利用する倉庫は……
Info,0,Errand,倉庫からアイテムを預ける
Info,1,Title,A Primer on Item Management!
Info,1,Explanation,"Bah! Too many ARKS hooligans these days are <br>layabouts! They lug around stuff just for the sake <br>of it, with no mind for the consequences! Now <br>listen up as I extol the virtues of the storage <br>facilities provided to everyone. In fact, <br>MY storage is..."
Info,1,Errand,Put or remove an item from your Storehouse.
