section,group,id,text
Info,0,Title,我が内なる衝動のままに
Info,0,Explanation,戦いへと掻き立てる破壊の衝動……<br>その正体について、余は考え続けている。<br>そうしたところ、管理官殿が<br>今回の任務を与えてくれた。<br>アークスの歴史は闘争の歴史……<br>共に戦うことで何かを掴めるのでは、と。<br>リーダー、パートナーカードを使って<br>余を戦いに随伴させるのだ。
Info,0,Reward,エルダーペインのＰＣ<br>サイカ・ヒョウリのＰＣ<br>※好感度上昇によるプレゼントはありません
Info,0,Target,エルダーペインたちの話を聞く
Info,1,Title,Driven by Impulse
Info,1,Explanation,"What is the destructive impulse within that<br>stirs us to battle? Just as I was pondering<br>this question, the officer gave me a mission.<br>They said the history of ARKS is one of conflict,<br>and that I may find my answer fighting alongside<br>its members. Please, accept my Partner Card<br>and allow me to accompany you, leader."
Info,1,Reward,Elder Pain's Partner Card<br>Saika Hyori's Partner Card<br>Note: You will not receive a gift for raising affinity.
Info,1,Target,Talk to Elder Pain and Saika Hyori.
