section,group,id,text
Info,0,Title,最高のルールの見つけ方
Info,0,Explanation,おかげさまで準備はうまく行ってるよ！<br>ところで、だんだん春の陽気になってきたし<br>みんなで身体を動かす遊びがほしくない？<br>まさに今、その遊びを考えてるんだけど<br>肝心の勝ち負けのルールが<br>なかなか決められなくて……<br>なにかいいヒント、持ってないかなっ？<br><br><yellow>※Lv.1～のエネミーの弱点を攻撃して撃破<c>
Info,0,Errand,仮テキス
Info,1,Title,How to Find the Best Rule
Info,1,Explanation,"We’re making great progress! The weather <br>is getting very spring-like! Don’t you feel <br>like doing something active outside with <br>everyone? I’m thinking of a game right <br>now, but I'm having a terrible time <br>deciding on the rules... any ideas?<br><br><yellow>Defeat a Level 1+ enemy by attacking <br>its weak point.<c>"
