section,group,id,text
Info,0,Title,お祝いにふさわしいサラダを！
Info,0,Explanation,バーベキューと一緒に、お祝いにふさわしい<br>付け合わせを作ろうと思うの！<br>うーん、やっぱり定番はポテトサラダよね。<br>と思いついたのはいいんだけど<br>材料のジャガイモがちょっとしかないよ！<br>ジャガイモ、持ってない！？<br><br><yellow>※目標アイテムはギャザリングで入手可能<c>
Info,0,Errand,対象テム品
Info,1,Title,Salad Perfect for a Celebration
Info,1,Explanation,"You can't have a celebratory BBQ without<br>potato salad, right? That'd be absurd!<br>I was all set to make some, but then I discovered<br>that I'm seriously lacking in potatoes! You wouldn't<br>happen to be carrying some potatoes around, <br>would you?<br><br><yellow>The objective Items can be obtained<br>through Gathering.<c>"
Info,1,Errand,"5 Monomates, Thank You Kindly"
