section,group,id,text
CharaName,0,name01,ヒルダ
CharaName,1,name01,Hilda
Skit,0,11_voice_navi02_116,体力の回復はアークスの回復装置<br>などでも可能だ。間もなく回復装置を<br>そちらに投下する。使ってみるといい。
Skit,0,11_voice_navi02_117,こちらヒルダだ。<br>周囲空域オールグリーン、<br>目標座標送信、投下許可を発布する。
Skit,1,11_voice_navi02_116,You can also recover HP at the ARKS Heal<br>Station. I'll send down a Heal Station for<br>you momentarily. You should use it.
Skit,1,11_voice_navi02_117,This is Hilda. Airspace is clear. Sending target<br>coordinates now. You have clearance<br>to send it.
