section,group,id,text
Skit,0,name01,エリン
Skit,0,11_voice_navi23_rob_01,<%me>さん、初めまして。<br>わたし、ディバイドクエスト管理官の<br>エリンです。
Skit,0,11_voice_navi23_rob_02,ディバイドクエストは、シャオさんの<br>演算でシミュレートしたフォトナーや<br>閃機種たちと戦う、新クエストです。
Skit,0,11_voice_navi23_rob_03,さまざまな戦況を想定したＶＲ訓練で<br>状況にあわせたルート選択が大切です。<br>よかったら、参加し
Skit,1,name01,Erin
Skit,1,11_voice_navi23_rob_01,"<%me>, it's a pleasure to <br>meet you. I'm Erin, the officer <br>in charge of Divide Quests."
Skit,1,11_voice_navi23_rob_02,Divide Quests are new quests in which you <br>will fight simulations of Photoners and <br>luminmechs based on Xiao's calculations.
Skit,1,11_voice_navi23_rob_03,"This VR training features a variety of battle <br>situations, so it's important to choose a <br>route that best suits the circumstances. <br>Please give them a try."
