section,group,id,text
TutorialText,0,Title,『バトルカウンター』について
TutorialText,0,text0001,バトルカウンターでは<br>以下のマッチング形式を選択します。<br><c 00b0f0>・ランクマッチ<c><br>　全バトルロビーのプレイヤーと<br>　ランダムでマッチングをおこないます。<br><c ffff00>　勝敗によりランキングが変動し<br>　報酬がもらえます。<c><br><br><c 00b0f0>・パスワードマッチ<c><br>　パスワードを入力することで<br>　特定のプレイヤーとマッチングできます。<br><c ff4f3f>　このマッチングでは<br>　ランキングは変動しませんが<br>　報酬がもらえます。<c>
TutorialText,0,text0002,マッチング形式を選択した後は<br>対戦ルールを選択して<br>「マッチングを開始する」を選択します。<br><br>その後、ウィンドウが表示されて<br>参加人数が集まるのを待ちます。<br><br><c ffff00>全員集まった時点で<br>自動でバトルエリア内へと転送されます。<c><br>　※マッチングを取り消したいときは<br>　　バトルカウンターのメニューにある<br>　　「マッチングを取り消す」を選択します。
TutorialText,0,text0003,バトルカウンターの詳しい説明は<br>メニューにある<br><c ffff00>「バトルアリーナの説明を聞く」<c>から<br>確認することができます。
TutorialText,1,Title,The Battle Counter
TutorialText,1,text0001,"The type of matching is selected at the Battle Counter.<br><c 00b0f0>- Ranked Match<c><br>All players in the Battle Lobby are randomly matched.<br><c ffff00>Rankings change based on whether you win or lose,<br>and you can receive Battle Coins.<c><br><br><c 00b0f0>- Password Match<c><br>Match with specific players by entering a password.<br><c ff4f3f>With this type of matching, rankings don't change<br>but you will receive rewards.<c>"
TutorialText,1,text0002,"After selecting match type, choose the battle rules and select ""Join Match.""<br><br>Then, a window will be displayed while you wait<br>for the appropriate number of players to arrive.<br><br><c ffff00>When all players have arrived, you'll automatically<br>be transported to the battlefield.<c><br>* To cancel matching, select ""Cancel matching"" from the Battle Counter menu."
TutorialText,1,text0003,"For more detailed information on the Battle Counter, go to <br><c ffff00>""Ask about the Battle Counter""<c> in the menu."
