section,group,id,text
Skit,0,name01,コフィー
Skit,0,text01,エトワールの練習クエストは<br>いかがでしたか？
Skit,0,text02,エトワールは<br>特殊なガードによる攻防一体の戦闘と<br>パーティー支援が特長のクラスです。
Skit,0,text03,いかなるエネミーと遭遇しても<br>万全の戦いができるよう<br>施設を活用いただければ
Skit,1,name01,Cofy
Skit,1,text01,What did you think of <br>the Étoile Practice Quest?
Skit,1,text02,Étoile can attack and defend at once using <br>a unique kind of Guard. They also excel at <br>supporting party members.
Skit,1,text03,I strongly advise you take advantage of the <br>facilities so that you're fully prepared for <br>any enemy encounter.
