section,group,id,text
TutorialText,0,Title,このクエストについて
TutorialText,0,text0001,このクエストは<br>制限時間を経過することで<br>クリアとなるクエストです。<br><br>また、クエストポイントが<br>一定値以上になると<br>レアエネミーやブーストエネミーが<br>出現しやすい状態となります。<br><br>制限時間までに<br>よりたくさんのエネミーを撃退できるよう<br>仲間と協力して頑張りましょう！
TutorialText,0,text0002,このクエストでは<br><red>クエストをクリアするまで<br>エネミーからドロップするアイテムを<br>獲得できません。<c><br><br>クエストクリア後、転送先のエリアにて<br>獲得することができます
TutorialText,1,Title,About This Quest
TutorialText,1,text0001,"This quest is completed when the players<br>exceed the time limit. In addition, you can<br>accumulate quest points to make rare enemies<br>and Berserk Enemies appear more frequently.<br>Work with your companions to kill as many enemies<br>as you can within the time limit!"
TutorialText,1,text0002,"In this quest, <red>you can't acquire items dropped by enemies until you've cleared<br>the quest.<c><br><br>Once you've completed the quest, you can obtain the enemy drops in the<br>Teleporter destination area."
