section,group,id,text
Skit,0,text00,『練習クエスト』について
Skit,0,text01,練習クエストでは各クラスの特徴や<br>戦い方を実践形式で学べます。<br><br>訓練中は課題に応じた装備が<br>支給されるので装備の用意や<br>クラスの変更は必要ありません。<br><br>各練習クエストをクリアすることで<br>ご褒美がありますので<br>積極的に練習してみましょう。
Skit,0,linewindow001,練習クエストが受注出来るようになりました
Skit,1,text00,Practice Quests
Skit,1,text01,"Practice Quests are a way to learn the features and fighting style of a class in a<br>practical learning environment. Proper gear is provided during training,<br>so you won't be required to provide your own or change your class.<br><br>There are special rewards for clearing each quest, so be sure to clear them all."
Skit,1,linewindow001,You can now accept Practice Quests.
