section,group,id,text
Skit,0,linewindow,『専用ブロック』と『共用ブロック』について
Skit,0,text00,『専用ブロック』と『共用ブロック』について
Skit,0,text01,専用ブロックと共用ブロックについて<br><br>専用ブロックとは、特定のプラットフォームで<br>のみログインできるブロックになります。<br><br>専用ブロックには“PC”専用ブロックと<br>“PS Vita”専用ブロックがあり、指定されている<br>プラットフォームを使用しているユーザーのみ<br>ログインすることができます。<br><br>共用ブロックとは、“PC”ユーザーと<br>“PS Vita”ユーザーのどちらもがログインできる<br>ブロックに
Skit,1,linewindow,Exclusive Blocks and Cross-Platform Blocks
Skit,1,text00,Exclusive Blocks and Cross-Platform Blocks
Skit,1,text01,"Exclusive Blocks are Blocks you log in to on a<br>specific platform only.<br><br>For example, there are ""PC Blocks"" and a ""PS Vita Blocks""<br>that can only be logged in to by users of those<br>specific platforms.<br><br>Cross-Platform Blocks allow both PC users and<br>PS Vita users to log in."
