section,group,id,text
Required,0,Title,スティア連破訓練・1-Ⅶ
Required,0,Summary,アークス上級訓練教官ロナルディンから、<br>経験を積むために、<br>メガロティクスの討伐を勧められる。<br><br><yellow>※対象リージョン：スティア<br>※推奨セクション：ノイゼンプラント<c>
Required,1,Title,Stia Relentless Training 1-VII
Required,1,Summary,ARKS Advanced Training Instructor Ronaldine has tasked you with suppressing Megalotix enemies in order to gain some experience.<br><br><yellow>Target Region: Stia<br>Recommended Sector: Neusen Plant<c>
SubObjectives,0,text0101,ドールズの<br>メガロティクス（Lv.65以上）を倒す
SubObjectives,1,text0101,Defeat DOLLS Megalotix (Lv.65 or greater)
