section,group,id,text
Required,0,Title,エアリオ連破訓練・2-Ⅲ
Required,0,Summary,アークス上級訓練教官ロナルディンから、<br>経験を積むために、<br>メガロティクスの討伐を勧められる。<br><yellow>※対象リージョン：エアリオ<br>※推奨セクション：<br>　ヴァンフォード研究所跡（Rank.5以上）<br>※メガロティクス：<br>　二つ名“精鋭の”が付いた個体<c>
Required,1,Title,Aelio Relentless Training 2-III
Required,1,Summary,"ARKS Advanced Training Instructor Ronaldine has tasked you with suppressing Megalotix in order to gain some experience.<br><br><yellow>Target region: Aelio<br>Recommended Sector: Vanford Laboratory Ruins<br>(Rank 5 or higher)<br>Megalotix:<br>Seek out specimens whose names include ""Elite"".<c>"
SubObjectives,0,text0101,ドールズの<br>メガロティクス（Lv.70以上）を倒す
SubObjectives,1,text0101,Defeat DOLLS Megalotix (Lv.70 or Greater)
