section,group,id,text
Info,0,Title,周回：緊急クエスト
Info,0,Explanation,アークス各員へオーダーを通達します。<br>指定したクエストを一定数<br>達成してきてください。<br><br>報酬は報告時にお渡しします。<br><br><yellow>※ノーマル以上<br>Aランク以上でクリア<br>※トリガークエストは対象外となります。<c>
Info,0,Target,「任意の緊急クエスト」の
Info,1,Title,Circuit: Urgent Quest
Info,1,Explanation,Attention all ARKS ops! Complete the designated<br>quests.<br><br>You will receive your reward when you report in.<br><br><yellow>Clear on Normal or above with an A Rank <br>or better.<br>Note: Trigger Quests are not eligible.<c>
Info,1,Target,Clear any Urgent Quest
