section,group,id,text
Required,0,Title,期間限定クエストのクリア
Required,0,Summary,期間限定クエスト<br>“特別演習：ソニックスプリント”もしくは、<br>“特別演習：シャドウスプリント”を<br>クリアする。<br><br><yellow>※クエストカウンターで受注可能<c>
Required,1,Title,Clear the Limited-Time Quest
Required,1,Summary,"Clear the Limited-Time Quest ""Special Training: Sonic Sprint"" or ""Special Training: Shadow Sprint"".<br><br><yellow>*Available at the Quest Counter<c>"
SubObjectives,0,text0101,指定のクエストをクリアする
SubObjectives,0,Objective310,<space>
SubObjectives,1,text0101,Clear the designated quest
SubObjectives,1,Objective310,<space>
