section,group,id,text
Required,0,Title,【お月見】輝星の妖変・Ⅱ
Required,0,Summary,続いて、シーズンシンボルの付いた<br>ドレッドエネミーとの<br>交戦データを送信するように頼まれる。<br><yellow>※ドレッドエネミー：<br>　二つ名“老練の”が付いた個体<c><br><yellow>※エネミー討伐推奨セクション：<br>　中央エアリオ、南エアリオ、<br>　西エアリオ、北エアリオ<c>
Required,1,Title,[Moon-Gazing] Starlight Metamorphosis II
Required,1,Summary,"Next, Xiandy needs battle data on the Dread Enemy <br>marked with a Seasonal Symbol.<br><br><yellow>Dread Enemy: Seek out a specimen whose name<br>includes ""Veteran""<c><br><yellow>Recommended sectors for enemy suppression:<br>Central Aelio, South Aelio, West Aelio, North Aelio<c>"
SubObjectives,0,Objective0101,シンボル付きドレッドエネミーを倒す
SubObjectives,0,Objective0102,シャンディーと話す
SubObjectives,1,Objective0101,Defeat the Dread Enemy marked with a symbol
SubObjectives,1,Objective0102,Talk to Xiandy
