section,group,id,text
TutorialText,0,Title,このクエストについて
TutorialText,0,text0001,このクエストでは、<br>Ｅトライアルをクリアした際に<br><c 00ffff>「クエストPt」<c>が入手できます。<br><br><c 00ffff>「クエストPt」が<br>【2017】ポイントに達する<c>と<br>クエストクリアになります。<br>
TutorialText,0,text0002,このクエストでは、クエスト中に取得した<br><c 00ffff>クエストPtを同じルームに<br>入室している全パーティーで共有<c>します。<br><br><c ffff00>クエスト開始後は、他のパーティーにより<br>クエストPtが増えることがありますので<br>ご注意ください。<c>
TutorialText,1,Title,About This Quest
TutorialText,1,text0001,"In this quest, you earn <c 00ffff>quest points<c> <br>by clearing E Trials. Earn 2017 <c 00ffff>quest <br>points<c> to complete the quest."
TutorialText,1,text0002,"In this quest, <c 00ffff>when you earn quest points, <br>they are shared with all parties in the same room.<c><br><br><c ffff00>Note: Other parties can add to your quest points once you begin.<c>"
