section,group,id,text
Required,0,Title,ドライゼンプラント制圧戦
Required,0,Summary,<%me>たちは、<br>グレンたちとともに、<br>スティアキャンプの北に位置する<br>ドライゼンプラントの制圧に向かう。
Required,1,Title,Capturando la planta Dreisen
Required,1,Summary,"Los héroes parten junto a Glen y su tripulación para capturar la planta Dreisen, ubicada al norte del campamento Stia."
SubObjectives,0,text0101,ドライゼンプラントの入口にいる<br>カヌイと話す
SubObjectives,0,text0102,中心部に向かう
SubObjectives,0,text0103,炎ホウオウの討伐
SubObjectives,1,text0101,Habla con Kanui en la entrada de la planta<br>Dreisen.
SubObjectives,1,text0102,Dirígete al centro
