section,group,id,text
Required,0,Title,再び指令室へ
Required,0,Summary,アークスの教導官であるブルーダーから、<br>コクーンでの指南を受けた<br><%me>は、<br>クロフォードに呼ばれ、<br>再びセントラルシティの指令室に向かう。
Required,1,Title,A la sala de mando
Required,1,Summary,"Después de recibir el entrenamiento Cocoon del instructor de ARKS Dozer, Crawford convoca a<%me>de regreso a la Sala de Comando en Central City."
SubObjectives,0,text0101,指令室に向かう
SubObjectives,0,text0102,クロフォードと話す
SubObjectives,1,text0101,Dirígete a la sala de mando
SubObjectives,1,text0102,Habla con Crawford
