section,group,id,text
msn_023021,0,name_7030,クイーラ
msn_023021,0,msn_023021_0010,えーと、聞こえる？<br>キミ、噂の“ガーディアン”だよね？
msn_023021,0,msn_023021_0020,私は、クイーラ。<br>突然だけど、頼みたいことがあるの。
msn_023021,0,msn_023021_0030,リテムシティの入り口あたりにいるから、<br>ちょっと来てもらえないかな
msn_023021,1,name_7030,Quilla
msn_023021,1,msn_023021_0010,"Uh, can you hear me? You're that legendary ""Guardian"", right?"
msn_023021,1,msn_023021_0020,I'm Quilla. I've got a request for you.
msn_023021,1,msn_023021_0030,I'm near the entrance to Retem City. Could you stop by and see me?
