section,group,id,text
Event1,0,text01,この課題も難なくこなしたか。<br>さすが、私が目をかけてきただけの<br>ことはあるな。
Event1,0,text02,君たち若者の成長は目覚ましい。<br>うかうかしていると教えている側の<br>我々も追い抜かれてしまいそうだ。
Event1,0,11_voice_NPC_5054_101,今度は、私が君の胸を借りるつもりで<br>任務に臨むとしよう。<br>それでは、よろしく頼む
Event1,1,text01,"All this still wasn't enough to faze you, huh?<br>I knew I wasn't wrong to give you this much <br>of my attention."
Event1,1,text02,You and your peers are growing so quickly.<br>I think you'd surpass your instructors real<br>quick if we let our attention slip.
Event1,1,11_voice_NPC_5054_101,"Why don't I go along with you on a mission <br>soon and knock some of the rust off? <br>Looking forward to it, operative."
