section,group,id,text
Event1,0,text01,先輩、お帰りなさい。<br>トランマイザーのデータ、どうも<br>ありがとうございます。
Event1,0,11_voice_NPC_5062_104,……先輩と話してると、なんだか<br>お兄ちゃんが目の前にいるみたいな<br>気がしてきます。
Event1,0,text03,……ふふ、おかしいですよね。<br>見た目も、話し方も全然ちがうのに。<br>なんとなく安心するんです。
Event1,0,text04,それじゃ、どうも<br>ありがとうございました。<br>また、お願いしますね
Event1,1,text01,Welcome back. <br>Thank you for the data on the Tranmizer.
Event1,1,11_voice_NPC_5062_104,"This may seem out of nowhere, but when I talk<br>with you, it feels like my brother's standing<br>in front of me."
Event1,1,text03,"Heh, isn't that silly? You neither speak nor<br>look anything like him, but you have the same<br>sort of... comforting aura about you."
Event1,1,text04,"Anyway, thank you again.<br>I'm sure I'll have more work for you later."
