section,group,id,text
Event1,0,11_voice_NPC_5570_101,拝見しましたの、マスター！<br>本当にほれぼれするおもてなしで……<br>驚嘆ですの！　感動ですの！
Event1,0,text02,わたくしも皆さまにご満足いただける<br>丁重で華麗なおもてなしを目指して<br>精進いたしますの！
Event1,0,text03,マスター、心から感謝しますわ。<br>ありが
Event1,1,11_voice_NPC_5570_101,"I had the pleasure of viewing your magnificent show of hospitality, Master! I must say, I was awestruck. Moved to tears, even."
Event1,1,text02,"I, too, must further devote myself to acts of goodwill and cordiality."
Event1,1,text03,"I am truly grateful for everything you have done for me, Master. Thank you very much!"
