section,group,id,text
CharaName,0,name01,ハンス
CharaName,1,name01,Hans
Event1,0,11_voice_NPC_5052_101,すげぇ！すっげぇぜ！<br>マジでやっちまいやがった！<br>向かうところ敵なしって感じだな！
Event1,0,text02,向かうところ敵なしって感じだな！<br>ま、まあオレだってそれくらいは<br>できると思うけどよ……
Event1,0,text03,んじゃ、帰ってきたら<br>ゆっくり話を聞かせてくれよ！<br>待ってるぜ！
Event1,1,11_voice_NPC_5052_101,"Pal, that was nuts! You went and freakin' did<br>it! I swear, you gotta be invincible!"
Event1,1,text02,"Absolutely invincible!<br>I-I mean, not like I couldn'ta done it myself,<br>but ya know..."
Event1,1,text03,"Anyway, c'mon back here so we can talk!<br>See ya soon."
