section,group,id,text
Event1,0,11_voice_NPC_5051_101,これよ、これ！<br>高級食材なのよねぇー！
Event1,0,text02,私も話に聞いたことがあるだけで<br>実物を見るのは初めてなの！<br>調理しがいがあるわぁー！
Event1,0,text03,お店で売ってる値段ほどじゃないけど<br>多めにお礼を用意したつもりよ。
Event1,0,text04,<%me>さん<br>いつもいつも本当にありがと
Event1,1,11_voice_NPC_5051_101,Now THIS is the prime stuff! Good luck finding<br>ingredients this good anywhere else!
Event1,1,text02,"I've never seen this stuff up close before--only<br>heard about people cooking with it. Ooh, I can't<br>wait to get it over the flame!"
Event1,1,text03,"It's probably less than what you could get for<br>this stuff on the market, but I tried to give<br>your reward a little extra sweetener."
Event1,1,text04,"You've saved me over and over, <br><%me>.<br>Thanks so much!"
