section,group,id,text
Event1,0,text01,やあ、やる気になって<br>くれたみたいだね。
Event1,0,11_voice_NPC_5018_100,今回はアークスグランプリの<br>決勝のほうだよ。
Event1,0,text03,予選や本戦とはまた違うと思うけど<br>きみの実力であれば<br>些細な差かもしれないね。
Event1,0,text04,ともかく私は<br>きみの結果がとても楽しみなのさ。
Event1,1,text01,"Well, look who's rarin' to go again!"
Event1,1,11_voice_NPC_5018_100,"Looks like it's high noon--or shall I say,<br>time for the finals of the ARKS Grand Prix."
Event1,1,text03,"It's like to be a different animal from the<br>prelims and the regular matches. But I doubt<br>it'll faze an old hand like you, pardner."
Event1,1,text04,Can't wait to see what type <br>of show you put on.
