section,group,id,text
Event1,0,11_voice_NPC_5052_100,また「壊世区域」の調査任務が<br>回ってきちまったぜ！
Event1,0,text02,今度は、アムドゥスキアなんだが<br>ご多分に漏れず<br>だいぶおかしなエリアなんだと。
Event1,0,text03,そうなると、まずは情報が必要だよな！<br>……ってわけで、おたくの戦いっぷりを<br>モニターさせてほしいわけよ。
Event1,0,text04,いつもどおり、ちゃちゃっと<br>やってきてもらえねーかな？
Event1,1,11_voice_NPC_5052_100,We got ourselves another Corrupted Region<br>investigation mission!
Event1,1,text02,"This one's on Amduskia. It's a pretty weird<br>place, so that checks out."
Event1,1,text03,"If we wanna keep the surprises to a minimum,<br>we're gonna need some intel. Intel I'll get by<br>watching you fight over the monitor."
Event1,1,text04,Be a pal and do your thing?
