section,group,id,text
Event1,0,text01,お疲れ様ですわ。<br>デュアルブレードには慣れたみたいで<br>私、嬉しいです。
Event1,0,11_voice_NPC_5150_100,訓練メニューですが、貴方様には<br>簡単すぎたかもしれませんわね。
Event1,0,text03,でも、ひとつの指標になりましたわ。<br>次は、もう少しハードルを上げても<br>宜しいのかもしれませんわね。
Event1,0,text04,また是非私の訓練メニューを<br>試して頂けると嬉しいです。<br>それでは
Event1,1,text01,Nice work. I'm happy to see that you're getting<br>used to using Soaring Blades.
Event1,1,11_voice_NPC_5150_100,...Maybe that was too easy for someone of your<br>caliber.
Event1,1,text03,"Even so, it's a good measure of your skill thus<br>far. Next time I'll have something harder lined<br>up for you."
Event1,1,text04,"I hope you'll try out another one of my<br>training courses. Well, till next time!"
