section,group,id,text
Event1,0,text01,ありがとうございます。<br>これがブーストエネミーになった<br>セト・サディニアンのデータですね。
Event1,0,text02,人型の龍族も、他のエネミーみたいに<br>ブーストエネミーになっちゃうなんて<br>……なんだか、怖いですね。
Event1,0,11_voice_NPC_5062_100,さっそく調査内容、まとめておきます。<br>先輩、ありがとうございま
Event1,1,text01,"Thank you. This is the data on the Berserk<br>Enemy version of the Ceto Sadeenian, right?"
Event1,1,text02,"So even humanoid Draconians can turn into<br>Berserk Enemies, just like any other enemy.<br>It's kind of frightening to think about."
Event1,1,11_voice_NPC_5062_100,I'll get right on compiling this data into a<br>report. Thank you very much.
