section,group,id,text
Event1,0,text01,<%me>さん。<br>私を具現化したと思われる本物の私と<br>直接、話したいんですが……
Event1,0,11_voice_NPC_5532_104,どうも、本物の私が<br>私との接触を避けているような気が……<br>あれ以来、通信にも出てくれませんし。
Event1,0,text03,ですから、私と本物が<br>話さざるを得ない状況を作ることに<br>協力して欲しいんです。
Event1,0,11_voice_NPC_5532_100,どうするのかって？<br>クエストに連れていってもらえれば<br>本物がナビゲートしてくれる
Event1,1,text01,"<%me>, I'd like to <br>speak with the real me. The one who I <br>believe brought me into this world..."
Event1,1,11_voice_NPC_5532_104,But she clearly has no desire to talk to me.<br>I can't even get through to her on the comms.<br>I think she's avoiding me.
Event1,1,text03,So I'd like to ask you to create a situation in<br>which the two of us have no choice but to<br>confront each other.
Event1,1,11_voice_NPC_5532_100,"How? Well, if you just bring me out on a <br>quest with you, I'm sure the real Xiera will <br>chime in to guide offer he guidance!"
