section,group,id,text
Event1,0,11_voice_NPC_5062_101,ありがとうございます。<br>これがブーストエネミーになった<br>スパルガンのデータですね。
Event1,0,text02,地下坑道の機甲種もブーストエネミーに<br>なる……予想通りですが砂漠の機甲種と<br>比較すれば、何か違うのかも……
Event1,0,text03,いただいたデータ、もう少し分析<br>してみますね。先輩、どうも<br>ありがとうございました。
Event1,1,11_voice_NPC_5062_101,"Thank you. This is the data on the Berserk<br>Enemy version of the Spargun, right?"
Event1,1,text02,So even the automata in the Mines can become<br>Berserk Enemies. But they may differ somehow<br>from their Desert counterparts...
Event1,1,text03,This data merits further analysis.<br>Thank you very much for your help.
