section,group,id,text
Event1,0,text01,ガンナーは一日にしてならず。<br>特訓すればするほど、武器の扱いなどが<br>上達していくものよ。
Event1,0,11_voice_NPC_5057_100,最初は辛く、苦しいと思う特訓も<br>一つ一つ出来ることが増えるたびに<br>どんどん気持ちよくなっていく。
Event1,0,text03,そういう教え子を<br>私は何人も送り出してきた。<br>だから、貴方も安心して従いなさ
Event1,1,text01,"One cannot become a Gunner in a day.<br>The more you train, the better you'll get at<br>handling your armaments."
Event1,1,11_voice_NPC_5057_100,"It may be rough at first, but confidence<br>stems from capability--which, in turn,<br>comes with experience."
Event1,1,text03,I've led many a student in your position<br>to martial mastery. You need only relax<br>and trust in my instruction.
