section,group,id,text
Event1,0,text01,本当にとってきてくれたの？<br>やったっ、ありがとう！
Event1,0,text02,最初、フランカさんの要求を聞いた時は<br>どうしようー、って頭を抱えたんだけど<br>貴方に相談してみてよかったっ！
Event1,0,text03,これでバレンタインの準備も<br>最終段階！　あとは流行が来れば<br>きっと爆発的に、広まるはず……！
Event1,0,11_voice_NPC_5121_101,いつもいつも、ありがとね！<br>また何かあった
Event1,1,text01,You really got it?<br>Yeah! Thank you!
Event1,1,text02,"When Franca first asked about it,<br>I had no idea what I was gonna do.<br>I'm so glad I came to you!"
Event1,1,text03,"Now I'm in the final stages of<br>my Valentines prep! If I can just get people<br>interested, I'm sure it'll spread like a wildfire!"
Event1,1,11_voice_NPC_5121_101,I'm indebted to you as always.<br>I'll be in touch if I need anything else!
