section,group,id,text
CharaName,0,name01,エコー
CharaName,1,name01,Echo
Event1,0,text01,ふぅっ、これでおしまい……かな？<br>よかった、なんとかなったみたいね。
Event1,0,11_voice_NPC_5002_104,それにしても、すごいダーカーの数……<br>今回ので、少しでも減らせたなら<br>いいけど。
Event1,0,text03,それじゃ、戻りましょう。<br><%me>。
Event1,1,text01,"Whew... Is that about it? Great! We managed,<br>I guess. Somehow."
Event1,1,11_voice_NPC_5002_104,"Still, this is a crazy amount of Falspawn. <br>I hope we managed to reduce their <br>numbers a bit."
Event1,1,text03,"All right, let's head back, <br><%me>."
