section,group,id,text
Event1,0,text01,やあ、キミなら<br>受けてくれると思っていたよ。
Event1,0,11_voice_NPC_5009_104,この間の一件以来、ライトくんが<br>危ないだの何だのと口やかましくてね。
Event1,0,text03,キミが一緒に来てくれるのなら<br>彼も何も言うまい。
Event1,0,text04,それでは行くとしようか。<br>よろしく
Event1,1,text01,"Ah, I thought you'd accept this request."
Event1,1,11_voice_NPC_5009_104,"Ever since the recent incident, Wright just<br>won't stop blabbering on about danger <br>and all of that nonsense."
Event1,1,text03,If you were to accompany me... Well. Even he<br>couldn't complain about that.
Event1,1,text04,"Now, let us be on our way. <br>I'm counting on you."
