section,group,id,text
Event1,0,text01,マスター、ちょうどいいところに。<br>じつはわたくし、お願いがありますの。
Event1,0,11_voice_NPC_5570_105,エトワールの戦い方も固まって<br>きたと思うのですが、皆さまにしっかり<br>おもてなしできているのかが不安で……
Event1,0,text03,マスターでしたら、きっと素晴らしい<br>おもてなしができると思いますの！
Event1,0,text04,ですから、マスターのおもてなしを<br>ぜひ、わたくしに見せてください！<br>お願いします
Event1,1,text01,"Perfect timing, Master. I actually have a favor to ask of you..."
Event1,1,11_voice_NPC_5570_105,"While you seem to be getting the combat part of being an Étoile down, I worry about your ability to demonstrate proper hospitality."
Event1,1,text03,"But I just know you can be splendidly hospitable if you try, Master!"
Event1,1,text04,Which is why I wish to see just how hospitable you can be! Please!
