section,group,id,text
Event1,0,text01,おたくは寒さに強いからいいよな。<br>ついでに暑さにも強いんだろ？
Event1,0,11_voice_NPC_5052_104,まさに無敵じゃねーかよ！<br>オレもそんな体質に憧れるぜ……
Event1,0,text03,ま、オレの場合は体質以外にも<br>いろいろ問題はあるんだけどよ。
Event1,0,text04,ちっとはおたくの足元に及べるよう<br>しっかり見て勉強させてもらうぜ！
Event1,1,text01,"Good thing you can handle the cold. Actually, <br>I guess the heat's no sweat either, huh pal?"
Event1,1,11_voice_NPC_5052_104,You're basically invincible! Maybe one day I'll<br>be tough as nails like you are.
Event1,1,text03,Though I guess bein' tough's not the only <br>thing I gotta work on.
Event1,1,text04,I'm gonna watch and learn everything I can <br>that gets me one step closer to your level!
