section,group,id,text
CharaName,0,name01,オーザ
CharaName,1,name01,Oza
Event1,0,11_voice_NPC_5020_100,よし、こんなものだな。<br>良い練習になったと思うぞ。
Event1,0,text02,単騎での実力研鑽ももちろんだが<br>アークスとしては、連携行動も<br>おろそかにするわけにはいかない。
Event1,0,text03,それを忘れなければ大丈夫だ。<br>では、一度帰還するとしよう。
Event1,1,11_voice_NPC_5020_100,I think that's it. Nice work.
Event1,1,text02,"We ARKS operatives have to be able to <br>stand on our own feet, but we've got to <br>avoid tripping over each other's as well."
Event1,1,text03,"Remember that, it'll take you far. <br>Now, back to the ship!"
