section,group,id,text
Event1,0,text01,こんにちは、セラフィです！
Event1,0,11_voice_NPC_5158_100,<%me>さんは<br>ペットを育てていますか？
Event1,0,text03,ペットってとても可愛いですよね。<br>いろんな種類がいて、どの子も<br>育ててみたくなっちゃいます！
Event1,0,text04,今回は、ペットの連動機能について<br>耳寄りな情報をお持ちしました。<br>ぜひお聞きください
Event1,1,text01,"Hello, I'm Seraphi!"
Event1,1,11_voice_NPC_5158_100,"<%me>,<br>are you raising your pets witch care?"
Event1,1,text03,"Aren't they just darling? There are so many<br>kinds, and I just want to raise them all!"
Event1,1,text04,I've received some enticing info about pet<br>cross-compatibility. I do hope you'll listen!
