section,group,id,text
Event1,0,11_voice_NPC_5050_104,こちらは<br>解式ＰＡのストック上限拡張を<br>申請する試験となります。
Event1,0,text02,指定された「称号」を取得することで<br>解式ＰＡのストック上限が増加し<br>より活用しやすくなります。
Event1,0,text03,熟練の経験を求める課題ですが<br>貴方の実力なら不足ないでしょう。<br>報告をお待ちして
Event1,1,11_voice_NPC_5050_104,This exam will expand the Stock cap for Buildup Photon Arts.
Event1,1,text02,"By obtaining the designated title, your Buildup Photon Art Stock cap will increase, allowing you to make more use of them."
Event1,1,text03,"This challenge requires the experience of<br>a seasoned veteran, but I know you can<br>handle it. I anticipate your success."
