section,group,id,text
Event1,0,text01,よ、ようやく終わりましたわね……！<br>私、何度か昇天しかかりましたわ！
Event1,0,11_voice_NPC_5150_104,貴方様との探索は楽しいのですけれども<br>後半は全く付いていけませんでしたわ。
Event1,0,text03,まだまだ精進しなければなりませんね。<br>取り敢えず帰還いたしましょう。<br>干上がって
Event1,1,text01,It's... It's finally over! I was close to<br>kicking the bucket a few times there!
Event1,1,11_voice_NPC_5150_104,"It's fun going on expeditions with you and all,<br>but... towards the end I definitely couldn't<br>keep up with you at all."
Event1,1,text03,"I have to just keep giving my training my all.<br>In any case, let's head back. I'm about to<br>collapse into a pile of dust."
