section,group,id,text
Event1,0,11_voice_NPC_5054_101,うむ、やはり君は期待を裏切らないな。<br>完成度が一味も二味も違う。
Event1,0,text02,ワイヤードランス使い<%me><br>ここにあり！　といったところだな。<br>大いに誇りを持っていい。
Event1,0,text03,君ほどの慎重なスタイルならば<br>私より先に逝くことなど<br>考えられないな……
Event1,0,text04,私ももっと君の活躍を見守りたい。<br>ますます精進した
Event1,1,11_voice_NPC_5054_101,I knew you wouldn't let me down. No one else<br>quite matches up to your work.
Event1,1,text02,"Your work proclaims, <br>""I am <%me>,<br>master of the Wired Lance!""<br>That's right. Be proud."
Event1,1,text03,I doubt I'll outlive a fighter as capable as<br>you.
Event1,1,text04,I'm looking forward to seeing more of <br>your work. Focus on the fight ahead!
