section,group,id,text
Event1,0,11_voice_NPC_5121_100,おかえりなさいー！<br>現地の子たちから、配達再開の<br>連絡が入ったよ！　貴方のおかげだね。
Event1,0,text02,カカオ豆が届くのが待ちきれないよ！<br>品種と香りをこだわり抜いたカカオで<br>素敵なチョコレートにできるはず！
Event1,0,text03,さっそく試作を始めるよ！<br>またなにかあったらお願いするかも。<br>よろしくね
Event1,1,11_voice_NPC_5121_100,"Welcome back! The delivery kids said that<br>they're back on the delivery, and it's all<br>thanks to you."
Event1,1,text02,"I just can't wait for the cocoa beans to arrive!<br>They're high-quality, fragrant cocoa beans, so<br>I can make some wonderful chocolate!"
Event1,1,text03,"I'll start my trial run right away! But do stay<br>close, just in case I need you for anything else."
