section,group,id,text
Event1,0,11_voice_NPC_5052_107,お……おいおい<br>おたくマジで行くのかよ！？
Event1,0,text02,映像も見たけど<br>あの爪で切り裂かれたら<br>痛てーじゃ済まねえぞ！？
Event1,0,text03,それでも行くってんなら止めやしねぇ！<br>おたくの雄姿は、オレの瞳に<br>焼きつけておいてや
Event1,1,11_voice_NPC_5052_107,"Pal, hey... listen to me. Are you absolutely,<br>a hundred percent seriously gonna go!?"
Event1,1,text02,"I've seen pictures of those claws, pal.<br>You know what those can do to you?<br>""Ouch"" don't begin to cover it!"
Event1,1,text03,"If you still wanna go, be my guest! I'll <br>forever remember how you gallantly <br>strode off heroically to your doom."
