section,group,id,text
Event1,0,11_voice_NPC_5378_204,先日から続いている<br>ダーカーの大量発生に<br>対処するようにとのお達しよ。
Event1,0,text02,やることは簡単。<br>とにかくダーカーを沢山倒して<br>数を減らすだけ。
Event1,0,text03,少しでも多くのダーカーを<br>倒さなければならないから<br>貴方にも協力してほし
Event1,1,11_voice_NPC_5378_204,We've been tasked with containing the<br>sustained outbreak of Falspawn we've<br>experienced over the past several days.
Event1,1,text02,The job is simple: slay as many Falspawn<br>as you can to thin out their numbers.
Event1,1,text03,"The more we can eliminate, the better, so your<br>assistance would be a real boon."
