section,group,id,text
Event1,0,text01,やあ、マイフレンド！<br>困っているようだね！
Event1,0,11_voice_NPC_5242_101,大丈夫、僕には全てわかってるさ！<br>子供達の成長具合が、心配なのだろう？<br>それに、自分自身の成長のことも！
Event1,0,text03,……ああ、ああ！<br>みなまで言わないでくれマイフレンド！<br>大丈夫、僕が力になるさ！
Event1,0,text04,まずは、現状を知るために<br>君の愛しい子供達の成長ぶりを<br>僕に見せてくれな
Event1,1,text01,"Hello, mon ami!<br>You seem to be in quite the pickle!"
Event1,1,11_voice_NPC_5242_101,"Fret not, for I know all! You are concerned <br>about the growth of your babies, are you not?<br>And about your own growth as well!"
Event1,1,text03,"Yes, yes!<br>No need to talk to the others, mon ami!<br>Fear not! For I am here to help."
Event1,1,text04,"But first, I'd like to see how you've<br>progressed. May I take a look at how<br>your little darlings have grown?"
