section,group,id,text
CharaName,0,name01,エコー
CharaName,1,name01,Echo
Event1,0,text01,はぁっ、はぁっ……<br>や、やったよね？　倒せたんだよね？
Event1,0,11_voice_NPC_5002_101,はー、よかったぁ……<br>正直、すごく不安だったの。<br>なんか安心して、力が抜けちゃった。
Event1,0,text03,それじゃ長居は無用だし、帰りましょ。<br><%me>。
Event1,1,text01,Gah... Did we do it? Did we defeat it?
Event1,1,11_voice_NPC_5002_101,"Whew, thank goodness. Honestly, I was really<br>scared. I'm so relieved... and completely<br>drained, now."
Event1,1,text03,"Well, no need to hang around here anymore.<br>Let's get back, <%me>."
