section,group,id,text
Event1,0,11_voice_NPC_5055_101,ありがとうございます！<br>これが日食の発生過程……！
Event1,0,text02,アカデミーの人間として<br>相応しくない物言いかもしれませんが<br>何とも神々しさを感じさせますね。
Event1,0,text03,遥か昔、日食は、怪物が太陽を食べて<br>しまうのだと恐れられていたそうです。<br>今ならその気持ちもわかる気がします。
Event1,0,text04,ともあれ、これで依頼内容は完了です！<br>どうもありがとうございました
Event1,1,11_voice_NPC_5055_101,Thank you! So this is how a Solar <br>Eclipse works!
Event1,1,text02,"Perhaps this is inappropriate to say as a <br>member of the Academy, but it's almost <br>hard to believe this phenomenon ISN'T <br>divine in nature."
Event1,1,text03,"Stories tell that long ago, solar eclipses <br>were feared as a sign of monsters devouring <br>the  sun. Having observed one myself, I can <br>see why."
Event1,1,text04,"My musings aside, that marks your Order as<br>complete. Thank you very much!"
