section,group,id,text
Event1,0,text01,おつかれさま！<br>へっぽこぴーのアンタにしては<br>まずまずだったんじゃない？
Event1,0,11_voice_NPC_5056_104,でも私の見てきたアークスの中じゃ<br>まだ下から３番目くらいかな？
Event1,0,text03,私に言わせれば、アンタくらいじゃ<br>まだまだへっぽこぴーよ！
Event1,0,text04,もっともっと頑張って<br>難しいクエストに挑戦しなさい
Event1,1,text01,"Hey, nice work!<br>That was, like, three-quarters of the way to<br>halfway decent for a clown like you."
Event1,1,11_voice_NPC_5056_104,"You may have climbed up a rung on the ladder,<br>but you're still flailing around beneath the big<br>top, as far as I'm concerned."
Event1,1,text03,The point I'm trying to make here is that <br>you still aren't good for much beyond <br>low-level clownery.
Event1,1,text04,Work harder and take a crack at some <br>tougher quests!
