section,group,id,text
Event1,0,11_voice_NPC_5063_106,迫りくる巨体をものともせず<br>会心の一撃を角にお見舞いする……！<br>先生、お見事です！
Event1,0,text02,今後、フォードランと対峙したさいには<br>この方法で打ち破りたいと思います！
Event1,0,text03,先生、ご指導のほど<br>ありがとうございました！<br>またよろしくお願い
Event1,1,11_voice_NPC_5063_106,"Unflinchingly facing the specter of<br>double-horned death and lopping off the pointy<br>bit with a critical blow... Nicely done, Teach!"
Event1,1,text02,I hope I can pull off moves even HALF that<br>slick when it's my turn to face a Fodran!
Event1,1,text03,"I totally toot your tutelage, Teach!<br>Looking forward to learning more from you!"
