section,group,id,text
Event1,0,11_voice_NPC_5052_107,おいおい、最後に<br>とんでもねー隠しだまが<br>いやがったじゃねーか。
Event1,0,text02,何って？<br>ベガス・イリュージアとかいう<br>バカでかいエネミーだよ！
Event1,0,text03,あのスピードと、派手な攻撃は<br>さすがのオレも、ほんのちょびーっと<br>苦戦しそうな気がするわ。
Event1,0,text04,っつーわけで、おたくの本気を<br>見せてくれねーかなと<br>思うわけよ。
Event1,1,11_voice_NPC_5052_107,"Yeesh, that's a hell of an ace in the hole to<br>bust out right at the very end."
Event1,1,text02,What am I talkin' about? I'm talkin' about a<br>ginormous enemy called a Vegas Illusia!
Event1,1,text03,It's got serious speed and some flashy attacks.<br>I think it'd even throw ME for a loop.
Event1,1,text04,"So I was kinda hopin' you'd go in and do your<br>thing. Show off your best stuff, y'know?"
