section,group,id,text
Event1,0,11_voice_NPC_5061_104,ハッピーハーロウィーン！　ばぁー！<br>……うーん。なんか違うなぁ。<br>食べちゃうぞー！　オバケだぞー！
Event1,0,text02,あ、ごめんね。わたし、今回の<br>ハロウィンイベントでオバケ担当に<br>なったんだ。その練習をしてたの。
Event1,0,text03,でもまったくイメージが掴めなくて……<br>青白い雰囲気で、目が赤く光ってて<br>飛び回っているものを参考にしたいかも。
Event1,0,text04,そんな感じのエネミー、知ってるって？<br>それは渡りに船！　ねえお願い！<br>詳しく教えて！
Event1,1,11_voice_NPC_5061_104,"Happy Halloween! Boo!<br>No, that wasn't quite right. Um,<br>I'm gonna eat you! I'm a ghost!"
Event1,1,text02,"Oh, sorry. I'm supposed to be a<br>ghost for this year's Halloween<br>party, so I was practicing."
Event1,1,text03,But something is off. Maybe I should take<br>some hints from something blue-ish white<br>with glowing red eyes that floats around.
Event1,1,text04,"You know an enemy like that?<br>You're a lifesaver! Please, tell<br>me all about it!"
