section,group,id,text
Event1,0,11_voice_NPC_6010_106,あ、お帰りなさい！<br>えっ、アイディアを思いついた？<br>さっそく聞かせて！
Event1,0,text02,……ふんふん、卵で黄色くして<br>ラッピーに見えるように盛り付ける？
Event1,0,11_voice_NPC_6010_101,それいいよ！　それならみんな<br>ラッピーかと思ってびっくりするよ！<br>見た目のインパクトは最高だねっ！
Event1,0,text04,メインの盛り付けはこれで決まり。<br>貴方のアイディアのおかげだよ！<br>いつもありがとう！
Event1,1,11_voice_NPC_6010_106,"Welcome back! Oh? You've got an idea?<br>What are you waiting for, lay it on me!"
Event1,1,text02,"...I see, color some eggs yellow and make<br>it look like a Rappy?"
Event1,1,11_voice_NPC_6010_101,"That's a great idea! Everyone will be surprised<br>for sure! They'll think it’s a real Rappy, and it'll<br>look awesome!"
Event1,1,text04,I think I've got my main arrangement.<br>Thank you for the awesome idea!
