section,group,id,text
Event1,0,11_voice_NPC_5003_101,相棒、お疲れ！<br>そんな難しいことでもなかったな。<br>もっと早くにやればよかったよ。
Event1,0,text02,時間、取らせちゃってごめんな。<br>忙しかったんだろ？
Event1,0,text03,これ、取っといてくれよ。<br>タダってのも悪いし。
Event1,0,text04,また何か頼むことあるかもしれないけど<br>そのときは、よろしくな！
Event1,1,11_voice_NPC_5003_101,"Good going, partner!<br>That wasn't so bad, was it?<br>We probably should have done this forever ago."
Event1,1,text02,"Sorry for pulling you aside, though you've<br>gotta be busy, right?"
Event1,1,text03,"Here, let me make it up to you with this. Can't<br>have you wasting your time for nothing, yeah?"
Event1,1,text04,"I'm sure I'll probably bug you again sometime,<br>so sorry in advance!"
