section,group,id,text
Event1,0,text01,君が身につけてきた技術は本物だ。<br>君にとってソードは<br>唯一無二の相棒となったことだろう。
Event1,0,11_voice_NPC_5054_100,今回の課題は、これまでの<br>総仕上げとも言うべき内容だ！<br>一筋縄では行かないぞ。
Event1,0,text03,では始めるとしよう！<br>見せてくれたまえ、君の成
Event1,1,text01,"No one can deny your skill now. You and that<br>Sword aren't just wielder and weapon now,<br>you're two halves of a whole."
Event1,1,11_voice_NPC_5054_100,"Your next assignment will touch on everything<br>you've learned up to this point. Basic everyday<br>moves won't be enough, operative!"
Event1,1,text03,"Now let's begin! Show me what all your work's<br>been for, operative!"
