section,group,id,text
Event1,0,11_voice_NPC_5021_100,うむ、よろしい！<br>やはり君は優秀なアークスだな。<br>杞憂で済んでよかった。
Event1,0,text02,所持できる物品の数は限られる！<br>しかし度々倉庫を利用し<br>整理していれば問題はない！
Event1,0,text03,未拡張のアイテム倉庫では<br>２００個が関の山だが……拡張すれば<br>さらに使い勝手も良くなるぞ！
Event1,0,text04,いいか、私の利用する倉庫
Event1,1,11_voice_NPC_5021_100,"Now THAT'S what I like to see, kid! You're a<br>regular ol' ace of an ARKS! Gotta say, this<br>old man has a LOT less on his mind, now."
Event1,1,text02,"You can only hold so many items at once! <br>But if you use the Storehouse and manage <br>things properly, you shouldn't have a problem."
Event1,1,text03,"An unexpanded Storehouse can hold a <br>whopping two hundred items, but if you <br>expand it, you'll get even more space!"
Event1,1,text04,"Dagnabbit, back in the old days,<br>you could cram practically yer whole<br>house into a Storehouse..."
