section,group,id,text
Event1,0,text01,なんつーか、おたくの前じゃ<br>大小とか関係ねーんだな……
Event1,0,11_voice_NPC_5052_101,やっぱりおたくのバトルセンスは<br>抜きん出てるもんがあるな！
Event1,0,text03,他の攻略法は要らねーな！<br>おたくの戦い方だけで十分だぜ。<br>オレも本気出してくるわ！
Event1,0,text04,よっし早速、行ってくるわ。<br>今回もありがとな！<br>たまにはゆっくり
Event1,1,text01,"It's like... size doesn't matter to you at all,<br>pal."
Event1,1,11_voice_NPC_5052_101,You got the most amazing battle instincts in<br>the whole flippin' universe!
Event1,1,text03,"No other strategy needed! Your fighting style<br>is plenty. I'm gonna go all out, too!"
Event1,1,text04,"All right, I'm off. Thanks again! Take it easy<br>once in a while, yeah? Gotta get that ""you""<br>time in."
