section,group,id,text
Event1,0,text01,お帰りなさい！<br>これがあの大きな鉄の塊が<br>遺した物なのね。
Event1,0,11_voice_NPC_5051_101,歪みのない長筒。<br>これだけの厚みと剛性があれば<br>かなりの熱にも耐えられそう。
Event1,0,text03,大きなオーブンの煙突とかに<br>できるかもしれないし……<br>何か新しい物が作れる気がしてきたわ。
Event1,0,text04,どうもありがとう！<br>また、お願いしてもいい
Event1,1,text01,Welcome back!<br>So this is what that giant<br>metal mass left behind.
Event1,1,11_voice_NPC_5051_101,"A long, straight cylindrical object.<br>It's thick and sturdy enough that<br>it can probably withstand lots of heat."
Event1,1,text03,This could make a great chimney for a big <br>oven. Yeah... I'm feeling inspired now! <br>Time to cook up a little something new!
Event1,1,text04,"Thanks a lot! Come by and help out again<br>sometime, would you?"
