section,group,id,text
Event1,0,text01,<%me>！<br>お帰りなさい！　アンタには<br>油断なんてものは無縁だった？
Event1,0,11_voice_NPC_5056_109,でも、そう言って気を抜いて<br>サヨウナラしちゃう人もいるんだから<br>気をつけなきゃダメよ？
Event1,0,text03,……まあ、今回の様子を見るに<br>大丈夫だとは思うけど、さ。
Event1,0,text04,ま、なにはともあれ無事でよかった！<br>これからもよろしくね！<br><%me
Event1,1,text01,"<%me>, <br>welcome back! Guess I didn't have to worry <br>about you getting sloppy after all."
Event1,1,11_voice_NPC_5056_109,Remember that even the mighty may fall if they<br>rest too heavily on their laurels.<br>Stay sharp out there.
Event1,1,text03,"But from what I've seen, you'll probably be<br>okay."
Event1,1,text04,"Anywho, another day, another slay!<br>See you around, <br><%me>!"
