section,group,id,text
Event1,0,11_voice_NPC_5053_101,なんということだ！<br>これはラッピーの皇帝とも呼ぶべき<br>存在ではないか！
Event1,0,text02,……いや、まだそう<br>結論付けるのは早計か……<br>もう少し検証を進めねば。
Event1,0,text03,ああ、失礼。<br>いつになく興奮してしまった。<br>まずは、キミへの礼が先だな。
Event1,0,text04,ありがとう。<br>謝礼を受け取ってほしい。<br>これからも、協力をよろしく頼む！
Event1,1,11_voice_NPC_5053_101,My goodness! This creature could very well be<br>called King of the Rappies!
Event1,1,text02,Ahem. Perhaps that's premature conclusion <br>on my part. This requires more verification.
Event1,1,text03,Do pardon me. It's not like me to grow so<br>excited. Allow me to thank you.
Event1,1,text04,"Here, this is a token of my gratitude.<br>I hope our working relationship will be a long<br>and fruitful one."
