section,group,id,text
Event1,0,text01,ありがとう……<br>本当に助かったわ。
Event1,0,11_voice_NPC_5378_100,他人の戦い方を見ていると<br>自分一人で考えていては<br>気がつけないことが見えてくるわね。
Event1,0,text03,まだまだ見直さないといけない点が<br>あるみたい…
Event1,1,text01,Thank you. I really appreciate this.
Event1,1,11_voice_NPC_5378_100,Watching others fight helps me pick up<br>on things that never would've occurred<br>to me on my own.
Event1,1,text03,"And today, I picked up on quite a few things<br>I could stand to improve. It seems I have my<br>work cut out for me."
