section,group,id,text
Event1,0,text01,あ、マスター。<br>お疲れさまですの。
Event1,0,11_voice_NPC_5570_100,さっそく、エトワールの<br>次の昇段試験が許可されましたわ。<br>マスターなら、らくらく突破できますの。
Event1,0,text03,合格すればさらにエトワールで<br>ご活躍いただけるようになりますので<br>ぜひ、ご挑戦くださいで
Event1,1,text01,"Ah, Master. A pleasure to see you."
Event1,1,11_voice_NPC_5570_100,The next Étoile promotion exam is now available.<br>It should be an absolute breeze for you.
Event1,1,text03,"If you succeed, you will be able to expand your capabilities as an Étoile. I wish you good luck!"
