section,group,id,text
Event1,0,text01,キミは、ガル・グリフォンという<br>エネミーを知っているだろうか？
Event1,0,11_voice_NPC_5053_100,長らく、謎に包まれた存在だったのだが<br>近頃、このエネミーの目撃情報が<br>急増しているようなんだ。
Event1,0,text03,ぜひとも、その生態情報を入手したい！<br>それと、グリフォン・ゲルスという<br>希少種も調査対象とさせてほしい。
Event1,0,text04,このいずれかのエネミーと交戦した際の<br>データを提供してもらえないだろうか？<br>よろしく
Event1,1,text01,Do you know of an enemy called Gal Gryphon?
Event1,1,11_voice_NPC_5053_100,"It has been shrouded in mystery for a long<br>time, but recent eyewitness reports appear to<br>be rising rapidly."
Event1,1,text03,I must have data on the ecosystem of this<br>creature! I would also require an investigation<br>of the rare species named Gryphon Gehls.
Event1,1,text04,Could you supply me with the data I desire by<br>doing battle with either of these foes? I'm<br>counting on you.
