section,group,id,text
Event1,0,text01,それなりに経験をつんできたアンタなら<br>このぐらいカンタンでしょ？<br>さくさくっと集めてきてよね！
Event1,0,text02,凍土の原生種エネミーが<br>持ち歩いてるって話だから<br>実力がものをいう依頼よ？
Event1,0,11_voice_NPC_5056_100,そういう意味で、アンタにうってつけ！<br>それじゃ、よ
Event1,1,text01,"With all of your experience, this should be cake<br>for you, right? Go scrounge a bunch up!"
Event1,1,text02,"Tundra sylvants carry the stones in question, so<br>this Order calls for some serious chops."
Event1,1,11_voice_NPC_5056_100,"Which is where YOU come in! Hop to it, now!"
