section,group,id,text
Event1,0,text01,<%me>さん<br>ありがとうございました！
Event1,0,text02,淡い色の花弁がフワフワと舞う……<br>想像以上に美しいものでした。
Event1,0,11_voice_NPC_5055_100,惑星ハルコタン、まだまだ不思議な<br>現象がたくさんありそうですね。
Event1,0,text04,まだまだ知れることがたくさんあって<br>嬉しい限りです。<br>またよろしくお願い
Event1,1,text01,"Thank you so much, <br><%me>!"
Event1,1,text02,Pastel petals frolicking fleetingly... It is<br>more beautiful than I dared imagine.
Event1,1,11_voice_NPC_5055_100,I'm sure Harukotan hides many more <br>mysterious phenomenon.
Event1,1,text04,The mere thought that there is still so much to<br>learn fills me with excitement. I hope you will<br>come to my aid again!
