section,group,id,text
Event1,0,text01,あら、貴方でしたか。<br>首尾はいかがでしょうか？
Event1,0,text02,ふむ……私の思っていた以上に<br>この結晶石は、素晴らしい代物ですね。<br>最高級の砥石と言われるのも納得です。
Event1,0,text03,私にとって、武器たちは<br>最も信頼できる仲間ですので……<br>これで感謝を伝えたいと思います。
Event1,0,text04,ありがとうございました。<br>貴方のおかげで、私のバトルライフが<br>一層充実したものとなるでしょう。
Event1,0,text05,いつか、貴方とも<br>一緒に戦えたら嬉しい限りです。<br>そのために、日々精進いたします
Event1,1,text01,"Ah, it's you. How fairs your hunt?"
Event1,1,text02,"Hmmm, yes, this crystal is more wondrous than I'd imagined. I can see why it is called the ultimate whetstone."
Event1,1,text03,"To me, my weapons are my most trusted partners. I wish to convey my gratitude to them with this."
Event1,1,text04,Thank you very much. Your efforts have certainly improved my combat capabilities.
