section,group,id,text
Event1,0,11_voice_NPC_5053_101,おぉ……すばらしい！<br>これが、文献に記されていた<br>伝説のエネミーとの戦いの記録！
Event1,0,text02,詳しくは、徹底的な解析が必要だが<br>このデータが大きな手がかりと<br>なることは間違いない。
Event1,0,text03,功績に見合ったものでは<br>ないかもしれないが<br>謝礼を受け取ってほしい。
Event1,0,text04,まだまだ、世界には未知なる存在が<br>無数に潜んでいるだろう。<br>今後とも、力添えをお願いする
Event1,1,11_voice_NPC_5053_101,Yes... Magnificent! Footage of a battle with a<br>legendary enemy described in old records!
Event1,1,text02,"I will need to thoroughly analyze it to learn<br>more, but I'm certain this data will be a great<br>lead."
Event1,1,text03,"It may not be equal compensation for your<br>achievements, but you have my gratitude."
Event1,1,text04,Countless unknown beings are surely hiding in<br>this universe yet. I will request your<br>assistance again!
