section,group,id,text
Event1,0,text01,いい感じだったね、本当！<br>やっぱり一緒に来てよかったよ！
Event1,0,11_voice_NPC_5087_101,高低差のあるところでも<br>ちゃんと戦っていけたね。<br>いやー、成長を実感できるね！
Event1,0,text03,きっちり終わってよかったね！<br>さ、
Event1,1,text01,That was everything I hoped for! I'm so glad I<br>teamed up with you!
Event1,1,11_voice_NPC_5087_101,"That was great, how we handled the mix <br>of high and low ground and kept on <br>fighting. Can't you just taste the <br>progress we're making?"
Event1,1,text03,We sure tied a bow on that! <br>Time to head home.
