section,group,id,text
Event1,0,text01,おかえりなさい！<br>戻ってくるの、待ってたよー！
Event1,0,text02,悪い敵をたっくさん<br>やっつけてくれたんだね！
Event1,0,11_voice_NPC_5061_101,これで手伝ってくれる子たちも<br>戻ってこられそうだよー。<br>本当にありがとう！
Event1,0,text04,準備を進めるね！<br>また、協力してくれると嬉しいな。
Event1,1,text01,Welcome back!<br>I was waiting for you!
Event1,1,text02,You sure did take out a lot of enemies!
Event1,1,11_voice_NPC_5061_101,And all the kids that went out to fight have<br>come back. Thank you so much!
Event1,1,text04,We can move ahead with the preparations!<br>I hope you'll be willing to lend a hand again.
