section,group,id,text
Event1,0,text01,センパイ、ありがとな。<br>いつも頼ってばかりで悪い。<br>……それと、ありがとう。
Event1,0,text02,それにしても相変わらず<br>すごい動きだよな。<br>いまだに追いつける気が全然しない。
Event1,0,11_voice_NPC_5091_100,やっぱりセンパイが一番なんだなって<br>戦ってる姿を見て思ったよ。
Event1,0,text04,だから、さ。<br>これからも色々とおれに教えてくれよ。<br>……よろしく
Event1,1,text01,"Thanks, boss.<br>And sorry to bug you with this stuff.<br>Seriously, thank you."
Event1,1,text02,"Gotta say, your moves out there were HOT.<br>How am I ever supposed to catch up?"
Event1,1,11_voice_NPC_5091_100,"There's nobody alive who fights like you do,<br>and watchin' ya just drove that home."
Event1,1,text04,"Doesn't mean I can't try, though! So keep on<br>showin' me the ropes, boss! Thanks again."
