section,group,id,text
Event1,0,text01,こんにちは、セラフィです。<br>来てくださって嬉しいです！
Event1,0,11_voice_NPC_5158_100,今回は、新機能<br>「ＰＳＯ２ｅｓ倉庫」について<br>ご紹介いたします！
Event1,0,text03,『ＰＳＯ２ｅｓ』と『ＰＳＯ２』を繋ぐ<br>すごく便利な倉庫なんですよ！
Event1,0,text04,内容をご紹介いたしますので<br>オーダーを受注後に<br>ぜひ、私に話しかけてくださいね。
Event1,1,text01,"Hello, Seraphi here. I'm so glad you came!"
Event1,1,11_voice_NPC_5158_100,I'm here to go over a brand new function:<br>the PSO2es Storehouse!
Event1,1,text03,It's a super-handy storehouse that connects<br>PSO2es and PSO2!
Event1,1,text04,"I'll tell you all about it once you accept the<br>order, so please do so and come talk to me<br>right away!"
