section,group,id,text
Event1,0,11_voice_NPC_5053_101,おお……待っていたぞ！<br>スカルバファローの希少種情報<br>確かに受け取ったよ。
Event1,0,text02,希少種は、まだまだ謎多き存在だが<br>これで、また一歩<br>真実へと近づけそうだ……
Event1,0,text03,まだまだ、多くのエネミーのなかに<br>希少種が潜んでいるようだ。
Event1,0,text04,これからも我々の研究に<br>力を貸してくれたまえ。<br>よろ
Event1,1,11_voice_NPC_5053_101,"Ah, you're back! I've received your data on the<br>rare Skull Buffalo subspecies."
Event1,1,text02,"This species is strange indeed, but your data<br>brings us one step closer to discovering the<br>truth behind them."
Event1,1,text03,There are still many rare subspecies <br>to be found among your the typical <br>enemies you face.
Event1,1,text04,I would be delighted if you would continue to<br>aid me in my research. Don't let me down.
