section,group,id,text
Event1,0,11_voice_NPC_5053_100,この依頼を出すにあたり<br>真っ先にキミの顔が思い浮かんだよ。
Event1,0,text02,この難しい調査を頼めるのは<br>キミをおいて他に考えられない。
Event1,0,text03,キミなら必ずやり遂げてくれると<br>信じている。どうか全力を尽くして<br>科学の発展に寄与し
Event1,1,11_voice_NPC_5053_100,Yours was the first face that came to mind <br>when I considered potential applicants.
Event1,1,text02,You're the only person I could think of to help<br>with a survey this challenging.
Event1,1,text03,I'm sure you'll be able to see it through.<br>Please invest your efforts fully.<br>This is for　the sake of science.
