section,group,id,text
Event1,0,text01,おそらくはいつものように凶暴化……<br>身体能力強化だと思うんですが<br>調べてみないことにはわかりません。
Event1,0,11_voice_NPC_5063_100,わたしも行って見てみるつもりです。<br>先輩も、よければお願いします。
Event1,0,text03,いつもいつも手伝ってもらってばかりで<br>本当に申し訳ないのですが……<br>先輩しか、頼れる人いなくて……
Event1,0,text04,どうか、よろしくお願
Event1,1,text01,"The Berserk Enemy should be extra <br>aggressive. It may be physically stronger, but <br>we won't know unless we go investigate."
Event1,1,11_voice_NPC_5063_100,I intend to go see for myself. I hope you'll<br>come as well.
Event1,1,text03,I really am sorry to ask for your help so often.<br>There's just no one else I can turn to.
Event1,1,text04,I really appreciate this. Truly.
