section,group,id,text
Event1,0,text01,あの鎧野郎……デカすぎんだろ！<br>まるで自分が小物つーか豆粒にでも<br>なった気分だったぜ！
Event1,0,11_voice_NPC_5052_104,武器はデケーわ、鎧は堅いわ<br>氷みたいなんを飛ばしてくるわで<br>マジ勘弁って感じだぜ……
Event1,0,text03,も、もちろんオレが本気を出せば<br>倒せると思うんだけどよ……<br>一応、攻略法は知っておきてーし？
Event1,0,text04,じゃあオレはモニター越しで<br>ばっちり見てるからよ！<br>頼ん
Event1,1,text01,That big armored jerk! How huge can ya <br>possibly get!? Makes ya feel like you've been <br>shrunk down to a puny ant or something.
Event1,1,11_voice_NPC_5052_104,"Its weapon's honkin' huge, its armor's pudding-<br>thick, and it sends ice or somethin' flyin' at<br>ya. It's like, gimme a break already."
Event1,1,text03,"I...I mean, if I got serious, I could totally <br>drop one. But just in case, maybe someone <br>could  show me a good strategy before I <br>go toe-to-toe?"
Event1,1,text04,"Okay, I'll be watching your every move through<br>the monitor! You got this!"
