section,group,id,text
Event1,0,text01,大変！　大変！<br>クリスマスパーティーの開催予定地に<br>ダーカーが大発生中！
Event1,0,text02,特に、普段は凍土では見かけない<br>玩具系のダーカーが<br>たくさん目撃されてるみたいなの！
Event1,0,11_voice_NPC_5077_104,賑やかな雰囲気に誘われて<br>集まってきちゃってるのかなぁ……
Event1,0,text04,このままじゃ、会場の設置物に<br>いたずらされちゃう！<br>貴方の力で追い払ってもらえな
Event1,1,text01,This is awful!<br>A hoard of Falspawn has<br>taken over the party area!
Event1,1,11_voice_NPC_5077_104,Maybe all the hustle<br>and bustle drew them in.
Event1,1,text04,"At this rate, all our decorations<br>are going to be messed up!<br>Could you drive them off for us?"
