section,group,id,text
Event1,0,text01,お帰りなさいっ！　ど、どうだった？<br>ラスベガスコーンは手に入った！？
Event1,0,text02,それ、それ！　良かったよー！<br>今回ばかりはもう駄目かと思ったよ。<br>すぐ下ごしらえに取り掛かるからね！
Event1,0,11_voice_NPC_6010_101,もう何も問題ないよ！<br>手伝ってくれて、ありがとう！<br>今度こそゆっくり休んでね
Event1,1,text01,Welcome back! How'd it go?<br>You got the Las Vegas Corn?!
Event1,1,text02,"Yep, that's it! Oh, thank goodness! I really<br>thought I was out of luck this time. I'll get<br>started on the prep immediately!"
Event1,1,11_voice_NPC_6010_101,Now everything's taken care of! Thanks for saving<br>my bacon again. Go take a well-earned rest!
