section,group,id,text
Event1,0,text01,ブーストエネミーのフォードラン。<br>何度か戦ったことありますけど<br>正直、苦手なんです。
Event1,0,text02,ブーストエネミーのことが苦手だから<br>しっかり勉強して対策しようって<br>思ったのがはじまりでしたし……
Event1,0,11_voice_NPC_5062_100,っとと、脱線しました。<br>今日は勉強させてもらいます。<br>よろしくお願いしま
Event1,1,text01,"I've fought Berserk Fodran before, but to be<br>honest, I'm not very good at it."
Event1,1,text02,"I'm not too good with Berserk Enemies. <br>So I thought, I should learn by example and <br>come up with a plan of attack, and..."
Event1,1,11_voice_NPC_5062_100,Oops... Pardon my digression. I'm hoping to<br>learn a lot from you today.
