section,group,id,text
Event1,0,11_voice_NPC_5054_101,うむ、やはり君は期待を裏切らないな。<br>完成度が一味も二味も違う。
Event1,0,text02,パルチザン使い<%me><br>ここにあり！　といったところだな。<br>大いに誇りを持っていい。
Event1,0,text03,頂点を極めた者として、君の名を<br>披露する日が来るかもしれない。
Event1,0,text04,教導官冥利に尽きるというものだ。<br>ますます精進
Event1,1,11_voice_NPC_5054_101,I knew you wouldn't let me down.<br>No one else has　quite the same flair.
Event1,1,text02,"Your work proclaims, <br>""I am <%me>, <br>master of the Partisan!""<br>That's right. Be proud."
Event1,1,text03,"Y'know, the day may come when I pronounce <br>you to be the one who's summited that peak."
Event1,1,text04,"That's the greatest honor I can imagine as your<br>Instructor. Focus harder, aim higher!"
