section,group,id,text
Event1,0,text01,黒ノ領域、ありゃハンパねー場所だな。<br>足を踏み入れた瞬間<br>やべー所だってわかったぜ！
Event1,0,11_voice_NPC_5052_108,オレのアークスとしての直感っつーの？<br>それがビビっと来て、戻ってきたわけ！<br>逃げてきたわけじゃねえからな！
Event1,0,text03,で、報告もすんだわけだし？<br>これからもう一度行ってみようと<br>思ってんだけど……
Event1,0,text04,その前に、参考までにおたくが<br>どう戦うのか見ておきてーなと。<br>ちょっくら、行ってきてくれねーか？
Event1,1,text01,That Twilight Province place is serious<br>business. The second I stepped foot in there I<br>knew the pain train was comin'!
Event1,1,11_voice_NPC_5052_108,"Maybe it was, like, my intuition as an ARKS<br>operative? Anyway, I got scared stiff and came<br>back here! Not that I ran away or nothin'!"
Event1,1,text03,"So, I reported what I saw 'n all, and now I'm<br>thinkin' about headin' back there."
Event1,1,text04,"But first I wanna see how you fight, for<br>reference and all that jazz. Wouldja go pop<br>your head in there?"
