section,group,id,text
Event1,0,text01,なあなあ、おたくの交戦履歴見てたら<br>魔物種とかいう知らねーエネミーが<br>登録されてたんだけどよ……
Event1,0,11_voice_NPC_5052_100,また、おたくは<br>オレ達の知らねーところで<br>厄介事に首つっこんでたりするわけ？
Event1,0,text03,事情は詳しく詮索しねーけど<br>オレとしてはこのエネミーが<br>何なのか気になってるわけよ。
Event1,0,text04,コイツらとの戦闘データ<br>オレにも見させてもらえねーかな？<br>な
Event1,1,text01,"Looking through your engagement history, <br>I found these weird enemies called <br>supernaturals or somethin'?"
Event1,1,11_voice_NPC_5052_100,You stickin' your nose into trouble behind our<br>backs again?
Event1,1,text03,"Look, I ain't about to pry into what you do <br>on your own time, I just wanna know what's <br>up with these enemies."
Event1,1,text04,"So could you hook me up with some combat <br>data on these things, be a pal?"
