section,group,id,text
Event1,0,11_voice_NPC_5051_101,ありがとう！<br>すっごい頑丈そうな砲身ね。<br>うん、これならいい器具になりそう！
Event1,0,text02,あ、こうしちゃいられないわ。<br>早くこれを調理器具に加工して<br>もらわないと！
Event1,0,text03,そうそう、お礼も渡さなきゃ……<br>じゃあ、またね
Event1,1,11_voice_NPC_5051_101,Thanks! These are some sturdy gun barrels for<br>sure. Ought to make fine utensils!
Event1,1,text02,"Guess I should quit standing around and get to<br>making myself some good, sturdy utensils."
Event1,1,text03,"Oh, right, your reward! Here you go.<br>Come back soon!"
