section,group,id,text
Event1,0,text01,……遊園地でいいこと思いついたの！<br>夢いっぱいのショーをイベントでやったら<br>きっと盛り上がると思うんだ！
Event1,0,text02,聞いた話なんだけど<br>気持ちが引き込まれるようなショーには<br>大きな動きをつけるといいんだって！
Event1,0,11_voice_NPC_5097_104,どんなのがいいのかな？<br>お芝居みたいなポーズとか<br>腕を振り回す動作とか……？
Event1,0,text04,参考になりそうなものがほしいから<br>手伝ってくれないかなっ！　お
Event1,1,text01,I was walking around the amusement <br>park when I got an idea! I bet the people <br>would love an exciting show that captures <br>their imagination!
Event1,1,text02,"And from what I've heard, the best way to <br>tug at an audience's heartstrings is motion!"
Event1,1,11_voice_NPC_5097_104,But what KINDS of motion? Dramatic poses?<br>Performers swinging their arms around?
Event1,1,text04,"If you're up for helping, I could really use<br>some reference material. Pretty please?"
