section,group,id,text
Event1,0,text01,今回の新年祭では<br>ちょっと思い切ったアトラクションを<br>やってみたいと思っているの！
Event1,0,text02,それはね……<br>新年を祝う、ド派手なギミック！<br>やっぱり派手にお祝いしたいもんね！
Event1,0,11_voice_NPC_5121_104,でも、ネタが思いつかないのよね。<br>例えば、大きな建物が動いちゃうとか？<br>そんなの難しいか……
Event1,0,text04,え、大きな動くお城に心当たりがある？<br>ホント？　じゃ、参考にしたいから<br>ちょっと調べてきてもらっていいか
Event1,1,text01,I'm thinking of going BIG for the attractions<br>at this year's New Year's Festival!
Event1,1,text02,"I want to celebrate in a bold way, y'know?<br>Do something wild to ring in the new year!"
Event1,1,11_voice_NPC_5121_104,"Not that I have any concrete ideas... Maybe<br>I could MOVE a huge building somehow!? <br>Wait, no, that sounds like it'd be really hard..."
Event1,1,text04,"Huh? You actually know of a big, moving <br>castle? Really? Could you get some info <br>on that for me to use as reference?"
