section,group,id,text
Event1,0,11_voice_NPC_5011_101,おお、見事なもんじゃな。<br>格段に腕を上げたようじゃのう。
Event1,0,text02,うむ、いいぞいいぞ。<br>お主の努力に敬意を表して<br>贈り物をやろう。
Event1,0,text03,今後も、努力を怠らずに<br>その腕を磨いていって欲しいんじゃ。<br>応援しておる
Event1,1,11_voice_NPC_5011_101,Oho... magnificently done.<br>There's certainly a marked difference.
Event1,1,text02,"Hm, yes. Very good.<br>I'll give you a gift to express my utmost<br>respect for all your hard work."
Event1,1,text03,"I hope you'll continue to hone your skills while<br>resisting the urge to slack off.<br>I will be here, urging you on."
