section,group,id,text
Event1,0,text01,「ヴォル・ドラゴンの牙」はじっくり<br>煮込むと、ほどよく酸味が出るから<br>お肉がやわらかーくトロけるはずよ。
Event1,0,11_voice_NPC_5051_100,隠し味としてもピッタリね。<br>きっと革新的な料理が<br>できあがるに違いないわ！
Event1,0,text03,これがうまくいけば<br>料理の可能性が<br>一気に広がると思うのよね！
Event1,0,text04,ね、ね、私の夢がかかってるの！<br>どうかよろしくね！<br>できるだけいい状
Event1,1,text01,Stewing in some Vol Dragon fangs brings out a<br>gentle bitterness and makes the meat so<br>tender it just melts in your mouth!
Event1,1,11_voice_NPC_5051_100,It adds the perfect undertone! This dish is<br>gonna revolutionize the whole cooking world!
Event1,1,text03,"If we succeed here, we'll blast open whole new<br>realms of kitchen possibilities!"
Event1,1,text04,"Listen, my dreams are on the line here!<br>So... really try as hard as you can to bring<br>the goods back in good shape!"
