section,group,id,text
Event1,0,11_voice_NPC_5055_104,これが黒い粒子……<br>何でしょう、これ……<br>禍々しいとでもいうんでしょうか。
Event1,0,text02,気象の変化と<br>直接関係があるかはわかりませんが<br>とにかく解析に回してみます。
Event1,0,text03,これで依頼内容は完了です。<br>どうもありがとうござい
Event1,1,11_voice_NPC_5055_104,So THESE are black particles. Fascinating.<br>What ARE they? Am I supposed to <br>feel... menaced?
Event1,1,text02,"It's too early to say if they're directly<br>connected to the climatic changes of late, but<br>I'll analyze them and see what I come up with."
Event1,1,text03,That marks your Order as complete.<br>Thank you very much!
