section,group,id,text
Event1,0,11_voice_NPC_5052_101,おう！　戻ってきたみたいだな。<br>ボクシング野郎との戦いっぷり<br>バッチリモニターさせてもらったぜ！
Event1,0,text02,さすがに、あんだけすばしっこいと<br>おたくでも追いかけるのが<br>ちーっと大変そうだったな。
Event1,0,text03,まあ、おかげで倒し方はわかったんで<br>さっそくブッ倒しに行ってくるわ。<br>サンキューな！
Event1,0,text04,しっかし、あの動き……どっかで<br>見たことある気がするんだよなぁ。<br>龍族じゃなくてさ……何だっけな
Event1,1,11_voice_NPC_5052_101,"Hey, glad to see you back. I got some good<br>footage of you goin' twelve rounds against<br>that big boxer!"
Event1,1,text02,That thing moved like it ate lightning and<br>crapped thunder. Thought it had you on <br>the ropes for a second there!
Event1,1,text03,"But now I know how to beat one, and that's <br>just what I'm gonna do. Thanks!"
Event1,1,text04,"Still, coulda sworn I've seen those moves<br>before... and not on a Draconian..."
