section,group,id,text
CharaName,0,name01,エコー
CharaName,1,name01,Echo
Event1,0,text01,……そういえば、きみと<br>初めて会ったのは、ナベリウスでの<br>ダーカー大量発生の時だったよね。
Event1,0,11_voice_NPC_5002_102,ち、遅刻のことは忘れて！<br>もうっ、あの時ゼノが余計なこと<br>言うから……
Event1,0,text03,ほらっ、早く行くわよ！
Event1,1,text01,"Hey, come to think of it, we first met on<br>Naverius during that Falspawn outbreak, huh?"
Event1,1,11_voice_NPC_5002_102,"Just... forget about the fact that I<br>was late, okay!? Ugh, Zeno just couldn't keep<br>his mouth shut back then."
Event1,1,text03,"C'mon, let's get going!"
