section,group,id,text
Event1,0,text01,現在、特定の区域に<br>敵性反応が集中的に発現する<br>現象が確認されています。
Event1,0,11_voice_NPC_5050_104,その対策として<br>隔離領域を展開し、対応をしていますが<br>簡易的なもので長くはもちません。
Event1,0,text03,そこで、短時間のうちに<br>これら多数のエネミーを殲滅できる<br>実力を持つアークスに依頼をしています。
Event1,0,text04,今の貴方にとっては<br>容易い任務かも知れませんが<br>よろしくお願
Event1,1,text01,"At the present moment, we've verified that<br>the enemy is gathering in a certain region."
Event1,1,11_voice_NPC_5050_104,"As a countermeasure, we'd like to isolate that<br>area and deal with them, but that strategy <br>won't hold for long."
Event1,1,text03,We are requesting the help of skilled ARKS<br>operatives to annihilate the throng of<br>enemies as quickly as possible.
Event1,1,text04,"It may be a simple assignment for you,<br>but I hope you will accept it nonetheless."
