section,group,id,text
Event1,0,text01,今までは広い場所で訓練していました。<br>ですが、地下坑道は<br>狭い通路を進まなければなりません。
Event1,0,text02,そういった狭い場所で戦う経験が<br>私にはまだまだ乏しいんです。<br>もちろん、それ以外もですけどね！
Event1,0,11_voice_NPC_5150_100,ですから、貴方様に<br>ご一緒して頂けると<br>とても心強いですわ。
Event1,0,text04,是非是非、今回も<br>宜しくお願いいた
Event1,1,text01,"Until now, we've trained in wide open areas.<br>Now we need to learn how to advance in<br>narrow passages like the Underground Shafts."
Event1,1,text02,"I don't have much experience fighting in<br>cramped places like that yet, either…<br>Well, actually, there are a lot of things I<br>haven't experienced!"
Event1,1,11_voice_NPC_5150_100,Which is why I would feel SO much better if<br>you accompanied me.
Event1,1,text04,"Well, if another opportunity arises, come see<br>me again!"
