section,group,id,text
Event1,0,11_voice_NPC_5052_105,ディンゲールを倒したと思ったら<br>またとんでもないのが出てきやがった。<br>ちっとはこっちの都合も考えろっての。
Event1,0,text02,デカくて速いのはいいとしても<br>さらに空を飛ぶってのはちょっとマジ<br>勘弁って感じだよな。
Event1,0,text03,オレだったら……あー、まあ<br>それはいいか。おたくの戦い方を<br>じっくり見させてもらいたいしな。
Event1,0,text04,ということで、いつも通り<br>おたくの実力、攻略法を<br>見せてくれよ！　こ
Event1,1,11_voice_NPC_5052_105,"So there I was, just taking down a Dingale, <br>when this other crazy monstrosity comes <br>outta nowhere at pretty much the worst <br>possible timing."
Event1,1,text02,Big and fast? Now that's easy.<br>But toss in flight and you've got yourself<br>a real pain in the behind.
Event1,1,text03,"Now me, I'd just--You know what? I'll spare <br>you the details. You just go out there and <br>show me how you take care of business, pal."
Event1,1,text04,"Show me what you're made of, and what <br>you figure is the best way to take that thing <br>down. You got this, my friend!"
