section,group,id,text
Event1,0,text01,貴方の一番の力は、恐らくその<br>尽きることのない向上心ね。
Event1,0,text02,それを抱き続けていれば、自ずと<br>あらゆる分野で頂点に至るでしょう。
Event1,0,text03,まずはウォンドね。<br>この武器の扱いについて<br>さらに貴方は研鑽を積んでいく。
Event1,0,11_voice_NPC_5057_100,それを後押しするのが私の役目。<br>今回の特訓も、一筋縄では<br>いかな
Event1,1,text01,Your relentless drive to improve is by far your<br>strongest suit.
Event1,1,text02,"Keep embracing that, and you'll rise to the top<br>of any and every field you enter."
Event1,1,text03,"But first, Wands. You're still pushing yourself<br>to handle them more and more adeptly."
Event1,1,11_voice_NPC_5057_100,It's my job to stoke that fire. That's why this<br>won't be any run-of-the-mill boot camp.
