section,group,id,text
Event1,0,text01,先生、勉強になりました。<br>先生の動きをしっかり自分で<br>再現できるようイメージを固めます。
Event1,0,11_voice_NPC_5063_101,敵のコアばかり見ていないで<br>全体の動きを追うことを<br>忘れないようにします！
Event1,0,text03,それだけで先生に追いつけるとは<br>思ってないですけど、何かこう<br>ひらめくモノが見えました！
Event1,0,text04,先生、ご指導のほど<br>ありがとうございました！<br>またよろしくお願いいた
Event1,1,text01,"I learned so much, Teach! I've burned your<br>moves into my brain so I can replicate 'em!"
Event1,1,11_voice_NPC_5063_101,"I'll make sure and remember to follow the<br>enemy's moves as a whole, not just focus <br>on the core!"
Event1,1,text03,"I know that alone won't get me to your level,<br>but I got the idea all of a sudden while<br>watching you, so I'm gonna stick with it!"
Event1,1,text04,Thanks so much for taking the time to teach <br>me! I always learn a ton!
