section,group,id,text
Event1,0,11_voice_NPC_5057_101,私、忘れていたわ。<br>貴方が既に非の打ちどころがない<br>ウォンド使いだったことを。
Event1,0,text02,スーパーハードであれ<br>貴方は物事を大きな視点で捉えることを<br>もう決して忘れないようね。
Event1,0,text03,できることなら貴方には<br>さらに新しい世界を<br>見せてあげたい……
Event1,0,text04,また会えると
Event1,1,11_voice_NPC_5057_101,I'd forgotten just how much you've already<br>mastered the Wand.
Event1,1,text02,"It seems you never fail to see the bigger<br>picture, even on Super Hard difficulty."
Event1,1,text03,"If I can, I will show you ever more of the<br>worlds that remain for you to discover."
Event1,1,text04,I hope we meet again.
