section,group,id,text
Event1,0,11_voice_NPC_5479_104,龍族は、親玉を抑えちまって<br>統制を崩す方が早いかもしれねえな。
Event1,0,text02,集団のなかに紛れてるデカブツを<br>優先的に叩いて行こうと思う。
Event1,0,text03,龍族の分類については<br>あんたの方が明るいだろ？<br>見つけ次第、討伐を頼むぜ
Event1,1,11_voice_NPC_5479_104,"For the Draconians, we might want to break<br>their chain of command by dealing with<br>their leaders."
Event1,1,text02,I say we give priority to the big guys that<br>show up in their swarms.
Event1,1,text03,"You're smarter than I am when it comes to<br>classifying Draconians, though. Just take out<br>the important ones when you spot 'em."
