section,group,id,text
Event1,0,text01,……って、相棒！<br>「三人で任務に行こう」って<br>この三人なのかよ！
Event1,0,text02,まあまあ、せっかく相棒が<br>おれたちが仲良くなるキッカケを<br>くれたわけだし……行こうぜ！
Event1,0,text03,くっ、相棒を相棒って呼ばれると<br>なんだか複雑な気分になるけど……<br>わかったよ、行
Event1,1,text01,"Whoa, hang on there, mate! When you said<br>we'd be on a three-man team, I didn't think<br>two of us would be, well, me!"
Event1,1,text02,"C'mon now, our mate here's given us a<br>bondin' opportunity. We can't just let it go<br>to waste now can we?"
Event1,1,text03,"Hey, my mate's not your mate, got that?<br>Fine, though. Let's go."
