section,group,id,text
Event1,0,text01,聞いていたとおり<br>手ごわいエネミーだったが<br>有意なデータを得ることが出来た。
Event1,0,text02,実りのある特訓となって何よりだ。<br>だからお前との共闘は面白い。
Event1,0,text03,それでは、ここを離れるとしよう。<br>後で、私のもとに報告に来てほ
Event1,1,text01,"The enemies were as formidable as I had<br>heard, but we were able to obtain valuable<br>data nonetheless."
Event1,1,text02,What's most important is that our training<br>was beneficial to us. That's why teaming<br>up with you is so advantageous.
Event1,1,text03,"Now, let's leave this place. Report to me later."
