section,group,id,text
MainText,0,name010,クロフォード
MainText,0,text010,そうして戦うキミの姿は、いつも眩しい。<br>……それこそ、嫉妬するくらいにね。
MainText,0,text020,でも、そんな感情を超えるものが、僕たちのなかにはある。<br>さあ、すべての因果に決着をつけよう！
MainText,0,Line_HelpEvent,戦闘支援（クロフォード）<br>最大HP増加<br>最大PP増加<br>一定間隔でレスタサイン自動補充
MainText,1,name010,Crawford
MainText,1,text010,Verte pelear siempre es fascinante.<br>Tengo que admitir que casi me da envidia.
MainText,1,text020,"Pero cuando se llama a la acción, esos sentimientos son fáciles de dejar de lado.<br>¡Ahora es el momento de terminar esto de una vez por todas!"
MainText,1,Line_HelpEvent,Soporte de combate (Crawford)<br>Aumento de HP máx.<br>Aumento de PP máx.<br>Reposición automática de restasigne perió
