section,group,id,text
MainText,0,name010,ブルーダー
MainText,0,text010,キミには、常にその力以上のなにかを感じさせられる。<br>その力は、私に勇気を与えてくれる！
MainText,0,text020,離れていても、心はひとつだ！<br>さあ、行くぞ！　<%me>！
MainText,0,Line_HelpEvent,戦闘支援（ブルーダー）<br>最大HP増加<br>最大PP増加<br>一定間隔でレスタサイン自動補充
MainText,1,name010,topadora
MainText,1,text010,Siempre ha habido algo más en tu fuerza que la simple capacidad de combate.<br>¡Hay algo en esto que me da esperanza!
MainText,1,text020,"Puede que no estemos juntos, ¡pero estoy contigo!<br>¡Hagamos esto, <%me>!"
MainText,1,Line_HelpEvent,Soporte de combate (Dozer)<br>Aumento de HP máx.<br>Aumento de PP máx.<br>Reposición automática de restasigne periód
