section,group,id,text
MainText,0,name010,リューリン
MainText,0,text010,アークス各員に通達。<br>ラトヴァ山で、多数のエネミーの反応を確認。
MainText,0,text020,強力な反応は、<br>戦域統制型ドールズ“アムス・ヴェラ”と推定されます。
MainText,0,text030,周囲を警戒しつつ、<br>エネミーの殲滅をお願いします。
MainText,1,name010,Liu Lin
MainText,1,text010,Atención a todos los defensores de ARKS. Se han detectado numerosas lecturas enemigas<br>en el monte Latva.
MainText,1,text020,"Se cree que una lectura poderosa en particular es la unidad DOLLS,<br>Ams Vera."
MainText,1,text030,Procede con precaución y elimina a todos los enemigos.
