section,group,id,text
Basic,0,Title,特別任務：カヅチ襲来
Basic,0,Explanation,惑星ハルコタンの白ノ領域において<br>時空の歪みが観測された。<br>その影響からか、希少なエネミーの反応が<br>複数感知されている。<br>アークス各員は準備が出来次第<br>現地へと向かい、状況を調査せよ。<br>―――――――――――――――――――<br>開始条件：ボーナスキーカヅチ襲来消費<br>敵の撃退または制限時間の経過でクリア
Basic,1,Title,Special Mission: Kazuchi Assault
Basic,1,Explanation,A space-time distortion has been observed in the <br>Daybreak Province of the planet Harukotan. <br>Multiple rare enemy signatures have been picked <br>up as a result. ARKS personnel are hereby directed <br>to prepare for deployment to the affected area <br>and survey the situation.<br>---------------------------------------------------------<br>This mission can only be started by using Kazuchi <br>Assault Bonus Key. Complete by repelling the <br>enemies or exceeding the time limit.
QuestTarget,0,SimpleExplanation,敵をすべて撃退せよ！
QuestTarget,1,SimpleExplanation,Repel all enemies!
