section,group,id,text
Basic,0,Title,再誕の日
Basic,0,Explanation,不可侵領域のマザーシップ中枢に<br>全てを解き明かす者達が<br>他ならぬシオンの導きによって踏み入った。<br>目を逸らしてはならない。<br>これまで行ってきた歴史の改変は<br>全てこのときのためにあったのだ。<br>――――――――――――――――――――<br>失敗条件/戦闘不能後、リタイアを選択
Basic,0,StoryExplanation,不可侵領域のマザーシップ中枢に、全てを解き明かす<br>者達が、他ならぬシオンの導きによって踏み入った。<br>目を逸らしてはならない。これまで行ってきた歴史の<br>改変は、全てこのときのためにあったのだ。
Basic,1,Title,Day of Resurrection
Basic,1,Explanation,"Under the guidance of none other than Xion,<br>a group dedicated to the elucidation of all<br>phenomenon stepped into the inviolable nexus of<br>the Mothership. There was no looking away now.<br>The changes to history thus far were entirely for<br>the benefit of this moment.<br>----------------------------------------------------<br>You will fail this quest if you become incapacitated<br>or retire."
Basic,1,StoryExplanation,"Under the guidance of Xion, a group dedicated to the<br>elucidation of all phenomenons stepped into the inviolable<br>nexus of the Mothership. There's no turning back. The changes<br>to history thus far were entirely for the benefit of this moment."
QuestTarget,0,SimpleExplanation,シオンのもとへ急げ！
QuestTarget,1,SimpleExplanation,Hurry to Xion's Side!
