section,group,id,text
Required,0,Title,第２小隊長からの依頼・Ⅲ
Required,0,Summary,スティア先遣隊第２小隊長のハツカリから、<br>ノイゼンプラントに出現する<br>エネミーの討伐を頼まれる。
Required,1,Title,Solicitud del líder del segundo escuadrón III
Required,1,Summary,"Hatsukari, líder del segundo escuadrón de la unidad Stia Vanguard, te asigna la tarea de derrotar a los enemigos que se encuentran en la planta de Neusen."
SubObjectives,0,text0101,ノイゼンプラントに向かう
SubObjectives,0,text0102,ノイゼンプラントでエネミーを倒す
SubObjectives,1,text0101,Dirígete a la planta de Neusen
SubObjectives,1,text0102,Derrota enemigos en la planta de Neusen.
