section,group,id,text
Required,0,Title,リテムの景色・Ⅲ
Required,0,Summary,リテムシティの住人ウォーラスから、<br>まだ行ったことのない二ヶ所の景色を<br>見せてもらいたいと頼まれる。
Required,1,Title,Vistas de Retem III
Required,1,Summary,"Wallas, residente de Retem City, te pide que le muestres la vista<br>desde dos lugares en los que nunca ha estado."
SubObjectives,0,text0101,ガイドマーカーの指し示す場所に向かう
SubObjectives,0,text0102,ガイドマーカーの指し示す場所に向かう
SubObjectives,1,text0101,Dirígete a la ubicación del marcador de tareas
SubObjectives,1,text0102,Dirígete a la ubicación del marcador de tareas
