section,group,id,text
Required,0,Title,特殊能力カプセルの心得
Required,0,Summary,アークス教導官のグイーデンから、<br>特殊能力カプセルの交換と<br>特殊能力の付与の方法を教わる。<br><br><yellow>※“アイテムラボ”の<br>　“強化素材交換”で交換<c><br><yellow>※“アイテムラボ”の<br>　“特殊能力の追加”で能力追加<c>
Required,1,Title,Todo sobre las cápsulas Augment
Required,1,Summary,ab. <c>
SubObjectives,0,text0101,任意の特殊能力カプセルを交換する
SubObjectives,0,text0102,装備品に特殊能力を追加する
SubObjectives,1,text0101,Cambie por la cápsula de aumento designada
SubObjectives,1,text0102,Agregar un aumento a una pieza de equipo
