section,group,id,text
Required,0,Title,イコライジングエネミーの討伐
Required,0,Summary,リテムシティの住人ウーフーから、<br>“イコライジングエネミー”の討伐を頼まれる。<br><br><yellow>※対象リージョン：リテム<br>※対象セクションランク：Rank.3以上<c>
Required,1,Title,Igualación de la supresión enemiga
Required,1,Summary,爀㸀㰀戀爀㸀㰀礀攀氀氀漀眀㸀吀愀爀最攀琀 爀攀最椀漀渀㨀 刀攀琀攀洀㰀戀爀㸀吀愀爀最攀琀 匀攀挀琀漀爀 刀愀渀欀㨀 ㌀ 漀爀 栀椀最栀攀爀㰀挀㸀
SubObjectives,0,text0101,マクアド下層に向かう
SubObjectives,0,text0102,リテムで<br>イコライジングエネミーを倒す
SubObjectives,1,text0101,Dirígete al nivel inferior de Maqead
SubObjectives,1,text0102,Derrota a los enemigos igualadores en Retem
