section,group,id,text
ssn_017020,0,name_7022,カヌイ
ssn_017020,0,name_7001,マノン
ssn_017020,0,name_7026,ファリア
ssn_017020,0,ssn_017020_0010,あなたも来てくれたのね。
ssn_017020,0,ssn_017020_0020,こんにちは。
ssn_017020,0,ssn_017020_0030,みなさん、来てくださって感謝します。
ssn_017020,0,ssn_017020_0040,早速ですが、通信でお話したとおり、<br>相談に乗っていただきたいことがありまして……。
ssn_017020,0,ssn_017020_0050,先日、私はルシエランが収集していた<br>データの回収の任にあたっていました。
ssn_017020,0,ssn_017020_0060,そのデータの中にはアークスの戦闘記録をまとめていたものもあり、<br>戦闘能力や行動パターンなどが、事細かに記録されていました。
ssn_017020,0,ssn_017020_0070,惑星ハルファに降下したすべての星渡りやアークスたちの、<br>非常に膨大なデータでした。
ssn_017020,0,ssn_017020_0080,確認のために、目を通していたのですが……。
ssn_017020,0,ssn_017020_0090,そこには、マノンやファリアの名前がありませんでした。
ssn_017020,0,ssn_017020_0100,かつて、リサージェントアークスと呼ばれた、<br>記録する側の者のデータは、取る必要がなかったのでしょう。
ssn_017020,0,ssn_017020_0110,しかし私は、同様に“データがない者”を見つけてしまったのです。
ssn_017020,0,ssn_017020_0120,……“ヒバナ”。<br>10年前、ニルス・スティアとの戦いで命を落としたアークスです。
ssn_017020,0,ssn_017020_0130,ヒバナ……。<br>グレンと、クロフォードの親友だった人物ね。
ssn_017020,0,ssn_017020_0140,ええ。彼女の名前も<br>戦闘記録に書かれていなかったのです。
ssn_017020,0,ssn_017020_0150,ここから想像できることは……。
ssn_017020,0,ssn_017020_0160,彼女も、“記録する側”。<br>リサージェントアークスだった、ということでしょうか。
ssn_017020,0,ssn_017020_0170,……信じがたいことではありますが。<br>それで、ルシエルにお詳しいあなたたちをお呼びしたのです。
ssn_017020,0,ssn_017020_0180,このようなことは、即刻、隊長に報告するべきだとは承知の上です。
ssn_017020,0,ssn_017020_0190,しかし、ヒバナは隊長にとっても大切な友人。<br>憶測で話すのはよろしくないと思いまして。
ssn_017020,0,ssn_017020_0200,そう……。<br>賢明かもしれないわね。
ssn_017020,0,ssn_017020_0210,ただ……。仮にヒバナがリサージェントアークスだったとしても<br>誰が隣で研究していたか、興味を抱くことなく活動していたわ。
ssn_017020,0,ssn_017020_0220,そうですね。私たちが、研究者としている時期とも合致しないため、<br>見知ることもありません。
ssn_017020,0,ssn_017020_0230,<%me>。<br>一度ルシエルに行って古いデータがないか、<br>確認してくれないかしら。
ssn_017020,0,ssn_017020_0240,私たちは、ルシエランたちに<br>ヒバナを知っている人がいないか、聞いてみるわ。
ssn_017020,0,ssn_017020_0250,わかった。
ssn_017020,0,ssn_017020_0260,そっちは頼んだよ。
ssn_017020,0,ssn_017020_0270,そうですね。<br>私からもぜひ、お願いします。
ssn_017020,0,ssn_017020_0280,……まずはセントラルシティの研究者をあたりましょう。
ssn_017020,0,ssn_017020_0290,あら、ファリア。積極的ね。
ssn_017020,0,ssn_017020_0300,イルマから、もっと色々なことに興味を持ったほうが<br>研究者として世界が広がる、と助言されました。
ssn_017020,0,ssn_017020_0310,だから、知りたくなったのです。<br>私の知らないリサージェントアークスの過去を。
ssn_017020,0,ssn_017020_0320,お気をつけて。
ssn_017020,1,name_7022,Kanui
ssn_017020,1,name_7001,Manon
ssn_017020,1,name_7026,Pharia
ssn_017020,1,ssn_017020_0010,I'm glad to see you here.
ssn_017020,1,ssn_017020_0020,Hello.
ssn_017020,1,ssn_017020_0030,Thank you all for coming.
ssn_017020,1,ssn_017020_0040,"As I mentioned in my call, there's something I'd like to go over with you."
ssn_017020,1,ssn_017020_0050,I was recently tasked with retrieving some data that<br>the Lecielans have been aggregating for us.
ssn_017020,1,ssn_017020_0060,Contained within that data were battle records with very detailed information on ARKS's combat capabilities and behavioral patterns.
ssn_017020,1,ssn_017020_0070,Those records held a massive amount of data on every<br>Meteorn and ARKS defender on Halpha.
ssn_017020,1,ssn_017020_0080,But when I started looking over all of it...
ssn_017020,1,ssn_017020_0090,I couldn't find so much as a mention of Manon or Pharia.
ssn_017020,1,ssn_017020_0100,Perhaps Resurgent ARKS felt no need to collect data on those who were collecting the data.
ssn_017020,1,ssn_017020_0110,"However, they're not the only surprising omissions."
ssn_017020,1,ssn_017020_0120,Hibana. She lost her life in the battle against Nils Stia ten years ago.
ssn_017020,1,ssn_017020_0130,"Hibana... She was close with Glen and Crawford, right?"
ssn_017020,1,ssn_017020_0140,"Correct. I couldn't locate any of her battle records, either."
ssn_017020,1,ssn_017020_0150,"So, if my suspicions are correct..."
ssn_017020,1,ssn_017020_0160,"She was also a data collector. Or, rather, a member of Resurgent ARKS."
ssn_017020,1,ssn_017020_0170,"I know it sounds like a stretch, but that's why I wanted<br>to run it by people familiar with Leciel."
ssn_017020,1,ssn_017020_0180,I understand that I should report my theory to Commander Glen.
ssn_017020,1,ssn_017020_0190,"But in light of their relationship, I wanted to make absolutely sure, first."
ssn_017020,1,ssn_017020_0200,Right. That's the wise thing to do.
ssn_017020,1,ssn_017020_0210,"That said... even if she was with Resurgent ARKS, she seemed to be operating independently of any other researchers."
ssn_017020,1,ssn_017020_0220,"Interesting. And that was before our time, so we wouldn't have come into contact with her."
ssn_017020,1,ssn_017020_0230,"<%me>, would you mind going back to Leciel and looking around for old data?"
ssn_017020,1,ssn_017020_0240,We'll try asking the Lecielans if any of them might know Hibana.
ssn_017020,1,ssn_017020_0250,Sounds like a plan.
ssn_017020,1,ssn_017020_0260,Keep up the good work.
ssn_017020,1,ssn_017020_0270,Of course. I sincerely appreciate your help.
ssn_017020,1,ssn_017020_0280,Let's try the Central City researchers first.
ssn_017020,1,ssn_017020_0290,"Way to be proactive, Pharia."
ssn_017020,1,ssn_017020_0300,Ilma always tells me that taking interest in new things will help me grow as a researcher.
ssn_017020,1,ssn_017020_0310,So that's what I'm doing—taking an interest in Resurgent ARKS.
ssn_017020,1,ssn_017020_0320,Be careful.
