section,group,id,text
st_042100,0,st_042100_0001,A.D.2028/3/28/14:00
st_042100,0,st_042100_0010,ふー、食べた食べた！<br>おなかいっぱい、大満足だよー！
st_042100,0,st_042100_0020,アルも、あたしたちと同じように<br>ケーキやドーナツをばくばく食べてた。
st_042100,0,st_042100_0030,そう、あたしたちと同じ人間のように<br>食事を取ってるし、笑うし、驚くし……<br>やっぱり、アルやあの世界は……
st_042100,0,st_042100_0040,ああっと、なんでもない。<br>お茶でも飲んで、のんびりしましょ。<br>えっと、店員さんは……
st_042100,0,st_042100_0050,飲み物でしたら、これをどうぞ。<br>私からのプレゼントだよ。
st_042100,0,st_042100_0060,あ、えっと…………貴方は？
st_042100,0,st_042100_0070,ああ、ああ、お気になさらず。<br>感謝したいのは、むしろ私のほうさ。
st_042100,0,st_042100_0080,美しいお嬢さん方とお茶をする。<br>それはとてもインスピレーションを刺激する。<br>いやいやまったく、私もキミたちも幸運だ。
st_042100,0,st_042100_0090,……なんか変なのが来たけど<br>コオリ、あんたの知り合い？
st_042100,0,st_042100_0100,ち、違うよっ！<br>こんな変態さん、わたしも知らないよ！
st_042100,0,st_042100_0110,お嬢さんたち、ひそひそ話かい？<br>ダメだよ、声が漏れてしまっているぞ？
st_042100,0,st_042100_0120,そんなキミたちにお勧めしたいのが<br>弊社開発のアプリ「トラトラ♪」だ。
st_042100,0,st_042100_0130,このアプリは自信作さ。文章を打たなくても<br>アプリを起動し、思うだけで言葉が相手に伝わる！<br>テレパス気分になれるアプリなのさ！
st_042100,0,st_042100_0140,他人に聞かれたくない内緒話にうってつけ。<br>そして、内緒話と言えば高校生。<br>高校生と言えば花の女子高生。
st_042100,0,st_042100_0150,本リリース前にキミたちに使ってみてもらって<br>使い勝手を知りたいのだが……どうだろうか？
st_042100,0,st_042100_0160,何このキモい人。モニター目的だとしてもキモい。<br>どっかで見た気がするんだけど……<br>ねえ、本当にコオリの知り合いじゃないの？
st_042100,0,st_042100_0170,わっ、わたしに押しつけないでよー！<br>……どっかで見たような気がするけど<br>わたしも知らないよ、こんな人！
st_042100,0,st_042100_0180,実は生き別れの兄弟だったりしない？
st_042100,0,st_042100_0190,こんな気持ちの悪い家族はいないよ！
st_042100,0,st_042100_0200,……ま、兄弟で行動が似ていたとしても<br>ここまで露骨に気持ち悪く迫ってきたりは<br>しないよね。ごめんごめん。
st_042100,0,st_042100_0210,ヒツギちゃん……<br>こんな気持ち悪い人とわたしの行動に<br>似てる部分を見いだしてたんだね……
st_042100,0,st_042100_0220,……キ、キミたちっ！　<br>裏でこそこそ他人を卑下したりするのは<br>良くないことなんだぞ！
st_042100,0,st_042100_0230,なによ、思いっきり傍受されてるじゃん。<br>全然ダメじゃない、このアプリ。
st_042100,0,st_042100_0240,開発者なんだから当たり前だろう！<br>モニターと言っただろ、モニターと！
st_042100,0,st_042100_0250,まったく……最近の女子高生は<br>全然遠慮がなくておっかないなあ。<br>…………だが、それがいい。
st_042100,0,st_042100_0260,コオリー、警察呼んでー。<br>ヘンタイがいるー！　って叫べば<br>すぐに来てくれるはずだから。
st_042100,0,st_042100_0270,躊躇ないねキミ！
st_042100,0,st_042100_0280,へ、ヘンタイがいるー！！
st_042100,0,st_042100_0290,そっちのキミも少しは躊躇えよ！
st_042100,0,st_042100_0300,まったく……そんなの来るわけないだろう。<br>ここら一帯のエーテル通信には<br>すでに制限がかけてある、通報は無駄だよ。
st_042100,0,st_042100_0310,こう見えても私、結構有名人なんだ。<br>騒ぎになって人が集まったら面倒だから<br>外出時は周辺に通信制限をかけているのさ。
st_042100,0,st_042100_0320,……犯罪者ってこと？<br>未成年に対するあれこれの罪状で？
st_042100,0,st_042100_0330,違うよ！　ほらこれ、名刺！
st_042100,0,st_042100_0340,亜贄……萩斗？<br>ＹＭＴコーポレーション代表取締役社長<br>って、なんかどっかで聞いた名前ね。
st_042100,0,st_042100_0350,ＹＭＴコーポレーションって<br>この前アルくんの服を買うときに使ったアプリ。<br>あれを作った会社さんだよ。
st_042100,0,st_042100_0360,そう、エーテル通信時代の最先端を走る<br>ＹＭＴコーポレーションの若き社長にして<br>時代の寵児！　それがこの私、亜贄萩斗さ！
st_042100,0,st_042100_0370,……ああ、あのミリタリーオタクの人か。<br>そんな時代の寵児さんが、あたしたちみたいな<br>ただの女子高生に何用ですか？
st_042100,0,st_042100_0380,……ただの女子高生、ねえ？
st_042100,0,st_042100_0390,何か不満でも？
st_042100,0,st_042100_0400,いいや、なんでもないよ。<br>美しい二人のお嬢さん、ご協力ありがとう。<br>また会える日を楽しみにしているよ。
st_042100,0,st_042100_0410,……なんだかあの人、イヤな感じ。
st_042100,0,st_042100_0420,そうだねアルくん、ヘンな人だったねー。
st_042100,0,st_042100_0430,まるで、コオリみたい。
st_042100,0,st_042100_0440,そうね。
st_042100,0,st_042100_0450,アルくん辛辣ッ！<br>ヒツギちゃんも同意しないでよッ！？
st_042100,0,st_042100_0460,でも……ヒツギちゃん。<br>今の人、本当に何だったんだろう。
st_042100,0,st_042100_0470,……正直さっぱり。<br>でも一つだけ、わかってることもあるわ。
st_042100,0,st_042100_0480,あたしたちのお茶代、浮いた。
st_042100,0,st_042100_0490,改めて感じます。<br>向こうの世界の、技術レベルのいびつさを。
st_042100,0,st_042100_0500,通信技術をはじめとしたソフトウェアは<br>こちらの技術に比類するレベルです。<br>けど、それに対してハードウェアはまだまだ。
st_042100,0,st_042100_0510,不思議ですね……とても、ヘンです。<br>かの「エーテル」という通信素子に<br>何か秘密がありそうな感
st_042100,1,st_042100_0001,A.D. 2028/3/28 14:00
st_042100,1,st_042100_0010,Phew! I'm stuffed! I don't think I can eat another bite!
st_042100,1,st_042100_0020,Al was chowing down on those cakes and donuts<br>just like I was.
st_042100,1,st_042100_0030,"He really is human, just like me. He eats, he laughs, he gets<br>taken by surprise... So that must mean that whole world is..."
st_042100,1,st_042100_0040,"Uhhh, whoops! Don't mind me! Let's get some tea or<br>something. Where's that waiter...?"
st_042100,1,st_042100_0050,"If you're looking for a drink, take these. They're on me."
st_042100,1,st_042100_0060,"And, uhhh... Who’re you?"
st_042100,1,st_042100_0070,"Oh no, don't mind me. I should be the one thanking you,<br>oh no really."
st_042100,1,st_042100_0080,Having tea with lovely girls such as yourselves is just the sort<br>of thing I draw inspiration from. A meeting like this really<br>is a blessing.
st_042100,1,st_042100_0090,"Okay, who's the weirdo? He a friend of yours, Kohri?"
st_042100,1,st_042100_0100,What? No! I don't know this creep!
st_042100,1,st_042100_0110,"Telling secrets, are we, girls? Best be careful--we can all hear<br>you."
st_042100,1,st_042100_0120,"But girls, I have just the thing for you: this new Tel-Tel♪ app<br>my company has developed."
st_042100,1,st_042100_0130,I'm really proud of this one. It lets you chat directly with<br>each other without the need for pesky typing. It's like<br>telepathy in an app!
st_042100,1,st_042100_0140,It's perfect for those things you don't want anyone else to<br>hear. I'm sure cute schoolgirls like you have plenty of stories<br>like that.
st_042100,1,st_042100_0150,I was hoping you could test it out and see how it works before<br>its official release. What do you say?
st_042100,1,st_042100_0160,"This guy is a super creep! Even for the usual ""try my app!""<br>sort. He looks familiar, though... Are you sure you don't know<br>him, Kohri?"
st_042100,1,st_042100_0170,"Hey, don't look at me! I feel like I've seen him somewhere<br>before too, but I don't know where!"
st_042100,1,st_042100_0180,You sure he's not some long-lost brother of yours?
st_042100,1,st_042100_0190,"My family is 100% creep-free, okay!?"
st_042100,1,st_042100_0200,"Fine, fine. I know they say siblings act a lot alike, but even<br>you wouldn't take the creep factor to this level, huh? Sorry."
st_042100,1,st_042100_0210,"Wait... So you really think that, on some level, me and this guy<br>act even remotely alike...?"
st_042100,1,st_042100_0220,H-Hey now! Let's not go bad-mouthing people the second<br>you get the chance!
st_042100,1,st_042100_0230,"What, so you've been listening in on us this whole time?<br>So much for privacy. This app stinks."
st_042100,1,st_042100_0240,"I DID make it, you know! And I'm pretty sure I told you<br>this would be a test!"
st_042100,1,st_042100_0250,"Sheesh, girls your age don't know much in the way of<br>modesty, do you? Not that I mind, mind you."
st_042100,1,st_042100_0260,"Kohri, call the cops. Just tell them some creep is harassing us,<br>and they should show up pretty quick."
st_042100,1,st_042100_0270,"You really don't hold back, eh?"
st_042100,1,st_042100_0280,This creep is harassing us!
st_042100,1,st_042100_0290,"Oh, pipe down, would you?"
st_042100,1,st_042100_0300,Honestly... It's not like anyone is going to come and help. Your<br>call won't even get through. I've got the aether here on<br>lockdown.
st_042100,1,st_042100_0310,"Despite whatever misconceptions you seem to have, I'm<br>actually quite famous. I keep the aether on lock to get<br>some peace and quiet."
st_042100,1,st_042100_0320,"A famous fugitive? Charged with all sorts of crimes against<br>minors, no doubt."
st_042100,1,st_042100_0330,"No! Look, here's my card!"
st_042100,1,st_042100_0340,"Hagito Anie...? President and CEO of YMT Corporation? Wait,<br>where have I heard this name?"
st_042100,1,st_042100_0350,YMT Corporation is the place that makes the app we used<br>when we went out shopping for Al to get some clothes<br>the other day.
st_042100,1,st_042100_0360,"Bingo. YMT Corporation stands at the forefront of aether<br>communications, and I, Hagito Anie, stand at YMT's helm as its<br>prodigious CEO!"
st_042100,1,st_042100_0370,"Oh, right, the military maniac guy. Well, what does a<br>""prodigious CEO"" like yourself want with a couple of ordinary<br>high school girls?"
st_042100,1,st_042100_0380,"""Ordinary"" girls, hmm?"
st_042100,1,st_042100_0390,What are you trying to say?
st_042100,1,st_042100_0400,"Oh, no, nothing at all. Thank you for your help, my lovely<br>ladies. I look forward to seeing you again soon."
st_042100,1,st_042100_0410,What was with that guy? He gave me the creeps.
st_042100,1,st_042100_0420,Seriously. A regular skeeve-o-tron 5000.
st_042100,1,st_042100_0430,He was a lot like Kohri.
st_042100,1,st_042100_0440,Sure was.
st_042100,1,st_042100_0450,"Wow, Al! Harsh! And don't you go agreeing with him, Hitsugi!"
st_042100,1,st_042100_0460,"Jokes aside, though, what was his deal?"
st_042100,1,st_042100_0470,"I honestly have no idea. One thing I do know, though..."
st_042100,1,st_042100_0480,...is that free drinks always taste best.
st_042100,1,st_042100_0490,There it is again. Something is definitely off with their<br>technology.
st_042100,1,st_042100_0500,"Their communications network and the software on it are<br>comparable to our own, but their hardware still seems<br>generations behind."
st_042100,1,st_042100_0510,"It's bizarre, if not simply disconcerting. I get the feeling<br>that there's a lot more to this ""aether"" than meets the eye."
