section,group,id,text
un_061040,0,un_061040_0001,A.P.242/2/13
un_061040,0,un_061040_0010,<%me>さん！<br>以前、貴方を襲撃した<br>謎のアークスですが……
un_061040,0,un_061040_0020,<%me>さーん！
un_061040,0,un_061040_0030,もうお聞きになりましたか？<br>新しいクラスが設立されましたよ！
un_061040,0,un_061040_0040,その名も……<br>「ファントム」です！
un_061040,0,un_061040_0050,しかも、なんとですね！<br>ファントムの提唱者が……<br>私の、友達なんです！
un_061040,0,un_061040_0060,ストラトス。<br>ヒーローがファントムを語るな……<br>不愉快だ。
un_061040,0,un_061040_0070,……ん？<br>お前もいたのか、守護輝士。
un_061040,0,un_061040_0080,あれ？　<%me>さん<br>お知り合いだったんですか？
un_061040,0,un_061040_0090,知り合いという程ではない。<br>そういえば、挨拶がまだだったな。<br>俺の名は……
un_061040,0,un_061040_0100,“黒き狼”キョクヤ。<br>ファントムクラスの提唱者だ。<br>憶えておくがいい。
un_061040,0,un_061040_0110,よろしく、キョクヤ
un_061040,0,un_061040_0120,“黒き狼”って何？
un_061040,0,un_061040_0130,“黒き狼”を忘れているぞ……<br>その胸に深く刻み込め。
un_061040,0,un_061040_0140,ほう……気になるか。<br>だが、まだ時は満ちていない……<br>いずれ知る日が来るだろう。
un_061040,0,un_061040_0150,あ、そうだ。私たちに<br>ファントムのこと教えてくださいよ<br>キョーくん！
un_061040,0,un_061040_0160,俺は「キョクヤ」だ！<br>格好悪いあだ名で呼ぶな！
un_061040,0,un_061040_0170,えーっ、なんでですか？<br>子供の頃から呼んでたじゃないですか。<br>それに、キョーくんだって……
un_061040,0,un_061040_0180,……黙れ。正義に囚われ<br>現実を見ようとしない「ヒーロー」と<br>馴れ合うつもりなど、ない。
un_061040,0,un_061040_0190,なんでそんなこと言うんですか。<br>ヒーローは、希望と平和を守るため
un_061040,0,un_061040_0200,……くだらんな。<br>正義など、どうでもいい……<br>まだ理解できないのか。
un_061040,0,un_061040_0210,ファントムが見るのは、現実。<br>目的達成の手段に、正義だの悪だの……<br>莫迦げた名前は不要。
un_061040,0,un_061040_0220,うう……キョーくん、ひどい。<br>昔は、あんなにいい子だったのに……
un_061040,0,un_061040_0230,くっ……そ、そうだ！<br>ファントムのことだったな。<br>いいだろう、教えてやろう。
un_061040,0,un_061040_0240,ファントムクラスを活かすには<br>“影”のように立ち回る必要がある。<br>そこで重要なのが「回避行動」だ。
un_061040,0,un_061040_0250,「回避行動」を使いこなせば<br>攻撃をいなすことも強力な反撃で<br>一方的に攻撃し続けることも可能。
un_061040,0,un_061040_0260,また、ファントムのフォトンアーツは<br>それぞれ裏の力を秘めている……<br>状況に合わせ使い分けるがいい。
un_061040,0,un_061040_0270,“蝕み”も忘れるな。<br>状態異常の敵を蝕むことで……<br>ファントムは真価を発揮する。
un_061040,0,un_061040_0280,“影”のように舞い<br>表と裏の技を使い分け<br>“蝕み”で敵を恐怖に陥れる……
un_061040,0,un_061040_0290,それが、「亡霊」こと……<br>ファントムクラスの戦い方だ。
un_061040,0,un_061040_0300,そんなの、正義に反しています。<br>強い敵でも、真正面から堂々と戦って<br>打ち勝てばいいじゃないですか！
un_061040,0,un_061040_0310,……守護輝士。<br>お前も、ストラトスと同じ考えか？<br>正義が絶対の価値観だと……？
un_061040,0,un_061040_0320,正義は絶対的なものだ
un_061040,0,un_061040_0330,絶対とは限らない
un_061040,0,un_061040_0340,フン、そうか……<br>お前なら解ってくれると思ったが<br>買いかぶりすぎたようだな。
un_061040,0,un_061040_0350,ほう……この流れなら<br>ストラトスに同調しそうなものだが<br>確たる自分を持っているようだな。
un_061040,0,un_061040_0360,……お前が“正義”を捨て<br>「亡霊」になる覚悟があるかどうか<br>行動で見極めさせてもらう。
un_061040,0,un_061040_0370,……さらばだ。
un_061040,0,un_061040_0380,キョーくん！<br>失礼なことばかり言って……<br>逃げるなんて、卑怯ですよ！
un_061040,0,un_061040_0390,<%me>さん……<br>キョーくんが、大変恐縮です……
un_061040,0,un_061040_0400,私たち、実は幼なじみで……<br>昔は三人とも仲が良かったんですけど<br>ちょっと……大きな事件があって。
un_061040,0,un_061040_0410,当時、私はその事件で<br>その……心が、折れてしまいまして。<br>口もきけず、塞ぎ込んでいました。
un_061040,0,un_061040_0420,キョーくんは、私を励まそうと<br>色々努力してくれてたんですが……<br>私は、応えることができなかった。
un_061040,0,un_061040_0430,だから、愛想が尽きたんでしょう。<br>その頃から、あんな冷たい感じで……<br>嫌われちゃったんだと思います。
un_061040,0,un_061040_0440,でも、本当は悪い子じゃありません！<br>ちょっと悪ぶってはいますけど……<br>とても心の優しい子なんです！
un_061040,0,un_061040_0450,だから……<br>嫌わないであげてください。<br>失礼します！
un_061040,0,un_061040_0460,<%me>さん。<br>報告が途中になってしまいましたが<br>状況は把握されたと思います。
un_061040,0,un_061040_0470,新クラス「ファントム」の提唱者……<br>キョクヤさんが以前、貴方を襲ったのは<br>実力を測るため……でしょうか。
un_061040,0,un_061040_0480,<%me>さんは<br>新クラスの発展にいつも貢献してますし<br>気になる存在だったんでしょう。
un_061040,0,un_061040_0490,それにしても、ストラトスさんと<br>キョクヤさんは友達とのことですが……<br>あれじゃまるで、ライバルですよ！
un_061040,1,un_061040_0001,A.P.242/2/13
un_061040,1,un_061040_0010,Report! I've got some info on that<br>mysterious ARKS op who attacked you...
un_061040,1,un_061040_0020,Excuse me!
un_061040,1,un_061040_0030,Did you hear the news?<br>A new class has been officially recognized!
un_061040,1,un_061040_0040,It's called... Phantom!
un_061040,1,un_061040_0050,And get this! The Phantom Advocate is...<br>one of my friends!
un_061040,1,un_061040_0060,Stratos. Just hearing a Hero mention our creed<br>is enough to make my skin crawl.
un_061040,1,un_061040_0070,"Hm? So you're here as well, Guardian."
un_061040,1,un_061040_0080,Wait a minute. You two know each other?
un_061040,1,un_061040_0090,"I wouldn't go that far. In fact, I haven't<br>even properly introduced myself. They call me..."
un_061040,1,un_061040_0100,"Black Wolf Kyokuya, the Phantom Class Advocate.<br>Engrave that into your memory."
un_061040,1,un_061040_0110,"Nice to meet you, Kyokuya."
un_061040,1,un_061040_0120,Black Wolf? The heck?
un_061040,1,un_061040_0130,"You forgot ""Black Wolf."" Let that error stain<br>your soul, so that you may never repeat it."
un_061040,1,un_061040_0140,"Piqued your interest, have I? The hour of<br>elucidation is not yet at hand... but it will<br>arrive. Slowly. Surely."
un_061040,1,un_061040_0150,"Oh, hey. Tell us all about Phantoms, Kyokie!"
un_061040,1,un_061040_0160,My name is Kyokuya! Never refer to me with<br>that dreadful moniker again!
un_061040,1,un_061040_0170,"But why? I've always called you that.<br>Ever since we were little. Plus, you've always been--"
un_061040,1,un_061040_0180,"Silence. I have no interest in the thoughts<br>of a Hero. You ignore reality, cloistering<br>yourself in a cage of so-called justice."
un_061040,1,un_061040_0190,"Oh, don't be like that! Heroes are<br>protectors of hope and peace!"
un_061040,1,un_061040_0200,Justice? There is no meaning in the word.<br>Does that fact yet elude you?
un_061040,1,un_061040_0210,"Phantoms see only reality. Justice and evil<br>are nonsensical labels, ill-suited to the means<br>we use to accomplish our goals."
un_061040,1,un_061040_0220,*sob* That's so mean.<br>What happened to the kind Kyokie I used to know?
un_061040,1,un_061040_0230,"Ngh... Anyway! You wish to know of Phantoms,<br>yes? Allow me to educate you."
un_061040,1,un_061040_0240,To be a Phantom is to be evasion incarnate.<br>To be one with shadow.
un_061040,1,un_061040_0250,"Masterful dodging allows us to close in on our<br>foes, striking without fear of retaliation."
un_061040,1,un_061040_0260,"Evading alters our Photon Arts, to better<br>suit the shifting flow of combat."
un_061040,1,un_061040_0270,And let us forget not to enfeeble.<br>A Phantom's true worth is only revealed once a<br>foe is crippled by a patina of status ailments.
un_061040,1,un_061040_0280,Dance like a shadow. Let the fear of<br>enfeeblement drive foes to despair.
un_061040,1,un_061040_0290,Like a wraith darting through the night.<br>That is how a Phantom fights.
un_061040,1,un_061040_0300,But that's so... unjust!<br>Even strong enemies deserve a fair fight!
un_061040,1,un_061040_0310,"...Guardian, do you agree with Stratos?<br>Do you believe that justice trumps all?"
un_061040,1,un_061040_0320,Justice is absolute.
un_061040,1,un_061040_0330,I could go either way.
un_061040,1,un_061040_0340,"Hmph. I see. I thought you of all people<br>would understand, but I seem to have<br>overestimated you."
un_061040,1,un_061040_0350,"Interesting.<br>I thought you and Stratos would be in accord,<br>but it appears you have a mind of your own."
un_061040,1,un_061040_0360,Actions speak louder than words. Are you ready to abandon <br>your so-called justice? Are you prepared to become... <br>a Phantom? We will see.
un_061040,1,un_061040_0370,Farewell.
un_061040,1,un_061040_0380,Kyokie! You don't get to just run away<br>after saying all that rude stuff!
un_061040,1,un_061040_0390,I'm so sorry. Let me apologize for Kyokie's behavior.
un_061040,1,un_061040_0400,"We've known each other since we were kids.<br>The three of us got along so well, but then... <br>something happened."
un_061040,1,un_061040_0410,"It broke my heart. I couldn't even speak,<br>it got me so bad."
un_061040,1,un_061040_0420,"Kyokie tried so hard to cheer me up, but...<br>I just wasn't up to it."
un_061040,1,un_061040_0430,"That's probably why he's so mean now.<br>Ever since then, he's been so cold... I think he<br>hates me."
un_061040,1,un_061040_0440,"But he's really not a bad guy! He likes<br>to act tough, but deep down he's got a<br>good heart!"
un_061040,1,un_061040_0450,"So don't think badly of him, okay?<br>Anyway... Gotta run!"
un_061040,1,un_061040_0460,"My report was interrupted, but I think you've<br>got an idea of what happened now."
un_061040,1,un_061040_0470,Kyokuya is the Advocate of the new Phantom<br>Class. He probably attacked you to see<br>what you're capable of.
un_061040,1,un_061040_0480,"You're always helping us develop new<br>classes, so he probably figured you could help.<br>"
un_061040,1,un_061040_0490,"I didn't know Stratos and Kyokuya<br>were friends, though. They almost<br>seem like rivals!"
CharaName,0,name01,？？？
CharaName,1,name01,???
