section,group,id,text
un_020420,0,un_020420_0010,よっ、ほっ！　はっ、とうっ！<br>よし、撒けたかな！
un_020420,0,un_020420_0020,はいっ、こんにちは！<br>いやはや、恥ずかしいとこ<br>見られちゃったね。
un_020420,0,un_020420_0030,わたし、ちょうど今<br>敵から逃げてきたとこなんだ。
un_020420,0,un_020420_0040,まー、何が来ても大丈夫なぐらい<br>強ければいいんだけどさー<br>正直、わたしは弱いからねぇ。
un_020420,0,un_020420_0050,武器の扱いもまだまだだし<br>経験も足りないんだな、これが。
un_020420,0,un_020420_0060,それでも勝たなきゃいけないなら<br>……勝てる状況を作ればいい。<br>でしょ？
un_020420,0,un_020420_0070,……ということで<br>ご協力、お願いしまーす。
un_020420,0,un_020420_0080,今、この現場で考え得る<br>最良の勝ち目は、貴方を頼ること。<br>……どうかな？
un_020420,0,un_020420_0090,まあまあ、押しつけられたって<br>考え方は後ろ向きでもったいないよ？<br>頼りにされたと思って、さ！
