section,group,id,text
TutorialText,0,Title,『新世武器の潜在能力解放』について
TutorialText,0,text01,すべての新世武器は、<br>「<yellow>潜在能力<c>」を秘めています。<br><br>潜在能力とは「特定条件下で威力アップ」<br>などの、武器により異なる能力です。<br><br>新世武器の強化値を、<br><yellow>　「＋１０」→「＋１１」にする時<br>　「＋２０」→「＋２１」にする時<br>　「＋３０」→「＋３１」にする時<c><br>に、この「潜在能力解放」を行います。
TutorialText,0,text02,潜在能力を解放するには、<br>「フォトンスフィア」などの<br>素材アイテムとメセタが必要です。
TutorialText,0,text03,潜在能力にはレベルがあり、<br>解放するたびにLv.1～3まで上昇します。<br><br>潜在能力レベルが高いほど、<br>高い効果を得られます。
TutorialText,1,Title,Unlocking Potentials on Weapons
TutorialText,1,text01,"All weapons hold a hidden <yellow>[Potential]<c>.<br><br>Potentials will impart benefits that differ from weapon to weapon, such<br>as boosting attack power under certain conditions.<br><br>Potentials can be unlocked when enhancing a weapon from level<br><yellow> [+10] to [+11], [+20] to [+21] and from [+30] to [+31]<c>."
TutorialText,1,text02,"Meseta and materials, such as [Photon Spheres], are required to unlock a Potential."
TutorialText,1,text03,"Potentials also have levels, ranging from Level 1 to 3.<br>The level can be raised when unlocking the Potential.<br><br>The higher the level of the Potential, the greater its effect."
