section,group,id,text
Required,0,Title,アークスとしての第一歩・Ⅲ
Required,0,Summary,アークスのクラス教導官から、<br>現在のクラスの戦いかたを教わる。<br><br><yellow>※セントラルシティの、<br>ダントレイ、ダチュア、シャルキ、シャンレイ、<br>ホーニャン、ホロマンのうちひとりが対象。<c>
Required,1,Title,The ARKS Journey Begins III
Required,1,Summary,"Learn combat techniques for your current class from an<br>ARKS Instructor.<br><br><yellow>Look for Dontre, Da Chua, Sharkey, Shan Lei, Hornian, or<br>Holloman in Central City.<c>"
SubObjectives,0,Objective311,クラス管理官からのタスクをひとつ達成する
SubObjectives,1,Objective311,Clear 1 task from a class officer
