section,group,id,text
Required,0,Title,スティア連破訓練・2-Ⅹ
Required,0,Summary,アークス上級訓練教官ロナルディンから、<br>経験を積むために、<br>ドレッドエネミーの討伐を勧められる。<br><br><yellow>※対象リージョン：スティア<br>※ドレッドエネミー：<br>　二つ名“老練の”が付いた個体<c>
Required,1,Title,Stia Relentless Training 2-X
Required,1,Summary,"ARKS Advanced Training Instructor Ronaldine has tasked you with defeating Dread Enemies in order to gain some experience.<br><br><yellow>Target Region: Stia<br>Dread Enemy: Seek out a specimen whose name includes ""Veteran"".<c>"
SubObjectives,0,text0101,スティア外縁部でドレッドエネミーを倒す
SubObjectives,1,text0101,Defeat Dread Enemies in the Stia Outskirts
