section,group,id,text
Required,0,Title,エアリオ連破訓練・1-Ⅳ
Required,0,Summary,アークス上級訓練教官ロナルディンから、<br>経験を積むために、<br>ボスエネミーの討伐を勧められる。<br><br><yellow>※対象リージョン：エアリオ<c>
Required,1,Title,Aelio Relentless Training 1-IV
Required,1,Summary,ARKS Advanced Training Instructor Ronaldine has tasked you with defeating boss enemies in order to gain some experience.<br><br><yellow>Target Region: Aelio<c>
SubObjectives,0,text0101,マグナス山で<br>ボスエネミー（Lv.70以上）を倒す
SubObjectives,1,text0101,Defeat Boss Enemies (Lv.70 or Greater)<br>at Mt. Magnus
