section,group,id,text
Required,0,Title,南エアリオで野菜の調達
Required,0,Summary,南エアリオで、<br>ギャザリングにより野菜を入手する。<br><br><yellow>※対象ギャザリング素材：<br>　ガッツ・エアルカブラナなど<c>
Required,1,Title,Gather Vegetables at South Aelio
Required,1,Summary,"Obtain Vegetables by Gathering at South Aelio.<br><br><yellow>Target Gathering Materials: Robust Aelio Turnip, etc.<c>"
SubObjectives,0,text0101,南エアリオで野菜を入手する
SubObjectives,0,Objective311,ギャザリングで野菜を入手する
SubObjectives,1,text0101,Gather Vegetables at South Aelio
SubObjectives,1,Objective311,Obtain any vegetable
