section,group,id,text
Required,0,Title,ダークファルス・ダリオンの討伐
Required,0,Summary,重要目標討伐任務<br>“星砕の暴進”（Rank.2）で、<br>ダークファルス・ダリオンを倒す。<br><br><yellow>※対象エネミー：<br>　二つ名“深禍の”が付いた個体<c>
Required,1,Title,Dark Falz Dalion Suppression
Required,1,Summary,"Defeat Dark Falz Dalion in the Major Target Suppression Mission ""Planetcrusher Blitz"" (Rank 2).<br><br><yellow>*Target Enemy: Seek out a specimen whose name includes ""Malignant"".<c>"
SubObjectives,0,text0101,ダークファルス・ダリオンを倒す
SubObjectives,1,text0101,Defeat Dark Falz Dalion
