section,group,id,text
Required,0,Title,特殊能力カプセルの入手・4-Ⅲ
Required,0,Summary,チーム活動支援員のティムから、<br>所属するチームを活性化させるため、<br>特殊能力カプセルの入手を勧められる。<br><br><yellow>※推奨セクション：ドライゼンプラント<c>
Required,1,Title,Obtain Augment Capsules 4-III
Required,1,Summary,Alliance Activity Support Member Tim has tasked you with obtaining Augment Capsules in order to bolster your Alliance's strength.<br><br><yellow>Recommended Sector: Dreisen Plant<c>
SubObjectives,0,text0101,特殊能力カプセル<br>C/スティラ・ノートＣを入手する
SubObjectives,1,text0101,Obtain Augment Capsule<br>C/Stia Note C
