section,group,id,text
Required,0,Title,【お月見】輝星の妖変・Ⅲ
Required,0,Summary,さらに、シーズンシンボルの付いた<br>ネクス・ヴェラとの<br>交戦データを送信するように頼まれる。<br><br><yellow>※エネミー討伐推奨クエスト：<br>　ネクス・ヴェラ討伐戦<c>
Required,1,Title,[Moon-Gazing] Starlight Metamorphosis III
Required,1,Summary,Now Xiandy needs battle data on the Nex Vera <br>marked with a Seasonal Symbol.<br><br><yellow>Recommended sectors for enemy suppression:<br>Nex Vera Suppression Op<c>
SubObjectives,0,Objective0101,シンボル付きネクス・ヴェラを倒す
SubObjectives,0,Objective0102,シャンディーと話す
SubObjectives,1,Objective0101,Defeat the Nex Vera marked with a symbol.
SubObjectives,1,Objective0102,Talk to Xiandy.
