section,group,id,text
Required,0,Title,戦果の報告
Required,0,Summary,モラーバ峡谷でドールズを倒した<br><%me>たちは、<br>ハーディたちに報告するため、<br>リテムシティの執務室に戻る。
Required,1,Title,A Report of Success
Required,1,Summary,"After defeating the DOLLS in Murabba Canyon, the party<br>returns to Retem City to report to Hadi and the others."
SubObjectives,0,text0101,リテムシティの執務室に向かう
SubObjectives,0,text0102,リテムシティの執務室に向かう
SubObjectives,1,text0101,Head to Retem City's ARKS headquarters
SubObjectives,1,text0102,Head to Retem City's ARKS headquarters
