section,group,id,text
npc_773301,0,77330101,しばらくの間に、<br>ここも随分と賑やかになりましたね。
npc_773301,0,77330102,クヴァリス先遣隊でしたっけ？　ここでキャンプをしながら、<br>各地の施設を確認して回ってるんだとか。
npc_773301,0,77330103,おかげで仕事がやりやすくなりました。
npc_773301,0,77330104,ああ、私はこの辺りの遺跡を探索して回っている、<br>いわゆるトレジャーハンターってやつです
npc_773301,1,77330101,Haven't seen this many people in a while.
npc_773301,1,77330102,"Kvaris Advance Team, was it? Apparently they're camping in the area and checking out<br>the various facilities."
npc_773301,1,77330103,"Makes my life a little easier, I guess."
npc_773301,1,77330104,"Yeah, I go around exploring the ruins here. I'm what's called a treasure hunter."
