section,group,id,text
MainText,0,name010,ロッサ
MainText,0,text010,アークス各員に通達。<br>その近くで、強力なドールズの反応があった。
MainText,0,text020,過去のデータからすると、<br>どうやら戦域統制型ドールズ“ニルス・ヴェラ”のものらしい。
MainText,0,text030,ニルス・ヴェラは、いろいろと飛ばしてくるヤツだ。<br>動きをよく見て、臨機応変に対処し
MainText,1,name010,Rossa
MainText,1,text010,Calling all ARKS defenders. A powerful DOLLS unit has been detected in the<br>vicinity.
MainText,1,text020,"Going by past data, we believe it to be the Command DOLLS unit Nils Vera."
MainText,1,text030,Nils Vera has tons of different attacks. Stay alert and be adaptable!
