section,group,id,text
MainText,0,name010,ロッサ
MainText,0,text010,え、えーと、聞こえるか？<br>……そこは、誰が作ったか不明な空間らしい。
MainText,0,text020,いろいろと謎なんだが、そこから膨大なエネルギーが出ていて、<br>ほっとくと、こっちの世界に悪い影響が出る……かもって話だ。
MainText,0,text030,正体不明のエネミーの目撃情報もあるから、<br>く、くれぐれも慎重に行動するようにしてくれ…
MainText,1,name010,Rossa
MainText,1,text010,"Er, hey, is this thing on?<br>So, the thing is, we're not sure who created that space."
MainText,1,text020,"Fun little mystery, but there's some crazy energy coming out of it and we're<br>worried something bad might spill over into our world."
MainText,1,text030,"We're getting reports of some unidentified enemies, so, y'know…<br>Be careful out there."
