section,group,id,text
MainText,0,name010,リューリン
MainText,0,text010,本任務では、未確認のエネルギー反応の<br>調査を行います。
MainText,0,text020,付近でのフォトン濃度が異常値を示しています。<br>“オルタレルム”の影響なのでしょうか……。
MainText,0,text030,くれぐれも、不測の事態に備えつつ、<br>調査を進めてください。
MainText,1,name010,Liu Lin
MainText,1,text010,"En esta misión, estamos investigando una lectura de energía no confirmada."
MainText,1,text020,Hay una densidad de fotones anormal en las proximidades.<br>¿Podría esto estar relacionado con el Alter Realm...?
MainText,1,text030,"Por favor continúa con la investigación,<br>pero mantente en guardia y prepárate para cualquier co"
