section,group,id,text
MainText,0,name010,ブルーダー
MainText,0,text010,腹部の装甲がはがれたな。
MainText,0,text020,エネミーの中には、特定の部位を壊せるものもいる。<br>どこが弱いのか、よく見極めるんだ。
MainText,0,text030,部位破壊をすることで、動きが鈍くなったり、<br>弱点が露出したり、有利に戦えるようにな
MainText,1,name010,Dozer
MainText,1,text010,Its abdomen armor has come off.
MainText,1,text020,Some enemies have destructible parts.<br>Keep an eye out for any that could reveal a vulnerability.
MainText,1,text030,"Destroying certain parts can slow the enemy down, or reveal a weak point. Take them out to gain the upper hand."
