section,group,id,text
MainText,0,name010,ミス・キャンディー
MainText,0,text010,トリック・オア・トリートォ！　やっときてくれたぁ♪<br>アタシはミス・キャンディー！　よろしくねぇ。
MainText,0,text020,今回、ルシエルの技術で、パーティーを用意したんだぁ！<br>でも、肝心のお菓子が、エネミーたちにとられちゃったのぉ。
MainText,0,text030,よかったらお菓子を取り返してくれなぁい？<br>沢山取り返してくれたら、プレゼントと交換できるようにしてるからさ！
MainText,1,name010,Miss Candy
MainText,1,text010,Trick-or-treat! You're finally here! ♪<br>My name's Miss Candy! What a treat to meet you!
MainText,1,text020,"If you hadn't heard, we're using Leciel tech to throw a big party!<br>Problem is, enemies stole all our candy!"
MainText,1,text030,"Think you could get it back for us, sweetie?<br>If you bring back a lot, you can trade it in for some lovely rewards!"
