section,group,id,text
AcceptCondition,0,a1,特定のクライアントオーダーのクリア
AcceptCondition,0,a2,特定のクライアントオーダーのクリア
AcceptCondition,0,a3,スーパーハード受注許可証の所持
Basic,0,Title,\2200ファイナルアタッカー後半
Basic,0,Explanation,これは、バトルデータの調査中に発見された未確認の想定演習である。<br>作成者や作成目的は不明だが、エネミーの討伐速度を重視した内容となっている。<br>腕に自信のある者は、テストプランをふまえて実施される評価試験に参加せよ。<br>――――――――――――――――――――――――――――――――――――――<br><yellow>※エネミーとのレベル差７以上で獲得クエストポイント減少<c>
Basic,1,Title,Simulacro: Región No Identificada A16
Basic,1,Explanation,愀爀椀琀礀 戀攀琀眀攀攀渀 礀漀甀 愀渀搀 琀栀攀 攀渀攀洀椀攀猀 椀猀 㜀 漀爀 最爀攀愀琀攀爀⸀㰀挀㸀
QuestTarget,0,SimpleExplanation,制限時間内により多くクエストPtを獲得する
QuestTarget,1,SimpleExplanation,Gana puntos de misión durante el límite de tiempo.
