section,group,id,text
AcceptCondition,0,a1,特定のクライアントオーダーのクリア
AcceptCondition,0,a2,特定のクライアントオーダーのクリア
AcceptCondition,0,a3,スーパーハード受注許可証の所持
Basic,0,Title,想定演習：戦変万花のエネミー掃討戦
Basic,0,Explanation,このポータルでは、来るべき戦いに備えた想定演習を行うことができる。<br>トリガーの指定により、西エアリオのクライアノ断崖での戦いが再現される。<br>戦闘技術を駆使して、大型のフォーマーズを含むエネミーを殲滅せよ。<br><br><yellow>※対象トリガーの換金や特定倉庫への移動でクエスト破棄<c>
Basic,1,Title,Drill: Flurry of Flowers Clean Up Op
Basic,1,Explanation,"At this portal you can conduct drills to prepare for battles to come. This trigger recreates a battle at Cryano Cliffs in West Aelio. Make use of your battle skills to defeat the enemies, including the large FORMERS.<br><br><yellow>Moving the triggers to a specific storage or converting them will cause you to abandon the quest.<c>"
QuestTarget,0,SimpleExplanation,最奥部のエネミーを討伐せよ！
QuestTarget,1,SimpleExplanation,Suppress the enemies in the final area!
