section,group,id,text
Required,0,Title,特殊能力カプセルの心得
Required,0,Summary,アークス教導官のグイーデンから、<br>特殊能力カプセルの交換と<br>特殊能力の付与の方法を教わる。<br><br><yellow>※“アイテムラボ”の<br>　“強化素材交換”で交換<c><br><yellow>※“アイテムラボ”の<br>　“特殊能力の追加”で能力追加<c>
Required,1,Title,All About Augment Capsules
Required,1,Summary,ARKS Instructor Guiden provides a lesson on obtaining Augment Capsules and adding augments.<br><br><yellow>Get capsules through the Enhancement Materials Exchange at the Item Lab.<c><br><yellow>Gain the effects of augments by selecting Add Augments at the Item Lab.<c>
SubObjectives,0,text0101,任意の特殊能力カプセルを交換する
SubObjectives,0,text0102,装備品に特殊能力を追加する
SubObjectives,1,text0101,Trade for the designated Augment Capsule
SubObjectives,1,text0102,Add an Augment to a piece of equipment
