section,group,id,text
Required,0,Title,ミッションパスの利用
Required,0,Summary,アークス上級情報支援員のリーディアから、<br>“ミッションパス”について教わる。<br><br><yellow>※メインメニューの“タスク/クエスト”から<br>　“ミッションパス”を選択することで達成可能<c>
Required,1,Title,Using a Mission Pass
Required,1,Summary,"ARKS Advanced Intelligence Support member Lydia<br>teaches you about Mission Passes.<br><br><yellow>Note: Can be achieved by selecting ""Mission Pass""<br>from ""Tasks/Quests"" in the Main Menu.<c>"
SubObjectives,0,text0101,ミッションパスを見る
SubObjectives,1,text0101,View a Mission Pass
