section,group,id,text
Required,0,Title,クヴァリス先遣隊長からの依頼・Ⅴ
Required,0,Summary,クヴァリス先遣隊長のクリストバルから、<br>ベルガナ遺跡に出現する<br>エンハンスドエネミーの討伐を頼まれる。
Required,1,Title,Kvaris Advance Team's Help Request V
Required,1,Summary,Kvaris Advance Team commander Cristobal tasks you with defeating Enhanced Enemies that appear in the Belugana Ruins.
SubObjectives,0,text0101,ベルガナ遺跡でエンハンスドエネミーを倒す
SubObjectives,0,text0102,クリストバルと話す
SubObjectives,1,text0101,Defeat the Enhanced Enemies at Belugana Ruins
SubObjectives,1,text0102,Talk to Cristobal
