section,group,id,text
ssn_017110,0,name_7016,グレン
ssn_017110,0,name_7004,クロフォード
ssn_017110,0,name_7024,ヒバナ
ssn_017110,0,ssn_017110_0010,お前が直接ここに来るとは。<br>何か問題が起きたか。
ssn_017110,0,ssn_017110_0020,問題……とは少し違うけれど。<br>とりあえず、これを見てくれ。
ssn_017110,0,ssn_017110_0030,なんだこれは。<br>リサージェントアークスの、観測者データ……？
ssn_017110,0,ssn_017110_0040,“観測者名、ヒバナ”……。<br>……一体、どういうことだ。
ssn_017110,0,ssn_017110_0050,まさか、ヒバナが、<br>リサージェントアークスだと言いたいのか。
ssn_017110,0,ssn_017110_0060,……受け入れがたいのは、わかってる。<br>僕も、まだ、完全に受け入れられてはない。
ssn_017110,0,ssn_017110_0070,これは、ファリア君と<%me>が、<br>ネームレスシティで手に入れたデータだ。
ssn_017110,0,ssn_017110_0080,グレンと一緒に、このデータを見たくて……<br>ヒバナの本当のことを知りたくて、ここに来た。
ssn_017110,0,ssn_017110_0090,ヒバナが……。<br>リサージェントアークス……？
ssn_017110,0,ssn_017110_0100,……正直、にわかには信じがたい。<br>だが、お前がここに来てまで言うのであれば、信憑性の高い話なのだろう。
ssn_017110,0,ssn_017110_0110,真実は、己の目で見るとしよう。
ssn_017110,0,ssn_017110_0120,……じゃあ、再生するよ。
ssn_017110,0,ssn_017110_0130,……観測者名、ヒバナ。観測記録、16日目。<br>アークスの訓練生との接触に成功。
ssn_017110,0,ssn_017110_0140,驚くほど平均値から外れた、超人的なアークスがいた。<br>グレンと、クロフォードっていうの。
ssn_017110,0,ssn_017110_0150,彼らを観測対象と定め、<br>今後の戦闘能力の成長を確認するため、さらなる接触を試みるわ。
ssn_017110,0,ssn_017110_0160,観測記録、61日目。
ssn_017110,0,ssn_017110_0170,頭脳明晰で采配に長けているクロフォードと、<br>自身の体力と、持ち前の勇猛さで何事にも立ち向かうグレン。
ssn_017110,0,ssn_017110_0180,時折、彼らならば、<br>この星の未来を変えられるのではないかとさえ思う。
ssn_017110,0,ssn_017110_0190,彼らとともに過ごす毎日は学びが多く、<br>私も本当に楽しく過ごせているわ。
ssn_017110,0,ssn_017110_0200,……彼らのような人が長として育ってくれれば、<br>ハルファは、未来は、きっと……。
ssn_017110,0,ssn_017110_0210,観測記録、145日目。
ssn_017110,0,ssn_017110_0220,彼らとの仲が深まるにつれ、<br>時折、私の存在について悩むことがある。
ssn_017110,0,ssn_017110_0230,私は、グレンとクロフォードに偽りの私を見せている。
ssn_017110,0,ssn_017110_0240,アークスではない。星渡りではない。<br>“何も知らない”なんてことはないの。
ssn_017110,0,ssn_017110_0250,私が彼らの思っている<br>“ヒバナ”じゃないのが、苦しいよ……。
ssn_017110,0,ssn_017110_0260,観測302日目。<br>“上”から、ハルファにて大規模な作戦を展開すると聞いた。
ssn_017110,0,ssn_017110_0270,新型エネミー、ニルス・スティアがセントラルシティを襲撃する……らしい。
ssn_017110,0,ssn_017110_0280,私はルシエルの研究者、私は知っている者。<br>私は……“アークスのヒバナ”じゃない。
ssn_017110,0,ssn_017110_0290,……どうするかは、決めないといけないよね。
ssn_017110,0,ssn_017110_0300,私たちの未来は、私たちで変えなきゃ……ね……。
ssn_017110,0,ssn_017110_0310,………。
ssn_017110,0,ssn_017110_0320,さいごのメッセージは“上”の者の手が届かない、<br>約束の場所に、のこすわ。
ssn_017110,0,ssn_017110_0330,そしてこのデータも……。
ssn_017110,0,ssn_017110_0340,………。<br>これで、仕舞いか。
ssn_017110,0,ssn_017110_0350,くそ。<br>なぜ俺たちには話してくれなかった。
ssn_017110,0,ssn_017110_0360,俺が、俺たちが、<br>襲撃があることを知っているだけでも、未来が変わったかもしれないだろう。
ssn_017110,0,ssn_017110_0370,僕たちが幼かったから……<br>彼女がすべて、抱え込むことになってしまった。
ssn_017110,0,ssn_017110_0380,それが最善の選択だった。
ssn_017110,0,ssn_017110_0390,クロフォードたちの負担を考えてのことだ。
ssn_017110,0,ssn_017110_0400,ああ……ヒバナは本当に賢い人だ。
ssn_017110,0,ssn_017110_0410,“変わった未来の先”で、僕たちが、<br>この事実に気づくことまで見越していたなんて。
ssn_017110,0,ssn_017110_0420,データをルシエルに報告していなかったのは、<br>伝えなければならないことを削除されてしまうのを恐れたからだろうね。
ssn_017110,0,ssn_017110_0430,……ふむ。<br>さいごのメッセージ、というのはどうする。
ssn_017110,0,ssn_017110_0440,グレンに回収を任せてもいいかな。<br>回収できたら、ハルフィリア湖で会おう。
ssn_017110,0,ssn_017110_0450,僕は、セントラルに戻って、準備をしてくるよ。<br>彼女への手向けを用意して、君たちを待っている。
ssn_017110,0,ssn_017110_0460,わかった。<br>……一緒に来てくれるか、<%me>。
ssn_017110,0,ssn_017110_0470,僕たちの“約束の場所”といえば、あそこだよね。
ssn_017110,0,ssn_017110_0480,ああ、見当はついている。<br>行くぞ。
ssn_017110,0,ssn_017110_0490,……全てを、見な
ssn_017110,1,name_7016,Glen
ssn_017110,1,name_7004,Crawford
ssn_017110,1,name_7024,Hibana
ssn_017110,1,ssn_017110_0010,"If you're here in person, it means something bad's happening."
ssn_017110,1,ssn_017110_0020,"Mmm... Not exactly ""something bad,"" but... Here. Take a look at this."
ssn_017110,1,ssn_017110_0030,What is this? Resurgent ARKS monitoring data?
ssn_017110,1,ssn_017110_0040,"""Monitor Name: Hibana..."" What the hell is this?"
ssn_017110,1,ssn_017110_0050,Are you trying to tell me Hibana was with Resurgent ARKS?
ssn_017110,1,ssn_017110_0060,"I know it's a really tough pill, Glen. I'm not sure I've swallowed it myself yet."
ssn_017110,1,ssn_017110_0070,This is data that Pharia and <%me> found in the Nameless City.
ssn_017110,1,ssn_017110_0080,I wanted to go over it with you... To learn the truth about her together.
ssn_017110,1,ssn_017110_0090,Hibana was Resurgent ARKS...?
ssn_017110,1,ssn_017110_0100,It's almost impossible to believe... But you wouldn't come out here if there weren't something to it.
ssn_017110,1,ssn_017110_0110,"Well, let's see it with our own eyes."
ssn_017110,1,ssn_017110_0120,"Okay, let's take a look."
ssn_017110,1,ssn_017110_0130,Monitor Name: Hibana. Observation log day 16. Made contact with ARKS trainees.
ssn_017110,1,ssn_017110_0140,Two exceptional trainees with superhuman abilities stand out: Glen and Crawford.
ssn_017110,1,ssn_017110_0150,Subjects marked for contact and continued observation to monitor combat capability growth.
ssn_017110,1,ssn_017110_0160,Observation log day 61.
ssn_017110,1,ssn_017110_0170,"Crawford is brilliant and a natural leader, while Glen's athleticism and courage make him a capable problem-solver."
ssn_017110,1,ssn_017110_0180,Sometimes I even suspect that the two of them could change this planet's fate.
ssn_017110,1,ssn_017110_0190,They teach me something new every day. I am enjoying myself a great deal.
ssn_017110,1,ssn_017110_0200,"...If they can be trained as leaders, Halpha's future may yet be..."
ssn_017110,1,ssn_017110_0210,Observation log day 145.
ssn_017110,1,ssn_017110_0220,"As we grow closer with each other, I sometimes find myself worrying about my life here."
ssn_017110,1,ssn_017110_0230,The person I'm presenting to them is not real.
ssn_017110,1,ssn_017110_0240,I'm not with ARKS. I'm not a Meteorn. I'm not oblivious to what's going on.
ssn_017110,1,ssn_017110_0250,I'm not the Hibana they think I am. And that tears at me.
ssn_017110,1,ssn_017110_0260,"Observation day 302. Received word from ""on high"" about a large scale operation."
ssn_017110,1,ssn_017110_0270,A new enemy known as Nils Stia will launch an attack... or so I'm told.
ssn_017110,1,ssn_017110_0280,"I'm a Leciel researcher. I'm in the know. I am not ""ARKS defender Hibana""."
ssn_017110,1,ssn_017110_0290,I need to make a very tough decision here.
ssn_017110,1,ssn_017110_0300,We are the ones who need to change our fate.
ssn_017110,1,ssn_017110_0310,...
ssn_017110,1,ssn_017110_0320,"I'll leave my final message in our meet-up spot, beyond the reach of those on high."
ssn_017110,1,ssn_017110_0330,And these files too...
ssn_017110,1,ssn_017110_0340,...<br>I guess that's it.
ssn_017110,1,ssn_017110_0350,Damn it. Why didn't she ever say anything to us?
ssn_017110,1,ssn_017110_0360,"If I— If we had known about the attack, at least, we might've been able to change things. We..."
ssn_017110,1,ssn_017110_0370,We were young... so she ended up keeping it all to herself.
ssn_017110,1,ssn_017110_0380,She made the right choice.
ssn_017110,1,ssn_017110_0390,She was thinking about the impact on you two.
ssn_017110,1,ssn_017110_0400,Yeah... Hibana was always brilliant.
ssn_017110,1,ssn_017110_0410,She even thought ahead to us finding out about this on the other side of it all.
ssn_017110,1,ssn_017110_0420,She must've kept her message to us secret from Leciel<br>because she was afraid of having it erased.
ssn_017110,1,ssn_017110_0430,"Hmm. What do we do about this ""final message""?"
ssn_017110,1,ssn_017110_0440,"Why don't you see if you can find it, Glen? Then we can meet up at Halphia Lake."
ssn_017110,1,ssn_017110_0450,I'm heading back to Central for now. I'll prepare a memorial for her and await your return.
ssn_017110,1,ssn_017110_0460,"Got it. You coming along, <%me>?"
ssn_017110,1,ssn_017110_0470,"Our ""meet-up spot"" has to be there, right?"
ssn_017110,1,ssn_017110_0480,Where else could it be? I'll see you.
ssn_017110,1,ssn_017110_0490,It's high time we got some closure.
