section,group,id,text
TutorialText,0,Title,バイタルゲージのデザイン変更
TutorialText,0,text0001,プレイヤーのキャラクター名、クラスレベル、HP、PPなどが<br>表示される“バイタルゲージ”は、デザインを変更できます。<br><br><swguidetype T_MainMenu>で“メインメニュー”を開き、<br><yellow>“パーソナル”<c>から<br><yellow>“バイタルゲージデザイン”<c>を選択してください。
TutorialText,0,text0002,このバイタルゲージのデザインは、<br>専用のチケットアイテムで追加できます。<br><br>変更したバイタルゲージのデザインは、<br>パーティーメンバーの画面上にも反映されます。<
TutorialText,1,Title,Changing the Vital Gauge Design
TutorialText,1,text0001,"The design of the Vital Gauge, which displays information such as the player's character name, class level, HP, and PP can be changed.<br><br>Open the Main Menu with <swguidetype T_MainMenu>, then go to <yellow>[Personal]<c>, then <yellow>[Vital Gauge Design]<c>."
TutorialText,1,text0002,This Vital Gauge design can be added with a special ticket item.<br><br>The updated Vital Gauge design will be reflected in your party members' screens as well.
