section,group,id,text
TutorialText,0,Title,ネームレスシティ居住区画調査
TutorialText,0,text0001,“ネームレスシティ居住区画調査”は、<br>居住区画を各パーティーが自由に探索し、制限時間いっぱいまで<br>調査することが目的のクエストです。<br><br>調査の過程で入手できる“探索ポイント”を集めて<br>特殊なチェストを開錠することで、様々な報酬を獲得できます。<br><br><yellow>※クエストカウンターの“ネームレスシティ探索”から受注可能です。<c>
TutorialText,0,text0002,探索ポイントは、プレイヤーごとに所持しています。<br>エネミー撃破、トライアルクリア、“アンロックサイン”取得で<br>入手可能です。<br><br>また、フィールド上には特殊なチェストが設置されており、<br>探索ポイントを消費することで開錠し、アイテムを入手できます。<br><br>※チェストの開錠状況はプレイヤーごとに保存されます。
TutorialText,0,text0003,探索ポイントに関する注意点は、以下の通りです。<br><br>・<yellow>クエストが終了すると消失<c>し、持ち越せません。<br>　制限時間内により多くのチェストを開錠して、消費しましょう。<br>・所持量が多いほど、プレイヤーの<yellow>防御力が低下します。<c><br>・戦闘不能になると、<yellow>所持量の一部が消失<c>します。
TutorialText,1,Title,Nameless City Residential District Investigation
TutorialText,1,text0001,"In the Nameless City Residential District Investigation, the objective is for each party to freely explore the residential district until the time limit has been reached.<br><br>Various rewards can be obtained by collecting Exploration Points while investigating and unlocking special chests.<br><br><yellow>*This can be accepted from [Nameless City Exploration] at the Quest Counter."
TutorialText,1,text0002,"Each player has their own Exploration Points.<br>They can be earned by defeating enemies, clearing trials, and obtaining Unlock Signs.<br><br>Also, items can be obtained by using Exploration Points to open special chests that are scattered about the field.<br><br>Note: The open status of chests is saved for each player."
TutorialText,1,text0003,Notes regarding Exploration Points:<br><br>・<yellow>Points will vanish once the quest is completed<c> and will not carry over.<br>   Spend as many as you can within the time limit by opening chests.<br>・The player's <yellow>defense will lower<c> the more points they possess.<br>・<yellow>Part of the owned amount will vanish<c> if the player becomes incapacitated.
