section,group,id,text
TutorialText,0,Title,ラッピーの集会場
TutorialText,0,text0001,各リージョンの探索セクションでは、<br>ドレッドエネミーを倒した時、まれに<br>たくさんのラッピーが出現することがあります。<br><br>ラッピーの鳴き声が響きわたるのが出現の合図です。<br>ガイドを頼りにラッピーの出現場所を見つけましょう。
TutorialText,0,text0002,ラッピーのほかにも、<yellow>“エンペ・ラッピー”<c>などの<br>特別なエネミーが出現します。
TutorialText,0,text0003,各リージョンの探索セクションでは、<br>マーカー付近に出現するドレッドエネミーを倒した時、<br>たくさんのラッピーが出現することがあります。<br><br>ラッピーの鳴き声が響きわたるのが出現の合図です。<br>ガイドを頼りにラッピーの出現場所を見つけましょう。
TutorialText,1,Title,Rappy Spot
TutorialText,1,text0001,"In rare cases, many Rappies will spawn when defeating Dread Enemies in each<br>exploration sectors. <br><br>You will be able to hear Rappies chirp so seek for their spawn point by using the guide."
TutorialText,1,text0002,"Special enemies such as <yellow>Emperappy<c> will spawn as well, other than Rappies."
TutorialText,1,text0003,Many Rappies can spawn when defeating Dread Enemies that spawn near the Marker in each exploration sector.<br><br>You will be able to hear Rappies chirp so seek for their spawn point by using the guide.
