section,group,id,text
TutorialText,0,Title,想定演習：双路攻略戦について
TutorialText,0,text0001,“想定演習：双路攻略戦”は、<br>プレイヤーが戦闘エリアの内側と外側の二手に分かれ<br>出現するエネミーを撃破することが目的です。<br><br>内側と外側のどちらからスタートするかは<br>プレイヤーごとに毎回ランダムに決定します。
TutorialText,0,text0002,クエスト中、内側と外側のプレイヤーが協力することで<br>解除可能なギミックが配置されています。<br><br>内側と外側の双方からスイッチを踏むことでギミックが解除され、<br>戦闘を有利にするオブジェクトが出現します。<br><br>互いの状況をよく見て、協力しながら戦闘を有利に進めましょう。
TutorialText,1,Title,Drill: Dual Route Capture Battle
TutorialText,1,text0001,"In “Drill: Dual Route Capture Battle,”<br>players will split into two groups, one inside the battle area and one<br>outside, and the objective is to defeat the enemies that appear.<br><br>Whether each player starts from the inside or outside is decided<br>randomly each time."
TutorialText,1,text0002,"During the quest, there are gimmicks that can be deactivated by both<br>inside and outside players working together.<br><br>Stepping on switches from both inside and outside will deactivate the<br>gimmick, and objects that will give you an advantage in battle will appear.<br><br>Keep a close eye on each other's situations and work together to gain an<br>advantage in battle."
