section,group,id,text
TutorialText,0,Title,プリセット能力
TutorialText,0,text0001,エネミーを倒したときにドロップする武器や防具には、<br>低確率で特殊な効果を持つ“プリセット能力”が付与されます。<br><br>“プリセット能力”はレベルが高いほど希少で、<br>効果も強力になります。<br><br>アイテムラボで、別のプリセット能力を追加したり、<br>能力のレベルを上げることもできます。
TutorialText,0,text0002,プリセット能力を移植するには、<br>素材としてプリセット能力がついた同名の武器または防具と、<br>素材アイテムが必要です。
TutorialText,1,Title,Preset Skills
TutorialText,1,text0001,"On rare occasions, weapons and armor dropped by defeated enemies will have special effects known as ""Preset Skills"".<br><br>The higher the level of the Preset Skills, the rarer - but also more powerful - they are.<br><br>You can also add other Preset Skills or raise Preset Skill levels at the Item Lab."
TutorialText,1,text0002,"To transfer a Preset Skill, you will need a weapon or armor with the same name that has a Preset Skill to use as material, along with some other material items."
