section,group,id,text
TutorialText,0,Title,アイテム交換ショップでの交換方法
TutorialText,0,text0001,アイテム交換ショップでは、希望アイテムの対価となる<br>納品アイテムを選択する方法が、２種類あります。<br><br>・納品アイテム数を選ぶと、対価の希望アイテム数が決まる方法<br>・希望アイテム数を選ぶと、対価の納品アイテム数が決まる方法<br><br>※アイテムによっては、<%Function>で交換方法を切り替えられます。
TutorialText,0,text0002,希望アイテムの必要個数を選択する方式は、<br>納品アイテムに以下のものが含まれる場合は利用できません。<br><br>・“対象のACスクラッチアイテム”など、一意でないアイテム<br>・武器や防具など、個々に能力値が変動するアイテム
TutorialText,1,Title,Exchanging at the Item Exchange Shop
TutorialText,1,text0001,"In the Item Exchange Shop, there are two ways to select the items to use when exchanging for desired items.<br><br>・Selecting the amount of items you will exchange, which will decide the amount of the desired item you will receive<br>・Selecting the amount of the desired item you will receive, which will decide the amount of the items required to exchange<br><br>*For some items, you can use <%Function> to switch the exchange method."
TutorialText,1,text0002,"The method that involves selecting the required amount of desired items cannot be used if it includes exchanging the following items.<br><br>・Non-unique items such as specific AC Scratch Ticket items<br>・Items that could have varying stats and ability values, such as weapons and armor"
