section,group,id,text
TutorialText,0,Title,クローズドβテスト
TutorialText,0,text0001,ナグルスの撃破おめでとうございます！<br><br>これで『PSO2:NGS』の基本的な遊び方のガイダンスは終了です。<br>ここからはテスト期間終了まで、自由に冒険を楽しんでください。
TutorialText,0,text0002,セントラルシティ内には、“サイドタスク”が受注できる<br>たくさんのキャラクターたちがいます。<br><br>彼らのタスクを進めることで、『PSO2:NGS』の<br>様々なコンテンツを体験することができますので、<br>ぜひ、挑戦してみてくださ
TutorialText,1,Title,Closed Beta Test
TutorialText,1,text0001,Congratulations on defeating Nogleth!<br><br>This concludes the guidance to the gameplay of PSO2:NGS.<br>Please enjoy the game freely until the end of the test period.
TutorialText,1,text0002,"In Central City are many characters who will provide you<br>with Side Tasks, when you talk to them.<br><br>By completing these tasks, you can experience various<br>content of PSO2:NGS. so we recommend giving it a try!"
