section,group,id,text
TutorialText,0,Title,クエスト即時開始の提案
TutorialText,0,text0001,同行者を募る（マッチングする）クエストでは、<br>規定人数に達することで、自動的にクエストが開始されます。<br><br>ただし、規定人数に達していない場合でも、<br>“クエスト情報”から“クエスト即時開始の提案”を選択すると、<br>現時点のメンバーだけでクエストを開始するよう、提案できます。
TutorialText,0,text0002,“クエスト即時開始の提案”を選択すると、<br>現在のメンバーでクエストを開始してよいかの確認が、<br>ほかのプレイヤーに届きます。<br><br>全員が賛成した場合、クエストを開始します。<br>※未回答のプレイヤーは“賛成”として扱われます。
TutorialText,1,Title,Quest Immediate Start Proposal
TutorialText,1,text0001,"In matchmaking quests, the quest automatically begins once the stipulated number of people are found.<br><br>However, even when you don't have enough people, you can suggest to begin the quest with the current members by selecting ""Quest Immediate Start"" from Quest Info."
TutorialText,1,text0002,"When you select Propose Quest Immediate Start, a notification will be sent to the other players asking if they agree to start with the current members.<br><br>The quest will start if everyone accepts the proposal.<br>Note: Players who do not respond will count as accepting."
