section,group,id,text
TutorialText,0,Title,ダウンゲージ
TutorialText,0,text0002,ダウンしたエネミーはしばらく攻撃できないため、<br>一気にダメージを与えるチャンスです。
TutorialText,0,text0001,緊急クエストなどのエネミーには、<br>“ダウンゲージ”が表示されている場合があります。<br><br>エネミーを攻撃することでダウンゲージが減少し、<br>なくなるとエネミーがダウンします。
TutorialText,1,Title,The Down Gauge
TutorialText,1,text0002,"Downed enemies cannot attack for a while, giving you a prime opportunity to deal some damage."
TutorialText,1,text0001,"Some enemies, such as those that appear during Urgent Quests, will have a Down Gauge.<br><br>This gauge depletes as you attack the enemy, and when it is completely drained, the enemy will be downed."
