section,group,id,text
TutorialText,0,Title,リアメイのサイドタスク
TutorialText,0,text0001,アークス訓練教官のリアメイから受注できるサイドタスクは、<br><yellow>毎日<utc>12:00</utc>にクリア状態がリセットされるタスク<c>です。<br>クリア状態がリセットされたタスクは、再び受注することが可能です。
TutorialText,0,text0002,また、リアメイはセントラルシティなど、<br>各リージョンのアークス拠点を巡回しています。<br><br>どの拠点にいるリアメイからでも、<br>同じサイドタスクを受注することができます。
TutorialText,1,Title,Leah May's Side Tasks
TutorialText,1,text0001,Leah May's side tasks have their clear status reset <yellow>every day at <utc>12:00</utc><c>. Tasks that have their clear status reset can be accepted again.
TutorialText,1,text0002,"Leah May travels around to the ARKS bases in each region, such as Central City.<br><br>You can accept the same side tasks from her regardless of the location."
