section,group,id,text
Info,0,Title,一流ブレイバーを目指して
Info,0,Explanation,アークス同士で依頼を出し合う理由の一つに<br>第三者による評価システムがあるのね。<br>一定の功績が認められると、自身の能力へ<br>反映がなされるしくみなんだー。<br>どう？　ブレイバーとしての功績を<br>わたしに示してみる？<br>ま、考えるよりやった方がいいって。<br>今から与える試練をクリアしてみせてよ。<br><br><yellow>※対象エネミーLv.21～をブレイバーで撃破<c>
Info,0,Errand,ブレイバーのスキルポイント＋
Info,1,Title,Quiero ser el mejor: más valiente
Info,1,Explanation,<yellow> Derrota a los enemigos objetivo<br>que sean de nivel 21+ como Braver. <c>
Info,1,Errand,+5 puntos de habilidad más valientes
