section,group,id,text
Info,0,Title,ジャストアタック特訓・Ⅹ
Info,0,Explanation,なあ、センパイ。<br>ナベリウスの遺跡で出現するダーカーの<br>キュクロナーダっているだろ。<br>攻撃力も防御力も高いし、攻撃範囲も広い。<br>戦いづらいうえに、ジャストアタックが<br>上手いように当たらないんだ。<br>いつものようにお手本を見せてくれないか？<br><br><yellow>※Lv.31以上のキュクロナーダが対象<br>ジャストアタックで撃破する<c>
Info,0,Errand,任意のアークスクエストまたはフリーフィールド
Info,1,Title,Campo de entrenamiento de ataque perfecto X
Info,1,Explanation,<yellow> Derrota a un Cuchronahda de nivel 31+ con<br>un ataque perfecto. <c>
Info,1,Errand,Completa una misión o expedición de ARKS.
