section,group,id,text
Info,0,Title,英雄と幻視の巫女
Info,0,Explanation,に依頼するといいって<br>教えてもらってさ。<br>手を貸してもらえると助かる！<br><br><yellow>※イーサン、カレンのみ同行<br>ノーマル以上でクリア<c>
Info,0,Reward,イーサン、カレンのPC　※受注時に付与<br>※好感度上昇によるプレゼントはあり
Info,1,Title,El héroe y la hechicera visionaria
Info,1,Explanation,"¡Perdón por la solicitud repentina!<br>Nos perdimos aquí, así que estamos buscando<br>para un camino a casa. íbamos a comprobar cada uno<br>ubicación, pero los lugareños dijeron que deberíamos preguntarte. ¡Estaríamos muy agradecidos si nos ayudaras!<br><br><yellow>Con Ethan y Karen como únicos<br>socios, claro en Normal o superior.<c>"
Info,1,Reward,Tarjeta de socio de Ethan y Karen<br>Emitido tras la aceptación de Quest.<br>Nota: No recibirás un regalo por aumentar la afinidad.
