section,group,id,text
TutorialText,0,Title,『ネッキーからの挑戦状』について
TutorialText,0,text0001,ボクはネッキー！<br>アークスのみんなに挑戦するため<br>新しい採掘基地防衛戦を用意したよ！<br><br>ルールは簡単！<br>３つの拠点が壊れたらクエスト失敗だ！<br>頑張って守り切ってね！<br><br>今回はダーカー以外のエネミーも<br>出て来るので注意してね！
TutorialText,0,text0002,また、特別ルールとして<br><yellow>侵食されたソケットは<br>浄化ができなくなっているよ！<c><br><br>ソルザ・ブラーダを見つけたら<br>素早く倒すのが攻略のカギだよ！
TutorialText,0,text0003,さらにさらに！<br><yellow>最後の力を使って拠点を破壊しようとする<br>エネミー<c>も新しく用意したよ！<br><br>ウェーブが終わる前に倒さないと<br>大惨事になるから、出てきたエネミーは<br>全部倒してね！<br><br>クエストの説明はこれでおしまい！<br>みんなの成功を祈ってい
TutorialText,1,Title,Un desafío de Necky
TutorialText,1,text0001,"Hola, soy Necky! He preparado una nueva batalla de defensa de la Base Minera para desafiar<br>¡Todos en ARKS! Las reglas son simples: si las tres fortalezas son destruidas,<br>¡fallas la misión! ¡Haz tu mejor esfuerzo para defenderlos! Y recuerda, serás<br>¡Lidiando con algo más que Falspawn!"
TutorialText,1,text0002,"También hay una regla especial:<br><yellow>¡No puedes purificar sockets corruptos!<c><br><br>Si ves un Solza Brahda, ¡será mejor que lo saques en un abrir y cerrar de ojos!"
TutorialText,1,text0003,"¡Pero espera, hay más!<br><yellow>Te enfrentaré a nuevos enemigos que usarán hasta el último gramo.<br>¡De su fuerza para intentar destruir fortalezas! <c> Harán mucho daño si<br>No los eliminas antes del final de la ola, así que asegúrate de destruirlos.<br>¡CADA enemigo que aparece! ¡Eso es todo por la descripción general de la misión! Mantendré mis dedos<br>cruzado por todos ustedes!"
