section,group,id,text
TutorialText,0,Title,このクエストについて
TutorialText,0,text0001,に累積します。<c>
TutorialText,0,text0002,このクエストでは<br><red>クエストをクリアするまで<br>エネミーからドロップするアイテムを<br>獲得できません。<c><br><br>クエストクリア後、転送先のエリアにて<br>獲得することができ
TutorialText,1,Title,Acerca de esta misión
TutorialText,1,text0001,"En esta misión, tu objetivo es destruir al jefe en el área final.<br><br>Mejoras de enlace de misión: cada vez que completas una misión de puntos ganados, se suma a<br>su <red>clasificación de misiones<c> acumulada y su <red>clasificación de resultados<c>. tu impulso<br>El nivel aumenta según el total de puntos acumulados, lo que <c f4a142> activa un<br>efecto de impulso<c> en misiones de impulso vinculadas.<br><br>Nota: Los puntos Quest Link Boost se <c f4a142>se comparten entre todas las cuentas del mismo barco.<c>"
TutorialText,1,text0002,"En esta misión, <red>no puedes adquirir objetos caídos de los enemigos hasta que completes la misión.<c><br><br>Los elementos caerán en el área posterior al teletransporte cuando completes la misión."
