section,group,id,text
CharaName,0,name01,？？？
CharaName,0,name02,？？？
CharaName,1,name01,¿?
CharaName,1,name02,¿?
ls_010030,0,ls_010030_0010,Wish upon a star<br>hope to be again
ls_010030,0,ls_010030_0020,the one you find<br>when all is done and through
ls_010030,0,ls_010030_0030,If all made a wish to save this star<br>would it be in vain?
ls_010030,0,ls_010030_0040,"So much it holds, too dear to part<br>may ways see the light of answers"
ls_010030,0,ls_010030_0050,"For all was, once, just taken away<br>that one hope, all disappeared<br>(one hope, all disappeared)"
ls_010030,0,ls_010030_0060,"So, none can break, nor brittle my heart<br>no, never again, until the end…"
ls_010030,0,ls_010030_0070,"Phantasy stars in universe, they shine on<br>unravel the dark to light the world, they shine on"
ls_010030,0,ls_010030_0080,"For all of the hearts who gave their all<br>know that it shines because of you, they shine on"
ls_010030,0,ls_010030_0090,"Phantasy stars in universe, they light up<br>shooting to bright the wishes true, they light up"
ls_010030,0,ls_010030_0100,"Many a star in universe<br>but it's only the one with you, that I can see"
ls_010030,0,ls_010030_0110,"Times have a way to stray, away<br>to swoon what is sane"
ls_010030,0,ls_010030_0120,"There is much to save, if love has a part<br>if to be, a flower, I'll be"
ls_010030,0,ls_010030_0130,"When all had gone, it had seemed as end<br>but somehow you reappeared<br>(somehow you reappeared)"
ls_010030,0,ls_010030_0140,"When nothing breathes a hope of a chance<br>still, even then, until the end…"
ls_010030,0,ls_010030_0150,"Phantasy stars in universe, they shine on<br>filling the sky with lights afloat, they shine on"
ls_010030,0,ls_010030_0160,"Many a fray to keep aglow<br>only to stand against it all, they shine on"
ls_010030,0,ls_010030_0170,"Phantasy stars in universe, they light up<br>fighting to shine in eyes of you, they light up"
ls_010030,0,ls_010030_0180,"Many a star in universe<br>still, if ever we are apart, you will find me"
ls_010030,0,ls_010030_0190,"For all was, once, taken away<br>all had disappeared"
ls_010030,0,ls_010030_0200,without the hope I hold<br>I'm nothing to be<br>made fable in sorrow
ls_010030,0,ls_010030_0210,"When all had gone, I had seen the end<br>you somehow reappeared"
ls_010030,0,ls_010030_0220,"without a heart, we're nothing at all<br>so make it love to save us all"
ls_010030,0,ls_010030_0230,"Phantasy stars in universe, they shine on<br>unravel the dark to light the world, they shine on"
ls_010030,0,ls_010030_0240,"For all of the hearts who gave their all<br>know that it shines because of you, they shine on"
ls_010030,0,ls_010030_0250,"Phantasy stars in universe, they light up<br>shooting to bright the wishes true, they light up"
ls_010030,0,ls_010030_0260,"Many a star in universe<br>still, we'll never be worlds apart"
ls_010030,0,ls_010030_0270,"Phantasy stars in universe<br>it's always the one with you, that I ever see"
ls_010030,0,ls_010030_1010,Living Universe
ls_010030,0,ls_010030_1020,初音ミク&巡音ルカ
ls_010030,1,ls_010030_0010,Hacer un deseo a una estrella <br> esperar a ser de nuevo
ls_010030,1,ls_010030_0020,el uno que encuentras <br> cuando todo este hecho y terminado
ls_010030,1,ls_010030_0030,"Si todos hicieran un deseo para salvar esta estrella, ¿seria en vano? <br>"
ls_010030,1,ls_010030_0040,"Tiene mucho que ver, demasiado querido como para separarlo <br> muchas vias veran la luz de las respuestas"
ls_010030,1,ls_010030_0050,"Porque todo fue asi, una vez, se llevo todo y desaparecio esa esperanza <br> (esa esperanza desaparecio)"
ls_010030,1,ls_010030_0060,"Asi que nadie puede romperlo, ni es fragil mi corazon <br> no, nunca mas hasta el final..."
ls_010030,1,ls_010030_0070,"Las estrellas fantasmagoricas en el universo brillan <br> descubrir la oscuridad y iluminar el mundo, ellas brillan"
ls_010030,1,ls_010030_0080,"Porque todos los corazones que dieron todo su ser <br> saben que brilla gracias a ti, ellas brillan"
ls_010030,1,ls_010030_0090,"Las estrellas fantasmagoricas en el universo se encienden <br> disparando hacia la luz de las verdaderas peticiones, ellas brillan"
ls_010030,1,ls_010030_0100,Muchos estrellitas en el universo <br> pero solo la que esta contigo es la que veo
ls_010030,1,ls_010030_0110,Los tiempos tienen un camino para apartarse <br> para suavizar lo que es racional
ls_010030,1,ls_010030_0120,"Hay mucho que salvar si el amor tiene algo que ver <br> si soy, una flor, sere"
ls_010030,1,ls_010030_0130,Cuando todo parecia haber terminado <br> pero de alguna manera reaparecio |(de alguna manera reaparecio)
ls_010030,1,ls_010030_0140,"Cuando no hay esperanza de una oportunidad<br> aun, incluso entonces, hasta el final..."
ls_010030,1,ls_010030_0150,"Fantasia en la universo, brillan en<br> llenando el cielo con luces flotantes, brillan"
ls_010030,1,ls_010030_0160,"Muchos un enfrentamiento para mantener encendido<br> solo para oponerse a el todo, brillan"
ls_010030,1,ls_010030_0170,"Fantasia en la universo, iluminan<br> luchando por brillar en los ojos de ti, ilumina"
ls_010030,1,ls_010030_0180,"Muchos una estrella en universo<br> todavia, si alguna vez estamos apartados, encontraras a mi"
ls_010030,1,ls_010030_0190,"Porque todo era, una vez tomado lejos<br> todo habia desaparecido"
ls_010030,1,ls_010030_0200,sin la esperanza que sostengo<br> Soy nada para ser <br> hecho leyenda en tristeza
ls_010030,1,ls_010030_0210,"Cuando todo habia ido, yo habia visto el final<br> de alguna manera reaparecieron"
ls_010030,1,ls_010030_0220,"sin un corazon, somos nada en absoluto<br> asi haz que sea amor para salvar a todos"
ls_010030,1,ls_010030_0230,"Las estrellas fantasmagoricas en el universo brillan <br> descubrir la oscuridad y iluminar el mundo, ellas brillan"
ls_010030,1,ls_010030_0240,"Porque todos los corazones que dieron todo su ser <br> saben que brilla gracias a ti, ellas brillan"
ls_010030,1,ls_010030_0250,"Las estrellas fantasmagoricas en el universo se encienden <br> disparando hacia la luz de las verdaderas peticiones, ellas brillan"
ls_010030,1,ls_010030_0260,"Muchas estrellas en universo<br> todavia, nunca estaras lejos del mundo"
ls_010030,1,ls_010030_0270,"Fantasia en la universo<br> siempre es el uno con ti, que yo veo"
ls_010030,1,ls_010030_1010,Universo Viviente
ls_010030,1,ls_010030_1020,Hatsune Miku & Megurine Luka
