section,group,id,text
Event1,0,11_voice_NPC_5051_101,ありがとう！<br>うわー、これがウワサの剣刃か。<br>うん、確かにこれなら何でも切れそう。
Event1,0,text02,あの食材を千切りにして……<br>いやいやみじん切りのほうが……？<br>……ああっと、ごめんなさい！
Event1,0,text03,料理のことは、きちんと厨房で<br>考えればいいもんね。<br>それより、お礼、お礼っと。
Event1,0,text04,いつもいつもありがとう！<br>また
Event1,1,11_voice_NPC_5051_101,"¡Muchas gracias! Vaya, esto parece<br>¡Como si pudiera cortarte con sólo mirarlo!<br>Esto definitivamente funcionará."
Event1,1,text02,"Ahora veamos, ¿debería empezar rebanando, cortando en cubitos,<br>o picar...? ¡Oh, no me hagas caso!"
Event1,1,text03,"Realmente debería dejar mi cerebro de cocina en<br>la cocina. Aquí, déjame obtener tu recompensa por<br>antes de que me pierda en mi próximo plato."
Event1,1,text04,¡Gracias como siempre! ¡Asegúrate de pasar nuevamente!
