section,group,id,text
Event1,0,text01,大掃除の後は気持ちいい……<br>と言いたいところだけど<br>すっきりしないね
Event1,0,text02,この世のすべてのダーカーが<br>駆除されない限り、アタシの心が<br>すっきりすることはないんだろう。
Event1,0,11_voice_NPC_5059_104,局所的に退治して<br>つかの間の安らぎを得る……<br>つまらない生き方かもね。
Event1,0,text04,それでもアタシはダーカーを<br>最後の１匹まで殺し続ける。<br>また機会があれば、よろし
Event1,1,text01,"He oido que salen en gran numero, <br> pero eso no hace la diferencia. ||TAG_1|| Lo que sea que haya, lo matamos."
Event1,1,text02,Dudo que mi corazón realmente encuentre la paz hasta que<br>hayamos erradicado todos los Falspawn que existen.
Event1,1,11_voice_NPC_5059_104,"Limpiarlos área por área, ganando solo un<br>breve momento de paz cada vez, es tan... aburrido."
Event1,1,text04,"Pero seguiré matándolos, hasta el último <br>. Espero que me ayudes si vuelve a surgir la oportunidad <br>."
