section,group,id,text
Event1,0,11_voice_NPC_5054_101,うむ、特訓内容は合格だ。<br>順調に昇っているようだな<br>はるかな高みへの階段を。
Event1,0,text02,精進を忘れず、驕りもせずに<br>愚直に努力を続けていれば<br>君ならばきっと辿り着けるだろう。
Event1,0,text03,そう……誰もが夢見る<br>ランチャー使いの頂点へ。<br>それまで、頑
Event1,1,11_voice_NPC_5054_101,"Sí, has pasado. Y ha dado otro<br>paso significativo en su viaje."
Event1,1,text02,Creo que si mantienes la cabeza recta<br>y no pierdes la concentración ni te enorgulleces demasiado...<br>realmente te convertirás en algo.
Event1,1,text03,Los picos que tantos sueñan alcanzar...<br>los del verdadero dominio del Lanzador.<br>¡Sigue luchando! ¡Están tan cerca!
