section,group,id,text
Event1,0,11_voice_NPC_5053_104,私たちの得ている情報は<br>依頼の詳細が全てだよ。<br>申し訳ない話だけどね。
Event1,0,text02,だが、キミは情報が不足していようとも<br>素早い判断と臨機応変な対応が<br>出来る人材だということは知っている。
Event1,0,text03,ゆえに、キミにお願いしたのだよ。<br>どうか、情報を掴んできてくれたまえ。<br>よろ
Event1,1,11_voice_NPC_5053_104,"Me temo que, una vez más, los detalles son pocos y<br>espaciados."
Event1,1,text02,"Pero confío en tu ojo perspicaz, como siempre.<br>Cuento contigo para aprovechar al máximo los<br>pocos datos disponibles."
Event1,1,text03,Espero ver los resultados de su<br>diligente recopilación de información.
