section,group,id,text
Event1,0,11_voice_NPC_5050_104,こちらは、貴方の能力を<br>さらに高めるための<br>適正評価試験になります。
Event1,0,text02,指定された「称号」を取得し<br>私に達成を報告してください。
Event1,0,text03,称号取得のための条件は<br>＋１０の★１２以上のユニットを<br>リア、アーム、レッグに装備すること。
Event1,0,text04,難しい課題ですが<br>今の貴方には乗り越えられるでしょう。<br>報告をお待ちしております
Event1,1,11_voice_NPC_5050_104,Esta es una prueba de evaluación para elevar tu<br>límite de nivel.
Event1,1,text02,Obtenga el título especificado e infórmeme una vez<br>has terminado.
Event1,1,text03,"Para ganar este título, debes tener +10 12★<br>unidades equipadas para su espalda, brazos y piernas."
Event1,1,text04,"No es una tarea fácil, pero tengo fe en que<br>estás más que a la altura del desafío.<br>Espero escuchar de su éxito."
