section,group,id,text
Event1,0,11_voice_NPC_5018_101,おーおーおーおー、見事見事。<br>いやいや、本当にやってのけるとは<br>お兄さん驚きだよ。
Event1,0,text02,確かにきみの実力は本物っぽいね。<br>アークスにとってうれしいことだよ。<br>うんうん。
Event1,0,text03,これからも、その力で<br>アークスのため、世界のために<br>がんばってほしいなあ。
Event1,0,text04,そのほうが、私がサボ
Event1,1,11_voice_NPC_5018_101,"¡Bueno, si eso no supera a todos!<br>Realmente haces que parezca facil."
Event1,1,text02,"Tienes algo especial. ARKS necesita<br>mas como tu, eso puedo decir."
Event1,1,text03,"Espero verte poniendo esa habilidad en buen<br>trabajo para ayudar a ARKS y al resto del<br>mundo también, ¿entiendes?"
Event1,1,text04,"Ahora, voy a descansar mis botas aquí<br>por un minuto..."
