section,group,id,text
Event1,0,11_voice_NPC_5050_104,こちらは、相応の実力を持つ<br>アークスのみが挑戦できる<br>解式ＰＡの習得許可申請試験です。
Event1,0,text02,解式ＰＡは、強力で特殊なＰＡです。<br>敵へのダメージで溜まるエネルギーを<br>消費して、放つことができます。
Event1,0,text03,これまでのＰＡと性質が異なるため<br>相応の実力を持つアークスにのみ<br>習得を許可しています。
Event1,0,text04,ですが、今の貴方であれば<br>必ず成し遂げることができるでしょう。<br>報告をお待ちしております
Event1,1,11_voice_NPC_5050_104,"Este es el examen de permiso de acumulación de arte con fotones, <br>, destinado únicamente a agentes calificados de ARKS."
Event1,1,text02,Libera<br>gastando la energía que acumulas a través de<br>dañando enemigos.
Event1,1,text03,"Debido a que son diferentes de todas las demás<br>Photon Arts, solo los agentes calificados de ARKS<br>pueden usarlos."
Event1,1,text04,Pero estoy seguro de que no es nada que no puedas manejar.<br>Estaré esperando la buena palabra.
