section,group,id,text
Event1,0,text01,やはり、お前との共闘は充実している。<br>今回も、多くの経験を<br>積むことができた。
Event1,0,11_voice_NPC_5151_100,得られたデータは<br>バウンサーというクラスの<br>さらなる発展に、必ず役に立つだろう。
Event1,0,text03,また、共に戦おう。<br>お前のさらなる成長を<br>期待している。
Event1,0,text04,私も、カトリや<br>他のバウンサーたちの模範となるよう<br>鍛錬を積んでいか
Event1,1,text01,Pelear contigo es bastante gratificante. He adquirido mas experiencia util.
Event1,1,11_voice_NPC_5151_100,Estoy seguro de que los datos que recopilamos también serán útiles<br>para desarrollar aún más la Clase Bouncer.
Event1,1,text03,Unamos fuerzas nuevamente pronto. Espero mas progreso de tu parte.
Event1,1,text04,Debo continuar mi entrenamiento para<br>ser un buen ejemplo para Katori y<br>los demás Bouncers.
