section,group,id,text
Event1,0,text01,技術は高まっていくにつれ<br>熟達速度が緩やかになっていく。<br>それは自然の摂理よ。
Event1,0,text02,そこで投げ出すか投げ出さないかは<br>完全に個人の資質に拠っている。
Event1,0,11_voice_NPC_5057_100,貴方は、こうして私に話している時点で<br>投げ出さない側に属しているようね。
Event1,0,text04,それでは、ツインマシンガンの<br>さらなる訓練、始めてみま
Event1,1,text01,"Cuanto más mejore su técnica, más<br>comenzará a ver rendimientos decrecientes. Eso es<br>solo una ley de la naturaleza."
Event1,1,text02,Todo el mundo tiene derecho a decidir si<br>cruza ese estancamiento o lo deja pasar cuando las cosas<br>se ponen difíciles.
Event1,1,11_voice_NPC_5057_100,El hecho de que estés aquí hablando conmigo<br>ahora significa que definitivamente no vas a dejar pasar a <br>.
Event1,1,text04,"Supongo que estás listo para otra ronda de entrenamiento con<br>Twin Machine Guns, ¿entonces?"
