section,group,id,text
Event1,0,text01,今回の試験は、惑星・地球の<br>東京というエリアでの自由な探索活動を<br>許可するためのものとなります。
Event1,0,11_voice_NPC_5050_104,本来ならば、地球と我々アークスとの<br>接点を作った貴方に、このような任務を<br>課すのは、おかしな話なのですが……
Event1,0,text03,これもひとえに<br>組織というものの硬直性ゆえと<br>ご容赦いただければと思います。
Event1,0,text04,とはいえ、貴方の実力をもってすれば<br>問題のない任務でしょう。<br>それでは、吉報をお待ちして
Event1,1,text01,La finalidad de esta prueba es certificarle para actuar libremente en la zona de Tokio del planeta Tierra.
Event1,1,11_voice_NPC_5050_104,"Deberia estar asignandote una mision que conectara a la gente de la Tierra con nosotros, los Arks, pero..."
Event1,1,text03,Considera que esta parte es parte de la burocracia inherente en nuestra organizacion. Por favor no te preocupes.
Event1,1,text04,"Sin embargo, considerando tu habilidad, creo que esto podria ser una tarea sencilla para ti, pero espero que la aceptes de todos modos."
