section,group,id,text
Event1,0,text01,ロックゴーレム以外にも<br>ゴーレムって名前がつくエネミーが<br>いるみてーだな。
Event1,0,11_voice_NPC_5052_106,えーと、ボンバゴーレムってやつか。<br>……おっ、コイツの名前！<br>イイカンジじゃね！？
Event1,0,text03,オレ的には<br>ボンバって響きが気に入ったぜ！<br>……まあ、所詮エネミーなんだけどよ。
Event1,0,text04,よし、次の戦闘データは<br>コイツのを取ってきてくれよ！<br
Event1,1,text01,He oído que los Rock Golems no son los únicos Golems<br>que existen...
Event1,1,11_voice_NPC_5052_106,"Como este Bomber Golem... ¿¡BOMBER Golem!?<br>Hombre, ¡qué nombre tan genial!"
Event1,1,text03,¡El nombre suena genial!<br>Aunque sigue siendo un enemigo.
Event1,1,text04,"Ve a buscar información sobre estos tipos malos, ¿eh?<br>¡Hombre, no puedo esperar a saber cómo son!"
