section,group,id,text
Event1,0,11_voice_NPC_5567_104,うーん……<br>エネルギーが少なくなってきたから<br>お腹ペコペコだよ……
Event1,0,text02,アークスシップにはおいしそうなものが<br>たくさんあるみたいだけど……わたしは<br>ダークニクスだから食べられないし……
Event1,0,text03,うふぅ……ダーカー因子を補給しないと<br>このままだと、機能停止しちゃう……<br><%me>さん。
Event1,0,text04,わたしは、あのヒトと約束したから<br>一緒に行けないけど……<br>ダーカー因子の補給、頼めな
Event1,1,11_voice_NPC_5567_104,"Mm... Desde que comencé a quedarme sin<br>energía, me he estado muriendo de hambre..."
Event1,1,text02,"Hay muchas cosas deliciosas en el<br>ARKS Ship, pero no puedo comer nada porque soy<br>un Darknyx."
Event1,1,text03,¡Los automatas se han vuelto freneticos y<br>comenzo a atacarlos!
Event1,1,text04,"Le hice una promesa a cierta persona, así que<br>no puedo ir contigo, pero ¿podría pedirte que<br>me reabastezca F-Factor?"
