section,group,id,text
Event1,0,text01,遺跡エリアにいるキュクロナーダって<br>ダーカーがいるだろ？<br>あの図体がでかいやつ。
Event1,0,text02,あいつって、攻撃範囲は広いし<br>地面を叩きつけて衝撃波も出してくる。<br>正直、苦手なんだ。
Event1,0,11_voice_NPC_5091_105,ジャストアタックで手早く倒せれば<br>それがいいってのはわかってるんだけど<br>なかなか上手くいかないんだよな。
Event1,0,text04,だからさ、センパイ、手間かけて<br>悪いんだけど、ジャストアタックでの<br>倒し方を見せてもらえないか？
Event1,1,text01,"Entonces están estos Cuchronahda Falspawn afuera<br>en las ruinas, ¿verdad? Esos grandes, enormes."
Event1,1,text02,w comienzan<br>a romper el suelo y a enviar<br>ondas de choque.
Event1,1,11_voice_NPC_5091_105,"Sé que debería intentar moverme para realizar ataques rápidos y<br>perfectos, pero es difícil, ¿sabes?"
Event1,1,text04,"Por eso esperaba que pudieras mostrarme a<br>cómo derrotarlos con un ataque<br>perfecto, jefe."
