section,group,id,text
Event1,0,11_voice_NPC_5053_100,多くの有益な情報を<br>得ることができた。<br>キミには感謝している！
Event1,0,text02,だが、惑星ハルコタンの生態には<br>まだまだ謎なところが多い。
Event1,0,text03,さらに多くのデータを集めて<br>それを解明していかねばなるまい。<br>今後とも、よろしく
Event1,1,11_voice_NPC_5053_100,Eso me proporcionó un verdadero caché de<br>datos beneficiosos. ¡Estoy muy agradecido!
Event1,1,text02,"Sin embargo, la ecología de Harukotan<br>sigue siendo un misterio."
Event1,1,text03,Debo recopilar más datos y dejar al descubierto esos<br>misterios. Espero que continúes<br>para ayudarme.
