section,group,id,text
Event1,0,11_voice_NPC_5057_100,今、貴方に見えている世界は<br>初めてツインダガーを手にした頃と<br>ずいぶん違っているでしょう。
Event1,0,text02,力がつけばつくほど<br>目の前の全てが<br>ありふれたものに見えてくるはずよ。
Event1,0,text03,でも今回の教導メニューは<br>そんな貴方に初心を思い返させてくれる<br>厳しい内容だということを忘れないで。
Event1,1,11_voice_NPC_5057_100,Me imagino que la forma en que ves el mundo ha<br>cambiado bastante desde la primera vez que<br>empuñaste las Dagas Gemelas.
Event1,1,text02,"Cuanto más poderoso te vuelves,<br>más común debería parecer todo lo que ves <br>."
Event1,1,text03,Pero no lo olvides: el objetivo de entrenar<br>de esta intensidad es recordarte cómo era<br>en tus días de novato.
