section,group,id,text
Event1,0,text01,パーティーを組むと戦いの幅が広がるし<br>ソロで時々ある危機的な状況も、仲間が<br>フォローしてくれるのは、わかった。
Event1,0,text02,だけど、多人数だと、どうしても<br>自由がきかないこととかもあって<br>評価に影響することもあるだろ？
Event1,0,11_voice_NPC_5091_104,そういう、評価を意識した時に<br>パーティー全体の動きは変わるのか<br>ちょっと気になるんだ。
Event1,0,text04,……センパイ。<br>よければおれに、やり方ってのを<br>見せてく
Event1,1,text01,Trabajar en un grupo abre toda una gama<br>de estrategias de combate y realmente ayuda cuando<br>te encuentras con problemas que no puedes manejar solo.<br>Lo entiendo.
Event1,1,text02,"Pero cuanta más gente hay en el partido, menos<br>control que siento que tengo sobre lo que puedo hacer.<br>Y eso puede hacer bajar nuestro ranking, ¿sabes?"
Event1,1,11_voice_NPC_5091_104,Eso me hizo pensar: ¿la gente tiende a<br>coordinarse de manera diferente cuando están disparando<br>un alto rango?
Event1,1,text04,"Esperaba que pudieras demostrar<br>Para mí, jefe."
