section,group,id,text
Event1,0,11_voice_NPC_5407_200,今、あちこちの惑星で<br>不自然にダーカーが<br>増えているみたいです。
Event1,0,text02,原因は不明だけど、どうも上の人らは<br>俺たちが関わった戦いの余波じゃないか<br>と、考えてるらしいんだ。
Event1,0,text03,ブルーノさんは、このダーカー発生に<br>ついて調査するよう指令を受けて<br>わたしがお手伝いすることになりました。
Event1,0,text04,ダーカーバスターズ、再始動です！<br><%me>さん……<br>協力をお願いしてもいい
Event1,1,11_voice_NPC_5407_200,Los Falspawn anormales han ido en aumento en<br>en casi todos los planetas en los que hemos estado.
Event1,1,text02,"Demonios, si sabemos por qué, pero la teoría de<br>de los altos mandos es que es un efecto secundario de las peleas<br>en las que hemos estado involucrados."
Event1,1,text03,"A Bruno se le ha encomendado la tarea de investigar<br>la causa raíz de estos Falspawn, y a<br>se me ha encomendado a mí ayudarlo."
Event1,1,text04,"¡Los Falspawn Busters están de vuelta en acción! ¿Te importaría<br>unirte a nosotros, <%me>?"
