section,group,id,text
Event1,0,11_voice_NPC_5055_100,いつも気軽に引き受けていただいて<br>本当にありがとうございます！
Event1,0,text02,でも、僕の予測が正しいと<br>かなり危険な観察になるはずです。<br>火傷には充分、注意してくださいね！
Event1,0,text03,僕の観察も大事ですけど<br><%me>さんの<br>身体はもっと大事だし……
Event1,0,text04,くれぐれも無理はしないでください
Event1,1,11_voice_NPC_5055_100,Siempre estás tan listo y dispuesto a aceptar<br>mis solicitudes. ¡Significa mucho para mí!
Event1,1,text02,"Pero si mis pronósticos son correctos, esta podría ser una misión un poco arriesgada. Querrás tener cuidado con<br>para evitar quemaduras."
Event1,1,text03,"Quiero decir, creo que mi investigacion es importante, pero <br> definitivamente no es mas importante que tu seguridad, <br>"
Event1,1,text04,"¡Tengo que descubrir como funciona y enviarle a ||TAG_0|| mi analisis a la Academia, rapidamente!"
