section,group,id,text
Event1,0,11_voice_NPC_5026_100,最近、レンジャーとして<br>活躍されてると聞きましたよお。
Event1,0,text02,撃って撃って撃ちまくって<br>殺しまくってるんですねえ。<br>いいですねえ、いいですよお。
Event1,0,text03,それじゃあですねえ、リサに<br>その実力を見せてもらえませんかあ？
Event1,0,text04,ふふっ。<br>いい報告、待って
Event1,1,11_voice_NPC_5026_100,He oído que últimamente has estado causando todo tipo de problemas<br>como Ranger.
Event1,1,text02,"Según lo que dice la gente, has estado acumulando<br>bastantes cadáveres. ¡Qué lindo!"
Event1,1,text03,"Ahora, ¿crees que puedes mostrarme a mi pequeño<br>qué tipo de carnicería puedes hacer tú <br>? ¿Mmm?"
Event1,1,text04,"¡Oh, estoy tan emocionada de saberlo!"
