section,group,id,text
CharaName,0,name01,エコー
CharaName,1,name01,Eco
Event1,0,text01,ふぅっ、これでおしまい……かな？<br>よかった、なんとかなったみたいね。
Event1,0,11_voice_NPC_5002_104,それにしても、すごいダーカーの数……<br>今回ので、少しでも減らせたなら<br>いいけど。
Event1,0,text03,それじゃ、戻りましょう。<br><%me>。
Event1,1,text01,"Uf... ¿Eso es todo? ¡Excelente! Lo logramos, <br>, supongo. De alguna manera."
Event1,1,11_voice_NPC_5002_104,"Aún así, esta es una cantidad increíble de Falspawn. <br>Espero que hayamos logrado reducir un poco sus números <br>."
Event1,1,text03,"Muy bien, volvamos,<br><%me>."
