section,group,id,text
Event1,0,text01,わあ、ありがとう！<br>ふむふむ……これは何か<br>モーター的なもののようね。
Event1,0,text02,うーん、今あるものを組み合わせて<br>何か作れないかしら……？<br>少し考えてみるわね。
Event1,0,11_voice_NPC_5051_100,やっぱり、私の料理には<br>あなたの持ってきてくれる<br>刺激的な素材が不可欠だわ！
Event1,0,text04,体に気を付けて<br>これからも新しい発見を目指して<br>頑張ってね。応援しているわ！
Event1,1,text01,"¡Oh, gracias! Hmm, veamos... Me parece<br>una especie de motor."
Event1,1,text02,Hmm... Tal vez podría hacer algo con estas cosas<br>si las juntara todas. Será mejor que lleve a<br>a una lluvia de ideas.
Event1,1,11_voice_NPC_5051_100,Debo decir que no sería ni la mitad de cocinero que soy<br>hoy sin todos los interesantes ingredientes que<br>me traes.
Event1,1,text04,Cuídate y sigue esforzándote por<br>hacer nuevos descubrimientos. ¡Te estoy apoyando!
