section,group,id,text
Event1,0,11_voice_NPC_5053_101,ありがとう！<br>キミからもたらされた情報は<br>必ずや幻創種の解明に役立つだろう。
Event1,0,text02,幻創種は、そもそも生物と<br>大別してよいものかすらも<br>定かではない存在のようなのだ。
Event1,0,text03,研究には、これまで以上の困難が<br>待ち受けているだろう。<br>私も気を引き締めてかかるよ。
Event1,0,text04,少ないが、謝礼を受け取ってほしい。<br>これからも私の研究に<br>力を貸してもら
Event1,1,11_voice_NPC_5053_101,"¡Ah, gracias! La información que me trajiste.<br>Sin duda será fundamental para analizar<br>los fantasmas."
Event1,1,text02,"Los fantasmas son fascinantes porque, en<br>en conjunto, no pueden considerarse<br>seres vivos, aunque poseen<br>muchas cualidades similares."
Event1,1,text03,"Hemos dado un paso adelante hacia un mundo mucho más<br>situación precaria. La investigación será más difícil<br>que nunca, pero debo estar a la altura de la tarea."
Event1,1,text04,Por favor acepte esta modesta recompensa.<br>Estaría agradecido de contar con su ayuda nuevamente.
