section,group,id,text
Event1,0,text01,お、終わりましたの……？<br>私、クタクタでもう動けませんわ……
Event1,0,text02,貴方様は……<br>余裕、といった感じですわね……
Event1,0,11_voice_NPC_5150_100,でも、今回も得るものはありましたし<br>上達した気がします。<br>気のせいかもしれませんが。
Event1,0,text04,これからも精進いたしますわ。<br>さあ、帰還いたしまし
Event1,1,text01,¿Se acabó?<br>Estoy tan agotado que no puedo mover un músculo.
Event1,1,text02,Y tú... parece que podrías enfrentarte fácilmente a<br>más. Oh...
Event1,1,11_voice_NPC_5150_100,"...Pero esta vez aprendí algunas cosas y estoy<br>bastante seguro de que mejoré. Sin embargo, podría ser solo mi<br>imaginación."
Event1,1,text04,"Sólo necesito seguir entrenando.<br>Bueno, volvamos, supongo."
