section,group,id,text
Event1,0,text01,いままで集めたブーストエネミー……<br>その原因となる、侵食核の情報を<br>まとめてみているんです。
Event1,0,11_voice_NPC_5062_105,ただ、知れば知るほどわからない<br>というか、わからない箇所が多くて<br>まとまりきらないというか……
Event1,0,text03,しかも、新しいタイプの侵食核も<br>見つかっているとのことですし<br>……まだまだ道半ば、ですね。
Event1,0,text04,取り急ぎ、その新たな侵食核の<br>情報を集めておきたいと思います。<br>協力してもらえま
Event1,1,text01,Hemos estado trabajando para recopilar información sobre<br>los núcleos corruptos que son la fuente de todo<br>Estos enemigos Berserk que hemos encontrado.
Event1,1,11_voice_NPC_5062_105,"Pero parece que cuanto más aprendemos, menos<br>lo sabemos. Hay tantas incógnitas,<br>Ni siquiera sabemos cuáles son todos."
Event1,1,text03,"Y luego están estos nuevos tipos de<br>núcleos corruptos que se han descubierto,<br>y... parece que todavía estamos muy lejos."
Event1,1,text04,"Entonces, para ir al grano, ¿podrías por favor?<br>ayúdame a saber más sobre estas nuevas<br>núcleos corruptos?"
