section,group,id,text
Event1,0,11_voice_NPC_5018_101,おーおーおーおー、見事見事。<br>いやいや、本当にやってのけるとは<br>お兄さん驚きだよ。
Event1,0,text02,確かにきみの実力は本物っぽいね。<br>アークスにとってうれしいことだよ。<br>うんうん。
Event1,0,text03,これからも、その力で<br>アークスのため、世界のために<br>がんばってほしいなあ。
Event1,0,text04,そのほうが、私がサボれるからねー
Event1,1,11_voice_NPC_5018_101,"¡Hola, compañero! Coloréame impresionado.<br>Manejaste eso como si estuvieras fuera por<br>un mosey."
Event1,1,text02,"Seguro que eres el artículo genuino. <br>El tipo ARKS debería considerarse afortunado de tener <br>, te digo una cosa."
Event1,1,text03,"Ahora ve a salvar el mundo, ¿escuchas?"
Event1,1,text04,Mientras me tomo un pequeño respiro de los polvorientos<br>senderos aquí...
