section,group,id,text
Event1,0,11_voice_NPC_5021_100,うむ、よろしい！<br>やはり君は優秀なアークスだな。<br>杞憂で済んでよかった。
Event1,0,text02,オートワードを用いれば<br>かけ声のみならず、不意の状況でも<br>危険を知らせることが可能だ！
Event1,0,text03,ユニークな使い方をするアークスも<br>居ることだし、使わなければ損と<br>言ってしまっても問題ないだろう！
Event1,0,text04,いいか、私も当初は羞恥心
Event1,1,11_voice_NPC_5021_100,"Para aumentar el nivel de elemento, elige armas con la misma rareza y categoria que los materiales."
Event1,1,text02,"El uso del chat automático no solo permite a<br>dar un grito, sino que también puede darle un empujón a<br>cuando surge un peligro."
Event1,1,text03,"Muchas operaciones de ARKS encuentran muchas formas creativas<br>de usarlo. En lo que a mí respecta, sería<br>un desperdicio no hacerlo."
Event1,1,text04,"Cuando estaba empezando, era demasiado tímido para<br>realmente usar Auto Chat en todo su potencial y..."
