section,group,id,text
Event1,0,11_voice_NPC_5087_100,おっかえりー！<br>カタナの使い方、少しうまくなったね。
Event1,0,text02,それもこれも、わたしの考えた<br>訓練用メニューのおかげだよねー？
Event1,0,text03,もちろん、あなたのがんばりもあるけど<br>カタナの腕を上げたいなら<br>これからもわたしのとこへおいでー。
Event1,0,text04,もっとすごい訓練用メニュー<br>考えとくから、また
Event1,1,11_voice_NPC_5087_100,"¡Bienvenido de nuevo! Parece que te estás poniendo un poco<br>Más acostumbrado a empuñar Katanas, ¿eh?"
Event1,1,text02,"Apuesto que todo es gracias al super-grande.<br>régimen de entrenamiento que preparé para ti, ¿sí?"
Event1,1,text03,"No restar importancia a todo el duro trabajo que has hecho.<br>poner, por supuesto! Ahora bien, si quieres<br>mejora aún más, solo asegúrate de pasar por aquí<br>y verme."
Event1,1,text04,Tendré un plan aún mejor elaborado por<br>Entonces lo prometo.
