section,group,id,text
Event1,0,11_voice_NPC_5053_104,やはりキミは期待を裏切らないな。<br>大いに感謝している。
Event1,0,text02,キミの協力は、学術的に<br>大きな価値のあるものだ。<br>どうか誇りに思ってほしい。
Event1,0,text03,それでは私はモニター越しに<br>キミを見守っている
Event1,1,11_voice_NPC_5053_104,Veo que mis esperanzas en usted estaban bien fundadas.<br>Tienes mi más sincero agradecimiento.
Event1,1,text02,Su cooperación es muy valiosa para nuestra<br>búsqueda del avance científico.<br>Espero que te enorgullezca saber eso.
Event1,1,text03,Te estaras observando a traves del monitor.
