section,group,id,text
Event1,0,11_voice_NPC_5059_104,黒ノ領域の奥のほうで<br>デカいヤツが、確認されたみたいだね。
Event1,0,text02,小物ばかりで、くすぶってたんだ。<br>腕が鳴るね。
Event1,0,text03,ま、あんたが気分が乗らないなら<br>アタシが倒してくるだけさ。
Event1,0,text04,依頼を受ける、受けないは<br>個人の自由だよ。<br>無理強いはしない
Event1,1,11_voice_NPC_5059_104,Escuché que verificaron un enorme Falspawn<br>en lo profundo de la Provincia Nightfall.
Event1,1,text02,Será un buen cambio de ritmo con respecto a la interminable franja de<br>de pequeños peces. Tengo muchas ganas de dejarlo.
Event1,1,text03,"Bueno, si no te sientes con ganas, entonces yo<br>lo haré. Así de simple."
Event1,1,text04,Eres libre de elegir si aceptas la solicitud<br>o no. No te obligaré.
