section,group,id,text
Event1,0,11_voice_NPC_5056_104,アンタに鼻をあかされるなんて<br>ちょっと悔しいわね……
Event1,0,text02,でも楽勝だったようにも見えないわよ？<br>結構、キツかったんじゃない？
Event1,0,text03,楽勝でも苦戦でもＳランククリアには<br>違いないから、とりあえず、おめでと！
Event1,0,text04,さ、次の探索に出掛けないと<br>またすぐ声かけちゃうからね
Event1,1,11_voice_NPC_5056_104,"¡Ahora, continua con tu proxima exploracion<br>antes de que te llame para otra tarea!"
Event1,1,text02,Pero tengo la sensación de que no fue tan fácil<br>como parecía. Tenías que haber luchado al menos<br>un poco.
Event1,1,text03,"Aun así, sea pan comido o no, una S es una S. ¡Muy bien<br>hecho!"
Event1,1,text04,"¡Ahora, continúa con tu próxima exploración<br>antes de que te llame para otra tarea!"
