section,group,id,text
Event1,0,11_voice_NPC_5003_101,助かったー！<br>一時はどうなることかと思ったぜ。
Event1,0,text02,相棒にも手間かけさせちまったな。<br>これに懲りて、安請け合いはしないよう<br>気をつけるよ。
Event1,0,text03,これ報酬の分け前。<br>んじゃ、ありがとな
Event1,1,11_voice_NPC_5003_101,¡Impresionante! No estaba seguro de qué iba a pasar<br>por un momento allí.
Event1,1,text02,"Lo siento por hacerte ir a toda prisa y con problemas para ayudarme, amigo.<br>Me asegurare de solo hacer promesas que puedo cumplir desde ahora."
Event1,1,text03,Aquí está tu recompensa. ¡Muchas gracias!
