section,group,id,text
Basic,0,Title,此処に在る意味
Basic,0,Explanation,ユクリータより現れた、原初の【若人】<br>アウロラ。彼女が復活した理由を探るため<br>リリーパ各地を巡る。<br>――――――――――――――――――――<br>※高難度クエスト<br>※スケープドール・ハーフドール使用禁止<br>失敗条件/戦闘不能
Basic,0,StoryExplanation,ユクリータより現れた、原初の【若人】アウロラ。<br>彼女が復活した理由を探るためリリーパ各地を巡る。<br>※高難度クエスト<br>※スケープドール・ハーフドール使用禁止
Basic,1,Title,El significado de estar aquí
Basic,1,Explanation,"Aurora fue la génesis del Aprendiz el Vernal,<br>originario de Euclyta. Para investigar la razón<br>para su avivamiento, se abrió camino a través del vasto<br>tierras de Lillipa.<br>-------------------------------------<br>Esta es una misión de alta dificultad.<br>El uso de Scape Doll o Half Scape Doll es<br>prohibido.<br>Fallarás esta misión si quedas incapacitado."
Basic,1,StoryExplanation,"Aurora fue la génesis del Aprendiz el Vernal,<br>originario de Euclyta. Para investigar la razón<br>para su avivamiento, se abrió camino a través del vasto<br>tierras de Lillipa."
QuestTarget,0,SimpleExplanation,壊世区域を調査せよ！
QuestTarget,1,SimpleExplanation,¡Examina la región corrupta!
