section,group,id,text
Basic,0,Title,紡がれるは新たな歴史
Basic,0,Explanation,サラとマリアと共に<br>惑星ナベリウスの遺跡奥地へと辿り着いた<br><%me>。<br>その目的はただひとつ。<br>あの日、消息を絶った彼を救うことにある。<br>――――――――――――――――――――<br>失敗条件/戦闘不能後、リタイアを選択
Basic,0,StoryExplanation,サラとマリアと共に、惑星ナベリウスの遺跡奥地へと<br>辿り着いた<%me>。<br>その目的はただひとつ。<br>あの日、消息を絶った彼を救うことにある。
Basic,1,Title,Hilando una nueva historia
Basic,1,Explanation,en Naverio. Solo tenian un objetivo: el<br>rescate del hombre que desaparecio ese fatidico dia.
Basic,1,StoryExplanation,en Naverio. Sólo tenían un objetivo: el<br>rescate del hombre que desapareció ese fatídico día.
QuestTarget,0,SimpleExplanation,ファルス・ヒューナルを撃退せよ！
QuestTarget,1,SimpleExplanation,¡Derrota a Falz Hyunal!
