section,group,id,text
st_054010,0,st_054010_0002,魔道国クエントの新たな王に<br>ハリエットが即位したことにより<br>国内は落ち着きを取り戻しつつあった。
st_054010,0,st_054010_0004,しかし、ハリエットの目的は<br>国の平定のみにあらず。
st_054010,0,st_054010_0006,世界を蝕む徒花、エフィメラの排斥を目指し<br>新生クエントは動き出そうとしていた。
st_054010,0,st_054010_0010,まずは、周辺諸国を含めた<br>状況を整理しましょう。<br>ヴァルナ、お願いします。
st_054010,0,st_054010_0020,この大陸は、大きく分けて<br>東西南北で四つの国に分かれています。
st_054010,0,st_054010_0030,東方には、イス＝アルス通商連合国。<br>肥沃な土地と資源を用いて商売していた<br>商人達が作り上げた、集合体的国家です。
st_054010,0,st_054010_0040,特有の技術は、増殖魔術だね。<br>エフィメラの力を用いて、作物などを<br>大量に増殖させることが可能らしい。
st_054010,0,st_054010_0050,それだけなら平和的に聞こえるが<br>まあ、エフィメラを使っている以上<br>何か裏があるんだろうね。
st_054010,0,st_054010_0060,西方には、神国エピック。<br>過酷な修行を行う求道者が集っていた<br>オアシスを中心に成立した国。
st_054010,0,st_054010_0070,エピックでは、心を操る秘薬の精製に<br>成功したという噂を聞いたことがある。<br>エフィメラを用いることで、ね。
st_054010,0,st_054010_0080,北方に座するは、ヴェルン皇国。<br>代々の皇帝は、国で最も強い者が<br>選ばれるという、武人の国です。
st_054010,0,st_054010_0090,野蛮で危険な馬鹿共の国だよ。<br>肉体を強化する魔人化なんてものを<br>編み出している。
st_054010,0,st_054010_0100,そして、南方が我が魔道国クエント。<br>自然と共にあることを主とし<br>マナの活用に力を入れております。
st_054010,0,st_054010_0110,魔道研究だけは進んでいた国だ。<br>僕が開発した魔神城も<br>もとはクエント特有のものさ。
st_054010,0,st_054010_0120,……もっとも、誰かが<br>その技術を横流ししてくれて<br>各国が活用しているようだがね。
st_054010,0,st_054010_0130,クエント内の魔神城は、守護輝士殿の<br>ご協力もあって順次破壊されています。
st_054010,0,st_054010_0140,ですが、各国の管理する魔神城。<br>これについては、国境線のものも含め<br>依然として健在です。
st_054010,0,st_054010_0150,各国、魔神城がにらみ合っている。<br>これにより国同士の交流はほぼ断絶。
st_054010,0,st_054010_0160,現在の各国内がどういう状況か<br>知りようもない。
st_054010,0,st_054010_0170,勝手に侵入しようとすれば<br>たちまち魔神城が稼働し<br>侵入者を排除しようと動き出す。
st_054010,0,st_054010_0180,そんな馬鹿な真似をする輩は<br>まあ、いないだろうね。
st_054010,0,st_054010_0190,報告します！<br>ヴェルン国境線上にある魔神城が起動！<br>何者かが近づいた模様です！
st_054010,0,st_054010_0200,……そんな馬鹿な真似をする輩が<br>まだこの世にいたとはね。
st_054010,0,st_054010_0210,ヴェルンからの使者かもしれません。<br>急ぎ、国境へと向かいましょう。
st_054010,1,st_054010_0002,"Con Hariette asumiendo el papel de gobernante del Reino Mágico<br>de Cuento, la tierra volvía a tomar el camino de la paz."
st_054010,1,st_054010_0004,Pero el objetivo de Hariette era más que simplemente sentarse<br>el trono.
st_054010,1,st_054010_0006,"El recién renacido Cuento se movilizaba con la intención de<br>erradicando Ephemera, la flor insidiosa que erosiona el mundo."
st_054010,1,st_054010_0010,"Comencemos revisando la situación de nuestras tierras vecinas.<br>Varuna, si pudieras, por favor."
st_054010,1,st_054010_0020,Nuestro continente está dividido en cuatro naciones cardinales separadas.
st_054010,1,st_054010_0030,"Al este se encuentra la Federación de Comercio de Ys ​​Artia.<br>Construido por comerciantes, aprovecha su rico suelo.<br>y abundantes recursos para hacer negocios."
st_054010,1,st_054010_0040,Su especialidad de hechicería es la replicación. Ellos aprovechan el poder<br>de Ephemera para reproducir cosas en grandes cantidades.
st_054010,1,st_054010_0050,"Parece bastante inofensivo a primera vista, pero si Ephemera es<br>involucrados, es casi seguro que habrá una trampa."
st_054010,1,st_054010_0060,"Al oeste se encuentra la Tierra Divina de Epyk.<br>Construido alrededor de un oasis, los buscadores de la iluminación se reúnen allí<br>someterse a un riguroso entrenamiento ascético."
st_054010,1,st_054010_0070,"Se rumorea que en Epyk han perfeccionado un medio de<br>Refinar pociones de control mental. Usando Ephemera, por supuesto."
st_054010,1,st_054010_0080,Al norte se encuentra el Imperio Weyland.<br>Es una nación de guerreros que ha coronado a su<br>Emperador de los ciudadanos más fuertes durante generaciones.
st_054010,1,st_054010_0090,Es una tierra de salvajismo donde el poder hace el bien. ellos tienen<br>ideó un medio para mejorar el cuerpo llamado demonización.
st_054010,1,st_054010_0100,"Y en el sur está nuestra nación, el Reino Mágico de Cuento.<br>Vivimos en armonía con la naturaleza y encontramos aplicaciones prácticas.<br>por maná."
st_054010,1,st_054010_0110,Nuestra tierra se centra estrictamente en los estudios de lo arcano.<br>El Castrum Demonica que desarrollé comenzó como<br>La especialidad de Cuento.
st_054010,1,st_054010_0120,"Por supuesto, alguien filtró el arte de convocar a Castrums<br>a otras tierras, por lo que ahora todas las naciones los presentan en batalla."
st_054010,1,st_054010_0130,Los Castrum Demonicas dentro de Cuento están a punto de desaparecer<br>gracias a los esfuerzos de nuestro estimado Guardián.
st_054010,1,st_054010_0140,"Sin embargo, los Castrum Demonicas de otras tierras permanecen<br>de pie, demarcando físicamente sus fronteras."
st_054010,1,st_054010_0150,"Los Castrum Demonicas de cada tierra están en un punto muerto con uno<br>otro, poniendo fin a la mayoría de las relaciones internacionales."
st_054010,1,st_054010_0160,"Ergo, no tenemos forma de saber cuál es la realidad.<br>sobre el terreno de cualquier otra nación."
st_054010,1,st_054010_0170,"Si alguien intentara cruzar una frontera sin permiso,<br>los Castrum Demonicas se activarían y movilizarían<br>para exterminar a los intrusos."
st_054010,1,st_054010_0180,"De todos modos, nadie sería tan estúpido como para intentarlo."
st_054010,1,st_054010_0190,¡Tengo un informe! Un Castrum Demonica en la frontera de Weyland<br>se ha activado! ¡Alguien parece haberse acercado!
st_054010,1,st_054010_0200,"Bueno, ¿qué sabes? Me corrijo."
st_054010,1,st_054010_0210,It could be an envoy from Weyland.<br>Apresurémonos a llegar a la frontera.
Skit,0,skit01,The Destruction and Struggle
Skit,0,skit02,滅びゆく国
Skit,1,skit01,Destrucción y lucha
Skit,1,skit02,El país moribundo
CharaName,0,name01,兵士
CharaName,0,name02,？？？
CharaName,1,name01,¿?
CharaName,1,name02,¿?
