section,group,id,text
TutorialText,0,Title,『チームへの入団希望者登録・検索』について
TutorialText,0,text0001,チームへの入団希望者登録について説明します。<br><br>チームに所属したい場合に他の人から<br>チームに誘ってもらいやすくする機能です。<br><br>チームに所属していない人は<br>チームコマンドまたはチームカウンターから<br>チームへの入団希望者登録の<br>「入団希望を有効にする」にチェックを入れると<br>チーム側から検索対象となりチームから誘われやすくなります。<br><br><yellow>※登録内容はチームへ入団した時点でリセットされます。<c>
TutorialText,0,text0002,チームへの入団希望者検索について説明します。<br><br>マネージャー以上の役職で<br>チームに所属している人はチームカウンターから<br>「チームへの入団希望者検索」を選択すると<br>チームへの入団を希望している人を<br>検索することができます。
TutorialText,1,Title,Búsqueda de Alianzas y Candidatos
TutorialText,1,text0001,"Esta función te facilita recibir invitaciones de otros jugadores cuando<br>estás buscando unirte a una Alianza.<br><br>Los jugadores que no estén actualmente en una Alianza pueden registrar su deseo de unirse.<br>uno a través de los Comandos de la Alianza o en el Mostrador de la Alianza. Simplemente agregando<br>una marca de verificación además de [Looking for an Alliance] facilitará las cosas para las Alianzas<br>para encontrarte en búsquedas y enviarte una invitación.<br><br><yellow>Si ingresas a una Alianza, esta configuración se restablecerá.<c>"
TutorialText,1,text0002,Los miembros de la Alianza con una posición de Oficial o superior pueden usar<br>la función [Search for Candidates] en el contador de alianza para<br>busca jugadores que quieran unirse a una alianza.
