section,group,id,text
TutorialText,0,Title,『解式フォトンアーツ』について
TutorialText,0,text0001,><c ff4f3f><br>※通常クラスかつ<br>   メインクラスの武器で使用できます。<br><br>※ジャストアタックやクラススキル<br>   エネミーシールドなどの<br>   威力上昇、減少効果は適用されません。<c>
TutorialText,0,text0002,発動に必要なストック数を超えると<br>アイコンが点灯し、使用可能<c>になります。<br><c ff4f3f><br>※消費ストック数は<br>   解式ＰＡごとに異なります。<c>
TutorialText,0,text0003,ストック数上限は<br>習得初期の時点では「３」ですが<br>特定のクライアントオーダーを<br>達成することで増やすことが可能です。<br><br>上手に活用して戦闘を有利に進めましょう。
TutorialText,1,Title,CONSTRUIR ARTES FOTÓNICAS
TutorialText,1,text0001,"Buildup Photon Arts son movimientos especiales que usan un indicador separado <yellow> en lugar de PP<c>. Puedes configurar Buildup Photon Arts en tu paleta de armas y tu subpaleta.<br><c ff4f3f><br>Puedes usarlos con armas para tu clase normal y tu clase principal.<br><br>Las ventajas y desventajas de potencia de ataques perfectos, habilidades de clase, campos de amortiguación de fotones, etc. no se aplican.<c>"
TutorialText,1,text0002,"El indicador Buildup Photon Arts que rodea el ícono de la habilidad se acumula a medida que atacas a los enemigos y, una vez que está lleno, pones una ""acción"" en el banco.<br><yellow>Una vez que tengas suficiente stock para Buildup Photon Art, el ícono se ilumina y podrás usarlo.<c><br><c ff4f3f><br>El stock requerido varía dependiendo del Photon Art.<c>"
TutorialText,1,text0003,"El límite de acciones comienza en 3, pero puedes aumentarlo completando ciertos pedidos de clientes.<br><br>¡Úsalos para ser aún más efectivo en la batalla!"
