section,group,id,text
Required,0,Title,リテム連破訓練・2-Ⅴ
Required,0,Summary,><yellow><br>※対象リージョン：リテム<br>※推奨セクション：<br>　リテム・エルノザ（Rank.3以上）<c>
Required,1,Title,Entrenamiento implacable en Retem 2-V
Required,1,Summary,Target region: Retem<br><br><yellow>Target region: Retem<br>Recommended Sector: Retem Alnothe<br>(Rank 3 or higher)<c>
SubObjectives,0,text0101,夜間にサヴディサイズ（Lv.40以上）を倒す
SubObjectives,0,text0102,夜間にサヴァウロン（Lv.40以上）を倒す
SubObjectives,1,text0101,Derrota a una guadaйa Svadi por la noche (nivel 40 o superior)
SubObjectives,1,text0102,Derrota a un Svaulon de noche (nivel 40 o superior)
