section,group,id,text
Required,0,Title,スティア連破訓練・1-Ⅸ
Required,0,Summary,アークス上級訓練教官ロナルディンから、<br>経験を積むために、<br>メガロティクスの討伐を勧められる。<br><br><yellow>※対象リージョン：スティア<br>※推奨セクション：<br>　デクストベース、ノイゼンプラント<c>
Required,1,Title,Entrenamiento implacable de Stia 1-IX
Required,1,Summary,"ganar algo de experiencia.<br><br><yellow>Region objetivo: Stia<br>Sector recomendado: Base Dext, Planta Neusen <c>"
SubObjectives,0,text0101,ボスエネミーの<br>メガロティクス（Lv.65以上）を倒す
SubObjectives,1,text0101,Derrota a los enemigos jefes de Megalotix<br>(Nivel 65 o superior)
