section,group,id,text
Required,0,Title,リテム連破訓練・2-Ⅰ
Required,0,Summary,アークス上級訓練教官ロナルディンから、<br>経験を積むために、<br>レアエネミーの討伐を勧められる。<br><yellow><br>※対象リージョン：リテム<br>※推奨セクション：<br>　リテム・エルノザ（Rank.3以上）<c>
Required,1,Title,Entrenamiento implacable en Retem 2-I
Required,1,Summary,experiencia.<br><br><yellow>Region objetivo: Retem<br>Sector recomendado: Retem Alnothe<br>(Rango 3 o superior) <c>
SubObjectives,0,text0101,フォーマーズの<br>レアエネミー（Lv.40以上）を倒す
SubObjectives,1,text0101,Derrota a antiguos enemigos raros (nivel 40<br>o superior)
