section,group,id,text
Required,0,Title,スティア連破訓練・2-Ⅸ
Required,0,Summary,アークス上級訓練教官ロナルディンから、<br>経験を積むために、<br>ボスエネミーの討伐を勧められる。<br><br><yellow>※対象リージョン：スティア<br>※推奨セクション：ノイゼンプラント<c>
Required,1,Title,Entrenamiento implacable de Stia 2-IX
Required,1,Summary,para adquirir algo de experiencia.<br><br><yellow>Región objetivo: Stia<br>Sector recomendado: Planta Neusen <c>
SubObjectives,0,text0101,ドールズの<br>レアボスエネミー（Lv.65以上）を倒す
SubObjectives,1,text0101,Derrota a los enemigos jefes raros de DOLLS<br>(Nv.65 o superior)
