section,group,id,text
Required,0,Title,クヴァリス連破訓練・2-Ⅶ
Required,0,Summary,アークス上級訓練教官ロナルディンから、<br>経験を積むために、<br>ドールズの部位破壊を勧められる。<br><br><yellow>※対象リージョン：クヴァリス<br>※推奨セクション：<br>　ロストセントラル（Rank.2以上）<c>
Required,1,Title,Entrenamiento implacable de Kvaris 2-VII
Required,1,Summary,"El instructor de entrenamiento avanzado de ARKS, Ronaldine, te ha encargado con la tarea de destruir partes en DOLLS para obtener experiencia.<br><br><yellow>Zona objetivo: Kvaris<br>Sector recomendado: Perdido Central (Rango 2 o superior)<c>"
SubObjectives,0,text0101,リンシャン（Lv.51以上）の部位破壊をする
SubObjectives,0,text0102,プロクタス・リテナ（Lv.51以上）の<br>部位破壊をする
SubObjectives,1,text0101,Destruye partes de Rinshan (Nivel 51 o superior)
SubObjectives,1,text0102,Destruye partes de Proctys Retem (Nivel 51 o superior)
