section,group,id,text
Required,0,Title,【シーズン】オルタレルム探索でボスの討伐
Required,0,Summary,オルタレルム探索のクエスト<br>“異界戦線：凍土エリア峡江部”で<br>シーズンシンボルの付いた<br>ボスエネミーを倒す。
Required,1,Title,[Estacional] Alterar la supresión del jefe del reino
Required,1,Summary,"Derrota a los jefes enemigos marcados con símbolos estacionales en la misión de exploración de Alter Realm ""Altered Battle Line: Tundra Area Gorge""."
SubObjectives,0,text0101,指定のクエストで<br>シンボル付きボスエネミーを倒す
SubObjectives,1,text0101,Derrota a los jefes enemigos marcados con símbolos<br>en la misión designada.
