section,group,id,text
Required,0,Title,【シーズン】エネミーの討伐
Required,0,Summary,シーズンシンボルの付いたエネミー、<br>あるいはセレモ・ラッピーを倒す。<br><br><yellow>※対象リージョン：エアリオ<br>※セレモ・ラッピーが対象<c>
Required,1,Title,[Seasonal] Supresión enemiga
Required,1,Summary,Derrota enemigos de cualquier tipo marcados con símbolos estacionales o Ceremo Rappies.<br><br><yellow>Región de destino: Aelio<br>Los Ceremo Rappies son elegibles.<c>
SubObjectives,0,text0101,シンボル付きエネミーまたは、<br>セレモ・ラッピーを倒す
SubObjectives,1,text0101,Derrota a los enemigos marcados con símbolos.<br>o Ceremo Rappies
