section,group,id,text
Required,0,Title,【お月見】シーズンエネミーへの属性攻撃
Required,0,Summary,シーズンシンボルの付いた<br>任意のエネミーを<yellow>氷属性<c>の攻撃で倒す。<br><br><yellow>※シーズンエネミー：<br>　シンボル付きでないツキミ・ラッピーも含む<c><br><yellow>※エネミー討伐推奨セクション：<br>　中央エアリオ、南エアリオ、西エアリオ、<br>　北エアリオ、マグナス山<c>
Required,1,Title,[Moon-Gazing] Ataque elemental enemigo estacional
Required,1,Summary,"Derrota a cualquier enemigo marcado con un símbolo estacional.<br>usando un ataque elemental <yellow>Ice<c>.<br><br><yellow>Enemigo estacional:<br>También incluye Moongaze Rappy marcado sin símbolo<c><br><yellow>Sectores recomendados para la supresión del enemigo:<br>Aelio Central, Aelio Sur, Aelio Oeste, Aelio Norte,<br>monte Magnus<c>"
SubObjectives,0,text0101,シンボル付きエネミーを氷属性攻撃で倒す
SubObjectives,1,text0101,Derrota a los enemigos estacionales con ataques de hielo.
