section,group,id,text
npc_765801,0,76580101,え？　こんなところで何をしているのかって？
npc_765801,0,76580102,毎日マグをいじってばかりいたら、妻に怒られてしまってね……。<br>ここに隠れているんだよ。
npc_765801,0,76580103,それより、キミは新しく来たアークスだね。<br>マグをちゃんと使いこなせてい
npc_765801,1,76580101,¿Eh? ¿Quieres saber qué estoy haciendo aquí?
npc_765801,1,76580102,Pasé todos los días jugueteando con mi Mag y mi esposa se enojó conmigo. Así que me esconderé<br>aquí por un tiempo.
npc_765801,1,76580103,"De todos modos, eres un nuevo defensor de ARKS, ¿verdad? ¿Sabes cómo hacer un buen uso<br>de tu Mag?"
