section,group,id,text
MainText,0,name010,メッセージパック
MainText,0,text010,……こちら、オルタレルム調査隊。<br>現在、予定ルートにて調査を継続中。
MainText,0,text020,環境による影響と思われるが、数分前より、<br>本部との通信が途絶している。
MainText,0,text030,調査は一時中断。これより帰還ルートの確保を優先する。<br>以降の状況記録は、メッセージパックにて残していくことにする。
MainText,1,name010,módulo de datos
MainText,1,text010,Equipo de investigación de Alter Realm aquí. Actualmente realizando la investigación según lo planeado.
MainText,1,text020,"Las comunicaciones con el cuartel general se interrumpieron hace varios minutos,<br>probablemente debido a factores ambientales."
MainText,1,text030,Suspender temporalmente la investigación para priorizar la seguridad de la ruta de regreso.<br>Se dejarán más registros en Datapods.
