section,group,id,text
MainText,0,name010,ラン
MainText,0,text010,アークス各員に通達します。<br>その付近で、極めて強力なエネミーの反応が確認されました。
MainText,0,text020,……解析の結果、<br>反応は“ダークファルス・エイジス”のものに近似しています。
MainText,0,text030,不測の事態に備え、警戒してください。
MainText,1,name010,Corrió
MainText,1,text010,Atención. Todos los defensores de ARKS. Hemos detectado una lectura enemiga extremadamente poderosa.
MainText,1,text020,Nuestro análisis sugiere que es algo muy similar a<br>Dark Falz Aegis.
MainText,1,text030,Mantente en guardia y prepárate para cualquier cosa.
