section,group,id,text
AcceptCondition,0,a1,特定のクライアントオーダーのクリア
AcceptCondition,0,a2,特定のクライアントオーダーのクリア
AcceptCondition,0,a3,スーパーハード受注許可証の所持
Basic,0,Title,野望の残滓
Basic,0,Explanation,ルシエルの上層で、強力な時空間振動が確認された。<br>強力なエネミーの出現が見込まれるため、強行偵察を実施する。<br>アークス各員は、当該ポイントに急行し、状況を確認せよ。<br>――――――――――――――――――――――――――――――――――――――――<br>クリア可能回数：$(0)回<yellow>（※同時発生中の緊急クエスト含む）<c>
Basic,1,Title,Restos de ambición
Basic,1,Explanation,sly active Urgent Quests)<c>
QuestTarget,0,SimpleExplanation,ヴェノギア・ヴェラを撃破せよ！
QuestTarget,1,SimpleExplanation,Derrota a Venogia Vera.
