section,group,id,text
Required,0,Title,ラインストライクの基礎知識・Ⅰ
Required,0,Summary,カードマスターのヴィクトリアから、<br>“ラインストライク”について教わる。<br><br><yellow>※メインメニューの“コミュニケーション”から<br>　“ラインストライク”を開き<br>　“対NPCバトル”を選択することで達成可能<c>
Required,1,Title,Conceptos básicos del golpe de línea I
Required,1,Summary,La Maestra de Cartas Victoria está aquí para enseñarte <br>sobre Line Strike.<br><br><yellow>Puede completarse seleccionando <br>[Batalla contra NPC] en [Line Strike] dentro de <br>[Comunicaciones] del Menú Principal.<c>
SubObjectives,0,text0101,ラインストライクでNPCと対戦する
SubObjectives,1,text0101,Juega contra un NPC en Line Strike
