section,group,id,text
Required,0,Title,ポータブルホログラムの利用
Required,0,Summary,アークス上級情報支援員のリーディアから、<br>“ポータブルホログラム”について教わる。<br><br><yellow>※クイックメニューの“ポータブルホログラム”を<br>　選択することで達成可能<c>
Required,1,Title,Usando hologramas portátiles
Required,1,Summary,"Aprende sobre los Hologramas Portátiles con Lydia, <br>miembro del Equipo de Apoyo de Inteligencia Avanzada de ARKS.<br><br><yellow>*Puedes hacerlo seleccionando [Hologramas Portátiles] <br>desde el Menú Rápido.<c>"
SubObjectives,0,text0101,ポータブルホログラムを設置する
SubObjectives,1,text0101,Colocar holograma portátil
