section,group,id,text
ssn_014021,0,ssn_014021_0010,協力していただけるのですね。<br>ありがとうございます。
ssn_014021,0,ssn_014021_0020,先ほども言いましたが、ギガンティクスはとても危険なエネミーです。<br>決して、無理に戦おうとしないでください。
ssn_014021,0,ssn_014021_0030,近づいて、その姿を確認していただくだけで結構です。<br>データを取ることができたら、私の方から通信いたします。
ssn_014021,0,ssn_014021_0040,それでは、よろしくお願いします。<br>どうか、お気
ssn_014021,1,ssn_014021_0010,"Como dije antes, los Gigantix son enemigos particularmente peligrosos. No te quedes ahí si<br>los encuentras demasiado desafiantes."
ssn_014021,1,ssn_014021_0020,"Acercarse lo suficiente para confirmar su presencia es suficiente. Una vez que tengamos los datos<br>que necesitamos, te lo haré saber."
ssn_014021,1,ssn_014021_0030,"Bueno, entonces mucha suerte. Y por favor, ten cuidado."
ssn_014021,1,ssn_014021_0040,"Es una pena... Si más adelante decide que desea ayudarnos, visite<br>nuevamente."
