section,group,id,text
ssq_012060,0,name_7200,カルテヴィエ
ssq_012060,0,ssq_012060_0010,装備の限界突破、できたみたいだね。
ssq_012060,0,ssq_012060_0020,エネミーと戦ってみて、<br>その強さを確かめてみたらどう？
ssq_012060,0,ssq_012060_0030,アークスにとって、武器や防具の強化は重要。<br>しっかり覚えておくといいのさ。
ssq_012060,1,name_7200,Cartevei
ssq_012060,1,ssq_012060_0010,Parece que lograste Limit Break en algunos equipos.
ssq_012060,1,ssq_012060_0020,¿Qué tal probarlo contra algunos enemigos?
ssq_012060,1,ssq_012060_0030,Mejorar las armas y armaduras debería ser algo natural para los defensores de ARKS. Intenta tener<br>eso en mente.
