section,group,id,text
ssq_015812,0,name_7406,スレイン
ssq_015812,0,ssq_015812_0010,上出来だ。<br>とてもいい動きだった。
ssq_015812,0,ssq_015812_0020,これからも、己の魂を磨いてほしい。<br>心のゆくままに。
ssq_015812,0,ssq_015812_0030,キミならば、私の速さを超えられるかもしれない。<br>期待している。
ssq_015812,1,name_7406,slaine
ssq_015812,1,ssq_015812_0010,Maravilloso. Realmente un gran trabajo.
ssq_015812,1,ssq_015812_0020,Continúa perfeccionando tu alma a medida que el espíritu te mueve.
ssq_015812,1,ssq_015812_0030,"Si alguien podría superar incluso mi destreza, eres tú. Mis expectativas son altas."
