section,group,id,text
ssq_014212,0,name_7417,ディグホール
ssq_014212,0,ssq_014212_0010,よし、無事に集められたようだな。<br>これでエアリオの鉱石については、ひととおり教えたことになる。
ssq_014212,0,ssq_014212_0020,これまで、よく頑張ったな。<br>それじゃ、これからも存分にギャザリングを楽しんでくれ！
ssq_014212,1,name_7417,excavadora
ssq_014212,1,ssq_014212_0010,"Bien, todo está contabilizado. Ahora has aprendido todo lo que se sabe sobre los<br>minerales de Aelio."
ssq_014212,1,ssq_014212_0020,Has hecho un gran trabajo. ¡Espero que continúes reuniendo materiales al<br>contenido de tu corazón!
