section,group,id,text
TutorialText,0,Title,スティアで入手できる鉱石
TutorialText,0,text0001,スティアリージョンでは、<br>エアリオリージョンで入手可能な鉱石に加えて、テドラサイト、<br>ペンドライトなどの鉱石と、ヘクスカイト、<br>インフェリウムなどの鉱石をギャザリングできます。
TutorialText,0,text0002,鉱石は毎日決まった時間に再出現しますが、<br>同じ場所に出現するとは限りません。
TutorialText,1,Title,Minerales encontrados en Stia
TutorialText,1,text0001,e Aelio region, as well as Tetracite, Pentalite, Hexakite, and Inefernium.
TutorialText,1,text0002,"Los minerales reaparecerán todos los días a una hora específica, pero es posible que no reaparezcan en el mismo lugar."
